[
  {
    "step": 0,
    "timestamp": "2026-01-11T12:55:05.386207",
    "path": [],
    "action": "initial_load",
    "url": "https://www.zara.com/us/",
    "new_buttons": [],
    "new_links": {},
    "aria": "- link \"Skip to main content\":\n  - /url: \"#main\"\n- banner:\n  - button \"Open Menu\":\n    - img\n  - link \"Go to homepage\":\n    - /url: https://www.zara.com/us/\n  - list:\n    - listitem:\n      - link \"Search\":\n        - /url: https://www.zara.com/us/en/search/home\n    - listitem:\n      - link \"LOG IN\":\n        - /url: https://www.zara.com/us/en/logon\n    - listitem:\n      - link \"Help\":\n        - /url: https://www.zara.com/us/en/help-center\n    - listitem:\n      - link \"Cart empty\":\n        - /url: https://www.zara.com/us/en/shop/cart\n        - text: Shopping bag [\n        - status: \"0\"\n        - text: \"]\"\n- main:\n  - heading \"ZARA United States | SALE\" [level=1]\n  - region \"Zara category carousel\":\n    - list:\n      - listitem\n      - listitem\n      - listitem\n      - listitem\n      - listitem\n      - listitem\n      - listitem\n      - listitem\n      - listitem:\n        - text: THE NEW Scroll down\n        - heading \"Footer\" [level=2]\n        - link \"sign up for our newsletter\":\n          - /url: https://www.zara.com/us/en/z-newsletter-nl1400.html?v1=11110\n        - list:\n          - listitem:\n            - link \"Tiktok\":\n              - /url: https://www.tiktok.com/@zara\n          - listitem:\n            - link \"Instagram\":\n              - /url: https://www.instagram.com/zara/\n          - listitem:\n            - link \"Facebook\":\n              - /url: https://www.facebook.com/Zara\n          - listitem:\n            - link \"Pinterest\":\n              - /url: https://es.pinterest.com/zaraofficial\n          - listitem:\n            - link \"Youtube\":\n              - /url: http://www.youtube.com/user/zara\n          - listitem:\n            - link \"Spotify\":\n              - /url: https://open.spotify.com/user/r6ivwuv0ebk346hhxo446pbfv\n        - navigation \"Legal documents\":\n          - heading \"Legal documents\" [level=3]\n          - list:\n            - listitem:\n              - button \"Do Not Sell Or Share My Personal Information\"\n            - listitem:\n              - button \"Cookie and Ad Preferences\"\n            - listitem:\n              - link \"Privacy and Cookies Policy\":\n                - /url: https://www.zara.com/static/pdfs/US/privacy-policy/privacy-policy_en_US-20241209.html\n            - listitem:\n              - link \"Terms of use\":\n                - /url: https://static.zara.net/static/pdfs/US/terms-and-conditions/terms-and-conditions-en_US-20250829.pdf\n    - list:\n      - listitem\n      - listitem\n      - listitem\n      - listitem\n      - listitem\n      - listitem\n      - listitem:\n        - text: THE NEW Scroll down\n        - heading \"Footer\" [level=2]\n        - link \"sign up for our newsletter\":\n          - /url: https://www.zara.com/us/en/z-newsletter-nl1400.html?v1=11110\n        - list:\n          - listitem:\n            - link \"Tiktok\":\n              - /url: https://www.tiktok.com/@zara\n          - listitem:\n            - link \"Instagram\":\n              - /url: https://www.instagram.com/zara/\n          - listitem:\n            - link \"Facebook\":\n              - /url: https://www.facebook.com/Zara\n          - listitem:\n            - link \"Pinterest\":\n              - /url: https://es.pinterest.com/zaraofficial\n          - listitem:\n            - link \"Youtube\":\n              - /url: http://www.youtube.com/user/zara\n          - listitem:\n            - link \"Spotify\":\n              - /url: https://open.spotify.com/user/r6ivwuv0ebk346hhxo446pbfv\n        - navigation \"Legal documents\":\n          - heading \"Legal documents\" [level=3]\n          - list:\n            - listitem:\n              - button \"Do Not Sell Or Share My Personal Information\"\n            - listitem:\n              - button \"Cookie and Ad Preferences\"\n            - listitem:\n              - link \"Privacy and Cookies Policy\":\n                - /url: https://www.zara.com/static/pdfs/US/privacy-policy/privacy-policy_en_US-20241209.html\n            - listitem:\n              - link \"Terms of use\":\n                - /url: https://static.zara.net/static/pdfs/US/terms-and-conditions/terms-and-conditions-en_US-20250829.pdf\n    - list:\n      - listitem\n      - listitem\n      - listitem\n      - listitem\n      - listitem\n      - listitem\n      - listitem\n      - listitem\n      - listitem\n      - listitem:\n        - text: THE NEW Scroll down\n        - heading \"Footer\" [level=2]\n        - link \"sign up for our newsletter\":\n          - /url: https://www.zara.com/us/en/z-newsletter-nl1400.html?v1=11110\n        - list:\n          - listitem:\n            - link \"Tiktok\":\n              - /url: https://www.tiktok.com/@zara\n          - listitem:\n            - link \"Instagram\":\n              - /url: https://www.instagram.com/zara/\n          - listitem:\n            - link \"Facebook\":\n              - /url: https://www.facebook.com/Zara\n          - listitem:\n            - link \"Pinterest\":\n              - /url: https://es.pinterest.com/zaraofficial\n          - listitem:\n            - link \"Youtube\":\n              - /url: http://www.youtube.com/user/zara\n          - listitem:\n            - link \"Spotify\":\n              - /url: https://open.spotify.com/user/r6ivwuv0ebk346hhxo446pbfv\n        - navigation \"Legal documents\":\n          - heading \"Legal documents\" [level=3]\n          - list:\n            - listitem:\n              - button \"Do Not Sell Or Share My Personal Information\"\n            - listitem:\n              - button \"Cookie and Ad Preferences\"\n            - listitem:\n              - link \"Privacy and Cookies Policy\":\n                - /url: https://www.zara.com/static/pdfs/US/privacy-policy/privacy-policy_en_US-20241209.html\n            - listitem:\n              - link \"Terms of use\":\n                - /url: https://static.zara.net/static/pdfs/US/terms-and-conditions/terms-and-conditions-en_US-20250829.pdf\n    - list:\n      - listitem\n      - listitem\n      - listitem\n      - listitem\n      - listitem\n      - listitem\n      - listitem\n      - listitem:\n        - text: THE NEW Scroll down\n        - heading \"Footer\" [level=2]\n        - link \"sign up for our newsletter\":\n          - /url: https://www.zara.com/us/en/z-newsletter-nl1400.html?v1=11110\n        - list:\n          - listitem:\n            - link \"Tiktok\":\n              - /url: https://www.tiktok.com/@zara\n          - listitem:\n            - link \"Instagram\":\n              - /url: https://www.instagram.com/zara/\n          - listitem:\n            - link \"Facebook\":\n              - /url: https://www.facebook.com/Zara\n          - listitem:\n            - link \"Pinterest\":\n              - /url: https://es.pinterest.com/zaraofficial\n          - listitem:\n            - link \"Youtube\":\n              - /url: http://www.youtube.com/user/zara\n          - listitem:\n            - link \"Spotify\":\n              - /url: https://open.spotify.com/user/r6ivwuv0ebk346hhxo446pbfv\n        - navigation \"Legal documents\":\n          - heading \"Legal documents\" [level=3]\n          - list:\n            - listitem:\n              - button \"Do Not Sell Or Share My Personal Information\"\n            - listitem:\n              - button \"Cookie and Ad Preferences\"\n            - listitem:\n              - link \"Privacy and Cookies Policy\":\n                - /url: https://www.zara.com/static/pdfs/US/privacy-policy/privacy-policy_en_US-20241209.html\n            - listitem:\n              - link \"Terms of use\":\n                - /url: https://static.zara.net/static/pdfs/US/terms-and-conditions/terms-and-conditions-en_US-20250829.pdf\n    - list:\n      - listitem\n      - listitem\n      - listitem\n      - listitem\n      - listitem:\n        - heading \"Footer\" [level=2]\n        - link \"sign up for our newsletter\":\n          - /url: https://www.zara.com/us/en/z-newsletter-nl1400.html?v1=11110\n        - list:\n          - listitem:\n            - link \"Tiktok\":\n              - /url: https://www.tiktok.com/@zara\n          - listitem:\n            - link \"Instagram\":\n              - /url: https://www.instagram.com/zara/\n          - listitem:\n            - link \"Facebook\":\n              - /url: https://www.facebook.com/Zara\n          - listitem:\n            - link \"Pinterest\":\n              - /url: https://es.pinterest.com/zaraofficial\n          - listitem:\n            - link \"Youtube\":\n              - /url: http://www.youtube.com/user/zara\n          - listitem:\n            - link \"Spotify\":\n              - /url: https://open.spotify.com/user/r6ivwuv0ebk346hhxo446pbfv\n        - navigation \"Legal documents\":\n          - heading \"Legal documents\" [level=3]\n          - list:\n            - listitem:\n              - button \"Do Not Sell Or Share My Personal Information\"\n            - listitem:\n              - button \"Cookie and Ad Preferences\"\n            - listitem:\n              - link \"Privacy and Cookies Policy\":\n                - /url: https://www.zara.com/static/pdfs/US/privacy-policy/privacy-policy_en_US-20241209.html\n            - listitem:\n              - link \"Terms of use\":\n                - /url: https://static.zara.net/static/pdfs/US/terms-and-conditions/terms-and-conditions-en_US-20250829.pdf\n    - list:\n      - listitem\n      - listitem\n      - listitem\n      - listitem\n      - listitem\n      - listitem\n      - listitem:\n        - text: VIEW ALL Scroll down\n        - heading \"Footer\" [level=2]\n        - link \"sign up for our newsletter\":\n          - /url: https://www.zara.com/us/en/z-newsletter-nl1400.html?v1=11110\n        - list:\n          - listitem:\n            - link \"Tiktok\":\n              - /url: https://www.tiktok.com/@zara\n          - listitem:\n            - link \"Instagram\":\n              - /url: https://www.instagram.com/zara/\n          - listitem:\n            - link \"Facebook\":\n              - /url: https://www.facebook.com/Zara\n          - listitem:\n            - link \"Pinterest\":\n              - /url: https://es.pinterest.com/zaraofficial\n          - listitem:\n            - link \"Youtube\":\n              - /url: http://www.youtube.com/user/zara\n          - listitem:\n            - link \"Spotify\":\n              - /url: https://open.spotify.com/user/r6ivwuv0ebk346hhxo446pbfv\n        - navigation \"Legal documents\":\n          - heading \"Legal documents\" [level=3]\n          - list:\n            - listitem:\n              - button \"Do Not Sell Or Share My Personal Information\"\n            - listitem:\n              - button \"Cookie and Ad Preferences\"\n            - listitem:\n              - link \"Privacy and Cookies Policy\":\n                - /url: https://www.zara.com/static/pdfs/US/privacy-policy/privacy-policy_en_US-20241209.html\n            - listitem:\n              - link \"Terms of use\":\n                - /url: https://static.zara.net/static/pdfs/US/terms-and-conditions/terms-and-conditions-en_US-20250829.pdf\n    - list:\n      - listitem\n      - listitem\n      - listitem\n      - listitem:\n        - heading \"Footer\" [level=2]\n        - link \"sign up for our newsletter\":\n          - /url: https://www.zara.com/us/en/z-newsletter-nl1400.html?v1=11110\n        - list:\n          - listitem:\n            - link \"Tiktok\":\n              - /url: https://www.tiktok.com/@zara\n          - listitem:\n            - link \"Instagram\":\n              - /url: https://www.instagram.com/zara/\n          - listitem:\n            - link \"Facebook\":\n              - /url: https://www.facebook.com/Zara\n          - listitem:\n            - link \"Pinterest\":\n              - /url: https://es.pinterest.com/zaraofficial\n          - listitem:\n            - link \"Youtube\":\n              - /url: http://www.youtube.com/user/zara\n          - listitem:\n            - link \"Spotify\":\n              - /url: https://open.spotify.com/user/r6ivwuv0ebk346hhxo446pbfv\n        - navigation \"Legal documents\":\n          - heading \"Legal documents\" [level=3]\n          - list:\n            - listitem:\n              - button \"Do Not Sell Or Share My Personal Information\"\n            - listitem:\n              - button \"Cookie and Ad Preferences\"\n            - listitem:\n              - link \"Privacy and Cookies Policy\":\n                - /url: https://www.zara.com/static/pdfs/US/privacy-policy/privacy-policy_en_US-20241209.html\n            - listitem:\n              - link \"Terms of use\":\n                - /url: https://static.zara.net/static/pdfs/US/terms-and-conditions/terms-and-conditions-en_US-20250829.pdf\n    - list:\n      - listitem\n      - listitem:\n        - heading \"Footer\" [level=2]\n        - link \"sign up for our newsletter\":\n          - /url: https://www.zara.com/us/en/z-newsletter-nl1400.html?v1=11110\n        - list:\n          - listitem:\n            - link \"Tiktok\":\n              - /url: https://www.tiktok.com/@zara\n          - listitem:\n            - link \"Instagram\":\n              - /url: https://www.instagram.com/zara/\n          - listitem:\n            - link \"Facebook\":\n              - /url: https://www.facebook.com/Zara\n          - listitem:\n            - link \"Pinterest\":\n              - /url: https://es.pinterest.com/zaraofficial\n          - listitem:\n            - link \"Youtube\":\n              - /url: http://www.youtube.com/user/zara\n          - listitem:\n            - link \"Spotify\":\n              - /url: https://open.spotify.com/user/r6ivwuv0ebk346hhxo446pbfv\n        - navigation \"Legal documents\":\n          - heading \"Legal documents\" [level=3]\n          - list:\n            - listitem:\n              - button \"Do Not Sell Or Share My Personal Information\"\n            - listitem:\n              - button \"Cookie and Ad Preferences\"\n            - listitem:\n              - link \"Privacy and Cookies Policy\":\n                - /url: https://www.zara.com/static/pdfs/US/privacy-policy/privacy-policy_en_US-20241209.html\n            - listitem:\n              - link \"Terms of use\":\n                - /url: https://static.zara.net/static/pdfs/US/terms-and-conditions/terms-and-conditions-en_US-20250829.pdf\n    - list:\n      - listitem:\n        - button \"Move to MAN\"\n- contentinfo\n- region \"Chat\"\n- region \"Cookie banner\":\n  - dialog \"Privacy\":\n    - text: We use first-party and third-party cookies to understand the uses of our online store and to be able to improve it and to adapt the content to your preferences. For more information, please consult our\n    - link \"More information about your privacy, opens in a new tab\":\n      - /url: https://static.zara.net/static/pdfs/ZARA/cookies-policy/cookies_policy_en_US-20230915.pdf\n      - text: Privacy Policy.\n    - button \"Do Not Sell Or Share My Personal Information, Opens the preference center dialog\": Do Not Sell Or Share My Personal Information\n    - button \"Close\"\n- iframe"
  },
  {
    "step": 1,
    "timestamp": "2026-01-11T12:55:52.118497",
    "path": [
      "WOMAN"
    ],
    "action": "clicked: WOMAN",
    "url": "https://www.zara.com/us/",
    "new_buttons": [],
    "new_links": {
      "Go to homepage": "https://www.zara.com/us/",
      "LOG IN": "https://www.zara.com/us/en/logon",
      "Help": "https://www.zara.com/us/en/help-center",
      "GIFT CARD": "https://www.zara.com/us/en/z-giftcard-mkt1394.html",
      "CAREERS": "https://www.zara.com/us/en/work-with-us-mkt8081.html",
      "JOIN LIFE": "https://www.zara.com/us/en/z-join-life-mkt1399.html",
      "STORES": "https://www.zara.com/us/en/z-stores-st1404.html",
      "PERFUMES": "https://www.zara.com/us/en/woman-accessories-perfumes-l1017.html?v1=2419833",
      "MAKEUP": "https://www.zara.com/us/en/woman-beauty-makeup-l4414.html?v1=1881272",
      "ZARA HAIR": "https://www.zara.com/us/en/woman-hair-l7345.html?v1=2418886",
      "ABOUT": "https://www.zara.com/us/en/zara-travel-about-mkt15716.html",
      "REPAIR": "https://www.zara.com/us/en/preowned-repair-mkt5796.html",
      "SECOND HAND": "https://www.zara.com/us/en/preowned-resell-mkt5797.html",
      "DONATE": "https://www.zara.com/us/en/preowned-donate-mkt5798.html",
      "THE GUIDES": "https://www.zara.com/us/en/zara-travel-guide-mkt15717.html",
      "Youtube": "http://www.youtube.com/user/zara",
      "Spotify": "https://open.spotify.com/user/r6ivwuv0ebk346hhxo446pbfv"
    },
    "aria": "- link \"Skip to main content\":\n  - /url: \"#main\"\n- banner:\n  - button \"Close menu\"\n  - link \"Go to homepage\":\n    - /url: https://www.zara.com/us/\n  - list:\n    - listitem:\n      - link \"Search\":\n        - /url: https://www.zara.com/us/en/search/home\n    - listitem:\n      - link \"LOG IN\":\n        - /url: https://www.zara.com/us/en/logon\n    - listitem:\n      - link \"Help\":\n        - /url: https://www.zara.com/us/en/help-center\n    - listitem:\n      - link \"Cart empty\":\n        - /url: https://www.zara.com/us/en/shop/cart\n        - text: Shopping bag [\n        - status: \"0\"\n        - text: \"]\"\n- dialog \"Category Menu\":\n  - button \"Close menu\"\n  - link \"Go to homepage\":\n    - /url: https://www.zara.com/us/\n  - navigation:\n    - tablist \"Categories\":\n      - tab \"WOMAN\" [selected]\n      - tab \"MAN\"\n      - tab \"KIDS\"\n      - tab \"ZARA HOME\"\n      - tab \"BEAUTY\"\n      - tab \"MASSIMO DUTTI\"\n      - tab \"ZARA PRE-OWNED\"\n      - tab \"TRAVEL MODE\"\n    - tabpanel \"WOMAN\":\n      - list:\n        - listitem:\n          - button \"NEW COLLECTION\"\n        - listitem:\n          - button \"SALE\" [expanded]:\n            - text: SALE\n            - img\n        - listitem:\n          - link \"GIFT CARD\":\n            - /url: https://www.zara.com/us/en/z-giftcard-mkt1394.html\n        - listitem:\n          - button \"+ INFO\"\n        - listitem:\n          - link \"CAREERS\":\n            - /url: https://www.zara.com/us/en/work-with-us-mkt8081.html\n        - listitem: DOWNLOAD APP\n        - listitem:\n          - link \"JOIN LIFE\":\n            - /url: https://www.zara.com/us/en/z-join-life-mkt1399.html\n        - listitem:\n          - link \"STORES\":\n            - /url: https://www.zara.com/us/en/z-stores-st1404.html\n    - tabpanel \"MAN\":\n      - list:\n        - listitem:\n          - button \"NEW COLLECTION\"\n        - listitem:\n          - button \"SALE\"\n        - listitem:\n          - link \"GIFT CARD\":\n            - /url: https://www.zara.com/us/en/z-giftcard-mkt1394.html\n        - listitem: DOWNLOAD APP\n        - listitem:\n          - link \"STORES\":\n            - /url: https://www.zara.com/us/en/z-stores-st1404.html\n        - listitem:\n          - link \"JOIN LIFE\":\n            - /url: https://www.zara.com/us/en/z-join-life-mkt1399.html\n        - listitem: CAREERS\n        - listitem:\n          - button \"+ INFO\"\n    - tabpanel \"KIDS\":\n      - list:\n        - listitem:\n          - button \"NEW COLLECTION\"\n        - listitem:\n          - button \"SALE\"\n        - listitem:\n          - link \"GIFT CARD\":\n            - /url: https://www.zara.com/us/en/z-giftcard-mkt1394.html\n        - listitem: DOWNLOAD APP\n        - listitem:\n          - link \"STORES\":\n            - /url: https://www.zara.com/us/en/z-stores-st1404.html\n        - listitem: JOIN LIFE\n        - listitem: CAREERS\n        - listitem:\n          - button \"+ INFO\"\n    - tabpanel \"ZARA HOME\":\n      - list:\n        - listitem:\n          - button \"NEW COLLECTION\"\n        - listitem:\n          - button \"SALE\"\n        - listitem:\n          - link:\n            - /url: https://www.zara.com/us/en/zara-travel-guide-l15717.html?v1=2577013\n        - listitem:\n          - link \"GIFT CARD\":\n            - /url: https://www.zara.com/us/en/z-giftcard-mkt1394.html\n        - listitem:\n          - button \"+ INFO\"\n        - listitem: DOWNLOAD APP\n        - listitem:\n          - link \"JOIN LIFE\":\n            - /url: https://www.zara.com/us/en/z-join-life-mkt1399.html\n        - listitem:\n          - link \"CAREERS\":\n            - /url: https://www.zara.com/us/en/work-with-us-mkt8081.html\n        - listitem:\n          - link \"STORES\":\n            - /url: https://www.zara.com/us/en/z-stores-st1404.html\n        - listitem: RECALLED ITEMS\n    - tabpanel \"BEAUTY\":\n      - list:\n        - listitem:\n          - link \"PERFUMES\":\n            - /url: https://www.zara.com/us/en/woman-accessories-perfumes-l1017.html?v1=2419833\n            - paragraph: PERFUMES\n          - link \"MAKEUP\":\n            - /url: https://www.zara.com/us/en/woman-beauty-makeup-l4414.html?v1=1881272\n            - paragraph: MAKEUP\n          - link \"ZARA HAIR\":\n            - /url: https://www.zara.com/us/en/woman-hair-l7345.html?v1=2418886\n            - paragraph: ZARA HAIR\n        - listitem:\n          - button \"WOMAN\"\n        - listitem:\n          - button \"MAN\"\n        - listitem:\n          - button \"KIDS\"\n        - listitem:\n          - link:\n            - /url: https://www.zara.com/us/en/zara-travel-guide-l15717.html?v1=2577013\n        - listitem: DOWNLOAD APP\n        - listitem:\n          - link \"JOIN LIFE\":\n            - /url: https://www.zara.com/us/en/z-join-life-mkt1399.html\n        - listitem:\n          - button \"+ INFO\"\n    - tabpanel \"MASSIMO DUTTI\":\n      - list:\n        - listitem:\n          - button \"WOMAN\"\n        - listitem:\n          - button \"MAN\"\n    - tabpanel \"ZARA PRE-OWNED\":\n      - list:\n        - listitem:\n          - link \"ABOUT\":\n            - /url: https://www.zara.com/us/en/preowned-about-mkt5795.html\n        - listitem:\n          - link \"REPAIR\":\n            - /url: https://www.zara.com/us/en/preowned-repair-mkt5796.html\n        - listitem:\n          - link \"SECOND HAND\":\n            - /url: https://www.zara.com/us/en/preowned-resell-mkt5797.html\n        - listitem:\n          - link \"DONATE\":\n            - /url: https://www.zara.com/us/en/preowned-donate-mkt5798.html\n        - listitem:\n          - link \"JOIN LIFE\":\n            - /url: https://www.zara.com/us/en/z-join-life-mkt1399.html\n        - listitem:\n          - link \"CAREERS\":\n            - /url: https://www.zara.com/us/en/work-with-us-mkt8081.html\n        - listitem:\n          - link \"STORES\":\n            - /url: https://www.zara.com/us/en/z-stores-st1404.html\n    - tabpanel \"TRAVEL MODE\":\n      - list:\n        - listitem:\n          - link \"ABOUT\":\n            - /url: https://www.zara.com/us/en/zara-travel-about-mkt15716.html\n        - listitem:\n          - link \"THE GUIDES\":\n            - /url: https://www.zara.com/us/en/zara-travel-guide-mkt15717.html\n- main:\n  - heading \"ZARA United States | SALE\" [level=1]\n  - region \"Zara category carousel\":\n    - list:\n      - listitem\n      - listitem\n      - listitem\n      - listitem\n      - listitem\n      - listitem\n      - listitem\n      - listitem\n      - listitem:\n        - text: THE NEW Scroll down\n        - heading \"Footer\" [level=2]\n        - link \"sign up for our newsletter\":\n          - /url: https://www.zara.com/us/en/z-newsletter-nl1400.html?v1=11110\n        - list:\n          - listitem:\n            - link \"Tiktok\":\n              - /url: https://www.tiktok.com/@zara\n          - listitem:\n            - link \"Instagram\":\n              - /url: https://www.instagram.com/zara/\n          - listitem:\n            - link \"Facebook\":\n              - /url: https://www.facebook.com/Zara\n          - listitem:\n            - link \"Pinterest\":\n              - /url: https://es.pinterest.com/zaraofficial\n          - listitem:\n            - link \"Youtube\":\n              - /url: http://www.youtube.com/user/zara\n          - listitem:\n            - link \"Spotify\":\n              - /url: https://open.spotify.com/user/r6ivwuv0ebk346hhxo446pbfv\n        - navigation \"Legal documents\":\n          - heading \"Legal documents\" [level=3]\n          - list:\n            - listitem:\n              - button \"Cookies settings\"\n            - listitem:\n              - button \"Cookie and Ad Preferences\"\n            - listitem:\n              - link \"Privacy and Cookies Policy\":\n                - /url: https://www.zara.com/static/pdfs/US/privacy-policy/privacy-policy_en_US-20241209.html\n            - listitem:\n              - link \"Terms of use\":\n                - /url: https://static.zara.net/static/pdfs/US/terms-and-conditions/terms-and-conditions-en_US-20250829.pdf\n    - list:\n      - listitem\n      - listitem\n      - listitem\n      - listitem\n      - listitem\n      - listitem\n      - listitem:\n        - text: THE NEW Scroll down\n        - heading \"Footer\" [level=2]\n        - link \"sign up for our newsletter\":\n          - /url: https://www.zara.com/us/en/z-newsletter-nl1400.html?v1=11110\n        - list:\n          - listitem:\n            - link \"Tiktok\":\n              - /url: https://www.tiktok.com/@zara\n          - listitem:\n            - link \"Instagram\":\n              - /url: https://www.instagram.com/zara/\n          - listitem:\n            - link \"Facebook\":\n              - /url: https://www.facebook.com/Zara\n          - listitem:\n            - link \"Pinterest\":\n              - /url: https://es.pinterest.com/zaraofficial\n          - listitem:\n            - link \"Youtube\":\n              - /url: http://www.youtube.com/user/zara\n          - listitem:\n            - link \"Spotify\":\n              - /url: https://open.spotify.com/user/r6ivwuv0ebk346hhxo446pbfv\n        - navigation \"Legal documents\":\n          - heading \"Legal documents\" [level=3]\n          - list:\n            - listitem:\n              - button \"Cookies settings\"\n            - listitem:\n              - button \"Cookie and Ad Preferences\"\n            - listitem:\n              - link \"Privacy and Cookies Policy\":\n                - /url: https://www.zara.com/static/pdfs/US/privacy-policy/privacy-policy_en_US-20241209.html\n            - listitem:\n              - link \"Terms of use\":\n                - /url: https://static.zara.net/static/pdfs/US/terms-and-conditions/terms-and-conditions-en_US-20250829.pdf\n    - list:\n      - listitem\n      - listitem\n      - listitem\n      - listitem\n      - listitem\n      - listitem\n      - listitem\n      - listitem\n      - listitem\n      - listitem:\n        - text: THE NEW Scroll down\n        - heading \"Footer\" [level=2]\n        - link \"sign up for our newsletter\":\n          - /url: https://www.zara.com/us/en/z-newsletter-nl1400.html?v1=11110\n        - list:\n          - listitem:\n            - link \"Tiktok\":\n              - /url: https://www.tiktok.com/@zara\n          - listitem:\n            - link \"Instagram\":\n              - /url: https://www.instagram.com/zara/\n          - listitem:\n            - link \"Facebook\":\n              - /url: https://www.facebook.com/Zara\n          - listitem:\n            - link \"Pinterest\":\n              - /url: https://es.pinterest.com/zaraofficial\n          - listitem:\n            - link \"Youtube\":\n              - /url: http://www.youtube.com/user/zara\n          - listitem:\n            - link \"Spotify\":\n              - /url: https://open.spotify.com/user/r6ivwuv0ebk346hhxo446pbfv\n        - navigation \"Legal documents\":\n          - heading \"Legal documents\" [level=3]\n          - list:\n            - listitem:\n              - button \"Cookies settings\"\n            - listitem:\n              - button \"Cookie and Ad Preferences\"\n            - listitem:\n              - link \"Privacy and Cookies Policy\":\n                - /url: https://www.zara.com/static/pdfs/US/privacy-policy/privacy-policy_en_US-20241209.html\n            - listitem:\n              - link \"Terms of use\":\n                - /url: https://static.zara.net/static/pdfs/US/terms-and-conditions/terms-and-conditions-en_US-20250829.pdf\n    - list:\n      - listitem\n      - listitem\n      - listitem\n      - listitem\n      - listitem\n      - listitem\n      - listitem\n      - listitem:\n        - text: THE NEW Scroll down\n        - heading \"Footer\" [level=2]\n        - link \"sign up for our newsletter\":\n          - /url: https://www.zara.com/us/en/z-newsletter-nl1400.html?v1=11110\n        - list:\n          - listitem:\n            - link \"Tiktok\":\n              - /url: https://www.tiktok.com/@zara\n          - listitem:\n            - link \"Instagram\":\n              - /url: https://www.instagram.com/zara/\n          - listitem:\n            - link \"Facebook\":\n              - /url: https://www.facebook.com/Zara\n          - listitem:\n            - link \"Pinterest\":\n              - /url: https://es.pinterest.com/zaraofficial\n          - listitem:\n            - link \"Youtube\":\n              - /url: http://www.youtube.com/user/zara\n          - listitem:\n            - link \"Spotify\":\n              - /url: https://open.spotify.com/user/r6ivwuv0ebk346hhxo446pbfv\n        - navigation \"Legal documents\":\n          - heading \"Legal documents\" [level=3]\n          - list:\n            - listitem:\n              - button \"Cookies settings\"\n            - listitem:\n              - button \"Cookie and Ad Preferences\"\n            - listitem:\n              - link \"Privacy and Cookies Policy\":\n                - /url: https://www.zara.com/static/pdfs/US/privacy-policy/privacy-policy_en_US-20241209.html\n            - listitem:\n              - link \"Terms of use\":\n                - /url: https://static.zara.net/static/pdfs/US/terms-and-conditions/terms-and-conditions-en_US-20250829.pdf\n    - list:\n      - listitem\n      - listitem\n      - listitem\n      - listitem\n      - listitem:\n        - heading \"Footer\" [level=2]\n        - link \"sign up for our newsletter\":\n          - /url: https://www.zara.com/us/en/z-newsletter-nl1400.html?v1=11110\n        - list:\n          - listitem:\n            - link \"Tiktok\":\n              - /url: https://www.tiktok.com/@zara\n          - listitem:\n            - link \"Instagram\":\n              - /url: https://www.instagram.com/zara/\n          - listitem:\n            - link \"Facebook\":\n              - /url: https://www.facebook.com/Zara\n          - listitem:\n            - link \"Pinterest\":\n              - /url: https://es.pinterest.com/zaraofficial\n          - listitem:\n            - link \"Youtube\":\n              - /url: http://www.youtube.com/user/zara\n          - listitem:\n            - link \"Spotify\":\n              - /url: https://open.spotify.com/user/r6ivwuv0ebk346hhxo446pbfv\n        - navigation \"Legal documents\":\n          - heading \"Legal documents\" [level=3]\n          - list:\n            - listitem:\n              - button \"Cookies settings\"\n            - listitem:\n              - button \"Cookie and Ad Preferences\"\n            - listitem:\n              - link \"Privacy and Cookies Policy\":\n                - /url: https://www.zara.com/static/pdfs/US/privacy-policy/privacy-policy_en_US-20241209.html\n            - listitem:\n              - link \"Terms of use\":\n                - /url: https://static.zara.net/static/pdfs/US/terms-and-conditions/terms-and-conditions-en_US-20250829.pdf\n    - list:\n      - listitem\n      - listitem\n      - listitem\n      - listitem\n      - listitem\n      - listitem\n      - listitem:\n        - text: VIEW ALL Scroll down\n        - heading \"Footer\" [level=2]\n        - link \"sign up for our newsletter\":\n          - /url: https://www.zara.com/us/en/z-newsletter-nl1400.html?v1=11110\n        - list:\n          - listitem:\n            - link \"Tiktok\":\n              - /url: https://www.tiktok.com/@zara\n          - listitem:\n            - link \"Instagram\":\n              - /url: https://www.instagram.com/zara/\n          - listitem:\n            - link \"Facebook\":\n              - /url: https://www.facebook.com/Zara\n          - listitem:\n            - link \"Pinterest\":\n              - /url: https://es.pinterest.com/zaraofficial\n          - listitem:\n            - link \"Youtube\":\n              - /url: http://www.youtube.com/user/zara\n          - listitem:\n            - link \"Spotify\":\n              - /url: https://open.spotify.com/user/r6ivwuv0ebk346hhxo446pbfv\n        - navigation \"Legal documents\":\n          - heading \"Legal documents\" [level=3]\n          - list:\n            - listitem:\n              - button \"Cookies settings\"\n            - listitem:\n              - button \"Cookie and Ad Preferences\"\n            - listitem:\n              - link \"Privacy and Cookies Policy\":\n                - /url: https://www.zara.com/static/pdfs/US/privacy-policy/privacy-policy_en_US-20241209.html\n            - listitem:\n              - link \"Terms of use\":\n                - /url: https://static.zara.net/static/pdfs/US/terms-and-conditions/terms-and-conditions-en_US-20250829.pdf\n    - list:\n      - listitem\n      - listitem\n      - listitem\n      - listitem:\n        - heading \"Footer\" [level=2]\n        - link \"sign up for our newsletter\":\n          - /url: https://www.zara.com/us/en/z-newsletter-nl1400.html?v1=11110\n        - list:\n          - listitem:\n            - link \"Tiktok\":\n              - /url: https://www.tiktok.com/@zara\n          - listitem:\n            - link \"Instagram\":\n              - /url: https://www.instagram.com/zara/\n          - listitem:\n            - link \"Facebook\":\n              - /url: https://www.facebook.com/Zara\n          - listitem:\n            - link \"Pinterest\":\n              - /url: https://es.pinterest.com/zaraofficial\n          - listitem:\n            - link \"Youtube\":\n              - /url: http://www.youtube.com/user/zara\n          - listitem:\n            - link \"Spotify\":\n              - /url: https://open.spotify.com/user/r6ivwuv0ebk346hhxo446pbfv\n        - navigation \"Legal documents\":\n          - heading \"Legal documents\" [level=3]\n          - list:\n            - listitem:\n              - button \"Cookies settings\"\n            - listitem:\n              - button \"Cookie and Ad Preferences\"\n            - listitem:\n              - link \"Privacy and Cookies Policy\":\n                - /url: https://www.zara.com/static/pdfs/US/privacy-policy/privacy-policy_en_US-20241209.html\n            - listitem:\n              - link \"Terms of use\":\n                - /url: https://static.zara.net/static/pdfs/US/terms-and-conditions/terms-and-conditions-en_US-20250829.pdf\n    - list:\n      - listitem\n      - listitem:\n        - heading \"Footer\" [level=2]\n        - link \"sign up for our newsletter\":\n          - /url: https://www.zara.com/us/en/z-newsletter-nl1400.html?v1=11110\n        - list:\n          - listitem:\n            - link \"Tiktok\":\n              - /url: https://www.tiktok.com/@zara\n          - listitem:\n            - link \"Instagram\":\n              - /url: https://www.instagram.com/zara/\n          - listitem:\n            - link \"Facebook\":\n              - /url: https://www.facebook.com/Zara\n          - listitem:\n            - link \"Pinterest\":\n              - /url: https://es.pinterest.com/zaraofficial\n          - listitem:\n            - link \"Youtube\":\n              - /url: http://www.youtube.com/user/zara\n          - listitem:\n            - link \"Spotify\":\n              - /url: https://open.spotify.com/user/r6ivwuv0ebk346hhxo446pbfv\n        - navigation \"Legal documents\":\n          - heading \"Legal documents\" [level=3]\n          - list:\n            - listitem:\n              - button \"Cookies settings\"\n            - listitem:\n              - button \"Cookie and Ad Preferences\"\n            - listitem:\n              - link \"Privacy and Cookies Policy\":\n                - /url: https://www.zara.com/static/pdfs/US/privacy-policy/privacy-policy_en_US-20241209.html\n            - listitem:\n              - link \"Terms of use\":\n                - /url: https://static.zara.net/static/pdfs/US/terms-and-conditions/terms-and-conditions-en_US-20250829.pdf\n    - list:\n      - listitem:\n        - button \"Move to MAN\"\n- contentinfo\n- iframe"
  },
  {
    "step": 2,
    "timestamp": "2026-01-11T12:55:58.289213",
    "path": [
      "MAN"
    ],
    "action": "clicked: MAN",
    "url": "https://www.zara.com/us/",
    "new_buttons": [],
    "new_links": {
      "Go to homepage": "https://www.zara.com/us/",
      "LOG IN": "https://www.zara.com/us/en/logon",
      "Help": "https://www.zara.com/us/en/help-center",
      "GIFT CARD": "https://www.zara.com/us/en/z-giftcard-mkt1394.html",
      "CAREERS": "https://www.zara.com/us/en/work-with-us-mkt8081.html",
      "JOIN LIFE": "https://www.zara.com/us/en/z-join-life-mkt1399.html",
      "STORES": "https://www.zara.com/us/en/z-stores-st1404.html",
      "PERFUMES": "https://www.zara.com/us/en/woman-accessories-perfumes-l1017.html?v1=2419833",
      "MAKEUP": "https://www.zara.com/us/en/woman-beauty-makeup-l4414.html?v1=1881272",
      "ZARA HAIR": "https://www.zara.com/us/en/woman-hair-l7345.html?v1=2418886",
      "ABOUT": "https://www.zara.com/us/en/zara-travel-about-mkt15716.html",
      "REPAIR": "https://www.zara.com/us/en/preowned-repair-mkt5796.html",
      "SECOND HAND": "https://www.zara.com/us/en/preowned-resell-mkt5797.html",
      "DONATE": "https://www.zara.com/us/en/preowned-donate-mkt5798.html",
      "THE GUIDES": "https://www.zara.com/us/en/zara-travel-guide-mkt15717.html",
      "Youtube": "http://www.youtube.com/user/zara",
      "Spotify": "https://open.spotify.com/user/r6ivwuv0ebk346hhxo446pbfv"
    },
    "aria": "- link \"Skip to main content\":\n  - /url: \"#main\"\n- banner:\n  - button \"Close menu\"\n  - link \"Go to homepage\":\n    - /url: https://www.zara.com/us/\n  - list:\n    - listitem:\n      - link \"Search\":\n        - /url: https://www.zara.com/us/en/search/home\n    - listitem:\n      - link \"LOG IN\":\n        - /url: https://www.zara.com/us/en/logon\n    - listitem:\n      - link \"Help\":\n        - /url: https://www.zara.com/us/en/help-center\n    - listitem:\n      - link \"Cart empty\":\n        - /url: https://www.zara.com/us/en/shop/cart\n        - text: Shopping bag [\n        - status: \"0\"\n        - text: \"]\"\n- dialog \"Category Menu\":\n  - button \"Close menu\"\n  - link \"Go to homepage\":\n    - /url: https://www.zara.com/us/\n  - navigation:\n    - tablist \"Categories\":\n      - tab \"WOMAN\"\n      - tab \"MAN\" [selected]\n      - tab \"KIDS\"\n      - tab \"ZARA HOME\"\n      - tab \"BEAUTY\"\n      - tab \"MASSIMO DUTTI\"\n      - tab \"ZARA PRE-OWNED\"\n      - tab \"TRAVEL MODE\"\n    - tabpanel \"WOMAN\":\n      - list:\n        - listitem:\n          - button \"NEW COLLECTION\"\n        - listitem:\n          - button \"SALE\"\n        - listitem:\n          - link \"GIFT CARD\":\n            - /url: https://www.zara.com/us/en/z-giftcard-mkt1394.html\n        - listitem:\n          - button \"+ INFO\"\n        - listitem:\n          - link \"CAREERS\":\n            - /url: https://www.zara.com/us/en/work-with-us-mkt8081.html\n        - listitem: DOWNLOAD APP\n        - listitem:\n          - link \"JOIN LIFE\":\n            - /url: https://www.zara.com/us/en/z-join-life-mkt1399.html\n        - listitem:\n          - link \"STORES\":\n            - /url: https://www.zara.com/us/en/z-stores-st1404.html\n    - tabpanel \"MAN\":\n      - list:\n        - listitem:\n          - button \"NEW COLLECTION\"\n        - listitem:\n          - button \"SALE\" [expanded]:\n            - text: SALE\n            - img\n        - listitem:\n          - link \"GIFT CARD\":\n            - /url: https://www.zara.com/us/en/z-giftcard-mkt1394.html\n        - listitem: DOWNLOAD APP\n        - listitem:\n          - link \"STORES\":\n            - /url: https://www.zara.com/us/en/z-stores-st1404.html\n        - listitem:\n          - link \"JOIN LIFE\":\n            - /url: https://www.zara.com/us/en/z-join-life-mkt1399.html\n        - listitem: CAREERS\n        - listitem:\n          - button \"+ INFO\"\n    - tabpanel \"KIDS\":\n      - list:\n        - listitem:\n          - button \"NEW COLLECTION\"\n        - listitem:\n          - button \"SALE\"\n        - listitem:\n          - link \"GIFT CARD\":\n            - /url: https://www.zara.com/us/en/z-giftcard-mkt1394.html\n        - listitem: DOWNLOAD APP\n        - listitem:\n          - link \"STORES\":\n            - /url: https://www.zara.com/us/en/z-stores-st1404.html\n        - listitem: JOIN LIFE\n        - listitem: CAREERS\n        - listitem:\n          - button \"+ INFO\"\n    - tabpanel \"ZARA HOME\":\n      - list:\n        - listitem:\n          - button \"NEW COLLECTION\"\n        - listitem:\n          - button \"SALE\"\n        - listitem:\n          - link:\n            - /url: https://www.zara.com/us/en/zara-travel-guide-l15717.html?v1=2577013\n        - listitem:\n          - link \"GIFT CARD\":\n            - /url: https://www.zara.com/us/en/z-giftcard-mkt1394.html\n        - listitem:\n          - button \"+ INFO\"\n        - listitem: DOWNLOAD APP\n        - listitem:\n          - link \"JOIN LIFE\":\n            - /url: https://www.zara.com/us/en/z-join-life-mkt1399.html\n        - listitem:\n          - link \"CAREERS\":\n            - /url: https://www.zara.com/us/en/work-with-us-mkt8081.html\n        - listitem:\n          - link \"STORES\":\n            - /url: https://www.zara.com/us/en/z-stores-st1404.html\n        - listitem: RECALLED ITEMS\n    - tabpanel \"BEAUTY\":\n      - list:\n        - listitem:\n          - link \"PERFUMES\":\n            - /url: https://www.zara.com/us/en/woman-accessories-perfumes-l1017.html?v1=2419833\n            - paragraph: PERFUMES\n          - link \"MAKEUP\":\n            - /url: https://www.zara.com/us/en/woman-beauty-makeup-l4414.html?v1=1881272\n            - paragraph: MAKEUP\n          - link \"ZARA HAIR\":\n            - /url: https://www.zara.com/us/en/woman-hair-l7345.html?v1=2418886\n            - paragraph: ZARA HAIR\n        - listitem:\n          - button \"WOMAN\"\n        - listitem:\n          - button \"MAN\"\n        - listitem:\n          - button \"KIDS\"\n        - listitem:\n          - link:\n            - /url: https://www.zara.com/us/en/zara-travel-guide-l15717.html?v1=2577013\n        - listitem: DOWNLOAD APP\n        - listitem:\n          - link \"JOIN LIFE\":\n            - /url: https://www.zara.com/us/en/z-join-life-mkt1399.html\n        - listitem:\n          - button \"+ INFO\"\n    - tabpanel \"MASSIMO DUTTI\":\n      - list:\n        - listitem:\n          - button \"WOMAN\"\n        - listitem:\n          - button \"MAN\"\n    - tabpanel \"ZARA PRE-OWNED\":\n      - list:\n        - listitem:\n          - link \"ABOUT\":\n            - /url: https://www.zara.com/us/en/preowned-about-mkt5795.html\n        - listitem:\n          - link \"REPAIR\":\n            - /url: https://www.zara.com/us/en/preowned-repair-mkt5796.html\n        - listitem:\n          - link \"SECOND HAND\":\n            - /url: https://www.zara.com/us/en/preowned-resell-mkt5797.html\n        - listitem:\n          - link \"DONATE\":\n            - /url: https://www.zara.com/us/en/preowned-donate-mkt5798.html\n        - listitem:\n          - link \"JOIN LIFE\":\n            - /url: https://www.zara.com/us/en/z-join-life-mkt1399.html\n        - listitem:\n          - link \"CAREERS\":\n            - /url: https://www.zara.com/us/en/work-with-us-mkt8081.html\n        - listitem:\n          - link \"STORES\":\n            - /url: https://www.zara.com/us/en/z-stores-st1404.html\n    - tabpanel \"TRAVEL MODE\":\n      - list:\n        - listitem:\n          - link \"ABOUT\":\n            - /url: https://www.zara.com/us/en/zara-travel-about-mkt15716.html\n        - listitem:\n          - link \"THE GUIDES\":\n            - /url: https://www.zara.com/us/en/zara-travel-guide-mkt15717.html\n- main:\n  - heading \"ZARA United States | SALE\" [level=1]\n  - region \"Zara category carousel\":\n    - list:\n      - listitem\n      - listitem\n      - listitem\n      - listitem\n      - listitem\n      - listitem\n      - listitem\n      - listitem\n      - listitem:\n        - text: THE NEW Scroll down\n        - heading \"Footer\" [level=2]\n        - link \"sign up for our newsletter\":\n          - /url: https://www.zara.com/us/en/z-newsletter-nl1400.html?v1=11110\n        - list:\n          - listitem:\n            - link \"Tiktok\":\n              - /url: https://www.tiktok.com/@zara\n          - listitem:\n            - link \"Instagram\":\n              - /url: https://www.instagram.com/zara/\n          - listitem:\n            - link \"Facebook\":\n              - /url: https://www.facebook.com/Zara\n          - listitem:\n            - link \"Pinterest\":\n              - /url: https://es.pinterest.com/zaraofficial\n          - listitem:\n            - link \"Youtube\":\n              - /url: http://www.youtube.com/user/zara\n          - listitem:\n            - link \"Spotify\":\n              - /url: https://open.spotify.com/user/r6ivwuv0ebk346hhxo446pbfv\n        - navigation \"Legal documents\":\n          - heading \"Legal documents\" [level=3]\n          - list:\n            - listitem:\n              - button \"Do Not Sell Or Share My Personal Information\"\n            - listitem:\n              - button \"Cookie and Ad Preferences\"\n            - listitem:\n              - link \"Privacy and Cookies Policy\":\n                - /url: https://www.zara.com/static/pdfs/US/privacy-policy/privacy-policy_en_US-20241209.html\n            - listitem:\n              - link \"Terms of use\":\n                - /url: https://static.zara.net/static/pdfs/US/terms-and-conditions/terms-and-conditions-en_US-20250829.pdf\n    - list:\n      - listitem\n      - listitem\n      - listitem\n      - listitem\n      - listitem\n      - listitem\n      - listitem:\n        - text: THE NEW Scroll down\n        - heading \"Footer\" [level=2]\n        - link \"sign up for our newsletter\":\n          - /url: https://www.zara.com/us/en/z-newsletter-nl1400.html?v1=11110\n        - list:\n          - listitem:\n            - link \"Tiktok\":\n              - /url: https://www.tiktok.com/@zara\n          - listitem:\n            - link \"Instagram\":\n              - /url: https://www.instagram.com/zara/\n          - listitem:\n            - link \"Facebook\":\n              - /url: https://www.facebook.com/Zara\n          - listitem:\n            - link \"Pinterest\":\n              - /url: https://es.pinterest.com/zaraofficial\n          - listitem:\n            - link \"Youtube\":\n              - /url: http://www.youtube.com/user/zara\n          - listitem:\n            - link \"Spotify\":\n              - /url: https://open.spotify.com/user/r6ivwuv0ebk346hhxo446pbfv\n        - navigation \"Legal documents\":\n          - heading \"Legal documents\" [level=3]\n          - list:\n            - listitem:\n              - button \"Do Not Sell Or Share My Personal Information\"\n            - listitem:\n              - button \"Cookie and Ad Preferences\"\n            - listitem:\n              - link \"Privacy and Cookies Policy\":\n                - /url: https://www.zara.com/static/pdfs/US/privacy-policy/privacy-policy_en_US-20241209.html\n            - listitem:\n              - link \"Terms of use\":\n                - /url: https://static.zara.net/static/pdfs/US/terms-and-conditions/terms-and-conditions-en_US-20250829.pdf\n    - list:\n      - listitem\n      - listitem\n      - listitem\n      - listitem\n      - listitem\n      - listitem\n      - listitem\n      - listitem\n      - listitem\n      - listitem:\n        - text: THE NEW Scroll down\n        - heading \"Footer\" [level=2]\n        - link \"sign up for our newsletter\":\n          - /url: https://www.zara.com/us/en/z-newsletter-nl1400.html?v1=11110\n        - list:\n          - listitem:\n            - link \"Tiktok\":\n              - /url: https://www.tiktok.com/@zara\n          - listitem:\n            - link \"Instagram\":\n              - /url: https://www.instagram.com/zara/\n          - listitem:\n            - link \"Facebook\":\n              - /url: https://www.facebook.com/Zara\n          - listitem:\n            - link \"Pinterest\":\n              - /url: https://es.pinterest.com/zaraofficial\n          - listitem:\n            - link \"Youtube\":\n              - /url: http://www.youtube.com/user/zara\n          - listitem:\n            - link \"Spotify\":\n              - /url: https://open.spotify.com/user/r6ivwuv0ebk346hhxo446pbfv\n        - navigation \"Legal documents\":\n          - heading \"Legal documents\" [level=3]\n          - list:\n            - listitem:\n              - button \"Do Not Sell Or Share My Personal Information\"\n            - listitem:\n              - button \"Cookie and Ad Preferences\"\n            - listitem:\n              - link \"Privacy and Cookies Policy\":\n                - /url: https://www.zara.com/static/pdfs/US/privacy-policy/privacy-policy_en_US-20241209.html\n            - listitem:\n              - link \"Terms of use\":\n                - /url: https://static.zara.net/static/pdfs/US/terms-and-conditions/terms-and-conditions-en_US-20250829.pdf\n    - list:\n      - listitem\n      - listitem\n      - listitem\n      - listitem\n      - listitem\n      - listitem\n      - listitem\n      - listitem:\n        - text: THE NEW Scroll down\n        - heading \"Footer\" [level=2]\n        - link \"sign up for our newsletter\":\n          - /url: https://www.zara.com/us/en/z-newsletter-nl1400.html?v1=11110\n        - list:\n          - listitem:\n            - link \"Tiktok\":\n              - /url: https://www.tiktok.com/@zara\n          - listitem:\n            - link \"Instagram\":\n              - /url: https://www.instagram.com/zara/\n          - listitem:\n            - link \"Facebook\":\n              - /url: https://www.facebook.com/Zara\n          - listitem:\n            - link \"Pinterest\":\n              - /url: https://es.pinterest.com/zaraofficial\n          - listitem:\n            - link \"Youtube\":\n              - /url: http://www.youtube.com/user/zara\n          - listitem:\n            - link \"Spotify\":\n              - /url: https://open.spotify.com/user/r6ivwuv0ebk346hhxo446pbfv\n        - navigation \"Legal documents\":\n          - heading \"Legal documents\" [level=3]\n          - list:\n            - listitem:\n              - button \"Do Not Sell Or Share My Personal Information\"\n            - listitem:\n              - button \"Cookie and Ad Preferences\"\n            - listitem:\n              - link \"Privacy and Cookies Policy\":\n                - /url: https://www.zara.com/static/pdfs/US/privacy-policy/privacy-policy_en_US-20241209.html\n            - listitem:\n              - link \"Terms of use\":\n                - /url: https://static.zara.net/static/pdfs/US/terms-and-conditions/terms-and-conditions-en_US-20250829.pdf\n    - list:\n      - listitem\n      - listitem\n      - listitem\n      - listitem\n      - listitem:\n        - heading \"Footer\" [level=2]\n        - link \"sign up for our newsletter\":\n          - /url: https://www.zara.com/us/en/z-newsletter-nl1400.html?v1=11110\n        - list:\n          - listitem:\n            - link \"Tiktok\":\n              - /url: https://www.tiktok.com/@zara\n          - listitem:\n            - link \"Instagram\":\n              - /url: https://www.instagram.com/zara/\n          - listitem:\n            - link \"Facebook\":\n              - /url: https://www.facebook.com/Zara\n          - listitem:\n            - link \"Pinterest\":\n              - /url: https://es.pinterest.com/zaraofficial\n          - listitem:\n            - link \"Youtube\":\n              - /url: http://www.youtube.com/user/zara\n          - listitem:\n            - link \"Spotify\":\n              - /url: https://open.spotify.com/user/r6ivwuv0ebk346hhxo446pbfv\n        - navigation \"Legal documents\":\n          - heading \"Legal documents\" [level=3]\n          - list:\n            - listitem:\n              - button \"Do Not Sell Or Share My Personal Information\"\n            - listitem:\n              - button \"Cookie and Ad Preferences\"\n            - listitem:\n              - link \"Privacy and Cookies Policy\":\n                - /url: https://www.zara.com/static/pdfs/US/privacy-policy/privacy-policy_en_US-20241209.html\n            - listitem:\n              - link \"Terms of use\":\n                - /url: https://static.zara.net/static/pdfs/US/terms-and-conditions/terms-and-conditions-en_US-20250829.pdf\n    - list:\n      - listitem\n      - listitem\n      - listitem\n      - listitem\n      - listitem\n      - listitem\n      - listitem:\n        - text: VIEW ALL Scroll down\n        - heading \"Footer\" [level=2]\n        - link \"sign up for our newsletter\":\n          - /url: https://www.zara.com/us/en/z-newsletter-nl1400.html?v1=11110\n        - list:\n          - listitem:\n            - link \"Tiktok\":\n              - /url: https://www.tiktok.com/@zara\n          - listitem:\n            - link \"Instagram\":\n              - /url: https://www.instagram.com/zara/\n          - listitem:\n            - link \"Facebook\":\n              - /url: https://www.facebook.com/Zara\n          - listitem:\n            - link \"Pinterest\":\n              - /url: https://es.pinterest.com/zaraofficial\n          - listitem:\n            - link \"Youtube\":\n              - /url: http://www.youtube.com/user/zara\n          - listitem:\n            - link \"Spotify\":\n              - /url: https://open.spotify.com/user/r6ivwuv0ebk346hhxo446pbfv\n        - navigation \"Legal documents\":\n          - heading \"Legal documents\" [level=3]\n          - list:\n            - listitem:\n              - button \"Do Not Sell Or Share My Personal Information\"\n            - listitem:\n              - button \"Cookie and Ad Preferences\"\n            - listitem:\n              - link \"Privacy and Cookies Policy\":\n                - /url: https://www.zara.com/static/pdfs/US/privacy-policy/privacy-policy_en_US-20241209.html\n            - listitem:\n              - link \"Terms of use\":\n                - /url: https://static.zara.net/static/pdfs/US/terms-and-conditions/terms-and-conditions-en_US-20250829.pdf\n    - list:\n      - listitem\n      - listitem\n      - listitem\n      - listitem:\n        - heading \"Footer\" [level=2]\n        - link \"sign up for our newsletter\":\n          - /url: https://www.zara.com/us/en/z-newsletter-nl1400.html?v1=11110\n        - list:\n          - listitem:\n            - link \"Tiktok\":\n              - /url: https://www.tiktok.com/@zara\n          - listitem:\n            - link \"Instagram\":\n              - /url: https://www.instagram.com/zara/\n          - listitem:\n            - link \"Facebook\":\n              - /url: https://www.facebook.com/Zara\n          - listitem:\n            - link \"Pinterest\":\n              - /url: https://es.pinterest.com/zaraofficial\n          - listitem:\n            - link \"Youtube\":\n              - /url: http://www.youtube.com/user/zara\n          - listitem:\n            - link \"Spotify\":\n              - /url: https://open.spotify.com/user/r6ivwuv0ebk346hhxo446pbfv\n        - navigation \"Legal documents\":\n          - heading \"Legal documents\" [level=3]\n          - list:\n            - listitem:\n              - button \"Do Not Sell Or Share My Personal Information\"\n            - listitem:\n              - button \"Cookie and Ad Preferences\"\n            - listitem:\n              - link \"Privacy and Cookies Policy\":\n                - /url: https://www.zara.com/static/pdfs/US/privacy-policy/privacy-policy_en_US-20241209.html\n            - listitem:\n              - link \"Terms of use\":\n                - /url: https://static.zara.net/static/pdfs/US/terms-and-conditions/terms-and-conditions-en_US-20250829.pdf\n    - list:\n      - listitem\n      - listitem:\n        - heading \"Footer\" [level=2]\n        - link \"sign up for our newsletter\":\n          - /url: https://www.zara.com/us/en/z-newsletter-nl1400.html?v1=11110\n        - list:\n          - listitem:\n            - link \"Tiktok\":\n              - /url: https://www.tiktok.com/@zara\n          - listitem:\n            - link \"Instagram\":\n              - /url: https://www.instagram.com/zara/\n          - listitem:\n            - link \"Facebook\":\n              - /url: https://www.facebook.com/Zara\n          - listitem:\n            - link \"Pinterest\":\n              - /url: https://es.pinterest.com/zaraofficial\n          - listitem:\n            - link \"Youtube\":\n              - /url: http://www.youtube.com/user/zara\n          - listitem:\n            - link \"Spotify\":\n              - /url: https://open.spotify.com/user/r6ivwuv0ebk346hhxo446pbfv\n        - navigation \"Legal documents\":\n          - heading \"Legal documents\" [level=3]\n          - list:\n            - listitem:\n              - button \"Do Not Sell Or Share My Personal Information\"\n            - listitem:\n              - button \"Cookie and Ad Preferences\"\n            - listitem:\n              - link \"Privacy and Cookies Policy\":\n                - /url: https://www.zara.com/static/pdfs/US/privacy-policy/privacy-policy_en_US-20241209.html\n            - listitem:\n              - link \"Terms of use\":\n                - /url: https://static.zara.net/static/pdfs/US/terms-and-conditions/terms-and-conditions-en_US-20250829.pdf\n    - list:\n      - listitem:\n        - button \"Move to WOMAN\"\n      - listitem:\n        - button \"Move to KID\"\n- contentinfo\n- iframe"
  },
  {
    "step": 3,
    "timestamp": "2026-01-11T12:56:02.764975",
    "path": [
      "KIDS"
    ],
    "action": "clicked: KIDS",
    "url": "https://www.zara.com/us/",
    "new_buttons": [],
    "new_links": {
      "Go to homepage": "https://www.zara.com/us/",
      "LOG IN": "https://www.zara.com/us/en/logon",
      "Help": "https://www.zara.com/us/en/help-center",
      "GIFT CARD": "https://www.zara.com/us/en/z-giftcard-mkt1394.html",
      "CAREERS": "https://www.zara.com/us/en/work-with-us-mkt8081.html",
      "JOIN LIFE": "https://www.zara.com/us/en/z-join-life-mkt1399.html",
      "STORES": "https://www.zara.com/us/en/z-stores-st1404.html",
      "PERFUMES": "https://www.zara.com/us/en/woman-accessories-perfumes-l1017.html?v1=2419833",
      "MAKEUP": "https://www.zara.com/us/en/woman-beauty-makeup-l4414.html?v1=1881272",
      "ZARA HAIR": "https://www.zara.com/us/en/woman-hair-l7345.html?v1=2418886",
      "ABOUT": "https://www.zara.com/us/en/zara-travel-about-mkt15716.html",
      "REPAIR": "https://www.zara.com/us/en/preowned-repair-mkt5796.html",
      "SECOND HAND": "https://www.zara.com/us/en/preowned-resell-mkt5797.html",
      "DONATE": "https://www.zara.com/us/en/preowned-donate-mkt5798.html",
      "THE GUIDES": "https://www.zara.com/us/en/zara-travel-guide-mkt15717.html",
      "Youtube": "http://www.youtube.com/user/zara",
      "Spotify": "https://open.spotify.com/user/r6ivwuv0ebk346hhxo446pbfv"
    },
    "aria": "- link \"Skip to main content\":\n  - /url: \"#main\"\n- banner:\n  - button \"Close menu\"\n  - link \"Go to homepage\":\n    - /url: https://www.zara.com/us/\n  - list:\n    - listitem:\n      - link \"Search\":\n        - /url: https://www.zara.com/us/en/search/home\n    - listitem:\n      - link \"LOG IN\":\n        - /url: https://www.zara.com/us/en/logon\n    - listitem:\n      - link \"Help\":\n        - /url: https://www.zara.com/us/en/help-center\n    - listitem:\n      - link \"Cart empty\":\n        - /url: https://www.zara.com/us/en/shop/cart\n        - text: Shopping bag [\n        - status: \"0\"\n        - text: \"]\"\n- dialog \"Category Menu\":\n  - button \"Close menu\"\n  - link \"Go to homepage\":\n    - /url: https://www.zara.com/us/\n  - navigation:\n    - tablist \"Categories\":\n      - tab \"WOMAN\"\n      - tab \"MAN\"\n      - tab \"KIDS\" [selected]\n      - tab \"ZARA HOME\"\n      - tab \"BEAUTY\"\n      - tab \"MASSIMO DUTTI\"\n      - tab \"ZARA PRE-OWNED\"\n      - tab \"TRAVEL MODE\"\n    - tabpanel \"WOMAN\":\n      - list:\n        - listitem:\n          - button \"NEW COLLECTION\"\n        - listitem:\n          - button \"SALE\"\n        - listitem:\n          - link \"GIFT CARD\":\n            - /url: https://www.zara.com/us/en/z-giftcard-mkt1394.html\n        - listitem:\n          - button \"+ INFO\"\n        - listitem:\n          - link \"CAREERS\":\n            - /url: https://www.zara.com/us/en/work-with-us-mkt8081.html\n        - listitem: DOWNLOAD APP\n        - listitem:\n          - link \"JOIN LIFE\":\n            - /url: https://www.zara.com/us/en/z-join-life-mkt1399.html\n        - listitem:\n          - link \"STORES\":\n            - /url: https://www.zara.com/us/en/z-stores-st1404.html\n    - tabpanel \"MAN\":\n      - list:\n        - listitem:\n          - button \"NEW COLLECTION\"\n        - listitem:\n          - button \"SALE\"\n        - listitem:\n          - link \"GIFT CARD\":\n            - /url: https://www.zara.com/us/en/z-giftcard-mkt1394.html\n        - listitem: DOWNLOAD APP\n        - listitem:\n          - link \"STORES\":\n            - /url: https://www.zara.com/us/en/z-stores-st1404.html\n        - listitem:\n          - link \"JOIN LIFE\":\n            - /url: https://www.zara.com/us/en/z-join-life-mkt1399.html\n        - listitem: CAREERS\n        - listitem:\n          - button \"+ INFO\"\n    - tabpanel \"KIDS\":\n      - list:\n        - listitem:\n          - button \"NEW COLLECTION\"\n        - listitem:\n          - button \"SALE\" [expanded]:\n            - text: SALE\n            - img\n        - listitem:\n          - link \"GIFT CARD\":\n            - /url: https://www.zara.com/us/en/z-giftcard-mkt1394.html\n        - listitem: DOWNLOAD APP\n        - listitem:\n          - link \"STORES\":\n            - /url: https://www.zara.com/us/en/z-stores-st1404.html\n        - listitem: JOIN LIFE\n        - listitem: CAREERS\n        - listitem:\n          - button \"+ INFO\"\n    - tabpanel \"ZARA HOME\":\n      - list:\n        - listitem:\n          - button \"NEW COLLECTION\"\n        - listitem:\n          - button \"SALE\"\n        - listitem:\n          - link:\n            - /url: https://www.zara.com/us/en/zara-travel-guide-l15717.html?v1=2577013\n        - listitem:\n          - link \"GIFT CARD\":\n            - /url: https://www.zara.com/us/en/z-giftcard-mkt1394.html\n        - listitem:\n          - button \"+ INFO\"\n        - listitem: DOWNLOAD APP\n        - listitem:\n          - link \"JOIN LIFE\":\n            - /url: https://www.zara.com/us/en/z-join-life-mkt1399.html\n        - listitem:\n          - link \"CAREERS\":\n            - /url: https://www.zara.com/us/en/work-with-us-mkt8081.html\n        - listitem:\n          - link \"STORES\":\n            - /url: https://www.zara.com/us/en/z-stores-st1404.html\n        - listitem: RECALLED ITEMS\n    - tabpanel \"BEAUTY\":\n      - list:\n        - listitem:\n          - link \"PERFUMES\":\n            - /url: https://www.zara.com/us/en/woman-accessories-perfumes-l1017.html?v1=2419833\n            - paragraph: PERFUMES\n          - link \"MAKEUP\":\n            - /url: https://www.zara.com/us/en/woman-beauty-makeup-l4414.html?v1=1881272\n            - paragraph: MAKEUP\n          - link \"ZARA HAIR\":\n            - /url: https://www.zara.com/us/en/woman-hair-l7345.html?v1=2418886\n            - paragraph: ZARA HAIR\n        - listitem:\n          - button \"WOMAN\"\n        - listitem:\n          - button \"MAN\"\n        - listitem:\n          - button \"KIDS\"\n        - listitem:\n          - link:\n            - /url: https://www.zara.com/us/en/zara-travel-guide-l15717.html?v1=2577013\n        - listitem: DOWNLOAD APP\n        - listitem:\n          - link \"JOIN LIFE\":\n            - /url: https://www.zara.com/us/en/z-join-life-mkt1399.html\n        - listitem:\n          - button \"+ INFO\"\n    - tabpanel \"MASSIMO DUTTI\":\n      - list:\n        - listitem:\n          - button \"WOMAN\"\n        - listitem:\n          - button \"MAN\"\n    - tabpanel \"ZARA PRE-OWNED\":\n      - list:\n        - listitem:\n          - link \"ABOUT\":\n            - /url: https://www.zara.com/us/en/preowned-about-mkt5795.html\n        - listitem:\n          - link \"REPAIR\":\n            - /url: https://www.zara.com/us/en/preowned-repair-mkt5796.html\n        - listitem:\n          - link \"SECOND HAND\":\n            - /url: https://www.zara.com/us/en/preowned-resell-mkt5797.html\n        - listitem:\n          - link \"DONATE\":\n            - /url: https://www.zara.com/us/en/preowned-donate-mkt5798.html\n        - listitem:\n          - link \"JOIN LIFE\":\n            - /url: https://www.zara.com/us/en/z-join-life-mkt1399.html\n        - listitem:\n          - link \"CAREERS\":\n            - /url: https://www.zara.com/us/en/work-with-us-mkt8081.html\n        - listitem:\n          - link \"STORES\":\n            - /url: https://www.zara.com/us/en/z-stores-st1404.html\n    - tabpanel \"TRAVEL MODE\":\n      - list:\n        - listitem:\n          - link \"ABOUT\":\n            - /url: https://www.zara.com/us/en/zara-travel-about-mkt15716.html\n        - listitem:\n          - link \"THE GUIDES\":\n            - /url: https://www.zara.com/us/en/zara-travel-guide-mkt15717.html\n- main:\n  - heading \"ZARA United States | SALE\" [level=1]\n  - region \"Zara category carousel\":\n    - list:\n      - listitem\n      - listitem\n      - listitem\n      - listitem\n      - listitem\n      - listitem\n      - listitem\n      - listitem\n      - listitem:\n        - text: THE NEW Scroll down\n        - heading \"Footer\" [level=2]\n        - link \"sign up for our newsletter\":\n          - /url: https://www.zara.com/us/en/z-newsletter-nl1400.html?v1=11110\n        - list:\n          - listitem:\n            - link \"Tiktok\":\n              - /url: https://www.tiktok.com/@zara\n          - listitem:\n            - link \"Instagram\":\n              - /url: https://www.instagram.com/zara/\n          - listitem:\n            - link \"Facebook\":\n              - /url: https://www.facebook.com/Zara\n          - listitem:\n            - link \"Pinterest\":\n              - /url: https://es.pinterest.com/zaraofficial\n          - listitem:\n            - link \"Youtube\":\n              - /url: http://www.youtube.com/user/zara\n          - listitem:\n            - link \"Spotify\":\n              - /url: https://open.spotify.com/user/r6ivwuv0ebk346hhxo446pbfv\n        - navigation \"Legal documents\":\n          - heading \"Legal documents\" [level=3]\n          - list:\n            - listitem:\n              - button \"Do Not Sell Or Share My Personal Information\"\n            - listitem:\n              - button \"Cookie and Ad Preferences\"\n            - listitem:\n              - link \"Privacy and Cookies Policy\":\n                - /url: https://www.zara.com/static/pdfs/US/privacy-policy/privacy-policy_en_US-20241209.html\n            - listitem:\n              - link \"Terms of use\":\n                - /url: https://static.zara.net/static/pdfs/US/terms-and-conditions/terms-and-conditions-en_US-20250829.pdf\n    - list:\n      - listitem\n      - listitem\n      - listitem\n      - listitem\n      - listitem\n      - listitem\n      - listitem:\n        - text: THE NEW Scroll down\n        - heading \"Footer\" [level=2]\n        - link \"sign up for our newsletter\":\n          - /url: https://www.zara.com/us/en/z-newsletter-nl1400.html?v1=11110\n        - list:\n          - listitem:\n            - link \"Tiktok\":\n              - /url: https://www.tiktok.com/@zara\n          - listitem:\n            - link \"Instagram\":\n              - /url: https://www.instagram.com/zara/\n          - listitem:\n            - link \"Facebook\":\n              - /url: https://www.facebook.com/Zara\n          - listitem:\n            - link \"Pinterest\":\n              - /url: https://es.pinterest.com/zaraofficial\n          - listitem:\n            - link \"Youtube\":\n              - /url: http://www.youtube.com/user/zara\n          - listitem:\n            - link \"Spotify\":\n              - /url: https://open.spotify.com/user/r6ivwuv0ebk346hhxo446pbfv\n        - navigation \"Legal documents\":\n          - heading \"Legal documents\" [level=3]\n          - list:\n            - listitem:\n              - button \"Do Not Sell Or Share My Personal Information\"\n            - listitem:\n              - button \"Cookie and Ad Preferences\"\n            - listitem:\n              - link \"Privacy and Cookies Policy\":\n                - /url: https://www.zara.com/static/pdfs/US/privacy-policy/privacy-policy_en_US-20241209.html\n            - listitem:\n              - link \"Terms of use\":\n                - /url: https://static.zara.net/static/pdfs/US/terms-and-conditions/terms-and-conditions-en_US-20250829.pdf\n    - list:\n      - listitem\n      - listitem\n      - listitem\n      - listitem\n      - listitem\n      - listitem\n      - listitem\n      - listitem\n      - listitem\n      - listitem:\n        - text: THE NEW Scroll down\n        - heading \"Footer\" [level=2]\n        - link \"sign up for our newsletter\":\n          - /url: https://www.zara.com/us/en/z-newsletter-nl1400.html?v1=11110\n        - list:\n          - listitem:\n            - link \"Tiktok\":\n              - /url: https://www.tiktok.com/@zara\n          - listitem:\n            - link \"Instagram\":\n              - /url: https://www.instagram.com/zara/\n          - listitem:\n            - link \"Facebook\":\n              - /url: https://www.facebook.com/Zara\n          - listitem:\n            - link \"Pinterest\":\n              - /url: https://es.pinterest.com/zaraofficial\n          - listitem:\n            - link \"Youtube\":\n              - /url: http://www.youtube.com/user/zara\n          - listitem:\n            - link \"Spotify\":\n              - /url: https://open.spotify.com/user/r6ivwuv0ebk346hhxo446pbfv\n        - navigation \"Legal documents\":\n          - heading \"Legal documents\" [level=3]\n          - list:\n            - listitem:\n              - button \"Do Not Sell Or Share My Personal Information\"\n            - listitem:\n              - button \"Cookie and Ad Preferences\"\n            - listitem:\n              - link \"Privacy and Cookies Policy\":\n                - /url: https://www.zara.com/static/pdfs/US/privacy-policy/privacy-policy_en_US-20241209.html\n            - listitem:\n              - link \"Terms of use\":\n                - /url: https://static.zara.net/static/pdfs/US/terms-and-conditions/terms-and-conditions-en_US-20250829.pdf\n    - list:\n      - listitem\n      - listitem\n      - listitem\n      - listitem\n      - listitem\n      - listitem\n      - listitem\n      - listitem:\n        - text: THE NEW Scroll down\n        - heading \"Footer\" [level=2]\n        - link \"sign up for our newsletter\":\n          - /url: https://www.zara.com/us/en/z-newsletter-nl1400.html?v1=11110\n        - list:\n          - listitem:\n            - link \"Tiktok\":\n              - /url: https://www.tiktok.com/@zara\n          - listitem:\n            - link \"Instagram\":\n              - /url: https://www.instagram.com/zara/\n          - listitem:\n            - link \"Facebook\":\n              - /url: https://www.facebook.com/Zara\n          - listitem:\n            - link \"Pinterest\":\n              - /url: https://es.pinterest.com/zaraofficial\n          - listitem:\n            - link \"Youtube\":\n              - /url: http://www.youtube.com/user/zara\n          - listitem:\n            - link \"Spotify\":\n              - /url: https://open.spotify.com/user/r6ivwuv0ebk346hhxo446pbfv\n        - navigation \"Legal documents\":\n          - heading \"Legal documents\" [level=3]\n          - list:\n            - listitem:\n              - button \"Do Not Sell Or Share My Personal Information\"\n            - listitem:\n              - button \"Cookie and Ad Preferences\"\n            - listitem:\n              - link \"Privacy and Cookies Policy\":\n                - /url: https://www.zara.com/static/pdfs/US/privacy-policy/privacy-policy_en_US-20241209.html\n            - listitem:\n              - link \"Terms of use\":\n                - /url: https://static.zara.net/static/pdfs/US/terms-and-conditions/terms-and-conditions-en_US-20250829.pdf\n    - list:\n      - listitem\n      - listitem\n      - listitem\n      - listitem\n      - listitem:\n        - heading \"Footer\" [level=2]\n        - link \"sign up for our newsletter\":\n          - /url: https://www.zara.com/us/en/z-newsletter-nl1400.html?v1=11110\n        - list:\n          - listitem:\n            - link \"Tiktok\":\n              - /url: https://www.tiktok.com/@zara\n          - listitem:\n            - link \"Instagram\":\n              - /url: https://www.instagram.com/zara/\n          - listitem:\n            - link \"Facebook\":\n              - /url: https://www.facebook.com/Zara\n          - listitem:\n            - link \"Pinterest\":\n              - /url: https://es.pinterest.com/zaraofficial\n          - listitem:\n            - link \"Youtube\":\n              - /url: http://www.youtube.com/user/zara\n          - listitem:\n            - link \"Spotify\":\n              - /url: https://open.spotify.com/user/r6ivwuv0ebk346hhxo446pbfv\n        - navigation \"Legal documents\":\n          - heading \"Legal documents\" [level=3]\n          - list:\n            - listitem:\n              - button \"Do Not Sell Or Share My Personal Information\"\n            - listitem:\n              - button \"Cookie and Ad Preferences\"\n            - listitem:\n              - link \"Privacy and Cookies Policy\":\n                - /url: https://www.zara.com/static/pdfs/US/privacy-policy/privacy-policy_en_US-20241209.html\n            - listitem:\n              - link \"Terms of use\":\n                - /url: https://static.zara.net/static/pdfs/US/terms-and-conditions/terms-and-conditions-en_US-20250829.pdf\n    - list:\n      - listitem\n      - listitem\n      - listitem\n      - listitem\n      - listitem\n      - listitem\n      - listitem:\n        - text: VIEW ALL Scroll down\n        - heading \"Footer\" [level=2]\n        - link \"sign up for our newsletter\":\n          - /url: https://www.zara.com/us/en/z-newsletter-nl1400.html?v1=11110\n        - list:\n          - listitem:\n            - link \"Tiktok\":\n              - /url: https://www.tiktok.com/@zara\n          - listitem:\n            - link \"Instagram\":\n              - /url: https://www.instagram.com/zara/\n          - listitem:\n            - link \"Facebook\":\n              - /url: https://www.facebook.com/Zara\n          - listitem:\n            - link \"Pinterest\":\n              - /url: https://es.pinterest.com/zaraofficial\n          - listitem:\n            - link \"Youtube\":\n              - /url: http://www.youtube.com/user/zara\n          - listitem:\n            - link \"Spotify\":\n              - /url: https://open.spotify.com/user/r6ivwuv0ebk346hhxo446pbfv\n        - navigation \"Legal documents\":\n          - heading \"Legal documents\" [level=3]\n          - list:\n            - listitem:\n              - button \"Do Not Sell Or Share My Personal Information\"\n            - listitem:\n              - button \"Cookie and Ad Preferences\"\n            - listitem:\n              - link \"Privacy and Cookies Policy\":\n                - /url: https://www.zara.com/static/pdfs/US/privacy-policy/privacy-policy_en_US-20241209.html\n            - listitem:\n              - link \"Terms of use\":\n                - /url: https://static.zara.net/static/pdfs/US/terms-and-conditions/terms-and-conditions-en_US-20250829.pdf\n    - list:\n      - listitem\n      - listitem\n      - listitem\n      - listitem:\n        - heading \"Footer\" [level=2]\n        - link \"sign up for our newsletter\":\n          - /url: https://www.zara.com/us/en/z-newsletter-nl1400.html?v1=11110\n        - list:\n          - listitem:\n            - link \"Tiktok\":\n              - /url: https://www.tiktok.com/@zara\n          - listitem:\n            - link \"Instagram\":\n              - /url: https://www.instagram.com/zara/\n          - listitem:\n            - link \"Facebook\":\n              - /url: https://www.facebook.com/Zara\n          - listitem:\n            - link \"Pinterest\":\n              - /url: https://es.pinterest.com/zaraofficial\n          - listitem:\n            - link \"Youtube\":\n              - /url: http://www.youtube.com/user/zara\n          - listitem:\n            - link \"Spotify\":\n              - /url: https://open.spotify.com/user/r6ivwuv0ebk346hhxo446pbfv\n        - navigation \"Legal documents\":\n          - heading \"Legal documents\" [level=3]\n          - list:\n            - listitem:\n              - button \"Do Not Sell Or Share My Personal Information\"\n            - listitem:\n              - button \"Cookie and Ad Preferences\"\n            - listitem:\n              - link \"Privacy and Cookies Policy\":\n                - /url: https://www.zara.com/static/pdfs/US/privacy-policy/privacy-policy_en_US-20241209.html\n            - listitem:\n              - link \"Terms of use\":\n                - /url: https://static.zara.net/static/pdfs/US/terms-and-conditions/terms-and-conditions-en_US-20250829.pdf\n    - list:\n      - listitem\n      - listitem:\n        - heading \"Footer\" [level=2]\n        - link \"sign up for our newsletter\":\n          - /url: https://www.zara.com/us/en/z-newsletter-nl1400.html?v1=11110\n        - list:\n          - listitem:\n            - link \"Tiktok\":\n              - /url: https://www.tiktok.com/@zara\n          - listitem:\n            - link \"Instagram\":\n              - /url: https://www.instagram.com/zara/\n          - listitem:\n            - link \"Facebook\":\n              - /url: https://www.facebook.com/Zara\n          - listitem:\n            - link \"Pinterest\":\n              - /url: https://es.pinterest.com/zaraofficial\n          - listitem:\n            - link \"Youtube\":\n              - /url: http://www.youtube.com/user/zara\n          - listitem:\n            - link \"Spotify\":\n              - /url: https://open.spotify.com/user/r6ivwuv0ebk346hhxo446pbfv\n        - navigation \"Legal documents\":\n          - heading \"Legal documents\" [level=3]\n          - list:\n            - listitem:\n              - button \"Do Not Sell Or Share My Personal Information\"\n            - listitem:\n              - button \"Cookie and Ad Preferences\"\n            - listitem:\n              - link \"Privacy and Cookies Policy\":\n                - /url: https://www.zara.com/static/pdfs/US/privacy-policy/privacy-policy_en_US-20241209.html\n            - listitem:\n              - link \"Terms of use\":\n                - /url: https://static.zara.net/static/pdfs/US/terms-and-conditions/terms-and-conditions-en_US-20250829.pdf\n    - list:\n      - listitem:\n        - button \"Move to MAN\"\n      - listitem:\n        - button \"Move to HOME\"\n- contentinfo\n- iframe"
  },
  {
    "step": 4,
    "timestamp": "2026-01-11T12:56:06.710729",
    "path": [
      "ZARA HOME"
    ],
    "action": "clicked: ZARA HOME",
    "url": "https://www.zara.com/us/",
    "new_buttons": [],
    "new_links": {
      "Go to homepage": "https://www.zara.com/us/",
      "LOG IN": "https://www.zara.com/us/en/logon",
      "Help": "https://www.zara.com/us/en/help-center",
      "GIFT CARD": "https://www.zara.com/us/en/z-giftcard-mkt1394.html",
      "CAREERS": "https://www.zara.com/us/en/work-with-us-mkt8081.html",
      "JOIN LIFE": "https://www.zara.com/us/en/z-join-life-mkt1399.html",
      "STORES": "https://www.zara.com/us/en/z-stores-st1404.html",
      "PERFUMES": "https://www.zara.com/us/en/woman-accessories-perfumes-l1017.html?v1=2419833",
      "MAKEUP": "https://www.zara.com/us/en/woman-beauty-makeup-l4414.html?v1=1881272",
      "ZARA HAIR": "https://www.zara.com/us/en/woman-hair-l7345.html?v1=2418886",
      "ABOUT": "https://www.zara.com/us/en/zara-travel-about-mkt15716.html",
      "REPAIR": "https://www.zara.com/us/en/preowned-repair-mkt5796.html",
      "SECOND HAND": "https://www.zara.com/us/en/preowned-resell-mkt5797.html",
      "DONATE": "https://www.zara.com/us/en/preowned-donate-mkt5798.html",
      "THE GUIDES": "https://www.zara.com/us/en/zara-travel-guide-mkt15717.html",
      "Youtube": "http://www.youtube.com/user/zara",
      "Spotify": "https://open.spotify.com/user/r6ivwuv0ebk346hhxo446pbfv"
    },
    "aria": "- link \"Skip to main content\":\n  - /url: \"#main\"\n- banner:\n  - button \"Close menu\"\n  - link \"Go to homepage\":\n    - /url: https://www.zara.com/us/\n  - list:\n    - listitem:\n      - link \"Search\":\n        - /url: https://www.zara.com/us/en/search/home\n    - listitem:\n      - link \"LOG IN\":\n        - /url: https://www.zara.com/us/en/logon\n    - listitem:\n      - link \"Help\":\n        - /url: https://www.zara.com/us/en/help-center\n    - listitem:\n      - link \"Cart empty\":\n        - /url: https://www.zara.com/us/en/shop/cart\n        - text: Shopping bag [\n        - status: \"0\"\n        - text: \"]\"\n- dialog \"Category Menu\":\n  - button \"Close menu\"\n  - link \"Go to homepage\":\n    - /url: https://www.zara.com/us/\n  - navigation:\n    - tablist \"Categories\":\n      - tab \"WOMAN\"\n      - tab \"MAN\"\n      - tab \"KIDS\"\n      - tab \"ZARA HOME\" [selected]\n      - tab \"BEAUTY\"\n      - tab \"MASSIMO DUTTI\"\n      - tab \"ZARA PRE-OWNED\"\n      - tab \"TRAVEL MODE\"\n    - tabpanel \"WOMAN\":\n      - list:\n        - listitem:\n          - button \"NEW COLLECTION\"\n        - listitem:\n          - button \"SALE\"\n        - listitem:\n          - link \"GIFT CARD\":\n            - /url: https://www.zara.com/us/en/z-giftcard-mkt1394.html\n        - listitem:\n          - button \"+ INFO\"\n        - listitem:\n          - link \"CAREERS\":\n            - /url: https://www.zara.com/us/en/work-with-us-mkt8081.html\n        - listitem: DOWNLOAD APP\n        - listitem:\n          - link \"JOIN LIFE\":\n            - /url: https://www.zara.com/us/en/z-join-life-mkt1399.html\n        - listitem:\n          - link \"STORES\":\n            - /url: https://www.zara.com/us/en/z-stores-st1404.html\n    - tabpanel \"MAN\":\n      - list:\n        - listitem:\n          - button \"NEW COLLECTION\"\n        - listitem:\n          - button \"SALE\"\n        - listitem:\n          - link \"GIFT CARD\":\n            - /url: https://www.zara.com/us/en/z-giftcard-mkt1394.html\n        - listitem: DOWNLOAD APP\n        - listitem:\n          - link \"STORES\":\n            - /url: https://www.zara.com/us/en/z-stores-st1404.html\n        - listitem:\n          - link \"JOIN LIFE\":\n            - /url: https://www.zara.com/us/en/z-join-life-mkt1399.html\n        - listitem: CAREERS\n        - listitem:\n          - button \"+ INFO\"\n    - tabpanel \"KIDS\":\n      - list:\n        - listitem:\n          - button \"NEW COLLECTION\"\n        - listitem:\n          - button \"SALE\"\n        - listitem:\n          - link \"GIFT CARD\":\n            - /url: https://www.zara.com/us/en/z-giftcard-mkt1394.html\n        - listitem: DOWNLOAD APP\n        - listitem:\n          - link \"STORES\":\n            - /url: https://www.zara.com/us/en/z-stores-st1404.html\n        - listitem: JOIN LIFE\n        - listitem: CAREERS\n        - listitem:\n          - button \"+ INFO\"\n    - tabpanel \"ZARA HOME\":\n      - list:\n        - listitem:\n          - button \"NEW COLLECTION\"\n        - listitem:\n          - button \"SALE\" [expanded]:\n            - text: SALE\n            - img\n        - listitem:\n          - link:\n            - /url: https://www.zara.com/us/en/zara-travel-guide-l15717.html?v1=2577013\n        - listitem:\n          - link \"GIFT CARD\":\n            - /url: https://www.zara.com/us/en/z-giftcard-mkt1394.html\n        - listitem:\n          - button \"+ INFO\"\n        - listitem: DOWNLOAD APP\n        - listitem:\n          - link \"JOIN LIFE\":\n            - /url: https://www.zara.com/us/en/z-join-life-mkt1399.html\n        - listitem:\n          - link \"CAREERS\":\n            - /url: https://www.zara.com/us/en/work-with-us-mkt8081.html\n        - listitem:\n          - link \"STORES\":\n            - /url: https://www.zara.com/us/en/z-stores-st1404.html\n        - listitem: RECALLED ITEMS\n    - tabpanel \"BEAUTY\":\n      - list:\n        - listitem:\n          - link \"PERFUMES\":\n            - /url: https://www.zara.com/us/en/woman-accessories-perfumes-l1017.html?v1=2419833\n            - paragraph: PERFUMES\n          - link \"MAKEUP\":\n            - /url: https://www.zara.com/us/en/woman-beauty-makeup-l4414.html?v1=1881272\n            - paragraph: MAKEUP\n          - link \"ZARA HAIR\":\n            - /url: https://www.zara.com/us/en/woman-hair-l7345.html?v1=2418886\n            - paragraph: ZARA HAIR\n        - listitem:\n          - button \"WOMAN\"\n        - listitem:\n          - button \"MAN\"\n        - listitem:\n          - button \"KIDS\"\n        - listitem:\n          - link:\n            - /url: https://www.zara.com/us/en/zara-travel-guide-l15717.html?v1=2577013\n        - listitem: DOWNLOAD APP\n        - listitem:\n          - link \"JOIN LIFE\":\n            - /url: https://www.zara.com/us/en/z-join-life-mkt1399.html\n        - listitem:\n          - button \"+ INFO\"\n    - tabpanel \"MASSIMO DUTTI\":\n      - list:\n        - listitem:\n          - button \"WOMAN\"\n        - listitem:\n          - button \"MAN\"\n    - tabpanel \"ZARA PRE-OWNED\":\n      - list:\n        - listitem:\n          - link \"ABOUT\":\n            - /url: https://www.zara.com/us/en/preowned-about-mkt5795.html\n        - listitem:\n          - link \"REPAIR\":\n            - /url: https://www.zara.com/us/en/preowned-repair-mkt5796.html\n        - listitem:\n          - link \"SECOND HAND\":\n            - /url: https://www.zara.com/us/en/preowned-resell-mkt5797.html\n        - listitem:\n          - link \"DONATE\":\n            - /url: https://www.zara.com/us/en/preowned-donate-mkt5798.html\n        - listitem:\n          - link \"JOIN LIFE\":\n            - /url: https://www.zara.com/us/en/z-join-life-mkt1399.html\n        - listitem:\n          - link \"CAREERS\":\n            - /url: https://www.zara.com/us/en/work-with-us-mkt8081.html\n        - listitem:\n          - link \"STORES\":\n            - /url: https://www.zara.com/us/en/z-stores-st1404.html\n    - tabpanel \"TRAVEL MODE\":\n      - list:\n        - listitem:\n          - link \"ABOUT\":\n            - /url: https://www.zara.com/us/en/zara-travel-about-mkt15716.html\n        - listitem:\n          - link \"THE GUIDES\":\n            - /url: https://www.zara.com/us/en/zara-travel-guide-mkt15717.html\n- main:\n  - heading \"ZARA United States | SALE\" [level=1]\n  - region \"Zara category carousel\":\n    - list:\n      - listitem\n      - listitem\n      - listitem\n      - listitem\n      - listitem\n      - listitem\n      - listitem\n      - listitem\n      - listitem:\n        - text: THE NEW Scroll down\n        - heading \"Footer\" [level=2]\n        - link \"sign up for our newsletter\":\n          - /url: https://www.zara.com/us/en/z-newsletter-nl1400.html?v1=11110\n        - list:\n          - listitem:\n            - link \"Tiktok\":\n              - /url: https://www.tiktok.com/@zara\n          - listitem:\n            - link \"Instagram\":\n              - /url: https://www.instagram.com/zara/\n          - listitem:\n            - link \"Facebook\":\n              - /url: https://www.facebook.com/Zara\n          - listitem:\n            - link \"Pinterest\":\n              - /url: https://es.pinterest.com/zaraofficial\n          - listitem:\n            - link \"Youtube\":\n              - /url: http://www.youtube.com/user/zara\n          - listitem:\n            - link \"Spotify\":\n              - /url: https://open.spotify.com/user/r6ivwuv0ebk346hhxo446pbfv\n        - navigation \"Legal documents\":\n          - heading \"Legal documents\" [level=3]\n          - list:\n            - listitem:\n              - button \"Cookies settings\"\n            - listitem:\n              - button \"Cookie and Ad Preferences\"\n            - listitem:\n              - link \"Privacy and Cookies Policy\":\n                - /url: https://www.zara.com/static/pdfs/US/privacy-policy/privacy-policy_en_US-20241209.html\n            - listitem:\n              - link \"Terms of use\":\n                - /url: https://static.zara.net/static/pdfs/US/terms-and-conditions/terms-and-conditions-en_US-20250829.pdf\n    - list:\n      - listitem\n      - listitem\n      - listitem\n      - listitem\n      - listitem\n      - listitem\n      - listitem:\n        - text: THE NEW Scroll down\n        - heading \"Footer\" [level=2]\n        - link \"sign up for our newsletter\":\n          - /url: https://www.zara.com/us/en/z-newsletter-nl1400.html?v1=11110\n        - list:\n          - listitem:\n            - link \"Tiktok\":\n              - /url: https://www.tiktok.com/@zara\n          - listitem:\n            - link \"Instagram\":\n              - /url: https://www.instagram.com/zara/\n          - listitem:\n            - link \"Facebook\":\n              - /url: https://www.facebook.com/Zara\n          - listitem:\n            - link \"Pinterest\":\n              - /url: https://es.pinterest.com/zaraofficial\n          - listitem:\n            - link \"Youtube\":\n              - /url: http://www.youtube.com/user/zara\n          - listitem:\n            - link \"Spotify\":\n              - /url: https://open.spotify.com/user/r6ivwuv0ebk346hhxo446pbfv\n        - navigation \"Legal documents\":\n          - heading \"Legal documents\" [level=3]\n          - list:\n            - listitem:\n              - button \"Cookies settings\"\n            - listitem:\n              - button \"Cookie and Ad Preferences\"\n            - listitem:\n              - link \"Privacy and Cookies Policy\":\n                - /url: https://www.zara.com/static/pdfs/US/privacy-policy/privacy-policy_en_US-20241209.html\n            - listitem:\n              - link \"Terms of use\":\n                - /url: https://static.zara.net/static/pdfs/US/terms-and-conditions/terms-and-conditions-en_US-20250829.pdf\n    - list:\n      - listitem\n      - listitem\n      - listitem\n      - listitem\n      - listitem\n      - listitem\n      - listitem\n      - listitem\n      - listitem\n      - listitem:\n        - text: THE NEW Scroll down\n        - heading \"Footer\" [level=2]\n        - link \"sign up for our newsletter\":\n          - /url: https://www.zara.com/us/en/z-newsletter-nl1400.html?v1=11110\n        - list:\n          - listitem:\n            - link \"Tiktok\":\n              - /url: https://www.tiktok.com/@zara\n          - listitem:\n            - link \"Instagram\":\n              - /url: https://www.instagram.com/zara/\n          - listitem:\n            - link \"Facebook\":\n              - /url: https://www.facebook.com/Zara\n          - listitem:\n            - link \"Pinterest\":\n              - /url: https://es.pinterest.com/zaraofficial\n          - listitem:\n            - link \"Youtube\":\n              - /url: http://www.youtube.com/user/zara\n          - listitem:\n            - link \"Spotify\":\n              - /url: https://open.spotify.com/user/r6ivwuv0ebk346hhxo446pbfv\n        - navigation \"Legal documents\":\n          - heading \"Legal documents\" [level=3]\n          - list:\n            - listitem:\n              - button \"Cookies settings\"\n            - listitem:\n              - button \"Cookie and Ad Preferences\"\n            - listitem:\n              - link \"Privacy and Cookies Policy\":\n                - /url: https://www.zara.com/static/pdfs/US/privacy-policy/privacy-policy_en_US-20241209.html\n            - listitem:\n              - link \"Terms of use\":\n                - /url: https://static.zara.net/static/pdfs/US/terms-and-conditions/terms-and-conditions-en_US-20250829.pdf\n    - list:\n      - listitem:\n        - img \"Modern living room with black sofa, low table, bookshelf with books, plant, and large window. Picture on the wall and old radiator.\"\n      - listitem\n      - listitem\n      - listitem\n      - listitem\n      - listitem\n      - listitem\n      - listitem:\n        - text: THE NEW Scroll down\n        - heading \"Footer\" [level=2]\n        - link \"sign up for our newsletter\":\n          - /url: https://www.zara.com/us/en/z-newsletter-nl1400.html?v1=11110\n        - list:\n          - listitem:\n            - link \"Tiktok\":\n              - /url: https://www.tiktok.com/@zara\n          - listitem:\n            - link \"Instagram\":\n              - /url: https://www.instagram.com/zara/\n          - listitem:\n            - link \"Facebook\":\n              - /url: https://www.facebook.com/Zara\n          - listitem:\n            - link \"Pinterest\":\n              - /url: https://es.pinterest.com/zaraofficial\n          - listitem:\n            - link \"Youtube\":\n              - /url: http://www.youtube.com/user/zara\n          - listitem:\n            - link \"Spotify\":\n              - /url: https://open.spotify.com/user/r6ivwuv0ebk346hhxo446pbfv\n        - navigation \"Legal documents\":\n          - heading \"Legal documents\" [level=3]\n          - list:\n            - listitem:\n              - button \"Cookies settings\"\n            - listitem:\n              - button \"Cookie and Ad Preferences\"\n            - listitem:\n              - link \"Privacy and Cookies Policy\":\n                - /url: https://www.zara.com/static/pdfs/US/privacy-policy/privacy-policy_en_US-20241209.html\n            - listitem:\n              - link \"Terms of use\":\n                - /url: https://static.zara.net/static/pdfs/US/terms-and-conditions/terms-and-conditions-en_US-20250829.pdf\n    - list:\n      - listitem\n      - listitem\n      - listitem\n      - listitem\n      - listitem:\n        - heading \"Footer\" [level=2]\n        - link \"sign up for our newsletter\":\n          - /url: https://www.zara.com/us/en/z-newsletter-nl1400.html?v1=11110\n        - list:\n          - listitem:\n            - link \"Tiktok\":\n              - /url: https://www.tiktok.com/@zara\n          - listitem:\n            - link \"Instagram\":\n              - /url: https://www.instagram.com/zara/\n          - listitem:\n            - link \"Facebook\":\n              - /url: https://www.facebook.com/Zara\n          - listitem:\n            - link \"Pinterest\":\n              - /url: https://es.pinterest.com/zaraofficial\n          - listitem:\n            - link \"Youtube\":\n              - /url: http://www.youtube.com/user/zara\n          - listitem:\n            - link \"Spotify\":\n              - /url: https://open.spotify.com/user/r6ivwuv0ebk346hhxo446pbfv\n        - navigation \"Legal documents\":\n          - heading \"Legal documents\" [level=3]\n          - list:\n            - listitem:\n              - button \"Cookies settings\"\n            - listitem:\n              - button \"Cookie and Ad Preferences\"\n            - listitem:\n              - link \"Privacy and Cookies Policy\":\n                - /url: https://www.zara.com/static/pdfs/US/privacy-policy/privacy-policy_en_US-20241209.html\n            - listitem:\n              - link \"Terms of use\":\n                - /url: https://static.zara.net/static/pdfs/US/terms-and-conditions/terms-and-conditions-en_US-20250829.pdf\n    - list:\n      - listitem\n      - listitem\n      - listitem\n      - listitem\n      - listitem\n      - listitem\n      - listitem:\n        - text: VIEW ALL Scroll down\n        - heading \"Footer\" [level=2]\n        - link \"sign up for our newsletter\":\n          - /url: https://www.zara.com/us/en/z-newsletter-nl1400.html?v1=11110\n        - list:\n          - listitem:\n            - link \"Tiktok\":\n              - /url: https://www.tiktok.com/@zara\n          - listitem:\n            - link \"Instagram\":\n              - /url: https://www.instagram.com/zara/\n          - listitem:\n            - link \"Facebook\":\n              - /url: https://www.facebook.com/Zara\n          - listitem:\n            - link \"Pinterest\":\n              - /url: https://es.pinterest.com/zaraofficial\n          - listitem:\n            - link \"Youtube\":\n              - /url: http://www.youtube.com/user/zara\n          - listitem:\n            - link \"Spotify\":\n              - /url: https://open.spotify.com/user/r6ivwuv0ebk346hhxo446pbfv\n        - navigation \"Legal documents\":\n          - heading \"Legal documents\" [level=3]\n          - list:\n            - listitem:\n              - button \"Cookies settings\"\n            - listitem:\n              - button \"Cookie and Ad Preferences\"\n            - listitem:\n              - link \"Privacy and Cookies Policy\":\n                - /url: https://www.zara.com/static/pdfs/US/privacy-policy/privacy-policy_en_US-20241209.html\n            - listitem:\n              - link \"Terms of use\":\n                - /url: https://static.zara.net/static/pdfs/US/terms-and-conditions/terms-and-conditions-en_US-20250829.pdf\n    - list:\n      - listitem\n      - listitem\n      - listitem\n      - listitem:\n        - heading \"Footer\" [level=2]\n        - link \"sign up for our newsletter\":\n          - /url: https://www.zara.com/us/en/z-newsletter-nl1400.html?v1=11110\n        - list:\n          - listitem:\n            - link \"Tiktok\":\n              - /url: https://www.tiktok.com/@zara\n          - listitem:\n            - link \"Instagram\":\n              - /url: https://www.instagram.com/zara/\n          - listitem:\n            - link \"Facebook\":\n              - /url: https://www.facebook.com/Zara\n          - listitem:\n            - link \"Pinterest\":\n              - /url: https://es.pinterest.com/zaraofficial\n          - listitem:\n            - link \"Youtube\":\n              - /url: http://www.youtube.com/user/zara\n          - listitem:\n            - link \"Spotify\":\n              - /url: https://open.spotify.com/user/r6ivwuv0ebk346hhxo446pbfv\n        - navigation \"Legal documents\":\n          - heading \"Legal documents\" [level=3]\n          - list:\n            - listitem:\n              - button \"Cookies settings\"\n            - listitem:\n              - button \"Cookie and Ad Preferences\"\n            - listitem:\n              - link \"Privacy and Cookies Policy\":\n                - /url: https://www.zara.com/static/pdfs/US/privacy-policy/privacy-policy_en_US-20241209.html\n            - listitem:\n              - link \"Terms of use\":\n                - /url: https://static.zara.net/static/pdfs/US/terms-and-conditions/terms-and-conditions-en_US-20250829.pdf\n    - list:\n      - listitem\n      - listitem:\n        - heading \"Footer\" [level=2]\n        - link \"sign up for our newsletter\":\n          - /url: https://www.zara.com/us/en/z-newsletter-nl1400.html?v1=11110\n        - list:\n          - listitem:\n            - link \"Tiktok\":\n              - /url: https://www.tiktok.com/@zara\n          - listitem:\n            - link \"Instagram\":\n              - /url: https://www.instagram.com/zara/\n          - listitem:\n            - link \"Facebook\":\n              - /url: https://www.facebook.com/Zara\n          - listitem:\n            - link \"Pinterest\":\n              - /url: https://es.pinterest.com/zaraofficial\n          - listitem:\n            - link \"Youtube\":\n              - /url: http://www.youtube.com/user/zara\n          - listitem:\n            - link \"Spotify\":\n              - /url: https://open.spotify.com/user/r6ivwuv0ebk346hhxo446pbfv\n        - navigation \"Legal documents\":\n          - heading \"Legal documents\" [level=3]\n          - list:\n            - listitem:\n              - button \"Cookies settings\"\n            - listitem:\n              - button \"Cookie and Ad Preferences\"\n            - listitem:\n              - link \"Privacy and Cookies Policy\":\n                - /url: https://www.zara.com/static/pdfs/US/privacy-policy/privacy-policy_en_US-20241209.html\n            - listitem:\n              - link \"Terms of use\":\n                - /url: https://static.zara.net/static/pdfs/US/terms-and-conditions/terms-and-conditions-en_US-20250829.pdf\n    - list:\n      - listitem:\n        - button \"Move to KID\"\n      - listitem:\n        - button \"Move to MASSIMODUTTI\"\n- contentinfo\n- iframe"
  },
  {
    "step": 5,
    "timestamp": "2026-01-11T12:56:11.005314",
    "path": [
      "BEAUTY"
    ],
    "action": "clicked: BEAUTY",
    "url": "https://www.zara.com/us/",
    "new_buttons": [],
    "new_links": {
      "Go to homepage": "https://www.zara.com/us/",
      "LOG IN": "https://www.zara.com/us/en/logon",
      "Help": "https://www.zara.com/us/en/help-center",
      "GIFT CARD": "https://www.zara.com/us/en/z-giftcard-mkt1394.html",
      "CAREERS": "https://www.zara.com/us/en/work-with-us-mkt8081.html",
      "JOIN LIFE": "https://www.zara.com/us/en/z-join-life-mkt1399.html",
      "STORES": "https://www.zara.com/us/en/z-stores-st1404.html",
      "PERFUMES": "https://www.zara.com/us/en/woman-accessories-perfumes-l1017.html?v1=2419833",
      "MAKEUP": "https://www.zara.com/us/en/woman-beauty-makeup-l4414.html?v1=1881272",
      "ZARA HAIR": "https://www.zara.com/us/en/woman-hair-l7345.html?v1=2418886",
      "ABOUT": "https://www.zara.com/us/en/zara-travel-about-mkt15716.html",
      "REPAIR": "https://www.zara.com/us/en/preowned-repair-mkt5796.html",
      "SECOND HAND": "https://www.zara.com/us/en/preowned-resell-mkt5797.html",
      "DONATE": "https://www.zara.com/us/en/preowned-donate-mkt5798.html",
      "THE GUIDES": "https://www.zara.com/us/en/zara-travel-guide-mkt15717.html",
      "Youtube": "http://www.youtube.com/user/zara",
      "Spotify": "https://open.spotify.com/user/r6ivwuv0ebk346hhxo446pbfv"
    },
    "aria": "- link \"Skip to main content\":\n  - /url: \"#main\"\n- banner:\n  - button \"Close menu\"\n  - link \"Go to homepage\":\n    - /url: https://www.zara.com/us/\n  - list:\n    - listitem:\n      - link \"Search\":\n        - /url: https://www.zara.com/us/en/search/home\n    - listitem:\n      - link \"LOG IN\":\n        - /url: https://www.zara.com/us/en/logon\n    - listitem:\n      - link \"Help\":\n        - /url: https://www.zara.com/us/en/help-center\n    - listitem:\n      - link \"Cart empty\":\n        - /url: https://www.zara.com/us/en/shop/cart\n        - text: Shopping bag [\n        - status: \"0\"\n        - text: \"]\"\n- dialog \"Category Menu\":\n  - button \"Close menu\"\n  - link \"Go to homepage\":\n    - /url: https://www.zara.com/us/\n  - navigation:\n    - tablist \"Categories\":\n      - tab \"WOMAN\"\n      - tab \"MAN\"\n      - tab \"KIDS\"\n      - tab \"ZARA HOME\"\n      - tab \"BEAUTY\" [selected]\n      - tab \"MASSIMO DUTTI\"\n      - tab \"ZARA PRE-OWNED\"\n      - tab \"TRAVEL MODE\"\n    - tabpanel \"WOMAN\":\n      - list:\n        - listitem:\n          - button \"NEW COLLECTION\"\n        - listitem:\n          - button \"SALE\"\n        - listitem:\n          - link \"GIFT CARD\":\n            - /url: https://www.zara.com/us/en/z-giftcard-mkt1394.html\n        - listitem:\n          - button \"+ INFO\"\n        - listitem:\n          - link \"CAREERS\":\n            - /url: https://www.zara.com/us/en/work-with-us-mkt8081.html\n        - listitem: DOWNLOAD APP\n        - listitem:\n          - link \"JOIN LIFE\":\n            - /url: https://www.zara.com/us/en/z-join-life-mkt1399.html\n        - listitem:\n          - link \"STORES\":\n            - /url: https://www.zara.com/us/en/z-stores-st1404.html\n    - tabpanel \"MAN\":\n      - list:\n        - listitem:\n          - button \"NEW COLLECTION\"\n        - listitem:\n          - button \"SALE\"\n        - listitem:\n          - link \"GIFT CARD\":\n            - /url: https://www.zara.com/us/en/z-giftcard-mkt1394.html\n        - listitem: DOWNLOAD APP\n        - listitem:\n          - link \"STORES\":\n            - /url: https://www.zara.com/us/en/z-stores-st1404.html\n        - listitem:\n          - link \"JOIN LIFE\":\n            - /url: https://www.zara.com/us/en/z-join-life-mkt1399.html\n        - listitem: CAREERS\n        - listitem:\n          - button \"+ INFO\"\n    - tabpanel \"KIDS\":\n      - list:\n        - listitem:\n          - button \"NEW COLLECTION\"\n        - listitem:\n          - button \"SALE\"\n        - listitem:\n          - link \"GIFT CARD\":\n            - /url: https://www.zara.com/us/en/z-giftcard-mkt1394.html\n        - listitem: DOWNLOAD APP\n        - listitem:\n          - link \"STORES\":\n            - /url: https://www.zara.com/us/en/z-stores-st1404.html\n        - listitem: JOIN LIFE\n        - listitem: CAREERS\n        - listitem:\n          - button \"+ INFO\"\n    - tabpanel \"ZARA HOME\":\n      - list:\n        - listitem:\n          - button \"NEW COLLECTION\"\n        - listitem:\n          - button \"SALE\"\n        - listitem:\n          - link:\n            - /url: https://www.zara.com/us/en/zara-travel-guide-l15717.html?v1=2577013\n        - listitem:\n          - link \"GIFT CARD\":\n            - /url: https://www.zara.com/us/en/z-giftcard-mkt1394.html\n        - listitem:\n          - button \"+ INFO\"\n        - listitem: DOWNLOAD APP\n        - listitem:\n          - link \"JOIN LIFE\":\n            - /url: https://www.zara.com/us/en/z-join-life-mkt1399.html\n        - listitem:\n          - link \"CAREERS\":\n            - /url: https://www.zara.com/us/en/work-with-us-mkt8081.html\n        - listitem:\n          - link \"STORES\":\n            - /url: https://www.zara.com/us/en/z-stores-st1404.html\n        - listitem: RECALLED ITEMS\n    - tabpanel \"BEAUTY\":\n      - list:\n        - listitem:\n          - link \"PERFUMES\":\n            - /url: https://www.zara.com/us/en/woman-accessories-perfumes-l1017.html?v1=2419833\n            - paragraph: PERFUMES\n          - link \"MAKEUP\":\n            - /url: https://www.zara.com/us/en/woman-beauty-makeup-l4414.html?v1=1881272\n            - paragraph: MAKEUP\n          - link \"ZARA HAIR\":\n            - /url: https://www.zara.com/us/en/woman-hair-l7345.html?v1=2418886\n            - paragraph: ZARA HAIR\n        - listitem:\n          - button \"WOMAN\" [expanded]:\n            - text: WOMAN\n            - img\n        - listitem:\n          - button \"MAN\"\n        - listitem:\n          - button \"KIDS\"\n        - listitem:\n          - link:\n            - /url: https://www.zara.com/us/en/zara-travel-guide-l15717.html?v1=2577013\n        - listitem: DOWNLOAD APP\n        - listitem:\n          - link \"JOIN LIFE\":\n            - /url: https://www.zara.com/us/en/z-join-life-mkt1399.html\n        - listitem:\n          - button \"+ INFO\"\n    - tabpanel \"MASSIMO DUTTI\":\n      - list:\n        - listitem:\n          - button \"WOMAN\"\n        - listitem:\n          - button \"MAN\"\n    - tabpanel \"ZARA PRE-OWNED\":\n      - list:\n        - listitem:\n          - link \"ABOUT\":\n            - /url: https://www.zara.com/us/en/preowned-about-mkt5795.html\n        - listitem:\n          - link \"REPAIR\":\n            - /url: https://www.zara.com/us/en/preowned-repair-mkt5796.html\n        - listitem:\n          - link \"SECOND HAND\":\n            - /url: https://www.zara.com/us/en/preowned-resell-mkt5797.html\n        - listitem:\n          - link \"DONATE\":\n            - /url: https://www.zara.com/us/en/preowned-donate-mkt5798.html\n        - listitem:\n          - link \"JOIN LIFE\":\n            - /url: https://www.zara.com/us/en/z-join-life-mkt1399.html\n        - listitem:\n          - link \"CAREERS\":\n            - /url: https://www.zara.com/us/en/work-with-us-mkt8081.html\n        - listitem:\n          - link \"STORES\":\n            - /url: https://www.zara.com/us/en/z-stores-st1404.html\n    - tabpanel \"TRAVEL MODE\":\n      - list:\n        - listitem:\n          - link \"ABOUT\":\n            - /url: https://www.zara.com/us/en/zara-travel-about-mkt15716.html\n        - listitem:\n          - link \"THE GUIDES\":\n            - /url: https://www.zara.com/us/en/zara-travel-guide-mkt15717.html\n- main:\n  - heading \"ZARA United States | SALE\" [level=1]\n  - region \"Zara category carousel\":\n    - list:\n      - listitem\n      - listitem\n      - listitem\n      - listitem\n      - listitem\n      - listitem\n      - listitem\n      - listitem\n      - listitem:\n        - text: THE NEW Scroll down\n        - heading \"Footer\" [level=2]\n        - link \"sign up for our newsletter\":\n          - /url: https://www.zara.com/us/en/z-newsletter-nl1400.html?v1=11110\n        - list:\n          - listitem:\n            - link \"Tiktok\":\n              - /url: https://www.tiktok.com/@zara\n          - listitem:\n            - link \"Instagram\":\n              - /url: https://www.instagram.com/zara/\n          - listitem:\n            - link \"Facebook\":\n              - /url: https://www.facebook.com/Zara\n          - listitem:\n            - link \"Pinterest\":\n              - /url: https://es.pinterest.com/zaraofficial\n          - listitem:\n            - link \"Youtube\":\n              - /url: http://www.youtube.com/user/zara\n          - listitem:\n            - link \"Spotify\":\n              - /url: https://open.spotify.com/user/r6ivwuv0ebk346hhxo446pbfv\n        - navigation \"Legal documents\":\n          - heading \"Legal documents\" [level=3]\n          - list:\n            - listitem:\n              - button \"Do Not Sell Or Share My Personal Information\"\n            - listitem:\n              - button \"Cookie and Ad Preferences\"\n            - listitem:\n              - link \"Privacy and Cookies Policy\":\n                - /url: https://www.zara.com/static/pdfs/US/privacy-policy/privacy-policy_en_US-20241209.html\n            - listitem:\n              - link \"Terms of use\":\n                - /url: https://static.zara.net/static/pdfs/US/terms-and-conditions/terms-and-conditions-en_US-20250829.pdf\n    - list:\n      - listitem\n      - listitem\n      - listitem\n      - listitem\n      - listitem\n      - listitem\n      - listitem:\n        - text: THE NEW Scroll down\n        - heading \"Footer\" [level=2]\n        - link \"sign up for our newsletter\":\n          - /url: https://www.zara.com/us/en/z-newsletter-nl1400.html?v1=11110\n        - list:\n          - listitem:\n            - link \"Tiktok\":\n              - /url: https://www.tiktok.com/@zara\n          - listitem:\n            - link \"Instagram\":\n              - /url: https://www.instagram.com/zara/\n          - listitem:\n            - link \"Facebook\":\n              - /url: https://www.facebook.com/Zara\n          - listitem:\n            - link \"Pinterest\":\n              - /url: https://es.pinterest.com/zaraofficial\n          - listitem:\n            - link \"Youtube\":\n              - /url: http://www.youtube.com/user/zara\n          - listitem:\n            - link \"Spotify\":\n              - /url: https://open.spotify.com/user/r6ivwuv0ebk346hhxo446pbfv\n        - navigation \"Legal documents\":\n          - heading \"Legal documents\" [level=3]\n          - list:\n            - listitem:\n              - button \"Do Not Sell Or Share My Personal Information\"\n            - listitem:\n              - button \"Cookie and Ad Preferences\"\n            - listitem:\n              - link \"Privacy and Cookies Policy\":\n                - /url: https://www.zara.com/static/pdfs/US/privacy-policy/privacy-policy_en_US-20241209.html\n            - listitem:\n              - link \"Terms of use\":\n                - /url: https://static.zara.net/static/pdfs/US/terms-and-conditions/terms-and-conditions-en_US-20250829.pdf\n    - list:\n      - listitem\n      - listitem\n      - listitem\n      - listitem\n      - listitem\n      - listitem\n      - listitem\n      - listitem\n      - listitem\n      - listitem:\n        - text: THE NEW Scroll down\n        - heading \"Footer\" [level=2]\n        - link \"sign up for our newsletter\":\n          - /url: https://www.zara.com/us/en/z-newsletter-nl1400.html?v1=11110\n        - list:\n          - listitem:\n            - link \"Tiktok\":\n              - /url: https://www.tiktok.com/@zara\n          - listitem:\n            - link \"Instagram\":\n              - /url: https://www.instagram.com/zara/\n          - listitem:\n            - link \"Facebook\":\n              - /url: https://www.facebook.com/Zara\n          - listitem:\n            - link \"Pinterest\":\n              - /url: https://es.pinterest.com/zaraofficial\n          - listitem:\n            - link \"Youtube\":\n              - /url: http://www.youtube.com/user/zara\n          - listitem:\n            - link \"Spotify\":\n              - /url: https://open.spotify.com/user/r6ivwuv0ebk346hhxo446pbfv\n        - navigation \"Legal documents\":\n          - heading \"Legal documents\" [level=3]\n          - list:\n            - listitem:\n              - button \"Do Not Sell Or Share My Personal Information\"\n            - listitem:\n              - button \"Cookie and Ad Preferences\"\n            - listitem:\n              - link \"Privacy and Cookies Policy\":\n                - /url: https://www.zara.com/static/pdfs/US/privacy-policy/privacy-policy_en_US-20241209.html\n            - listitem:\n              - link \"Terms of use\":\n                - /url: https://static.zara.net/static/pdfs/US/terms-and-conditions/terms-and-conditions-en_US-20250829.pdf\n    - list:\n      - listitem:\n        - img \"Modern living room with black sofa, low table, bookshelf with books, plant, and large window. Picture on the wall and old radiator.\"\n      - listitem\n      - listitem\n      - listitem\n      - listitem\n      - listitem\n      - listitem\n      - listitem:\n        - text: THE NEW Scroll down\n        - heading \"Footer\" [level=2]\n        - link \"sign up for our newsletter\":\n          - /url: https://www.zara.com/us/en/z-newsletter-nl1400.html?v1=11110\n        - list:\n          - listitem:\n            - link \"Tiktok\":\n              - /url: https://www.tiktok.com/@zara\n          - listitem:\n            - link \"Instagram\":\n              - /url: https://www.instagram.com/zara/\n          - listitem:\n            - link \"Facebook\":\n              - /url: https://www.facebook.com/Zara\n          - listitem:\n            - link \"Pinterest\":\n              - /url: https://es.pinterest.com/zaraofficial\n          - listitem:\n            - link \"Youtube\":\n              - /url: http://www.youtube.com/user/zara\n          - listitem:\n            - link \"Spotify\":\n              - /url: https://open.spotify.com/user/r6ivwuv0ebk346hhxo446pbfv\n        - navigation \"Legal documents\":\n          - heading \"Legal documents\" [level=3]\n          - list:\n            - listitem:\n              - button \"Do Not Sell Or Share My Personal Information\"\n            - listitem:\n              - button \"Cookie and Ad Preferences\"\n            - listitem:\n              - link \"Privacy and Cookies Policy\":\n                - /url: https://www.zara.com/static/pdfs/US/privacy-policy/privacy-policy_en_US-20241209.html\n            - listitem:\n              - link \"Terms of use\":\n                - /url: https://static.zara.net/static/pdfs/US/terms-and-conditions/terms-and-conditions-en_US-20250829.pdf\n    - list:\n      - listitem\n      - listitem\n      - listitem\n      - listitem\n      - listitem:\n        - heading \"Footer\" [level=2]\n        - link \"sign up for our newsletter\":\n          - /url: https://www.zara.com/us/en/z-newsletter-nl1400.html?v1=11110\n        - list:\n          - listitem:\n            - link \"Tiktok\":\n              - /url: https://www.tiktok.com/@zara\n          - listitem:\n            - link \"Instagram\":\n              - /url: https://www.instagram.com/zara/\n          - listitem:\n            - link \"Facebook\":\n              - /url: https://www.facebook.com/Zara\n          - listitem:\n            - link \"Pinterest\":\n              - /url: https://es.pinterest.com/zaraofficial\n          - listitem:\n            - link \"Youtube\":\n              - /url: http://www.youtube.com/user/zara\n          - listitem:\n            - link \"Spotify\":\n              - /url: https://open.spotify.com/user/r6ivwuv0ebk346hhxo446pbfv\n        - navigation \"Legal documents\":\n          - heading \"Legal documents\" [level=3]\n          - list:\n            - listitem:\n              - button \"Do Not Sell Or Share My Personal Information\"\n            - listitem:\n              - button \"Cookie and Ad Preferences\"\n            - listitem:\n              - link \"Privacy and Cookies Policy\":\n                - /url: https://www.zara.com/static/pdfs/US/privacy-policy/privacy-policy_en_US-20241209.html\n            - listitem:\n              - link \"Terms of use\":\n                - /url: https://static.zara.net/static/pdfs/US/terms-and-conditions/terms-and-conditions-en_US-20250829.pdf\n    - list:\n      - listitem:\n        - img \"Brown bottle with the inscription \\\"WHIPPED COFFEE\\\" in white letters, on a soft beige background.\"\n      - listitem\n      - listitem\n      - listitem\n      - listitem\n      - listitem\n      - listitem:\n        - text: VIEW ALL Scroll down\n        - heading \"Footer\" [level=2]\n        - link \"sign up for our newsletter\":\n          - /url: https://www.zara.com/us/en/z-newsletter-nl1400.html?v1=11110\n        - list:\n          - listitem:\n            - link \"Tiktok\":\n              - /url: https://www.tiktok.com/@zara\n          - listitem:\n            - link \"Instagram\":\n              - /url: https://www.instagram.com/zara/\n          - listitem:\n            - link \"Facebook\":\n              - /url: https://www.facebook.com/Zara\n          - listitem:\n            - link \"Pinterest\":\n              - /url: https://es.pinterest.com/zaraofficial\n          - listitem:\n            - link \"Youtube\":\n              - /url: http://www.youtube.com/user/zara\n          - listitem:\n            - link \"Spotify\":\n              - /url: https://open.spotify.com/user/r6ivwuv0ebk346hhxo446pbfv\n        - navigation \"Legal documents\":\n          - heading \"Legal documents\" [level=3]\n          - list:\n            - listitem:\n              - button \"Do Not Sell Or Share My Personal Information\"\n            - listitem:\n              - button \"Cookie and Ad Preferences\"\n            - listitem:\n              - link \"Privacy and Cookies Policy\":\n                - /url: https://www.zara.com/static/pdfs/US/privacy-policy/privacy-policy_en_US-20241209.html\n            - listitem:\n              - link \"Terms of use\":\n                - /url: https://static.zara.net/static/pdfs/US/terms-and-conditions/terms-and-conditions-en_US-20250829.pdf\n    - list:\n      - listitem\n      - listitem\n      - listitem\n      - listitem:\n        - heading \"Footer\" [level=2]\n        - link \"sign up for our newsletter\":\n          - /url: https://www.zara.com/us/en/z-newsletter-nl1400.html?v1=11110\n        - list:\n          - listitem:\n            - link \"Tiktok\":\n              - /url: https://www.tiktok.com/@zara\n          - listitem:\n            - link \"Instagram\":\n              - /url: https://www.instagram.com/zara/\n          - listitem:\n            - link \"Facebook\":\n              - /url: https://www.facebook.com/Zara\n          - listitem:\n            - link \"Pinterest\":\n              - /url: https://es.pinterest.com/zaraofficial\n          - listitem:\n            - link \"Youtube\":\n              - /url: http://www.youtube.com/user/zara\n          - listitem:\n            - link \"Spotify\":\n              - /url: https://open.spotify.com/user/r6ivwuv0ebk346hhxo446pbfv\n        - navigation \"Legal documents\":\n          - heading \"Legal documents\" [level=3]\n          - list:\n            - listitem:\n              - button \"Do Not Sell Or Share My Personal Information\"\n            - listitem:\n              - button \"Cookie and Ad Preferences\"\n            - listitem:\n              - link \"Privacy and Cookies Policy\":\n                - /url: https://www.zara.com/static/pdfs/US/privacy-policy/privacy-policy_en_US-20241209.html\n            - listitem:\n              - link \"Terms of use\":\n                - /url: https://static.zara.net/static/pdfs/US/terms-and-conditions/terms-and-conditions-en_US-20250829.pdf\n    - list:\n      - listitem\n      - listitem:\n        - heading \"Footer\" [level=2]\n        - link \"sign up for our newsletter\":\n          - /url: https://www.zara.com/us/en/z-newsletter-nl1400.html?v1=11110\n        - list:\n          - listitem:\n            - link \"Tiktok\":\n              - /url: https://www.tiktok.com/@zara\n          - listitem:\n            - link \"Instagram\":\n              - /url: https://www.instagram.com/zara/\n          - listitem:\n            - link \"Facebook\":\n              - /url: https://www.facebook.com/Zara\n          - listitem:\n            - link \"Pinterest\":\n              - /url: https://es.pinterest.com/zaraofficial\n          - listitem:\n            - link \"Youtube\":\n              - /url: http://www.youtube.com/user/zara\n          - listitem:\n            - link \"Spotify\":\n              - /url: https://open.spotify.com/user/r6ivwuv0ebk346hhxo446pbfv\n        - navigation \"Legal documents\":\n          - heading \"Legal documents\" [level=3]\n          - list:\n            - listitem:\n              - button \"Do Not Sell Or Share My Personal Information\"\n            - listitem:\n              - button \"Cookie and Ad Preferences\"\n            - listitem:\n              - link \"Privacy and Cookies Policy\":\n                - /url: https://www.zara.com/static/pdfs/US/privacy-policy/privacy-policy_en_US-20241209.html\n            - listitem:\n              - link \"Terms of use\":\n                - /url: https://static.zara.net/static/pdfs/US/terms-and-conditions/terms-and-conditions-en_US-20250829.pdf\n    - list:\n      - listitem:\n        - button \"Move to MASSIMODUTTI\"\n      - listitem:\n        - button \"Move to PREOWNED\"\n- contentinfo\n- iframe"
  },
  {
    "step": 6,
    "timestamp": "2026-01-11T12:56:15.157800",
    "path": [
      "MASSIMO DUTTI"
    ],
    "action": "clicked: MASSIMO DUTTI",
    "url": "https://www.zara.com/us/",
    "new_buttons": [],
    "new_links": {
      "Go to homepage": "https://www.zara.com/us/",
      "LOG IN": "https://www.zara.com/us/en/logon",
      "Help": "https://www.zara.com/us/en/help-center",
      "GIFT CARD": "https://www.zara.com/us/en/z-giftcard-mkt1394.html",
      "CAREERS": "https://www.zara.com/us/en/work-with-us-mkt8081.html",
      "JOIN LIFE": "https://www.zara.com/us/en/z-join-life-mkt1399.html",
      "STORES": "https://www.zara.com/us/en/z-stores-st1404.html",
      "PERFUMES": "https://www.zara.com/us/en/woman-accessories-perfumes-l1017.html?v1=2419833",
      "MAKEUP": "https://www.zara.com/us/en/woman-beauty-makeup-l4414.html?v1=1881272",
      "ZARA HAIR": "https://www.zara.com/us/en/woman-hair-l7345.html?v1=2418886",
      "ABOUT": "https://www.zara.com/us/en/zara-travel-about-mkt15716.html",
      "REPAIR": "https://www.zara.com/us/en/preowned-repair-mkt5796.html",
      "SECOND HAND": "https://www.zara.com/us/en/preowned-resell-mkt5797.html",
      "DONATE": "https://www.zara.com/us/en/preowned-donate-mkt5798.html",
      "THE GUIDES": "https://www.zara.com/us/en/zara-travel-guide-mkt15717.html",
      "Youtube": "http://www.youtube.com/user/zara",
      "Spotify": "https://open.spotify.com/user/r6ivwuv0ebk346hhxo446pbfv"
    },
    "aria": "- link \"Skip to main content\":\n  - /url: \"#main\"\n- banner:\n  - button \"Close menu\"\n  - link \"Go to homepage\":\n    - /url: https://www.zara.com/us/\n  - list:\n    - listitem:\n      - link \"Search\":\n        - /url: https://www.zara.com/us/en/search/home\n    - listitem:\n      - link \"LOG IN\":\n        - /url: https://www.zara.com/us/en/logon\n    - listitem:\n      - link \"Help\":\n        - /url: https://www.zara.com/us/en/help-center\n    - listitem:\n      - link \"Cart empty\":\n        - /url: https://www.zara.com/us/en/shop/cart\n        - text: Shopping bag [\n        - status: \"0\"\n        - text: \"]\"\n- dialog \"Category Menu\":\n  - button \"Close menu\"\n  - link \"Go to homepage\":\n    - /url: https://www.zara.com/us/\n  - navigation:\n    - tablist \"Categories\":\n      - tab \"WOMAN\"\n      - tab \"MAN\"\n      - tab \"KIDS\"\n      - tab \"ZARA HOME\"\n      - tab \"BEAUTY\"\n      - tab \"MASSIMO DUTTI\" [selected]\n      - tab \"ZARA PRE-OWNED\"\n      - tab \"TRAVEL MODE\"\n    - tabpanel \"WOMAN\":\n      - list:\n        - listitem:\n          - button \"NEW COLLECTION\"\n        - listitem:\n          - button \"SALE\"\n        - listitem:\n          - link \"GIFT CARD\":\n            - /url: https://www.zara.com/us/en/z-giftcard-mkt1394.html\n        - listitem:\n          - button \"+ INFO\"\n        - listitem:\n          - link \"CAREERS\":\n            - /url: https://www.zara.com/us/en/work-with-us-mkt8081.html\n        - listitem: DOWNLOAD APP\n        - listitem:\n          - link \"JOIN LIFE\":\n            - /url: https://www.zara.com/us/en/z-join-life-mkt1399.html\n        - listitem:\n          - link \"STORES\":\n            - /url: https://www.zara.com/us/en/z-stores-st1404.html\n    - tabpanel \"MAN\":\n      - list:\n        - listitem:\n          - button \"NEW COLLECTION\"\n        - listitem:\n          - button \"SALE\"\n        - listitem:\n          - link \"GIFT CARD\":\n            - /url: https://www.zara.com/us/en/z-giftcard-mkt1394.html\n        - listitem: DOWNLOAD APP\n        - listitem:\n          - link \"STORES\":\n            - /url: https://www.zara.com/us/en/z-stores-st1404.html\n        - listitem:\n          - link \"JOIN LIFE\":\n            - /url: https://www.zara.com/us/en/z-join-life-mkt1399.html\n        - listitem: CAREERS\n        - listitem:\n          - button \"+ INFO\"\n    - tabpanel \"KIDS\":\n      - list:\n        - listitem:\n          - button \"NEW COLLECTION\"\n        - listitem:\n          - button \"SALE\"\n        - listitem:\n          - link \"GIFT CARD\":\n            - /url: https://www.zara.com/us/en/z-giftcard-mkt1394.html\n        - listitem: DOWNLOAD APP\n        - listitem:\n          - link \"STORES\":\n            - /url: https://www.zara.com/us/en/z-stores-st1404.html\n        - listitem: JOIN LIFE\n        - listitem: CAREERS\n        - listitem:\n          - button \"+ INFO\"\n    - tabpanel \"ZARA HOME\":\n      - list:\n        - listitem:\n          - button \"NEW COLLECTION\"\n        - listitem:\n          - button \"SALE\"\n        - listitem:\n          - link:\n            - /url: https://www.zara.com/us/en/zara-travel-guide-l15717.html?v1=2577013\n        - listitem:\n          - link \"GIFT CARD\":\n            - /url: https://www.zara.com/us/en/z-giftcard-mkt1394.html\n        - listitem:\n          - button \"+ INFO\"\n        - listitem: DOWNLOAD APP\n        - listitem:\n          - link \"JOIN LIFE\":\n            - /url: https://www.zara.com/us/en/z-join-life-mkt1399.html\n        - listitem:\n          - link \"CAREERS\":\n            - /url: https://www.zara.com/us/en/work-with-us-mkt8081.html\n        - listitem:\n          - link \"STORES\":\n            - /url: https://www.zara.com/us/en/z-stores-st1404.html\n        - listitem: RECALLED ITEMS\n    - tabpanel \"BEAUTY\":\n      - list:\n        - listitem:\n          - link \"PERFUMES\":\n            - /url: https://www.zara.com/us/en/woman-accessories-perfumes-l1017.html?v1=2419833\n            - paragraph: PERFUMES\n          - link \"MAKEUP\":\n            - /url: https://www.zara.com/us/en/woman-beauty-makeup-l4414.html?v1=1881272\n            - paragraph: MAKEUP\n          - link \"ZARA HAIR\":\n            - /url: https://www.zara.com/us/en/woman-hair-l7345.html?v1=2418886\n            - paragraph: ZARA HAIR\n        - listitem:\n          - button \"WOMAN\"\n        - listitem:\n          - button \"MAN\"\n        - listitem:\n          - button \"KIDS\"\n        - listitem:\n          - link:\n            - /url: https://www.zara.com/us/en/zara-travel-guide-l15717.html?v1=2577013\n        - listitem: DOWNLOAD APP\n        - listitem:\n          - link \"JOIN LIFE\":\n            - /url: https://www.zara.com/us/en/z-join-life-mkt1399.html\n        - listitem:\n          - button \"+ INFO\"\n    - tabpanel \"MASSIMO DUTTI\":\n      - list:\n        - listitem:\n          - button \"WOMAN\"\n        - listitem:\n          - button \"MAN\"\n    - tabpanel \"ZARA PRE-OWNED\":\n      - list:\n        - listitem:\n          - link \"ABOUT\":\n            - /url: https://www.zara.com/us/en/preowned-about-mkt5795.html\n        - listitem:\n          - link \"REPAIR\":\n            - /url: https://www.zara.com/us/en/preowned-repair-mkt5796.html\n        - listitem:\n          - link \"SECOND HAND\":\n            - /url: https://www.zara.com/us/en/preowned-resell-mkt5797.html\n        - listitem:\n          - link \"DONATE\":\n            - /url: https://www.zara.com/us/en/preowned-donate-mkt5798.html\n        - listitem:\n          - link \"JOIN LIFE\":\n            - /url: https://www.zara.com/us/en/z-join-life-mkt1399.html\n        - listitem:\n          - link \"CAREERS\":\n            - /url: https://www.zara.com/us/en/work-with-us-mkt8081.html\n        - listitem:\n          - link \"STORES\":\n            - /url: https://www.zara.com/us/en/z-stores-st1404.html\n    - tabpanel \"TRAVEL MODE\":\n      - list:\n        - listitem:\n          - link \"ABOUT\":\n            - /url: https://www.zara.com/us/en/zara-travel-about-mkt15716.html\n        - listitem:\n          - link \"THE GUIDES\":\n            - /url: https://www.zara.com/us/en/zara-travel-guide-mkt15717.html\n- main:\n  - heading \"ZARA United States | SALE\" [level=1]\n  - region \"Zara category carousel\":\n    - list:\n      - listitem\n      - listitem\n      - listitem\n      - listitem\n      - listitem\n      - listitem\n      - listitem\n      - listitem\n      - listitem:\n        - text: THE NEW Scroll down\n        - heading \"Footer\" [level=2]\n        - link \"sign up for our newsletter\":\n          - /url: https://www.zara.com/us/en/z-newsletter-nl1400.html?v1=11110\n        - list:\n          - listitem:\n            - link \"Tiktok\":\n              - /url: https://www.tiktok.com/@zara\n          - listitem:\n            - link \"Instagram\":\n              - /url: https://www.instagram.com/zara/\n          - listitem:\n            - link \"Facebook\":\n              - /url: https://www.facebook.com/Zara\n          - listitem:\n            - link \"Pinterest\":\n              - /url: https://es.pinterest.com/zaraofficial\n          - listitem:\n            - link \"Youtube\":\n              - /url: http://www.youtube.com/user/zara\n          - listitem:\n            - link \"Spotify\":\n              - /url: https://open.spotify.com/user/r6ivwuv0ebk346hhxo446pbfv\n        - navigation \"Legal documents\":\n          - heading \"Legal documents\" [level=3]\n          - list:\n            - listitem:\n              - button \"Cookies settings\"\n            - listitem:\n              - button \"Cookie and Ad Preferences\"\n            - listitem:\n              - link \"Privacy and Cookies Policy\":\n                - /url: https://www.zara.com/static/pdfs/US/privacy-policy/privacy-policy_en_US-20241209.html\n            - listitem:\n              - link \"Terms of use\":\n                - /url: https://static.zara.net/static/pdfs/US/terms-and-conditions/terms-and-conditions-en_US-20250829.pdf\n    - list:\n      - listitem\n      - listitem\n      - listitem\n      - listitem\n      - listitem\n      - listitem\n      - listitem:\n        - text: THE NEW Scroll down\n        - heading \"Footer\" [level=2]\n        - link \"sign up for our newsletter\":\n          - /url: https://www.zara.com/us/en/z-newsletter-nl1400.html?v1=11110\n        - list:\n          - listitem:\n            - link \"Tiktok\":\n              - /url: https://www.tiktok.com/@zara\n          - listitem:\n            - link \"Instagram\":\n              - /url: https://www.instagram.com/zara/\n          - listitem:\n            - link \"Facebook\":\n              - /url: https://www.facebook.com/Zara\n          - listitem:\n            - link \"Pinterest\":\n              - /url: https://es.pinterest.com/zaraofficial\n          - listitem:\n            - link \"Youtube\":\n              - /url: http://www.youtube.com/user/zara\n          - listitem:\n            - link \"Spotify\":\n              - /url: https://open.spotify.com/user/r6ivwuv0ebk346hhxo446pbfv\n        - navigation \"Legal documents\":\n          - heading \"Legal documents\" [level=3]\n          - list:\n            - listitem:\n              - button \"Cookies settings\"\n            - listitem:\n              - button \"Cookie and Ad Preferences\"\n            - listitem:\n              - link \"Privacy and Cookies Policy\":\n                - /url: https://www.zara.com/static/pdfs/US/privacy-policy/privacy-policy_en_US-20241209.html\n            - listitem:\n              - link \"Terms of use\":\n                - /url: https://static.zara.net/static/pdfs/US/terms-and-conditions/terms-and-conditions-en_US-20250829.pdf\n    - list:\n      - listitem\n      - listitem\n      - listitem\n      - listitem\n      - listitem\n      - listitem\n      - listitem\n      - listitem\n      - listitem\n      - listitem:\n        - text: THE NEW Scroll down\n        - heading \"Footer\" [level=2]\n        - link \"sign up for our newsletter\":\n          - /url: https://www.zara.com/us/en/z-newsletter-nl1400.html?v1=11110\n        - list:\n          - listitem:\n            - link \"Tiktok\":\n              - /url: https://www.tiktok.com/@zara\n          - listitem:\n            - link \"Instagram\":\n              - /url: https://www.instagram.com/zara/\n          - listitem:\n            - link \"Facebook\":\n              - /url: https://www.facebook.com/Zara\n          - listitem:\n            - link \"Pinterest\":\n              - /url: https://es.pinterest.com/zaraofficial\n          - listitem:\n            - link \"Youtube\":\n              - /url: http://www.youtube.com/user/zara\n          - listitem:\n            - link \"Spotify\":\n              - /url: https://open.spotify.com/user/r6ivwuv0ebk346hhxo446pbfv\n        - navigation \"Legal documents\":\n          - heading \"Legal documents\" [level=3]\n          - list:\n            - listitem:\n              - button \"Cookies settings\"\n            - listitem:\n              - button \"Cookie and Ad Preferences\"\n            - listitem:\n              - link \"Privacy and Cookies Policy\":\n                - /url: https://www.zara.com/static/pdfs/US/privacy-policy/privacy-policy_en_US-20241209.html\n            - listitem:\n              - link \"Terms of use\":\n                - /url: https://static.zara.net/static/pdfs/US/terms-and-conditions/terms-and-conditions-en_US-20250829.pdf\n    - list:\n      - listitem:\n        - img \"Modern living room with black sofa, low table, bookshelf with books, plant, and large window. Picture on the wall and old radiator.\"\n      - listitem\n      - listitem\n      - listitem\n      - listitem\n      - listitem\n      - listitem\n      - listitem:\n        - text: THE NEW Scroll down\n        - heading \"Footer\" [level=2]\n        - link \"sign up for our newsletter\":\n          - /url: https://www.zara.com/us/en/z-newsletter-nl1400.html?v1=11110\n        - list:\n          - listitem:\n            - link \"Tiktok\":\n              - /url: https://www.tiktok.com/@zara\n          - listitem:\n            - link \"Instagram\":\n              - /url: https://www.instagram.com/zara/\n          - listitem:\n            - link \"Facebook\":\n              - /url: https://www.facebook.com/Zara\n          - listitem:\n            - link \"Pinterest\":\n              - /url: https://es.pinterest.com/zaraofficial\n          - listitem:\n            - link \"Youtube\":\n              - /url: http://www.youtube.com/user/zara\n          - listitem:\n            - link \"Spotify\":\n              - /url: https://open.spotify.com/user/r6ivwuv0ebk346hhxo446pbfv\n        - navigation \"Legal documents\":\n          - heading \"Legal documents\" [level=3]\n          - list:\n            - listitem:\n              - button \"Cookies settings\"\n            - listitem:\n              - button \"Cookie and Ad Preferences\"\n            - listitem:\n              - link \"Privacy and Cookies Policy\":\n                - /url: https://www.zara.com/static/pdfs/US/privacy-policy/privacy-policy_en_US-20241209.html\n            - listitem:\n              - link \"Terms of use\":\n                - /url: https://static.zara.net/static/pdfs/US/terms-and-conditions/terms-and-conditions-en_US-20250829.pdf\n    - list:\n      - listitem\n      - listitem\n      - listitem\n      - listitem\n      - listitem:\n        - heading \"Footer\" [level=2]\n        - link \"sign up for our newsletter\":\n          - /url: https://www.zara.com/us/en/z-newsletter-nl1400.html?v1=11110\n        - list:\n          - listitem:\n            - link \"Tiktok\":\n              - /url: https://www.tiktok.com/@zara\n          - listitem:\n            - link \"Instagram\":\n              - /url: https://www.instagram.com/zara/\n          - listitem:\n            - link \"Facebook\":\n              - /url: https://www.facebook.com/Zara\n          - listitem:\n            - link \"Pinterest\":\n              - /url: https://es.pinterest.com/zaraofficial\n          - listitem:\n            - link \"Youtube\":\n              - /url: http://www.youtube.com/user/zara\n          - listitem:\n            - link \"Spotify\":\n              - /url: https://open.spotify.com/user/r6ivwuv0ebk346hhxo446pbfv\n        - navigation \"Legal documents\":\n          - heading \"Legal documents\" [level=3]\n          - list:\n            - listitem:\n              - button \"Cookies settings\"\n            - listitem:\n              - button \"Cookie and Ad Preferences\"\n            - listitem:\n              - link \"Privacy and Cookies Policy\":\n                - /url: https://www.zara.com/static/pdfs/US/privacy-policy/privacy-policy_en_US-20241209.html\n            - listitem:\n              - link \"Terms of use\":\n                - /url: https://static.zara.net/static/pdfs/US/terms-and-conditions/terms-and-conditions-en_US-20250829.pdf\n    - list:\n      - listitem\n      - listitem\n      - listitem\n      - listitem\n      - listitem\n      - listitem\n      - listitem:\n        - text: VIEW ALL Scroll down\n        - heading \"Footer\" [level=2]\n        - link \"sign up for our newsletter\":\n          - /url: https://www.zara.com/us/en/z-newsletter-nl1400.html?v1=11110\n        - list:\n          - listitem:\n            - link \"Tiktok\":\n              - /url: https://www.tiktok.com/@zara\n          - listitem:\n            - link \"Instagram\":\n              - /url: https://www.instagram.com/zara/\n          - listitem:\n            - link \"Facebook\":\n              - /url: https://www.facebook.com/Zara\n          - listitem:\n            - link \"Pinterest\":\n              - /url: https://es.pinterest.com/zaraofficial\n          - listitem:\n            - link \"Youtube\":\n              - /url: http://www.youtube.com/user/zara\n          - listitem:\n            - link \"Spotify\":\n              - /url: https://open.spotify.com/user/r6ivwuv0ebk346hhxo446pbfv\n        - navigation \"Legal documents\":\n          - heading \"Legal documents\" [level=3]\n          - list:\n            - listitem:\n              - button \"Cookies settings\"\n            - listitem:\n              - button \"Cookie and Ad Preferences\"\n            - listitem:\n              - link \"Privacy and Cookies Policy\":\n                - /url: https://www.zara.com/static/pdfs/US/privacy-policy/privacy-policy_en_US-20241209.html\n            - listitem:\n              - link \"Terms of use\":\n                - /url: https://static.zara.net/static/pdfs/US/terms-and-conditions/terms-and-conditions-en_US-20250829.pdf\n    - list:\n      - listitem\n      - listitem\n      - listitem\n      - listitem:\n        - heading \"Footer\" [level=2]\n        - link \"sign up for our newsletter\":\n          - /url: https://www.zara.com/us/en/z-newsletter-nl1400.html?v1=11110\n        - list:\n          - listitem:\n            - link \"Tiktok\":\n              - /url: https://www.tiktok.com/@zara\n          - listitem:\n            - link \"Instagram\":\n              - /url: https://www.instagram.com/zara/\n          - listitem:\n            - link \"Facebook\":\n              - /url: https://www.facebook.com/Zara\n          - listitem:\n            - link \"Pinterest\":\n              - /url: https://es.pinterest.com/zaraofficial\n          - listitem:\n            - link \"Youtube\":\n              - /url: http://www.youtube.com/user/zara\n          - listitem:\n            - link \"Spotify\":\n              - /url: https://open.spotify.com/user/r6ivwuv0ebk346hhxo446pbfv\n        - navigation \"Legal documents\":\n          - heading \"Legal documents\" [level=3]\n          - list:\n            - listitem:\n              - button \"Cookies settings\"\n            - listitem:\n              - button \"Cookie and Ad Preferences\"\n            - listitem:\n              - link \"Privacy and Cookies Policy\":\n                - /url: https://www.zara.com/static/pdfs/US/privacy-policy/privacy-policy_en_US-20241209.html\n            - listitem:\n              - link \"Terms of use\":\n                - /url: https://static.zara.net/static/pdfs/US/terms-and-conditions/terms-and-conditions-en_US-20250829.pdf\n    - list:\n      - listitem\n      - listitem:\n        - heading \"Footer\" [level=2]\n        - link \"sign up for our newsletter\":\n          - /url: https://www.zara.com/us/en/z-newsletter-nl1400.html?v1=11110\n        - list:\n          - listitem:\n            - link \"Tiktok\":\n              - /url: https://www.tiktok.com/@zara\n          - listitem:\n            - link \"Instagram\":\n              - /url: https://www.instagram.com/zara/\n          - listitem:\n            - link \"Facebook\":\n              - /url: https://www.facebook.com/Zara\n          - listitem:\n            - link \"Pinterest\":\n              - /url: https://es.pinterest.com/zaraofficial\n          - listitem:\n            - link \"Youtube\":\n              - /url: http://www.youtube.com/user/zara\n          - listitem:\n            - link \"Spotify\":\n              - /url: https://open.spotify.com/user/r6ivwuv0ebk346hhxo446pbfv\n        - navigation \"Legal documents\":\n          - heading \"Legal documents\" [level=3]\n          - list:\n            - listitem:\n              - button \"Cookies settings\"\n            - listitem:\n              - button \"Cookie and Ad Preferences\"\n            - listitem:\n              - link \"Privacy and Cookies Policy\":\n                - /url: https://www.zara.com/static/pdfs/US/privacy-policy/privacy-policy_en_US-20241209.html\n            - listitem:\n              - link \"Terms of use\":\n                - /url: https://static.zara.net/static/pdfs/US/terms-and-conditions/terms-and-conditions-en_US-20250829.pdf\n    - list:\n      - listitem:\n        - button \"Move to HOME\"\n      - listitem:\n        - button \"Move to BEAUTY\"\n- contentinfo\n- iframe"
  },
  {
    "step": 7,
    "timestamp": "2026-01-11T12:56:20.192044",
    "path": [
      "MASSIMO DUTTI",
      "WOMAN"
    ],
    "action": "clicked: MASSIMO DUTTI > WOMAN",
    "url": "https://www.zara.com/us/",
    "new_buttons": [],
    "new_links": {
      "Go to homepage": "https://www.zara.com/us/",
      "LOG IN": "https://www.zara.com/us/en/logon",
      "Help": "https://www.zara.com/us/en/help-center",
      "GIFT CARD": "https://www.zara.com/us/en/z-giftcard-mkt1394.html",
      "CAREERS": "https://www.zara.com/us/en/work-with-us-mkt8081.html",
      "JOIN LIFE": "https://www.zara.com/us/en/z-join-life-mkt1399.html",
      "STORES": "https://www.zara.com/us/en/z-stores-st1404.html",
      "PERFUMES": "https://www.zara.com/us/en/woman-accessories-perfumes-l1017.html?v1=2419833",
      "MAKEUP": "https://www.zara.com/us/en/woman-beauty-makeup-l4414.html?v1=1881272",
      "ZARA HAIR": "https://www.zara.com/us/en/woman-hair-l7345.html?v1=2418886",
      "ABOUT": "https://www.zara.com/us/en/zara-travel-about-mkt15716.html",
      "REPAIR": "https://www.zara.com/us/en/preowned-repair-mkt5796.html",
      "SECOND HAND": "https://www.zara.com/us/en/preowned-resell-mkt5797.html",
      "DONATE": "https://www.zara.com/us/en/preowned-donate-mkt5798.html",
      "THE GUIDES": "https://www.zara.com/us/en/zara-travel-guide-mkt15717.html",
      "Youtube": "http://www.youtube.com/user/zara",
      "Spotify": "https://open.spotify.com/user/r6ivwuv0ebk346hhxo446pbfv"
    },
    "aria": "- link \"Skip to main content\":\n  - /url: \"#main\"\n- banner:\n  - button \"Close menu\"\n  - link \"Go to homepage\":\n    - /url: https://www.zara.com/us/\n  - list:\n    - listitem:\n      - link \"Search\":\n        - /url: https://www.zara.com/us/en/search/home\n    - listitem:\n      - link \"LOG IN\":\n        - /url: https://www.zara.com/us/en/logon\n    - listitem:\n      - link \"Help\":\n        - /url: https://www.zara.com/us/en/help-center\n    - listitem:\n      - link \"Cart empty\":\n        - /url: https://www.zara.com/us/en/shop/cart\n        - text: Shopping bag [\n        - status: \"0\"\n        - text: \"]\"\n- dialog \"Category Menu\":\n  - button \"Close menu\"\n  - link \"Go to homepage\":\n    - /url: https://www.zara.com/us/\n  - navigation:\n    - tablist \"Categories\":\n      - tab \"WOMAN\" [selected]\n      - tab \"MAN\"\n      - tab \"KIDS\"\n      - tab \"ZARA HOME\"\n      - tab \"BEAUTY\"\n      - tab \"MASSIMO DUTTI\"\n      - tab \"ZARA PRE-OWNED\"\n      - tab \"TRAVEL MODE\"\n    - tabpanel \"WOMAN\":\n      - list:\n        - listitem:\n          - button \"NEW COLLECTION\"\n        - listitem:\n          - button \"SALE\" [expanded]:\n            - text: SALE\n            - img\n        - listitem:\n          - link \"GIFT CARD\":\n            - /url: https://www.zara.com/us/en/z-giftcard-mkt1394.html\n        - listitem:\n          - button \"+ INFO\"\n        - listitem:\n          - link \"CAREERS\":\n            - /url: https://www.zara.com/us/en/work-with-us-mkt8081.html\n        - listitem: DOWNLOAD APP\n        - listitem:\n          - link \"JOIN LIFE\":\n            - /url: https://www.zara.com/us/en/z-join-life-mkt1399.html\n        - listitem:\n          - link \"STORES\":\n            - /url: https://www.zara.com/us/en/z-stores-st1404.html\n    - tabpanel \"MAN\":\n      - list:\n        - listitem:\n          - button \"NEW COLLECTION\"\n        - listitem:\n          - button \"SALE\"\n        - listitem:\n          - link \"GIFT CARD\":\n            - /url: https://www.zara.com/us/en/z-giftcard-mkt1394.html\n        - listitem: DOWNLOAD APP\n        - listitem:\n          - link \"STORES\":\n            - /url: https://www.zara.com/us/en/z-stores-st1404.html\n        - listitem:\n          - link \"JOIN LIFE\":\n            - /url: https://www.zara.com/us/en/z-join-life-mkt1399.html\n        - listitem: CAREERS\n        - listitem:\n          - button \"+ INFO\"\n    - tabpanel \"KIDS\":\n      - list:\n        - listitem:\n          - button \"NEW COLLECTION\"\n        - listitem:\n          - button \"SALE\"\n        - listitem:\n          - link \"GIFT CARD\":\n            - /url: https://www.zara.com/us/en/z-giftcard-mkt1394.html\n        - listitem: DOWNLOAD APP\n        - listitem:\n          - link \"STORES\":\n            - /url: https://www.zara.com/us/en/z-stores-st1404.html\n        - listitem: JOIN LIFE\n        - listitem: CAREERS\n        - listitem:\n          - button \"+ INFO\"\n    - tabpanel \"ZARA HOME\":\n      - list:\n        - listitem:\n          - button \"NEW COLLECTION\"\n        - listitem:\n          - button \"SALE\"\n        - listitem:\n          - link:\n            - /url: https://www.zara.com/us/en/zara-travel-guide-l15717.html?v1=2577013\n        - listitem:\n          - link \"GIFT CARD\":\n            - /url: https://www.zara.com/us/en/z-giftcard-mkt1394.html\n        - listitem:\n          - button \"+ INFO\"\n        - listitem: DOWNLOAD APP\n        - listitem:\n          - link \"JOIN LIFE\":\n            - /url: https://www.zara.com/us/en/z-join-life-mkt1399.html\n        - listitem:\n          - link \"CAREERS\":\n            - /url: https://www.zara.com/us/en/work-with-us-mkt8081.html\n        - listitem:\n          - link \"STORES\":\n            - /url: https://www.zara.com/us/en/z-stores-st1404.html\n        - listitem: RECALLED ITEMS\n    - tabpanel \"BEAUTY\":\n      - list:\n        - listitem:\n          - link \"PERFUMES\":\n            - /url: https://www.zara.com/us/en/woman-accessories-perfumes-l1017.html?v1=2419833\n            - paragraph: PERFUMES\n          - link \"MAKEUP\":\n            - /url: https://www.zara.com/us/en/woman-beauty-makeup-l4414.html?v1=1881272\n            - paragraph: MAKEUP\n          - link \"ZARA HAIR\":\n            - /url: https://www.zara.com/us/en/woman-hair-l7345.html?v1=2418886\n            - paragraph: ZARA HAIR\n        - listitem:\n          - button \"WOMAN\"\n        - listitem:\n          - button \"MAN\"\n        - listitem:\n          - button \"KIDS\"\n        - listitem:\n          - link:\n            - /url: https://www.zara.com/us/en/zara-travel-guide-l15717.html?v1=2577013\n        - listitem: DOWNLOAD APP\n        - listitem:\n          - link \"JOIN LIFE\":\n            - /url: https://www.zara.com/us/en/z-join-life-mkt1399.html\n        - listitem:\n          - button \"+ INFO\"\n    - tabpanel \"MASSIMO DUTTI\":\n      - list:\n        - listitem:\n          - button \"WOMAN\"\n        - listitem:\n          - button \"MAN\"\n    - tabpanel \"ZARA PRE-OWNED\":\n      - list:\n        - listitem:\n          - link \"ABOUT\":\n            - /url: https://www.zara.com/us/en/preowned-about-mkt5795.html\n        - listitem:\n          - link \"REPAIR\":\n            - /url: https://www.zara.com/us/en/preowned-repair-mkt5796.html\n        - listitem:\n          - link \"SECOND HAND\":\n            - /url: https://www.zara.com/us/en/preowned-resell-mkt5797.html\n        - listitem:\n          - link \"DONATE\":\n            - /url: https://www.zara.com/us/en/preowned-donate-mkt5798.html\n        - listitem:\n          - link \"JOIN LIFE\":\n            - /url: https://www.zara.com/us/en/z-join-life-mkt1399.html\n        - listitem:\n          - link \"CAREERS\":\n            - /url: https://www.zara.com/us/en/work-with-us-mkt8081.html\n        - listitem:\n          - link \"STORES\":\n            - /url: https://www.zara.com/us/en/z-stores-st1404.html\n    - tabpanel \"TRAVEL MODE\":\n      - list:\n        - listitem:\n          - link \"ABOUT\":\n            - /url: https://www.zara.com/us/en/zara-travel-about-mkt15716.html\n        - listitem:\n          - link \"THE GUIDES\":\n            - /url: https://www.zara.com/us/en/zara-travel-guide-mkt15717.html\n- main:\n  - heading \"ZARA United States | SALE\" [level=1]\n  - region \"Zara category carousel\":\n    - list:\n      - listitem\n      - listitem\n      - listitem\n      - listitem\n      - listitem\n      - listitem\n      - listitem\n      - listitem\n      - listitem:\n        - text: THE NEW Scroll down\n        - heading \"Footer\" [level=2]\n        - link \"sign up for our newsletter\":\n          - /url: https://www.zara.com/us/en/z-newsletter-nl1400.html?v1=11110\n        - list:\n          - listitem:\n            - link \"Tiktok\":\n              - /url: https://www.tiktok.com/@zara\n          - listitem:\n            - link \"Instagram\":\n              - /url: https://www.instagram.com/zara/\n          - listitem:\n            - link \"Facebook\":\n              - /url: https://www.facebook.com/Zara\n          - listitem:\n            - link \"Pinterest\":\n              - /url: https://es.pinterest.com/zaraofficial\n          - listitem:\n            - link \"Youtube\":\n              - /url: http://www.youtube.com/user/zara\n          - listitem:\n            - link \"Spotify\":\n              - /url: https://open.spotify.com/user/r6ivwuv0ebk346hhxo446pbfv\n        - navigation \"Legal documents\":\n          - heading \"Legal documents\" [level=3]\n          - list:\n            - listitem:\n              - button \"Cookies settings\"\n            - listitem:\n              - button \"Cookie and Ad Preferences\"\n            - listitem:\n              - link \"Privacy and Cookies Policy\":\n                - /url: https://www.zara.com/static/pdfs/US/privacy-policy/privacy-policy_en_US-20241209.html\n            - listitem:\n              - link \"Terms of use\":\n                - /url: https://static.zara.net/static/pdfs/US/terms-and-conditions/terms-and-conditions-en_US-20250829.pdf\n    - list:\n      - listitem\n      - listitem\n      - listitem\n      - listitem\n      - listitem\n      - listitem\n      - listitem:\n        - text: THE NEW Scroll down\n        - heading \"Footer\" [level=2]\n        - link \"sign up for our newsletter\":\n          - /url: https://www.zara.com/us/en/z-newsletter-nl1400.html?v1=11110\n        - list:\n          - listitem:\n            - link \"Tiktok\":\n              - /url: https://www.tiktok.com/@zara\n          - listitem:\n            - link \"Instagram\":\n              - /url: https://www.instagram.com/zara/\n          - listitem:\n            - link \"Facebook\":\n              - /url: https://www.facebook.com/Zara\n          - listitem:\n            - link \"Pinterest\":\n              - /url: https://es.pinterest.com/zaraofficial\n          - listitem:\n            - link \"Youtube\":\n              - /url: http://www.youtube.com/user/zara\n          - listitem:\n            - link \"Spotify\":\n              - /url: https://open.spotify.com/user/r6ivwuv0ebk346hhxo446pbfv\n        - navigation \"Legal documents\":\n          - heading \"Legal documents\" [level=3]\n          - list:\n            - listitem:\n              - button \"Cookies settings\"\n            - listitem:\n              - button \"Cookie and Ad Preferences\"\n            - listitem:\n              - link \"Privacy and Cookies Policy\":\n                - /url: https://www.zara.com/static/pdfs/US/privacy-policy/privacy-policy_en_US-20241209.html\n            - listitem:\n              - link \"Terms of use\":\n                - /url: https://static.zara.net/static/pdfs/US/terms-and-conditions/terms-and-conditions-en_US-20250829.pdf\n    - list:\n      - listitem\n      - listitem\n      - listitem\n      - listitem\n      - listitem\n      - listitem\n      - listitem\n      - listitem\n      - listitem\n      - listitem:\n        - text: THE NEW Scroll down\n        - heading \"Footer\" [level=2]\n        - link \"sign up for our newsletter\":\n          - /url: https://www.zara.com/us/en/z-newsletter-nl1400.html?v1=11110\n        - list:\n          - listitem:\n            - link \"Tiktok\":\n              - /url: https://www.tiktok.com/@zara\n          - listitem:\n            - link \"Instagram\":\n              - /url: https://www.instagram.com/zara/\n          - listitem:\n            - link \"Facebook\":\n              - /url: https://www.facebook.com/Zara\n          - listitem:\n            - link \"Pinterest\":\n              - /url: https://es.pinterest.com/zaraofficial\n          - listitem:\n            - link \"Youtube\":\n              - /url: http://www.youtube.com/user/zara\n          - listitem:\n            - link \"Spotify\":\n              - /url: https://open.spotify.com/user/r6ivwuv0ebk346hhxo446pbfv\n        - navigation \"Legal documents\":\n          - heading \"Legal documents\" [level=3]\n          - list:\n            - listitem:\n              - button \"Cookies settings\"\n            - listitem:\n              - button \"Cookie and Ad Preferences\"\n            - listitem:\n              - link \"Privacy and Cookies Policy\":\n                - /url: https://www.zara.com/static/pdfs/US/privacy-policy/privacy-policy_en_US-20241209.html\n            - listitem:\n              - link \"Terms of use\":\n                - /url: https://static.zara.net/static/pdfs/US/terms-and-conditions/terms-and-conditions-en_US-20250829.pdf\n    - list:\n      - listitem:\n        - img \"Modern living room with black sofa, low table, bookshelf with books, plant, and large window. Picture on the wall and old radiator.\"\n      - listitem\n      - listitem\n      - listitem\n      - listitem\n      - listitem\n      - listitem\n      - listitem:\n        - text: THE NEW Scroll down\n        - heading \"Footer\" [level=2]\n        - link \"sign up for our newsletter\":\n          - /url: https://www.zara.com/us/en/z-newsletter-nl1400.html?v1=11110\n        - list:\n          - listitem:\n            - link \"Tiktok\":\n              - /url: https://www.tiktok.com/@zara\n          - listitem:\n            - link \"Instagram\":\n              - /url: https://www.instagram.com/zara/\n          - listitem:\n            - link \"Facebook\":\n              - /url: https://www.facebook.com/Zara\n          - listitem:\n            - link \"Pinterest\":\n              - /url: https://es.pinterest.com/zaraofficial\n          - listitem:\n            - link \"Youtube\":\n              - /url: http://www.youtube.com/user/zara\n          - listitem:\n            - link \"Spotify\":\n              - /url: https://open.spotify.com/user/r6ivwuv0ebk346hhxo446pbfv\n        - navigation \"Legal documents\":\n          - heading \"Legal documents\" [level=3]\n          - list:\n            - listitem:\n              - button \"Cookies settings\"\n            - listitem:\n              - button \"Cookie and Ad Preferences\"\n            - listitem:\n              - link \"Privacy and Cookies Policy\":\n                - /url: https://www.zara.com/static/pdfs/US/privacy-policy/privacy-policy_en_US-20241209.html\n            - listitem:\n              - link \"Terms of use\":\n                - /url: https://static.zara.net/static/pdfs/US/terms-and-conditions/terms-and-conditions-en_US-20250829.pdf\n    - list:\n      - listitem\n      - listitem\n      - listitem\n      - listitem\n      - listitem:\n        - heading \"Footer\" [level=2]\n        - link \"sign up for our newsletter\":\n          - /url: https://www.zara.com/us/en/z-newsletter-nl1400.html?v1=11110\n        - list:\n          - listitem:\n            - link \"Tiktok\":\n              - /url: https://www.tiktok.com/@zara\n          - listitem:\n            - link \"Instagram\":\n              - /url: https://www.instagram.com/zara/\n          - listitem:\n            - link \"Facebook\":\n              - /url: https://www.facebook.com/Zara\n          - listitem:\n            - link \"Pinterest\":\n              - /url: https://es.pinterest.com/zaraofficial\n          - listitem:\n            - link \"Youtube\":\n              - /url: http://www.youtube.com/user/zara\n          - listitem:\n            - link \"Spotify\":\n              - /url: https://open.spotify.com/user/r6ivwuv0ebk346hhxo446pbfv\n        - navigation \"Legal documents\":\n          - heading \"Legal documents\" [level=3]\n          - list:\n            - listitem:\n              - button \"Cookies settings\"\n            - listitem:\n              - button \"Cookie and Ad Preferences\"\n            - listitem:\n              - link \"Privacy and Cookies Policy\":\n                - /url: https://www.zara.com/static/pdfs/US/privacy-policy/privacy-policy_en_US-20241209.html\n            - listitem:\n              - link \"Terms of use\":\n                - /url: https://static.zara.net/static/pdfs/US/terms-and-conditions/terms-and-conditions-en_US-20250829.pdf\n    - list:\n      - listitem\n      - listitem\n      - listitem\n      - listitem\n      - listitem\n      - listitem\n      - listitem:\n        - text: VIEW ALL Scroll down\n        - heading \"Footer\" [level=2]\n        - link \"sign up for our newsletter\":\n          - /url: https://www.zara.com/us/en/z-newsletter-nl1400.html?v1=11110\n        - list:\n          - listitem:\n            - link \"Tiktok\":\n              - /url: https://www.tiktok.com/@zara\n          - listitem:\n            - link \"Instagram\":\n              - /url: https://www.instagram.com/zara/\n          - listitem:\n            - link \"Facebook\":\n              - /url: https://www.facebook.com/Zara\n          - listitem:\n            - link \"Pinterest\":\n              - /url: https://es.pinterest.com/zaraofficial\n          - listitem:\n            - link \"Youtube\":\n              - /url: http://www.youtube.com/user/zara\n          - listitem:\n            - link \"Spotify\":\n              - /url: https://open.spotify.com/user/r6ivwuv0ebk346hhxo446pbfv\n        - navigation \"Legal documents\":\n          - heading \"Legal documents\" [level=3]\n          - list:\n            - listitem:\n              - button \"Cookies settings\"\n            - listitem:\n              - button \"Cookie and Ad Preferences\"\n            - listitem:\n              - link \"Privacy and Cookies Policy\":\n                - /url: https://www.zara.com/static/pdfs/US/privacy-policy/privacy-policy_en_US-20241209.html\n            - listitem:\n              - link \"Terms of use\":\n                - /url: https://static.zara.net/static/pdfs/US/terms-and-conditions/terms-and-conditions-en_US-20250829.pdf\n    - list:\n      - listitem\n      - listitem\n      - listitem\n      - listitem:\n        - heading \"Footer\" [level=2]\n        - link \"sign up for our newsletter\":\n          - /url: https://www.zara.com/us/en/z-newsletter-nl1400.html?v1=11110\n        - list:\n          - listitem:\n            - link \"Tiktok\":\n              - /url: https://www.tiktok.com/@zara\n          - listitem:\n            - link \"Instagram\":\n              - /url: https://www.instagram.com/zara/\n          - listitem:\n            - link \"Facebook\":\n              - /url: https://www.facebook.com/Zara\n          - listitem:\n            - link \"Pinterest\":\n              - /url: https://es.pinterest.com/zaraofficial\n          - listitem:\n            - link \"Youtube\":\n              - /url: http://www.youtube.com/user/zara\n          - listitem:\n            - link \"Spotify\":\n              - /url: https://open.spotify.com/user/r6ivwuv0ebk346hhxo446pbfv\n        - navigation \"Legal documents\":\n          - heading \"Legal documents\" [level=3]\n          - list:\n            - listitem:\n              - button \"Cookies settings\"\n            - listitem:\n              - button \"Cookie and Ad Preferences\"\n            - listitem:\n              - link \"Privacy and Cookies Policy\":\n                - /url: https://www.zara.com/static/pdfs/US/privacy-policy/privacy-policy_en_US-20241209.html\n            - listitem:\n              - link \"Terms of use\":\n                - /url: https://static.zara.net/static/pdfs/US/terms-and-conditions/terms-and-conditions-en_US-20250829.pdf\n    - list:\n      - listitem\n      - listitem:\n        - heading \"Footer\" [level=2]\n        - link \"sign up for our newsletter\":\n          - /url: https://www.zara.com/us/en/z-newsletter-nl1400.html?v1=11110\n        - list:\n          - listitem:\n            - link \"Tiktok\":\n              - /url: https://www.tiktok.com/@zara\n          - listitem:\n            - link \"Instagram\":\n              - /url: https://www.instagram.com/zara/\n          - listitem:\n            - link \"Facebook\":\n              - /url: https://www.facebook.com/Zara\n          - listitem:\n            - link \"Pinterest\":\n              - /url: https://es.pinterest.com/zaraofficial\n          - listitem:\n            - link \"Youtube\":\n              - /url: http://www.youtube.com/user/zara\n          - listitem:\n            - link \"Spotify\":\n              - /url: https://open.spotify.com/user/r6ivwuv0ebk346hhxo446pbfv\n        - navigation \"Legal documents\":\n          - heading \"Legal documents\" [level=3]\n          - list:\n            - listitem:\n              - button \"Cookies settings\"\n            - listitem:\n              - button \"Cookie and Ad Preferences\"\n            - listitem:\n              - link \"Privacy and Cookies Policy\":\n                - /url: https://www.zara.com/static/pdfs/US/privacy-policy/privacy-policy_en_US-20241209.html\n            - listitem:\n              - link \"Terms of use\":\n                - /url: https://static.zara.net/static/pdfs/US/terms-and-conditions/terms-and-conditions-en_US-20250829.pdf\n    - list:\n      - listitem:\n        - button \"Move to MAN\"\n- contentinfo\n- iframe"
  },
  {
    "step": 8,
    "timestamp": "2026-01-11T12:56:24.244889",
    "path": [
      "MASSIMO DUTTI",
      "MAN"
    ],
    "action": "clicked: MASSIMO DUTTI > MAN",
    "url": "https://www.zara.com/us/",
    "new_buttons": [],
    "new_links": {
      "Go to homepage": "https://www.zara.com/us/",
      "LOG IN": "https://www.zara.com/us/en/logon",
      "Help": "https://www.zara.com/us/en/help-center",
      "GIFT CARD": "https://www.zara.com/us/en/z-giftcard-mkt1394.html",
      "CAREERS": "https://www.zara.com/us/en/work-with-us-mkt8081.html",
      "JOIN LIFE": "https://www.zara.com/us/en/z-join-life-mkt1399.html",
      "STORES": "https://www.zara.com/us/en/z-stores-st1404.html",
      "PERFUMES": "https://www.zara.com/us/en/woman-accessories-perfumes-l1017.html?v1=2419833",
      "MAKEUP": "https://www.zara.com/us/en/woman-beauty-makeup-l4414.html?v1=1881272",
      "ZARA HAIR": "https://www.zara.com/us/en/woman-hair-l7345.html?v1=2418886",
      "ABOUT": "https://www.zara.com/us/en/zara-travel-about-mkt15716.html",
      "REPAIR": "https://www.zara.com/us/en/preowned-repair-mkt5796.html",
      "SECOND HAND": "https://www.zara.com/us/en/preowned-resell-mkt5797.html",
      "DONATE": "https://www.zara.com/us/en/preowned-donate-mkt5798.html",
      "THE GUIDES": "https://www.zara.com/us/en/zara-travel-guide-mkt15717.html",
      "Youtube": "http://www.youtube.com/user/zara",
      "Spotify": "https://open.spotify.com/user/r6ivwuv0ebk346hhxo446pbfv"
    },
    "aria": "- link \"Skip to main content\":\n  - /url: \"#main\"\n- banner:\n  - button \"Close menu\"\n  - link \"Go to homepage\":\n    - /url: https://www.zara.com/us/\n  - list:\n    - listitem:\n      - link \"Search\":\n        - /url: https://www.zara.com/us/en/search/home\n    - listitem:\n      - link \"LOG IN\":\n        - /url: https://www.zara.com/us/en/logon\n    - listitem:\n      - link \"Help\":\n        - /url: https://www.zara.com/us/en/help-center\n    - listitem:\n      - link \"Cart empty\":\n        - /url: https://www.zara.com/us/en/shop/cart\n        - text: Shopping bag [\n        - status: \"0\"\n        - text: \"]\"\n- dialog \"Category Menu\":\n  - button \"Close menu\"\n  - link \"Go to homepage\":\n    - /url: https://www.zara.com/us/\n  - navigation:\n    - tablist \"Categories\":\n      - tab \"WOMAN\"\n      - tab \"MAN\" [selected]\n      - tab \"KIDS\"\n      - tab \"ZARA HOME\"\n      - tab \"BEAUTY\"\n      - tab \"MASSIMO DUTTI\"\n      - tab \"ZARA PRE-OWNED\"\n      - tab \"TRAVEL MODE\"\n    - tabpanel \"WOMAN\":\n      - list:\n        - listitem:\n          - button \"NEW COLLECTION\"\n        - listitem:\n          - button \"SALE\"\n        - listitem:\n          - link \"GIFT CARD\":\n            - /url: https://www.zara.com/us/en/z-giftcard-mkt1394.html\n        - listitem:\n          - button \"+ INFO\"\n        - listitem:\n          - link \"CAREERS\":\n            - /url: https://www.zara.com/us/en/work-with-us-mkt8081.html\n        - listitem: DOWNLOAD APP\n        - listitem:\n          - link \"JOIN LIFE\":\n            - /url: https://www.zara.com/us/en/z-join-life-mkt1399.html\n        - listitem:\n          - link \"STORES\":\n            - /url: https://www.zara.com/us/en/z-stores-st1404.html\n    - tabpanel \"MAN\":\n      - list:\n        - listitem:\n          - button \"NEW COLLECTION\"\n        - listitem:\n          - button \"SALE\" [expanded]:\n            - text: SALE\n            - img\n        - listitem:\n          - link \"GIFT CARD\":\n            - /url: https://www.zara.com/us/en/z-giftcard-mkt1394.html\n        - listitem: DOWNLOAD APP\n        - listitem:\n          - link \"STORES\":\n            - /url: https://www.zara.com/us/en/z-stores-st1404.html\n        - listitem:\n          - link \"JOIN LIFE\":\n            - /url: https://www.zara.com/us/en/z-join-life-mkt1399.html\n        - listitem: CAREERS\n        - listitem:\n          - button \"+ INFO\"\n    - tabpanel \"KIDS\":\n      - list:\n        - listitem:\n          - button \"NEW COLLECTION\"\n        - listitem:\n          - button \"SALE\"\n        - listitem:\n          - link \"GIFT CARD\":\n            - /url: https://www.zara.com/us/en/z-giftcard-mkt1394.html\n        - listitem: DOWNLOAD APP\n        - listitem:\n          - link \"STORES\":\n            - /url: https://www.zara.com/us/en/z-stores-st1404.html\n        - listitem: JOIN LIFE\n        - listitem: CAREERS\n        - listitem:\n          - button \"+ INFO\"\n    - tabpanel \"ZARA HOME\":\n      - list:\n        - listitem:\n          - button \"NEW COLLECTION\"\n        - listitem:\n          - button \"SALE\"\n        - listitem:\n          - link:\n            - /url: https://www.zara.com/us/en/zara-travel-guide-l15717.html?v1=2577013\n        - listitem:\n          - link \"GIFT CARD\":\n            - /url: https://www.zara.com/us/en/z-giftcard-mkt1394.html\n        - listitem:\n          - button \"+ INFO\"\n        - listitem: DOWNLOAD APP\n        - listitem:\n          - link \"JOIN LIFE\":\n            - /url: https://www.zara.com/us/en/z-join-life-mkt1399.html\n        - listitem:\n          - link \"CAREERS\":\n            - /url: https://www.zara.com/us/en/work-with-us-mkt8081.html\n        - listitem:\n          - link \"STORES\":\n            - /url: https://www.zara.com/us/en/z-stores-st1404.html\n        - listitem: RECALLED ITEMS\n    - tabpanel \"BEAUTY\":\n      - list:\n        - listitem:\n          - link \"PERFUMES\":\n            - /url: https://www.zara.com/us/en/woman-accessories-perfumes-l1017.html?v1=2419833\n            - paragraph: PERFUMES\n          - link \"MAKEUP\":\n            - /url: https://www.zara.com/us/en/woman-beauty-makeup-l4414.html?v1=1881272\n            - paragraph: MAKEUP\n          - link \"ZARA HAIR\":\n            - /url: https://www.zara.com/us/en/woman-hair-l7345.html?v1=2418886\n            - paragraph: ZARA HAIR\n        - listitem:\n          - button \"WOMAN\"\n        - listitem:\n          - button \"MAN\"\n        - listitem:\n          - button \"KIDS\"\n        - listitem:\n          - link:\n            - /url: https://www.zara.com/us/en/zara-travel-guide-l15717.html?v1=2577013\n        - listitem: DOWNLOAD APP\n        - listitem:\n          - link \"JOIN LIFE\":\n            - /url: https://www.zara.com/us/en/z-join-life-mkt1399.html\n        - listitem:\n          - button \"+ INFO\"\n    - tabpanel \"MASSIMO DUTTI\":\n      - list:\n        - listitem:\n          - button \"WOMAN\"\n        - listitem:\n          - button \"MAN\"\n    - tabpanel \"ZARA PRE-OWNED\":\n      - list:\n        - listitem:\n          - link \"ABOUT\":\n            - /url: https://www.zara.com/us/en/preowned-about-mkt5795.html\n        - listitem:\n          - link \"REPAIR\":\n            - /url: https://www.zara.com/us/en/preowned-repair-mkt5796.html\n        - listitem:\n          - link \"SECOND HAND\":\n            - /url: https://www.zara.com/us/en/preowned-resell-mkt5797.html\n        - listitem:\n          - link \"DONATE\":\n            - /url: https://www.zara.com/us/en/preowned-donate-mkt5798.html\n        - listitem:\n          - link \"JOIN LIFE\":\n            - /url: https://www.zara.com/us/en/z-join-life-mkt1399.html\n        - listitem:\n          - link \"CAREERS\":\n            - /url: https://www.zara.com/us/en/work-with-us-mkt8081.html\n        - listitem:\n          - link \"STORES\":\n            - /url: https://www.zara.com/us/en/z-stores-st1404.html\n    - tabpanel \"TRAVEL MODE\":\n      - list:\n        - listitem:\n          - link \"ABOUT\":\n            - /url: https://www.zara.com/us/en/zara-travel-about-mkt15716.html\n        - listitem:\n          - link \"THE GUIDES\":\n            - /url: https://www.zara.com/us/en/zara-travel-guide-mkt15717.html\n- main:\n  - heading \"ZARA United States | SALE\" [level=1]\n  - region \"Zara category carousel\":\n    - list:\n      - listitem\n      - listitem\n      - listitem\n      - listitem\n      - listitem\n      - listitem\n      - listitem\n      - listitem\n      - listitem:\n        - text: THE NEW Scroll down\n        - heading \"Footer\" [level=2]\n        - link \"sign up for our newsletter\":\n          - /url: https://www.zara.com/us/en/z-newsletter-nl1400.html?v1=11110\n        - list:\n          - listitem:\n            - link \"Tiktok\":\n              - /url: https://www.tiktok.com/@zara\n          - listitem:\n            - link \"Instagram\":\n              - /url: https://www.instagram.com/zara/\n          - listitem:\n            - link \"Facebook\":\n              - /url: https://www.facebook.com/Zara\n          - listitem:\n            - link \"Pinterest\":\n              - /url: https://es.pinterest.com/zaraofficial\n          - listitem:\n            - link \"Youtube\":\n              - /url: http://www.youtube.com/user/zara\n          - listitem:\n            - link \"Spotify\":\n              - /url: https://open.spotify.com/user/r6ivwuv0ebk346hhxo446pbfv\n        - navigation \"Legal documents\":\n          - heading \"Legal documents\" [level=3]\n          - list:\n            - listitem:\n              - button \"Do Not Sell Or Share My Personal Information\"\n            - listitem:\n              - button \"Cookie and Ad Preferences\"\n            - listitem:\n              - link \"Privacy and Cookies Policy\":\n                - /url: https://www.zara.com/static/pdfs/US/privacy-policy/privacy-policy_en_US-20241209.html\n            - listitem:\n              - link \"Terms of use\":\n                - /url: https://static.zara.net/static/pdfs/US/terms-and-conditions/terms-and-conditions-en_US-20250829.pdf\n    - list:\n      - listitem\n      - listitem\n      - listitem\n      - listitem\n      - listitem\n      - listitem\n      - listitem:\n        - text: THE NEW Scroll down\n        - heading \"Footer\" [level=2]\n        - link \"sign up for our newsletter\":\n          - /url: https://www.zara.com/us/en/z-newsletter-nl1400.html?v1=11110\n        - list:\n          - listitem:\n            - link \"Tiktok\":\n              - /url: https://www.tiktok.com/@zara\n          - listitem:\n            - link \"Instagram\":\n              - /url: https://www.instagram.com/zara/\n          - listitem:\n            - link \"Facebook\":\n              - /url: https://www.facebook.com/Zara\n          - listitem:\n            - link \"Pinterest\":\n              - /url: https://es.pinterest.com/zaraofficial\n          - listitem:\n            - link \"Youtube\":\n              - /url: http://www.youtube.com/user/zara\n          - listitem:\n            - link \"Spotify\":\n              - /url: https://open.spotify.com/user/r6ivwuv0ebk346hhxo446pbfv\n        - navigation \"Legal documents\":\n          - heading \"Legal documents\" [level=3]\n          - list:\n            - listitem:\n              - button \"Do Not Sell Or Share My Personal Information\"\n            - listitem:\n              - button \"Cookie and Ad Preferences\"\n            - listitem:\n              - link \"Privacy and Cookies Policy\":\n                - /url: https://www.zara.com/static/pdfs/US/privacy-policy/privacy-policy_en_US-20241209.html\n            - listitem:\n              - link \"Terms of use\":\n                - /url: https://static.zara.net/static/pdfs/US/terms-and-conditions/terms-and-conditions-en_US-20250829.pdf\n    - list:\n      - listitem\n      - listitem\n      - listitem\n      - listitem\n      - listitem\n      - listitem\n      - listitem\n      - listitem\n      - listitem\n      - listitem:\n        - text: THE NEW Scroll down\n        - heading \"Footer\" [level=2]\n        - link \"sign up for our newsletter\":\n          - /url: https://www.zara.com/us/en/z-newsletter-nl1400.html?v1=11110\n        - list:\n          - listitem:\n            - link \"Tiktok\":\n              - /url: https://www.tiktok.com/@zara\n          - listitem:\n            - link \"Instagram\":\n              - /url: https://www.instagram.com/zara/\n          - listitem:\n            - link \"Facebook\":\n              - /url: https://www.facebook.com/Zara\n          - listitem:\n            - link \"Pinterest\":\n              - /url: https://es.pinterest.com/zaraofficial\n          - listitem:\n            - link \"Youtube\":\n              - /url: http://www.youtube.com/user/zara\n          - listitem:\n            - link \"Spotify\":\n              - /url: https://open.spotify.com/user/r6ivwuv0ebk346hhxo446pbfv\n        - navigation \"Legal documents\":\n          - heading \"Legal documents\" [level=3]\n          - list:\n            - listitem:\n              - button \"Do Not Sell Or Share My Personal Information\"\n            - listitem:\n              - button \"Cookie and Ad Preferences\"\n            - listitem:\n              - link \"Privacy and Cookies Policy\":\n                - /url: https://www.zara.com/static/pdfs/US/privacy-policy/privacy-policy_en_US-20241209.html\n            - listitem:\n              - link \"Terms of use\":\n                - /url: https://static.zara.net/static/pdfs/US/terms-and-conditions/terms-and-conditions-en_US-20250829.pdf\n    - list:\n      - listitem:\n        - img \"Modern living room with black sofa, low table, bookshelf with books, plant, and large window. Picture on the wall and old radiator.\"\n      - listitem\n      - listitem\n      - listitem\n      - listitem\n      - listitem\n      - listitem\n      - listitem:\n        - text: THE NEW Scroll down\n        - heading \"Footer\" [level=2]\n        - link \"sign up for our newsletter\":\n          - /url: https://www.zara.com/us/en/z-newsletter-nl1400.html?v1=11110\n        - list:\n          - listitem:\n            - link \"Tiktok\":\n              - /url: https://www.tiktok.com/@zara\n          - listitem:\n            - link \"Instagram\":\n              - /url: https://www.instagram.com/zara/\n          - listitem:\n            - link \"Facebook\":\n              - /url: https://www.facebook.com/Zara\n          - listitem:\n            - link \"Pinterest\":\n              - /url: https://es.pinterest.com/zaraofficial\n          - listitem:\n            - link \"Youtube\":\n              - /url: http://www.youtube.com/user/zara\n          - listitem:\n            - link \"Spotify\":\n              - /url: https://open.spotify.com/user/r6ivwuv0ebk346hhxo446pbfv\n        - navigation \"Legal documents\":\n          - heading \"Legal documents\" [level=3]\n          - list:\n            - listitem:\n              - button \"Do Not Sell Or Share My Personal Information\"\n            - listitem:\n              - button \"Cookie and Ad Preferences\"\n            - listitem:\n              - link \"Privacy and Cookies Policy\":\n                - /url: https://www.zara.com/static/pdfs/US/privacy-policy/privacy-policy_en_US-20241209.html\n            - listitem:\n              - link \"Terms of use\":\n                - /url: https://static.zara.net/static/pdfs/US/terms-and-conditions/terms-and-conditions-en_US-20250829.pdf\n    - list:\n      - listitem\n      - listitem\n      - listitem\n      - listitem\n      - listitem:\n        - heading \"Footer\" [level=2]\n        - link \"sign up for our newsletter\":\n          - /url: https://www.zara.com/us/en/z-newsletter-nl1400.html?v1=11110\n        - list:\n          - listitem:\n            - link \"Tiktok\":\n              - /url: https://www.tiktok.com/@zara\n          - listitem:\n            - link \"Instagram\":\n              - /url: https://www.instagram.com/zara/\n          - listitem:\n            - link \"Facebook\":\n              - /url: https://www.facebook.com/Zara\n          - listitem:\n            - link \"Pinterest\":\n              - /url: https://es.pinterest.com/zaraofficial\n          - listitem:\n            - link \"Youtube\":\n              - /url: http://www.youtube.com/user/zara\n          - listitem:\n            - link \"Spotify\":\n              - /url: https://open.spotify.com/user/r6ivwuv0ebk346hhxo446pbfv\n        - navigation \"Legal documents\":\n          - heading \"Legal documents\" [level=3]\n          - list:\n            - listitem:\n              - button \"Do Not Sell Or Share My Personal Information\"\n            - listitem:\n              - button \"Cookie and Ad Preferences\"\n            - listitem:\n              - link \"Privacy and Cookies Policy\":\n                - /url: https://www.zara.com/static/pdfs/US/privacy-policy/privacy-policy_en_US-20241209.html\n            - listitem:\n              - link \"Terms of use\":\n                - /url: https://static.zara.net/static/pdfs/US/terms-and-conditions/terms-and-conditions-en_US-20250829.pdf\n    - list:\n      - listitem\n      - listitem\n      - listitem\n      - listitem\n      - listitem\n      - listitem\n      - listitem:\n        - text: VIEW ALL Scroll down\n        - heading \"Footer\" [level=2]\n        - link \"sign up for our newsletter\":\n          - /url: https://www.zara.com/us/en/z-newsletter-nl1400.html?v1=11110\n        - list:\n          - listitem:\n            - link \"Tiktok\":\n              - /url: https://www.tiktok.com/@zara\n          - listitem:\n            - link \"Instagram\":\n              - /url: https://www.instagram.com/zara/\n          - listitem:\n            - link \"Facebook\":\n              - /url: https://www.facebook.com/Zara\n          - listitem:\n            - link \"Pinterest\":\n              - /url: https://es.pinterest.com/zaraofficial\n          - listitem:\n            - link \"Youtube\":\n              - /url: http://www.youtube.com/user/zara\n          - listitem:\n            - link \"Spotify\":\n              - /url: https://open.spotify.com/user/r6ivwuv0ebk346hhxo446pbfv\n        - navigation \"Legal documents\":\n          - heading \"Legal documents\" [level=3]\n          - list:\n            - listitem:\n              - button \"Do Not Sell Or Share My Personal Information\"\n            - listitem:\n              - button \"Cookie and Ad Preferences\"\n            - listitem:\n              - link \"Privacy and Cookies Policy\":\n                - /url: https://www.zara.com/static/pdfs/US/privacy-policy/privacy-policy_en_US-20241209.html\n            - listitem:\n              - link \"Terms of use\":\n                - /url: https://static.zara.net/static/pdfs/US/terms-and-conditions/terms-and-conditions-en_US-20250829.pdf\n    - list:\n      - listitem\n      - listitem\n      - listitem\n      - listitem:\n        - heading \"Footer\" [level=2]\n        - link \"sign up for our newsletter\":\n          - /url: https://www.zara.com/us/en/z-newsletter-nl1400.html?v1=11110\n        - list:\n          - listitem:\n            - link \"Tiktok\":\n              - /url: https://www.tiktok.com/@zara\n          - listitem:\n            - link \"Instagram\":\n              - /url: https://www.instagram.com/zara/\n          - listitem:\n            - link \"Facebook\":\n              - /url: https://www.facebook.com/Zara\n          - listitem:\n            - link \"Pinterest\":\n              - /url: https://es.pinterest.com/zaraofficial\n          - listitem:\n            - link \"Youtube\":\n              - /url: http://www.youtube.com/user/zara\n          - listitem:\n            - link \"Spotify\":\n              - /url: https://open.spotify.com/user/r6ivwuv0ebk346hhxo446pbfv\n        - navigation \"Legal documents\":\n          - heading \"Legal documents\" [level=3]\n          - list:\n            - listitem:\n              - button \"Do Not Sell Or Share My Personal Information\"\n            - listitem:\n              - button \"Cookie and Ad Preferences\"\n            - listitem:\n              - link \"Privacy and Cookies Policy\":\n                - /url: https://www.zara.com/static/pdfs/US/privacy-policy/privacy-policy_en_US-20241209.html\n            - listitem:\n              - link \"Terms of use\":\n                - /url: https://static.zara.net/static/pdfs/US/terms-and-conditions/terms-and-conditions-en_US-20250829.pdf\n    - list:\n      - listitem\n      - listitem:\n        - heading \"Footer\" [level=2]\n        - link \"sign up for our newsletter\":\n          - /url: https://www.zara.com/us/en/z-newsletter-nl1400.html?v1=11110\n        - list:\n          - listitem:\n            - link \"Tiktok\":\n              - /url: https://www.tiktok.com/@zara\n          - listitem:\n            - link \"Instagram\":\n              - /url: https://www.instagram.com/zara/\n          - listitem:\n            - link \"Facebook\":\n              - /url: https://www.facebook.com/Zara\n          - listitem:\n            - link \"Pinterest\":\n              - /url: https://es.pinterest.com/zaraofficial\n          - listitem:\n            - link \"Youtube\":\n              - /url: http://www.youtube.com/user/zara\n          - listitem:\n            - link \"Spotify\":\n              - /url: https://open.spotify.com/user/r6ivwuv0ebk346hhxo446pbfv\n        - navigation \"Legal documents\":\n          - heading \"Legal documents\" [level=3]\n          - list:\n            - listitem:\n              - button \"Do Not Sell Or Share My Personal Information\"\n            - listitem:\n              - button \"Cookie and Ad Preferences\"\n            - listitem:\n              - link \"Privacy and Cookies Policy\":\n                - /url: https://www.zara.com/static/pdfs/US/privacy-policy/privacy-policy_en_US-20241209.html\n            - listitem:\n              - link \"Terms of use\":\n                - /url: https://static.zara.net/static/pdfs/US/terms-and-conditions/terms-and-conditions-en_US-20250829.pdf\n    - list:\n      - listitem:\n        - button \"Move to WOMAN\"\n      - listitem:\n        - button \"Move to KID\"\n- contentinfo\n- iframe"
  },
  {
    "step": 9,
    "timestamp": "2026-01-11T12:56:27.589933",
    "path": [
      "ZARA PRE-OWNED"
    ],
    "action": "clicked: ZARA PRE-OWNED",
    "url": "https://www.zara.com/us/",
    "new_buttons": [],
    "new_links": {
      "Go to homepage": "https://www.zara.com/us/",
      "LOG IN": "https://www.zara.com/us/en/logon",
      "Help": "https://www.zara.com/us/en/help-center",
      "GIFT CARD": "https://www.zara.com/us/en/z-giftcard-mkt1394.html",
      "CAREERS": "https://www.zara.com/us/en/work-with-us-mkt8081.html",
      "JOIN LIFE": "https://www.zara.com/us/en/z-join-life-mkt1399.html",
      "STORES": "https://www.zara.com/us/en/z-stores-st1404.html",
      "PERFUMES": "https://www.zara.com/us/en/woman-accessories-perfumes-l1017.html?v1=2419833",
      "MAKEUP": "https://www.zara.com/us/en/woman-beauty-makeup-l4414.html?v1=1881272",
      "ZARA HAIR": "https://www.zara.com/us/en/woman-hair-l7345.html?v1=2418886",
      "ABOUT": "https://www.zara.com/us/en/zara-travel-about-mkt15716.html",
      "REPAIR": "https://www.zara.com/us/en/preowned-repair-mkt5796.html",
      "SECOND HAND": "https://www.zara.com/us/en/preowned-resell-mkt5797.html",
      "DONATE": "https://www.zara.com/us/en/preowned-donate-mkt5798.html",
      "THE GUIDES": "https://www.zara.com/us/en/zara-travel-guide-mkt15717.html",
      "Youtube": "http://www.youtube.com/user/zara",
      "Spotify": "https://open.spotify.com/user/r6ivwuv0ebk346hhxo446pbfv"
    },
    "aria": "- link \"Skip to main content\":\n  - /url: \"#main\"\n- banner:\n  - button \"Close menu\"\n  - link \"Go to homepage\":\n    - /url: https://www.zara.com/us/\n  - list:\n    - listitem:\n      - link \"Search\":\n        - /url: https://www.zara.com/us/en/search/home\n    - listitem:\n      - link \"LOG IN\":\n        - /url: https://www.zara.com/us/en/logon\n    - listitem:\n      - link \"Help\":\n        - /url: https://www.zara.com/us/en/help-center\n    - listitem:\n      - link \"Cart empty\":\n        - /url: https://www.zara.com/us/en/shop/cart\n        - text: Shopping bag [\n        - status: \"0\"\n        - text: \"]\"\n- dialog \"Category Menu\":\n  - button \"Close menu\"\n  - link \"Go to homepage\":\n    - /url: https://www.zara.com/us/\n  - navigation:\n    - tablist \"Categories\":\n      - tab \"WOMAN\"\n      - tab \"MAN\"\n      - tab \"KIDS\"\n      - tab \"ZARA HOME\"\n      - tab \"BEAUTY\"\n      - tab \"MASSIMO DUTTI\"\n      - tab \"ZARA PRE-OWNED\" [selected]\n      - tab \"TRAVEL MODE\"\n    - tabpanel \"WOMAN\":\n      - list:\n        - listitem:\n          - button \"NEW COLLECTION\"\n        - listitem:\n          - button \"SALE\"\n        - listitem:\n          - link \"GIFT CARD\":\n            - /url: https://www.zara.com/us/en/z-giftcard-mkt1394.html\n        - listitem:\n          - button \"+ INFO\"\n        - listitem:\n          - link \"CAREERS\":\n            - /url: https://www.zara.com/us/en/work-with-us-mkt8081.html\n        - listitem: DOWNLOAD APP\n        - listitem:\n          - link \"JOIN LIFE\":\n            - /url: https://www.zara.com/us/en/z-join-life-mkt1399.html\n        - listitem:\n          - link \"STORES\":\n            - /url: https://www.zara.com/us/en/z-stores-st1404.html\n    - tabpanel \"MAN\":\n      - list:\n        - listitem:\n          - button \"NEW COLLECTION\"\n        - listitem:\n          - button \"SALE\"\n        - listitem:\n          - link \"GIFT CARD\":\n            - /url: https://www.zara.com/us/en/z-giftcard-mkt1394.html\n        - listitem: DOWNLOAD APP\n        - listitem:\n          - link \"STORES\":\n            - /url: https://www.zara.com/us/en/z-stores-st1404.html\n        - listitem:\n          - link \"JOIN LIFE\":\n            - /url: https://www.zara.com/us/en/z-join-life-mkt1399.html\n        - listitem: CAREERS\n        - listitem:\n          - button \"+ INFO\"\n    - tabpanel \"KIDS\":\n      - list:\n        - listitem:\n          - button \"NEW COLLECTION\"\n        - listitem:\n          - button \"SALE\"\n        - listitem:\n          - link \"GIFT CARD\":\n            - /url: https://www.zara.com/us/en/z-giftcard-mkt1394.html\n        - listitem: DOWNLOAD APP\n        - listitem:\n          - link \"STORES\":\n            - /url: https://www.zara.com/us/en/z-stores-st1404.html\n        - listitem: JOIN LIFE\n        - listitem: CAREERS\n        - listitem:\n          - button \"+ INFO\"\n    - tabpanel \"ZARA HOME\":\n      - list:\n        - listitem:\n          - button \"NEW COLLECTION\"\n        - listitem:\n          - button \"SALE\"\n        - listitem:\n          - link:\n            - /url: https://www.zara.com/us/en/zara-travel-guide-l15717.html?v1=2577013\n        - listitem:\n          - link \"GIFT CARD\":\n            - /url: https://www.zara.com/us/en/z-giftcard-mkt1394.html\n        - listitem:\n          - button \"+ INFO\"\n        - listitem: DOWNLOAD APP\n        - listitem:\n          - link \"JOIN LIFE\":\n            - /url: https://www.zara.com/us/en/z-join-life-mkt1399.html\n        - listitem:\n          - link \"CAREERS\":\n            - /url: https://www.zara.com/us/en/work-with-us-mkt8081.html\n        - listitem:\n          - link \"STORES\":\n            - /url: https://www.zara.com/us/en/z-stores-st1404.html\n        - listitem: RECALLED ITEMS\n    - tabpanel \"BEAUTY\":\n      - list:\n        - listitem:\n          - link \"PERFUMES\":\n            - /url: https://www.zara.com/us/en/woman-accessories-perfumes-l1017.html?v1=2419833\n            - paragraph: PERFUMES\n          - link \"MAKEUP\":\n            - /url: https://www.zara.com/us/en/woman-beauty-makeup-l4414.html?v1=1881272\n            - paragraph: MAKEUP\n          - link \"ZARA HAIR\":\n            - /url: https://www.zara.com/us/en/woman-hair-l7345.html?v1=2418886\n            - paragraph: ZARA HAIR\n        - listitem:\n          - button \"WOMAN\"\n        - listitem:\n          - button \"MAN\"\n        - listitem:\n          - button \"KIDS\"\n        - listitem:\n          - link:\n            - /url: https://www.zara.com/us/en/zara-travel-guide-l15717.html?v1=2577013\n        - listitem: DOWNLOAD APP\n        - listitem:\n          - link \"JOIN LIFE\":\n            - /url: https://www.zara.com/us/en/z-join-life-mkt1399.html\n        - listitem:\n          - button \"+ INFO\"\n    - tabpanel \"MASSIMO DUTTI\":\n      - list:\n        - listitem:\n          - button \"WOMAN\"\n        - listitem:\n          - button \"MAN\"\n    - tabpanel \"ZARA PRE-OWNED\":\n      - list:\n        - listitem:\n          - link \"ABOUT\":\n            - /url: https://www.zara.com/us/en/preowned-about-mkt5795.html\n        - listitem:\n          - link \"REPAIR\":\n            - /url: https://www.zara.com/us/en/preowned-repair-mkt5796.html\n        - listitem:\n          - link \"SECOND HAND\":\n            - /url: https://www.zara.com/us/en/preowned-resell-mkt5797.html\n        - listitem:\n          - link \"DONATE\":\n            - /url: https://www.zara.com/us/en/preowned-donate-mkt5798.html\n        - listitem:\n          - link \"JOIN LIFE\":\n            - /url: https://www.zara.com/us/en/z-join-life-mkt1399.html\n        - listitem:\n          - link \"CAREERS\":\n            - /url: https://www.zara.com/us/en/work-with-us-mkt8081.html\n        - listitem:\n          - link \"STORES\":\n            - /url: https://www.zara.com/us/en/z-stores-st1404.html\n    - tabpanel \"TRAVEL MODE\":\n      - list:\n        - listitem:\n          - link \"ABOUT\":\n            - /url: https://www.zara.com/us/en/zara-travel-about-mkt15716.html\n        - listitem:\n          - link \"THE GUIDES\":\n            - /url: https://www.zara.com/us/en/zara-travel-guide-mkt15717.html\n- main:\n  - heading \"ZARA United States | SALE\" [level=1]\n  - region \"Zara category carousel\":\n    - list:\n      - listitem\n      - listitem\n      - listitem\n      - listitem\n      - listitem\n      - listitem\n      - listitem\n      - listitem\n      - listitem:\n        - text: THE NEW Scroll down\n        - heading \"Footer\" [level=2]\n        - link \"sign up for our newsletter\":\n          - /url: https://www.zara.com/us/en/z-newsletter-nl1400.html?v1=11110\n        - list:\n          - listitem:\n            - link \"Tiktok\":\n              - /url: https://www.tiktok.com/@zara\n          - listitem:\n            - link \"Instagram\":\n              - /url: https://www.instagram.com/zara/\n          - listitem:\n            - link \"Facebook\":\n              - /url: https://www.facebook.com/Zara\n          - listitem:\n            - link \"Pinterest\":\n              - /url: https://es.pinterest.com/zaraofficial\n          - listitem:\n            - link \"Youtube\":\n              - /url: http://www.youtube.com/user/zara\n          - listitem:\n            - link \"Spotify\":\n              - /url: https://open.spotify.com/user/r6ivwuv0ebk346hhxo446pbfv\n        - navigation \"Legal documents\":\n          - heading \"Legal documents\" [level=3]\n          - list:\n            - listitem:\n              - button \"Cookies settings\"\n            - listitem:\n              - button \"Cookie and Ad Preferences\"\n            - listitem:\n              - link \"Privacy and Cookies Policy\":\n                - /url: https://www.zara.com/static/pdfs/US/privacy-policy/privacy-policy_en_US-20241209.html\n            - listitem:\n              - link \"Terms of use\":\n                - /url: https://static.zara.net/static/pdfs/US/terms-and-conditions/terms-and-conditions-en_US-20250829.pdf\n    - list:\n      - listitem\n      - listitem\n      - listitem\n      - listitem\n      - listitem\n      - listitem\n      - listitem:\n        - text: THE NEW Scroll down\n        - heading \"Footer\" [level=2]\n        - link \"sign up for our newsletter\":\n          - /url: https://www.zara.com/us/en/z-newsletter-nl1400.html?v1=11110\n        - list:\n          - listitem:\n            - link \"Tiktok\":\n              - /url: https://www.tiktok.com/@zara\n          - listitem:\n            - link \"Instagram\":\n              - /url: https://www.instagram.com/zara/\n          - listitem:\n            - link \"Facebook\":\n              - /url: https://www.facebook.com/Zara\n          - listitem:\n            - link \"Pinterest\":\n              - /url: https://es.pinterest.com/zaraofficial\n          - listitem:\n            - link \"Youtube\":\n              - /url: http://www.youtube.com/user/zara\n          - listitem:\n            - link \"Spotify\":\n              - /url: https://open.spotify.com/user/r6ivwuv0ebk346hhxo446pbfv\n        - navigation \"Legal documents\":\n          - heading \"Legal documents\" [level=3]\n          - list:\n            - listitem:\n              - button \"Cookies settings\"\n            - listitem:\n              - button \"Cookie and Ad Preferences\"\n            - listitem:\n              - link \"Privacy and Cookies Policy\":\n                - /url: https://www.zara.com/static/pdfs/US/privacy-policy/privacy-policy_en_US-20241209.html\n            - listitem:\n              - link \"Terms of use\":\n                - /url: https://static.zara.net/static/pdfs/US/terms-and-conditions/terms-and-conditions-en_US-20250829.pdf\n    - list:\n      - listitem\n      - listitem\n      - listitem\n      - listitem\n      - listitem\n      - listitem\n      - listitem\n      - listitem\n      - listitem\n      - listitem:\n        - text: THE NEW Scroll down\n        - heading \"Footer\" [level=2]\n        - link \"sign up for our newsletter\":\n          - /url: https://www.zara.com/us/en/z-newsletter-nl1400.html?v1=11110\n        - list:\n          - listitem:\n            - link \"Tiktok\":\n              - /url: https://www.tiktok.com/@zara\n          - listitem:\n            - link \"Instagram\":\n              - /url: https://www.instagram.com/zara/\n          - listitem:\n            - link \"Facebook\":\n              - /url: https://www.facebook.com/Zara\n          - listitem:\n            - link \"Pinterest\":\n              - /url: https://es.pinterest.com/zaraofficial\n          - listitem:\n            - link \"Youtube\":\n              - /url: http://www.youtube.com/user/zara\n          - listitem:\n            - link \"Spotify\":\n              - /url: https://open.spotify.com/user/r6ivwuv0ebk346hhxo446pbfv\n        - navigation \"Legal documents\":\n          - heading \"Legal documents\" [level=3]\n          - list:\n            - listitem:\n              - button \"Cookies settings\"\n            - listitem:\n              - button \"Cookie and Ad Preferences\"\n            - listitem:\n              - link \"Privacy and Cookies Policy\":\n                - /url: https://www.zara.com/static/pdfs/US/privacy-policy/privacy-policy_en_US-20241209.html\n            - listitem:\n              - link \"Terms of use\":\n                - /url: https://static.zara.net/static/pdfs/US/terms-and-conditions/terms-and-conditions-en_US-20250829.pdf\n    - list:\n      - listitem:\n        - img \"Modern living room with black sofa, low table, bookshelf with books, plant, and large window. Picture on the wall and old radiator.\"\n      - listitem\n      - listitem\n      - listitem\n      - listitem\n      - listitem\n      - listitem\n      - listitem:\n        - text: THE NEW Scroll down\n        - heading \"Footer\" [level=2]\n        - link \"sign up for our newsletter\":\n          - /url: https://www.zara.com/us/en/z-newsletter-nl1400.html?v1=11110\n        - list:\n          - listitem:\n            - link \"Tiktok\":\n              - /url: https://www.tiktok.com/@zara\n          - listitem:\n            - link \"Instagram\":\n              - /url: https://www.instagram.com/zara/\n          - listitem:\n            - link \"Facebook\":\n              - /url: https://www.facebook.com/Zara\n          - listitem:\n            - link \"Pinterest\":\n              - /url: https://es.pinterest.com/zaraofficial\n          - listitem:\n            - link \"Youtube\":\n              - /url: http://www.youtube.com/user/zara\n          - listitem:\n            - link \"Spotify\":\n              - /url: https://open.spotify.com/user/r6ivwuv0ebk346hhxo446pbfv\n        - navigation \"Legal documents\":\n          - heading \"Legal documents\" [level=3]\n          - list:\n            - listitem:\n              - button \"Cookies settings\"\n            - listitem:\n              - button \"Cookie and Ad Preferences\"\n            - listitem:\n              - link \"Privacy and Cookies Policy\":\n                - /url: https://www.zara.com/static/pdfs/US/privacy-policy/privacy-policy_en_US-20241209.html\n            - listitem:\n              - link \"Terms of use\":\n                - /url: https://static.zara.net/static/pdfs/US/terms-and-conditions/terms-and-conditions-en_US-20250829.pdf\n    - list:\n      - listitem\n      - listitem\n      - listitem\n      - listitem\n      - listitem:\n        - heading \"Footer\" [level=2]\n        - link \"sign up for our newsletter\":\n          - /url: https://www.zara.com/us/en/z-newsletter-nl1400.html?v1=11110\n        - list:\n          - listitem:\n            - link \"Tiktok\":\n              - /url: https://www.tiktok.com/@zara\n          - listitem:\n            - link \"Instagram\":\n              - /url: https://www.instagram.com/zara/\n          - listitem:\n            - link \"Facebook\":\n              - /url: https://www.facebook.com/Zara\n          - listitem:\n            - link \"Pinterest\":\n              - /url: https://es.pinterest.com/zaraofficial\n          - listitem:\n            - link \"Youtube\":\n              - /url: http://www.youtube.com/user/zara\n          - listitem:\n            - link \"Spotify\":\n              - /url: https://open.spotify.com/user/r6ivwuv0ebk346hhxo446pbfv\n        - navigation \"Legal documents\":\n          - heading \"Legal documents\" [level=3]\n          - list:\n            - listitem:\n              - button \"Cookies settings\"\n            - listitem:\n              - button \"Cookie and Ad Preferences\"\n            - listitem:\n              - link \"Privacy and Cookies Policy\":\n                - /url: https://www.zara.com/static/pdfs/US/privacy-policy/privacy-policy_en_US-20241209.html\n            - listitem:\n              - link \"Terms of use\":\n                - /url: https://static.zara.net/static/pdfs/US/terms-and-conditions/terms-and-conditions-en_US-20250829.pdf\n    - list:\n      - listitem:\n        - img \"Brown bottle with the inscription \\\"WHIPPED COFFEE\\\" in white letters, on a soft beige background.\"\n      - listitem\n      - listitem\n      - listitem\n      - listitem\n      - listitem\n      - listitem:\n        - text: VIEW ALL Scroll down\n        - heading \"Footer\" [level=2]\n        - link \"sign up for our newsletter\":\n          - /url: https://www.zara.com/us/en/z-newsletter-nl1400.html?v1=11110\n        - list:\n          - listitem:\n            - link \"Tiktok\":\n              - /url: https://www.tiktok.com/@zara\n          - listitem:\n            - link \"Instagram\":\n              - /url: https://www.instagram.com/zara/\n          - listitem:\n            - link \"Facebook\":\n              - /url: https://www.facebook.com/Zara\n          - listitem:\n            - link \"Pinterest\":\n              - /url: https://es.pinterest.com/zaraofficial\n          - listitem:\n            - link \"Youtube\":\n              - /url: http://www.youtube.com/user/zara\n          - listitem:\n            - link \"Spotify\":\n              - /url: https://open.spotify.com/user/r6ivwuv0ebk346hhxo446pbfv\n        - navigation \"Legal documents\":\n          - heading \"Legal documents\" [level=3]\n          - list:\n            - listitem:\n              - button \"Cookies settings\"\n            - listitem:\n              - button \"Cookie and Ad Preferences\"\n            - listitem:\n              - link \"Privacy and Cookies Policy\":\n                - /url: https://www.zara.com/static/pdfs/US/privacy-policy/privacy-policy_en_US-20241209.html\n            - listitem:\n              - link \"Terms of use\":\n                - /url: https://static.zara.net/static/pdfs/US/terms-and-conditions/terms-and-conditions-en_US-20250829.pdf\n    - list:\n      - listitem:\n        - img \"Short-haired model wears a long black dress and velvet jacket in a minimalist space with a concrete floor.\"\n      - listitem\n      - listitem\n      - listitem:\n        - heading \"Footer\" [level=2]\n        - link \"sign up for our newsletter\":\n          - /url: https://www.zara.com/us/en/z-newsletter-nl1400.html?v1=11110\n        - list:\n          - listitem:\n            - link \"Tiktok\":\n              - /url: https://www.tiktok.com/@zara\n          - listitem:\n            - link \"Instagram\":\n              - /url: https://www.instagram.com/zara/\n          - listitem:\n            - link \"Facebook\":\n              - /url: https://www.facebook.com/Zara\n          - listitem:\n            - link \"Pinterest\":\n              - /url: https://es.pinterest.com/zaraofficial\n          - listitem:\n            - link \"Youtube\":\n              - /url: http://www.youtube.com/user/zara\n          - listitem:\n            - link \"Spotify\":\n              - /url: https://open.spotify.com/user/r6ivwuv0ebk346hhxo446pbfv\n        - navigation \"Legal documents\":\n          - heading \"Legal documents\" [level=3]\n          - list:\n            - listitem:\n              - button \"Cookies settings\"\n            - listitem:\n              - button \"Cookie and Ad Preferences\"\n            - listitem:\n              - link \"Privacy and Cookies Policy\":\n                - /url: https://www.zara.com/static/pdfs/US/privacy-policy/privacy-policy_en_US-20241209.html\n            - listitem:\n              - link \"Terms of use\":\n                - /url: https://static.zara.net/static/pdfs/US/terms-and-conditions/terms-and-conditions-en_US-20250829.pdf\n    - list:\n      - listitem\n      - listitem:\n        - heading \"Footer\" [level=2]\n        - link \"sign up for our newsletter\":\n          - /url: https://www.zara.com/us/en/z-newsletter-nl1400.html?v1=11110\n        - list:\n          - listitem:\n            - link \"Tiktok\":\n              - /url: https://www.tiktok.com/@zara\n          - listitem:\n            - link \"Instagram\":\n              - /url: https://www.instagram.com/zara/\n          - listitem:\n            - link \"Facebook\":\n              - /url: https://www.facebook.com/Zara\n          - listitem:\n            - link \"Pinterest\":\n              - /url: https://es.pinterest.com/zaraofficial\n          - listitem:\n            - link \"Youtube\":\n              - /url: http://www.youtube.com/user/zara\n          - listitem:\n            - link \"Spotify\":\n              - /url: https://open.spotify.com/user/r6ivwuv0ebk346hhxo446pbfv\n        - navigation \"Legal documents\":\n          - heading \"Legal documents\" [level=3]\n          - list:\n            - listitem:\n              - button \"Cookies settings\"\n            - listitem:\n              - button \"Cookie and Ad Preferences\"\n            - listitem:\n              - link \"Privacy and Cookies Policy\":\n                - /url: https://www.zara.com/static/pdfs/US/privacy-policy/privacy-policy_en_US-20241209.html\n            - listitem:\n              - link \"Terms of use\":\n                - /url: https://static.zara.net/static/pdfs/US/terms-and-conditions/terms-and-conditions-en_US-20250829.pdf\n    - list:\n      - listitem:\n        - button \"Move to BEAUTY\"\n      - listitem:\n        - button \"Move to TRAVEL\"\n- contentinfo\n- iframe"
  },
  {
    "step": 10,
    "timestamp": "2026-01-11T12:56:31.788052",
    "path": [
      "TRAVEL MODE"
    ],
    "action": "clicked: TRAVEL MODE",
    "url": "https://www.zara.com/us/en/-c2577013.html?regionGroupId=41",
    "new_buttons": [],
    "new_links": {
      "Go to homepage": "https://www.zara.com/us/",
      "LOG IN": "https://www.zara.com/us/en/logon",
      "Help": "https://www.zara.com/us/en/help-center",
      "GIFT CARD": "https://www.zara.com/us/en/z-giftcard-mkt1394.html",
      "CAREERS": "https://www.zara.com/us/en/work-with-us-mkt8081.html",
      "JOIN LIFE": "https://www.zara.com/us/en/z-join-life-mkt1399.html",
      "STORES": "https://www.zara.com/us/en/z-stores-st1404.html",
      "PERFUMES": "https://www.zara.com/us/en/woman-accessories-perfumes-l1017.html?v1=2419833",
      "MAKEUP": "https://www.zara.com/us/en/woman-beauty-makeup-l4414.html?v1=1881272",
      "ZARA HAIR": "https://www.zara.com/us/en/woman-hair-l7345.html?v1=2418886",
      "ABOUT": "https://www.zara.com/us/en/zara-travel-about-mkt15716.html",
      "REPAIR": "https://www.zara.com/us/en/preowned-repair-mkt5796.html",
      "SECOND HAND": "https://www.zara.com/us/en/preowned-resell-mkt5797.html",
      "DONATE": "https://www.zara.com/us/en/preowned-donate-mkt5798.html",
      "THE GUIDES": "https://www.zara.com/us/en/zara-travel-guide-mkt15717.html",
      "Youtube": "http://www.youtube.com/user/zara",
      "Spotify": "https://open.spotify.com/user/r6ivwuv0ebk346hhxo446pbfv"
    },
    "aria": "- link \"Skip to main content\":\n  - /url: \"#main\"\n- banner:\n  - button \"Close menu\"\n  - link \"Go to homepage\":\n    - /url: https://www.zara.com/us/\n  - list:\n    - listitem:\n      - link \"Search\":\n        - /url: https://www.zara.com/us/en/search/home\n    - listitem:\n      - link \"LOG IN\":\n        - /url: https://www.zara.com/us/en/logon\n    - listitem:\n      - link \"Help\":\n        - /url: https://www.zara.com/us/en/help-center\n    - listitem:\n      - link \"Cart empty\":\n        - /url: https://www.zara.com/us/en/shop/cart\n        - text: Shopping bag [\n        - status: \"0\"\n        - text: \"]\"\n- dialog \"Category Menu\":\n  - button \"Close menu\"\n  - link \"Go to homepage\":\n    - /url: https://www.zara.com/us/\n  - navigation:\n    - tablist \"Categories\":\n      - tab \"WOMAN\" [selected]\n      - tab \"MAN\"\n      - tab \"KIDS\"\n      - tab \"ZARA HOME\"\n      - tab \"BEAUTY\"\n      - tab \"MASSIMO DUTTI\"\n      - tab \"ZARA PRE-OWNED\"\n      - tab \"TRAVEL MODE\"\n    - tabpanel \"WOMAN\":\n      - list:\n        - listitem:\n          - button \"NEW COLLECTION\"\n        - listitem:\n          - button \"SALE\" [expanded]:\n            - text: SALE\n            - img\n        - listitem:\n          - link \"GIFT CARD\":\n            - /url: https://www.zara.com/us/en/z-giftcard-mkt1394.html\n        - listitem:\n          - button \"+ INFO\"\n        - listitem:\n          - link \"CAREERS\":\n            - /url: https://www.zara.com/us/en/work-with-us-mkt8081.html\n        - listitem: DOWNLOAD APP\n        - listitem:\n          - link \"JOIN LIFE\":\n            - /url: https://www.zara.com/us/en/z-join-life-mkt1399.html\n        - listitem:\n          - link \"STORES\":\n            - /url: https://www.zara.com/us/en/z-stores-st1404.html\n    - tabpanel \"MAN\":\n      - list:\n        - listitem:\n          - button \"NEW COLLECTION\"\n        - listitem:\n          - button \"SALE\"\n        - listitem:\n          - link \"GIFT CARD\":\n            - /url: https://www.zara.com/us/en/z-giftcard-mkt1394.html\n        - listitem: DOWNLOAD APP\n        - listitem:\n          - link \"STORES\":\n            - /url: https://www.zara.com/us/en/z-stores-st1404.html\n        - listitem:\n          - link \"JOIN LIFE\":\n            - /url: https://www.zara.com/us/en/z-join-life-mkt1399.html\n        - listitem: CAREERS\n        - listitem:\n          - button \"+ INFO\"\n    - tabpanel \"KIDS\":\n      - list:\n        - listitem:\n          - button \"NEW COLLECTION\"\n        - listitem:\n          - button \"SALE\"\n        - listitem:\n          - link \"GIFT CARD\":\n            - /url: https://www.zara.com/us/en/z-giftcard-mkt1394.html\n        - listitem: DOWNLOAD APP\n        - listitem:\n          - link \"STORES\":\n            - /url: https://www.zara.com/us/en/z-stores-st1404.html\n        - listitem: JOIN LIFE\n        - listitem: CAREERS\n        - listitem:\n          - button \"+ INFO\"\n    - tabpanel \"ZARA HOME\":\n      - list:\n        - listitem:\n          - button \"NEW COLLECTION\"\n        - listitem:\n          - button \"SALE\"\n        - listitem:\n          - link:\n            - /url: https://www.zara.com/us/en/zara-travel-guide-l15717.html?v1=2577013\n        - listitem:\n          - link \"GIFT CARD\":\n            - /url: https://www.zara.com/us/en/z-giftcard-mkt1394.html\n        - listitem:\n          - button \"+ INFO\"\n        - listitem: DOWNLOAD APP\n        - listitem:\n          - link \"JOIN LIFE\":\n            - /url: https://www.zara.com/us/en/z-join-life-mkt1399.html\n        - listitem:\n          - link \"CAREERS\":\n            - /url: https://www.zara.com/us/en/work-with-us-mkt8081.html\n        - listitem:\n          - link \"STORES\":\n            - /url: https://www.zara.com/us/en/z-stores-st1404.html\n        - listitem: RECALLED ITEMS\n    - tabpanel \"BEAUTY\":\n      - list:\n        - listitem:\n          - link \"PERFUMES\":\n            - /url: https://www.zara.com/us/en/woman-accessories-perfumes-l1017.html?v1=2419833\n            - paragraph: PERFUMES\n          - link \"MAKEUP\":\n            - /url: https://www.zara.com/us/en/woman-beauty-makeup-l4414.html?v1=1881272\n            - paragraph: MAKEUP\n          - link \"ZARA HAIR\":\n            - /url: https://www.zara.com/us/en/woman-hair-l7345.html?v1=2418886\n            - paragraph: ZARA HAIR\n        - listitem:\n          - button \"WOMAN\"\n        - listitem:\n          - button \"MAN\"\n        - listitem:\n          - button \"KIDS\"\n        - listitem:\n          - link:\n            - /url: https://www.zara.com/us/en/zara-travel-guide-l15717.html?v1=2577013\n        - listitem: DOWNLOAD APP\n        - listitem:\n          - link \"JOIN LIFE\":\n            - /url: https://www.zara.com/us/en/z-join-life-mkt1399.html\n        - listitem:\n          - button \"+ INFO\"\n    - tabpanel \"MASSIMO DUTTI\":\n      - list:\n        - listitem:\n          - button \"WOMAN\"\n        - listitem:\n          - button \"MAN\"\n    - tabpanel \"ZARA PRE-OWNED\":\n      - list:\n        - listitem:\n          - link \"ABOUT\":\n            - /url: https://www.zara.com/us/en/preowned-about-mkt5795.html\n        - listitem:\n          - link \"REPAIR\":\n            - /url: https://www.zara.com/us/en/preowned-repair-mkt5796.html\n        - listitem:\n          - link \"SECOND HAND\":\n            - /url: https://www.zara.com/us/en/preowned-resell-mkt5797.html\n        - listitem:\n          - link \"DONATE\":\n            - /url: https://www.zara.com/us/en/preowned-donate-mkt5798.html\n        - listitem:\n          - link \"JOIN LIFE\":\n            - /url: https://www.zara.com/us/en/z-join-life-mkt1399.html\n        - listitem:\n          - link \"CAREERS\":\n            - /url: https://www.zara.com/us/en/work-with-us-mkt8081.html\n        - listitem:\n          - link \"STORES\":\n            - /url: https://www.zara.com/us/en/z-stores-st1404.html\n    - tabpanel \"TRAVEL MODE\":\n      - list:\n        - listitem:\n          - link \"ABOUT\":\n            - /url: https://www.zara.com/us/en/zara-travel-about-mkt15716.html\n        - listitem:\n          - link \"THE GUIDES\":\n            - /url: https://www.zara.com/us/en/zara-travel-guide-mkt15717.html\n- main:\n  - heading \"ZARA United States | SALE\" [level=1]\n  - region \"Zara category carousel\":\n    - list:\n      - listitem\n      - listitem\n      - listitem\n      - listitem\n      - listitem\n      - listitem\n      - listitem\n      - listitem\n      - listitem:\n        - text: THE NEW Scroll down\n        - heading \"Footer\" [level=2]\n        - link \"sign up for our newsletter\":\n          - /url: https://www.zara.com/us/en/z-newsletter-nl1400.html?v1=11110\n        - list:\n          - listitem:\n            - link \"Tiktok\":\n              - /url: https://www.tiktok.com/@zara\n          - listitem:\n            - link \"Instagram\":\n              - /url: https://www.instagram.com/zara/\n          - listitem:\n            - link \"Facebook\":\n              - /url: https://www.facebook.com/Zara\n          - listitem:\n            - link \"Pinterest\":\n              - /url: https://es.pinterest.com/zaraofficial\n          - listitem:\n            - link \"Youtube\":\n              - /url: http://www.youtube.com/user/zara\n          - listitem:\n            - link \"Spotify\":\n              - /url: https://open.spotify.com/user/r6ivwuv0ebk346hhxo446pbfv\n        - navigation \"Legal documents\":\n          - heading \"Legal documents\" [level=3]\n          - list:\n            - listitem:\n              - button \"Do Not Sell Or Share My Personal Information\"\n            - listitem:\n              - button \"Cookie and Ad Preferences\"\n            - listitem:\n              - link \"Privacy and Cookies Policy\":\n                - /url: https://www.zara.com/static/pdfs/US/privacy-policy/privacy-policy_en_US-20241209.html\n            - listitem:\n              - link \"Terms of use\":\n                - /url: https://static.zara.net/static/pdfs/US/terms-and-conditions/terms-and-conditions-en_US-20250829.pdf\n    - list:\n      - listitem\n      - listitem\n      - listitem\n      - listitem\n      - listitem\n      - listitem\n      - listitem:\n        - text: THE NEW Scroll down\n        - heading \"Footer\" [level=2]\n        - link \"sign up for our newsletter\":\n          - /url: https://www.zara.com/us/en/z-newsletter-nl1400.html?v1=11110\n        - list:\n          - listitem:\n            - link \"Tiktok\":\n              - /url: https://www.tiktok.com/@zara\n          - listitem:\n            - link \"Instagram\":\n              - /url: https://www.instagram.com/zara/\n          - listitem:\n            - link \"Facebook\":\n              - /url: https://www.facebook.com/Zara\n          - listitem:\n            - link \"Pinterest\":\n              - /url: https://es.pinterest.com/zaraofficial\n          - listitem:\n            - link \"Youtube\":\n              - /url: http://www.youtube.com/user/zara\n          - listitem:\n            - link \"Spotify\":\n              - /url: https://open.spotify.com/user/r6ivwuv0ebk346hhxo446pbfv\n        - navigation \"Legal documents\":\n          - heading \"Legal documents\" [level=3]\n          - list:\n            - listitem:\n              - button \"Do Not Sell Or Share My Personal Information\"\n            - listitem:\n              - button \"Cookie and Ad Preferences\"\n            - listitem:\n              - link \"Privacy and Cookies Policy\":\n                - /url: https://www.zara.com/static/pdfs/US/privacy-policy/privacy-policy_en_US-20241209.html\n            - listitem:\n              - link \"Terms of use\":\n                - /url: https://static.zara.net/static/pdfs/US/terms-and-conditions/terms-and-conditions-en_US-20250829.pdf\n    - list:\n      - listitem\n      - listitem\n      - listitem\n      - listitem\n      - listitem\n      - listitem\n      - listitem\n      - listitem\n      - listitem\n      - listitem:\n        - text: THE NEW Scroll down\n        - heading \"Footer\" [level=2]\n        - link \"sign up for our newsletter\":\n          - /url: https://www.zara.com/us/en/z-newsletter-nl1400.html?v1=11110\n        - list:\n          - listitem:\n            - link \"Tiktok\":\n              - /url: https://www.tiktok.com/@zara\n          - listitem:\n            - link \"Instagram\":\n              - /url: https://www.instagram.com/zara/\n          - listitem:\n            - link \"Facebook\":\n              - /url: https://www.facebook.com/Zara\n          - listitem:\n            - link \"Pinterest\":\n              - /url: https://es.pinterest.com/zaraofficial\n          - listitem:\n            - link \"Youtube\":\n              - /url: http://www.youtube.com/user/zara\n          - listitem:\n            - link \"Spotify\":\n              - /url: https://open.spotify.com/user/r6ivwuv0ebk346hhxo446pbfv\n        - navigation \"Legal documents\":\n          - heading \"Legal documents\" [level=3]\n          - list:\n            - listitem:\n              - button \"Do Not Sell Or Share My Personal Information\"\n            - listitem:\n              - button \"Cookie and Ad Preferences\"\n            - listitem:\n              - link \"Privacy and Cookies Policy\":\n                - /url: https://www.zara.com/static/pdfs/US/privacy-policy/privacy-policy_en_US-20241209.html\n            - listitem:\n              - link \"Terms of use\":\n                - /url: https://static.zara.net/static/pdfs/US/terms-and-conditions/terms-and-conditions-en_US-20250829.pdf\n    - list:\n      - listitem\n      - listitem\n      - listitem\n      - listitem\n      - listitem\n      - listitem\n      - listitem\n      - listitem:\n        - text: THE NEW Scroll down\n        - heading \"Footer\" [level=2]\n        - link \"sign up for our newsletter\":\n          - /url: https://www.zara.com/us/en/z-newsletter-nl1400.html?v1=11110\n        - list:\n          - listitem:\n            - link \"Tiktok\":\n              - /url: https://www.tiktok.com/@zara\n          - listitem:\n            - link \"Instagram\":\n              - /url: https://www.instagram.com/zara/\n          - listitem:\n            - link \"Facebook\":\n              - /url: https://www.facebook.com/Zara\n          - listitem:\n            - link \"Pinterest\":\n              - /url: https://es.pinterest.com/zaraofficial\n          - listitem:\n            - link \"Youtube\":\n              - /url: http://www.youtube.com/user/zara\n          - listitem:\n            - link \"Spotify\":\n              - /url: https://open.spotify.com/user/r6ivwuv0ebk346hhxo446pbfv\n        - navigation \"Legal documents\":\n          - heading \"Legal documents\" [level=3]\n          - list:\n            - listitem:\n              - button \"Do Not Sell Or Share My Personal Information\"\n            - listitem:\n              - button \"Cookie and Ad Preferences\"\n            - listitem:\n              - link \"Privacy and Cookies Policy\":\n                - /url: https://www.zara.com/static/pdfs/US/privacy-policy/privacy-policy_en_US-20241209.html\n            - listitem:\n              - link \"Terms of use\":\n                - /url: https://static.zara.net/static/pdfs/US/terms-and-conditions/terms-and-conditions-en_US-20250829.pdf\n    - list:\n      - listitem\n      - listitem\n      - listitem\n      - listitem\n      - listitem:\n        - heading \"Footer\" [level=2]\n        - link \"sign up for our newsletter\":\n          - /url: https://www.zara.com/us/en/z-newsletter-nl1400.html?v1=11110\n        - list:\n          - listitem:\n            - link \"Tiktok\":\n              - /url: https://www.tiktok.com/@zara\n          - listitem:\n            - link \"Instagram\":\n              - /url: https://www.instagram.com/zara/\n          - listitem:\n            - link \"Facebook\":\n              - /url: https://www.facebook.com/Zara\n          - listitem:\n            - link \"Pinterest\":\n              - /url: https://es.pinterest.com/zaraofficial\n          - listitem:\n            - link \"Youtube\":\n              - /url: http://www.youtube.com/user/zara\n          - listitem:\n            - link \"Spotify\":\n              - /url: https://open.spotify.com/user/r6ivwuv0ebk346hhxo446pbfv\n        - navigation \"Legal documents\":\n          - heading \"Legal documents\" [level=3]\n          - list:\n            - listitem:\n              - button \"Do Not Sell Or Share My Personal Information\"\n            - listitem:\n              - button \"Cookie and Ad Preferences\"\n            - listitem:\n              - link \"Privacy and Cookies Policy\":\n                - /url: https://www.zara.com/static/pdfs/US/privacy-policy/privacy-policy_en_US-20241209.html\n            - listitem:\n              - link \"Terms of use\":\n                - /url: https://static.zara.net/static/pdfs/US/terms-and-conditions/terms-and-conditions-en_US-20250829.pdf\n    - list:\n      - listitem\n      - listitem\n      - listitem\n      - listitem\n      - listitem\n      - listitem\n      - listitem:\n        - text: VIEW ALL Scroll down\n        - heading \"Footer\" [level=2]\n        - link \"sign up for our newsletter\":\n          - /url: https://www.zara.com/us/en/z-newsletter-nl1400.html?v1=11110\n        - list:\n          - listitem:\n            - link \"Tiktok\":\n              - /url: https://www.tiktok.com/@zara\n          - listitem:\n            - link \"Instagram\":\n              - /url: https://www.instagram.com/zara/\n          - listitem:\n            - link \"Facebook\":\n              - /url: https://www.facebook.com/Zara\n          - listitem:\n            - link \"Pinterest\":\n              - /url: https://es.pinterest.com/zaraofficial\n          - listitem:\n            - link \"Youtube\":\n              - /url: http://www.youtube.com/user/zara\n          - listitem:\n            - link \"Spotify\":\n              - /url: https://open.spotify.com/user/r6ivwuv0ebk346hhxo446pbfv\n        - navigation \"Legal documents\":\n          - heading \"Legal documents\" [level=3]\n          - list:\n            - listitem:\n              - button \"Do Not Sell Or Share My Personal Information\"\n            - listitem:\n              - button \"Cookie and Ad Preferences\"\n            - listitem:\n              - link \"Privacy and Cookies Policy\":\n                - /url: https://www.zara.com/static/pdfs/US/privacy-policy/privacy-policy_en_US-20241209.html\n            - listitem:\n              - link \"Terms of use\":\n                - /url: https://static.zara.net/static/pdfs/US/terms-and-conditions/terms-and-conditions-en_US-20250829.pdf\n    - list:\n      - listitem\n      - listitem\n      - listitem\n      - listitem:\n        - heading \"Footer\" [level=2]\n        - link \"sign up for our newsletter\":\n          - /url: https://www.zara.com/us/en/z-newsletter-nl1400.html?v1=11110\n        - list:\n          - listitem:\n            - link \"Tiktok\":\n              - /url: https://www.tiktok.com/@zara\n          - listitem:\n            - link \"Instagram\":\n              - /url: https://www.instagram.com/zara/\n          - listitem:\n            - link \"Facebook\":\n              - /url: https://www.facebook.com/Zara\n          - listitem:\n            - link \"Pinterest\":\n              - /url: https://es.pinterest.com/zaraofficial\n          - listitem:\n            - link \"Youtube\":\n              - /url: http://www.youtube.com/user/zara\n          - listitem:\n            - link \"Spotify\":\n              - /url: https://open.spotify.com/user/r6ivwuv0ebk346hhxo446pbfv\n        - navigation \"Legal documents\":\n          - heading \"Legal documents\" [level=3]\n          - list:\n            - listitem:\n              - button \"Do Not Sell Or Share My Personal Information\"\n            - listitem:\n              - button \"Cookie and Ad Preferences\"\n            - listitem:\n              - link \"Privacy and Cookies Policy\":\n                - /url: https://www.zara.com/static/pdfs/US/privacy-policy/privacy-policy_en_US-20241209.html\n            - listitem:\n              - link \"Terms of use\":\n                - /url: https://static.zara.net/static/pdfs/US/terms-and-conditions/terms-and-conditions-en_US-20250829.pdf\n    - list:\n      - listitem\n      - listitem:\n        - heading \"Footer\" [level=2]\n        - link \"sign up for our newsletter\":\n          - /url: https://www.zara.com/us/en/z-newsletter-nl1400.html?v1=11110\n        - list:\n          - listitem:\n            - link \"Tiktok\":\n              - /url: https://www.tiktok.com/@zara\n          - listitem:\n            - link \"Instagram\":\n              - /url: https://www.instagram.com/zara/\n          - listitem:\n            - link \"Facebook\":\n              - /url: https://www.facebook.com/Zara\n          - listitem:\n            - link \"Pinterest\":\n              - /url: https://es.pinterest.com/zaraofficial\n          - listitem:\n            - link \"Youtube\":\n              - /url: http://www.youtube.com/user/zara\n          - listitem:\n            - link \"Spotify\":\n              - /url: https://open.spotify.com/user/r6ivwuv0ebk346hhxo446pbfv\n        - navigation \"Legal documents\":\n          - heading \"Legal documents\" [level=3]\n          - list:\n            - listitem:\n              - button \"Do Not Sell Or Share My Personal Information\"\n            - listitem:\n              - button \"Cookie and Ad Preferences\"\n            - listitem:\n              - link \"Privacy and Cookies Policy\":\n                - /url: https://www.zara.com/static/pdfs/US/privacy-policy/privacy-policy_en_US-20241209.html\n            - listitem:\n              - link \"Terms of use\":\n                - /url: https://static.zara.net/static/pdfs/US/terms-and-conditions/terms-and-conditions-en_US-20250829.pdf\n    - list:\n      - listitem:\n        - button \"Move to MAN\"\n- contentinfo\n- alert: Loading\n- iframe"
  }
]