[
  {
    "step": 0,
    "timestamp": "2026-01-13T16:29:33.799490",
    "path": [],
    "action": "initial_load",
    "url": "https://www.alexandermcqueen.com/en-us",
    "new_buttons": [],
    "new_links": {},
    "aria": "- img \"Women in McQueen tartan dress and cargo jacket\"\n- paragraph: Women's New In\n- link \"SHOP NOW\":\n  - /url: /en-us/ca/women-new-in\n- banner:\n  - link \"Alexander McQueen\":\n    - /url: /en-us\n    - img \"Alexander McQueen\"\n  - list:\n    - listitem:\n      - button \"Search\":\n        - text: Search\n        - img\n    - listitem:\n      - link:\n        - /url: /en-us/signin\n        - img\n    - listitem:\n      - link:\n        - /url: https://www.alexandermcqueen.com/en-us/cart\n        - img\n    - listitem:\n      - button \"Menu MENU\":\n        - img \"Menu\"\n        - text: MENU\n- main:\n  - group \"1 / 5\":\n    - link \"McQueen double-breasted coat in grey\":\n      - /url: https://alexandermcqueen.com/marketing?pid=852855QKABM1021\n      - img \"McQueen double-breasted coat in grey\"\n  - group \"2 / 5\":\n    - link \"Red Tartan Dress\":\n      - /url: https://alexandermcqueen.com/marketing?pid=858338Q1BGE6130\n      - img \"Red Tartan Dress\"\n  - group \"3 / 5\":\n    - link \"McQueen silver earrings\":\n      - /url: https://alexandermcqueen.com/marketing?pid=854498J161F1046\n      - img \"McQueen silver earrings\"\n  - group \"4 / 5\":\n    - link \"McQueen knee high boots in black\":\n      - /url: https://alexandermcqueen.com/marketing?pid=852025WHAE31000\n      - img \"McQueen knee high boots in black\"\n  - group \"5 / 5\":\n    - link \"Tartan Manta Bag\":\n      - /url: https://alexandermcqueen.com/marketing?pid=8559971VDXB8490\n      - img \"Tartan Manta Bag\"\n  - img \"Three McQueen models in jackets and outerwear\"\n  - paragraph: Coats and Outerwear\n  - link \"Women\":\n    - /url: /en-us/ca/women/ready-to-wear/coats-and-outerwear\n  - link \"Men\":\n    - /url: /en-us/ca/men/ready-to-wear/coats-and-outerwear\n  - img \"McQueen EC1 Sneaker in Black\"\n  - paragraph: New | EC1 Sneaker\n  - link \"Women\":\n    - /url: /en-us/ca/women/shoes/ec1-sneaker\n  - link \"Men\":\n    - /url: /en-us/ca/men/shoes/ec1-sneakers\n- heading \"EXCLUSIVE SERVICES\" [level=2]\n- list:\n  - listitem:\n    - link \"Online assistance service Alexander McQueen, McQueen, AMQ Online Assistance\":\n      - /url: /en-us/cp/client-service/client-service/contact-us\n      - img \"Online assistance service Alexander McQueen, McQueen, AMQ\"\n      - paragraph: Online Assistance\n  - listitem:\n    - link \"Store services Alexander McQueen Store Services\":\n      - /url: /en-us/storelocator\n      - img \"Store services Alexander McQueen\"\n      - paragraph: Store Services\n  - listitem:\n    - link \"Alexander McQueen footer, complimentary shipping and returns FAQ Complimentary Express Shipping and Returns\":\n      - /url: /en-us/cp/faq#returns-exchanges\n      - img \"Alexander McQueen footer, complimentary shipping and returns FAQ\"\n      - paragraph: Complimentary Express Shipping and Returns\n- contentinfo:\n  - navigation:\n    - heading \"Customer Services\" [level=2]\n    - list:\n      - listitem:\n        - link \"FAQs\":\n          - /url: /en-us/cp/faq\n      - listitem:\n        - link \"Track my order\":\n          - /url: /en-us/track-order\n      - listitem:\n        - link \"Register Return\":\n          - /url: /en-us/return-order\n      - listitem:\n        - link \"Store Locator\":\n          - /url: /en-us/stores\n      - listitem:\n        - link \"Request an appointment\":\n          - /url: /en-us\n  - navigation:\n    - heading \"The company\" [level=2]\n    - list:\n      - listitem:\n        - link \"Legal Area\":\n          - /url: /en-us/legal/terms-and-conditions-of-sale\n      - listitem:\n        - link \"Privacy Policy & Cookies\":\n          - /url: /en-us/legal/privacy-policy\n      - listitem:\n        - link \"Cookie Policy\":\n          - /url: /en-us/legal/cookie-policy\n      - listitem:\n        - link \"Cookies Settings and Do Not Sell or Share\":\n          - /url: /en-us\n      - listitem:\n        - link \"Careers\":\n          - /url: \"https://careers.kering.com/careers?filter_house=Alexander+McQueen \"\n      - listitem:\n        - link \"Alexander McQueen\":\n          - /url: /en-us/legal/terms-and-conditions-of-sale\n  - navigation:\n    - heading \"Follow\" [level=2]\n    - list:\n      - listitem:\n        - link \"Facebook\":\n          - /url: https://www.facebook.com/AlexanderMcQueen\n      - listitem:\n        - link \"Instagram\":\n          - /url: https://www.instagram.com/alexandermcqueen/\n      - listitem:\n        - link \"X\":\n          - /url: https://twitter.com/mcqueen\n      - listitem:\n        - link \"YouTube\":\n          - /url: https://www.youtube.com/c/alexandermcqueen\n      - listitem:\n        - link \"TikTok\":\n          - /url: https://www.tiktok.com/@mcqueen\n      - listitem\n  - button \"Subscribe to the Newsletter\":\n    - text: Subscribe to the Newsletter\n    - img\n  - paragraph: \"Shipping to:\"\n  - button \"United States\"\n  - button \"EN\"\n  - img \"Alexander McQueen\"\n  - paragraph: \u00a9 2025 Alexander McQueen Trading Limited/Autumnpaper Limited\n- alert\n- img"
  },
  {
    "step": 1,
    "timestamp": "2026-01-13T16:29:53.342538",
    "path": [
      "Women"
    ],
    "action": "clicked: Women",
    "url": "https://www.alexandermcqueen.com/en-us",
    "new_buttons": [],
    "new_links": {
      "New in": "/en-us/ca/women-new-in",
      "Women\u2019s SS26 Pre Collection": "/en-us/ca/women/collections/w-ss26-pre-collection",
      "Women's AW25 Collection": "/en-us/ca/women/collections/w-aw25-collection",
      "Holiday Edit | Pre-SS26": "/en-us/ca/women/collections/holiday-edit",
      "Tartan Edit": "/en-us/ca/women/collections/tartan-edit",
      "Gifts for Her": "/en-us/ca/gifts/gifts-for-her",
      "Evening": "/en-us/ca/women/collections/occasion-edit",
      "Winter Edit": "/en-us/ca/women/collections/seasonal-edit",
      "Store Locator": "/en-us/stores",
      "McQueen double-breasted coat in grey": "https://alexandermcqueen.com/marketing?pid=852855QKABM1021",
      "Red Tartan Dress": "https://alexandermcqueen.com/marketing?pid=858338Q1BGE6130",
      "McQueen silver earrings": "https://alexandermcqueen.com/marketing?pid=854498J161F1046",
      "McQueen knee high boots in black": "https://alexandermcqueen.com/marketing?pid=852025WHAE31000",
      "Tartan Manta Bag": "https://alexandermcqueen.com/marketing?pid=8559971VDXB8490"
    },
    "aria": "- banner:\n  - list:\n    - listitem:\n      - dialog:\n        - img \"Alexander McQueen\"\n        - img \"McQueen PreSS26 Campaign\"\n        - paragraph: \"Shipping to:\"\n        - button \"United States\"\n        - button \"EN\"\n        - tablist \"Categories\":\n          - tab \"Women\" [selected]\n          - tab \"Men\"\n          - tab \"Gifts\"\n          - tab \"Inside McQueen\"\n        - tabpanel \"Women\":\n          - tablist \"Subcategories\":\n            - tab \"Collections\" [selected]\n            - button \"New in\":\n              - link \"New in\":\n                - /url: /en-us/ca/women-new-in\n            - tab \"Ready-to-Wear\"\n            - tab \"Handbags\"\n            - tab \"Shoes\"\n            - tab \"Accessories\"\n            - tab \"Jewellery\"\n          - tabpanel \"Collections\":\n            - list:\n              - listitem:\n                - link \"Women\u2019s SS26 Pre Collection\":\n                  - /url: /en-us/ca/women/collections/w-ss26-pre-collection\n              - listitem:\n                - link \"Women's AW25 Collection\":\n                  - /url: /en-us/ca/women/collections/w-aw25-collection\n            - text: Shop By\n            - list:\n              - listitem:\n                - link \"Holiday Edit | Pre-SS26\":\n                  - /url: /en-us/ca/women/collections/holiday-edit\n              - listitem:\n                - link \"Tartan Edit\":\n                  - /url: /en-us/ca/women/collections/tartan-edit\n              - listitem:\n                - link \"Gifts for Her\":\n                  - /url: /en-us/ca/gifts/gifts-for-her\n              - listitem:\n                - link \"Evening\":\n                  - /url: /en-us/ca/women/collections/occasion-edit\n              - listitem:\n                - link \"Winter Edit\":\n                  - /url: /en-us/ca/women/collections/seasonal-edit\n        - link \"Customer Service\":\n          - /url: /en-us/cp/client-service/client-service/contact-us\n        - link \"My Account\":\n          - /url: /en-us/myaccount\n        - link \"Store Locator\":\n          - /url: /en-us/stores\n        - button:\n          - img\n- main:\n  - group \"1 / 5\":\n    - link \"McQueen double-breasted coat in grey\":\n      - /url: https://alexandermcqueen.com/marketing?pid=852855QKABM1021\n      - img \"McQueen double-breasted coat in grey\"\n  - group \"2 / 5\":\n    - link \"Red Tartan Dress\":\n      - /url: https://alexandermcqueen.com/marketing?pid=858338Q1BGE6130\n      - img \"Red Tartan Dress\"\n  - group \"3 / 5\":\n    - link \"McQueen silver earrings\":\n      - /url: https://alexandermcqueen.com/marketing?pid=854498J161F1046\n      - img \"McQueen silver earrings\"\n  - group \"4 / 5\":\n    - link \"McQueen knee high boots in black\":\n      - /url: https://alexandermcqueen.com/marketing?pid=852025WHAE31000\n      - img \"McQueen knee high boots in black\"\n  - group \"5 / 5\":\n    - link \"Tartan Manta Bag\":\n      - /url: https://alexandermcqueen.com/marketing?pid=8559971VDXB8490\n      - img \"Tartan Manta Bag\"\n- alert"
  },
  {
    "step": 2,
    "timestamp": "2026-01-13T16:30:00.482754",
    "path": [
      "Women",
      "Collections"
    ],
    "action": "clicked: Women > Collections",
    "url": "https://www.alexandermcqueen.com/en-us",
    "new_buttons": [],
    "new_links": {
      "New in": "/en-us/ca/women-new-in",
      "Women\u2019s SS26 Pre Collection": "/en-us/ca/women/collections/w-ss26-pre-collection",
      "Women's AW25 Collection": "/en-us/ca/women/collections/w-aw25-collection",
      "Holiday Edit | Pre-SS26": "/en-us/ca/women/collections/holiday-edit",
      "Tartan Edit": "/en-us/ca/women/collections/tartan-edit",
      "Gifts for Her": "/en-us/ca/gifts/gifts-for-her",
      "Evening": "/en-us/ca/women/collections/occasion-edit",
      "Winter Edit": "/en-us/ca/women/collections/seasonal-edit",
      "Store Locator": "/en-us/stores",
      "McQueen double-breasted coat in grey": "https://alexandermcqueen.com/marketing?pid=852855QKABM1021",
      "Red Tartan Dress": "https://alexandermcqueen.com/marketing?pid=858338Q1BGE6130",
      "McQueen silver earrings": "https://alexandermcqueen.com/marketing?pid=854498J161F1046",
      "McQueen knee high boots in black": "https://alexandermcqueen.com/marketing?pid=852025WHAE31000",
      "Tartan Manta Bag": "https://alexandermcqueen.com/marketing?pid=8559971VDXB8490"
    },
    "aria": "- banner:\n  - list:\n    - listitem:\n      - dialog:\n        - img \"Alexander McQueen\"\n        - img \"McQueen PreSS26 Campaign\"\n        - paragraph: \"Shipping to:\"\n        - button \"United States\"\n        - button \"EN\"\n        - tablist \"Categories\":\n          - tab \"Women\" [selected]\n          - tab \"Men\"\n          - tab \"Gifts\"\n          - tab \"Inside McQueen\"\n        - tabpanel \"Women\":\n          - tablist \"Subcategories\":\n            - tab \"Collections\" [selected]\n            - button \"New in\":\n              - link \"New in\":\n                - /url: /en-us/ca/women-new-in\n            - tab \"Ready-to-Wear\"\n            - tab \"Handbags\"\n            - tab \"Shoes\"\n            - tab \"Accessories\"\n            - tab \"Jewellery\"\n          - tabpanel \"Collections\":\n            - list:\n              - listitem:\n                - link \"Women\u2019s SS26 Pre Collection\":\n                  - /url: /en-us/ca/women/collections/w-ss26-pre-collection\n              - listitem:\n                - link \"Women's AW25 Collection\":\n                  - /url: /en-us/ca/women/collections/w-aw25-collection\n            - text: Shop By\n            - list:\n              - listitem:\n                - link \"Holiday Edit | Pre-SS26\":\n                  - /url: /en-us/ca/women/collections/holiday-edit\n              - listitem:\n                - link \"Tartan Edit\":\n                  - /url: /en-us/ca/women/collections/tartan-edit\n              - listitem:\n                - link \"Gifts for Her\":\n                  - /url: /en-us/ca/gifts/gifts-for-her\n              - listitem:\n                - link \"Evening\":\n                  - /url: /en-us/ca/women/collections/occasion-edit\n              - listitem:\n                - link \"Winter Edit\":\n                  - /url: /en-us/ca/women/collections/seasonal-edit\n        - link \"Customer Service\":\n          - /url: /en-us/cp/client-service/client-service/contact-us\n        - link \"My Account\":\n          - /url: /en-us/myaccount\n        - link \"Store Locator\":\n          - /url: /en-us/stores\n        - button:\n          - img\n- main:\n  - group \"1 / 5\":\n    - link \"McQueen double-breasted coat in grey\":\n      - /url: https://alexandermcqueen.com/marketing?pid=852855QKABM1021\n      - img \"McQueen double-breasted coat in grey\"\n  - group \"2 / 5\":\n    - link \"Red Tartan Dress\":\n      - /url: https://alexandermcqueen.com/marketing?pid=858338Q1BGE6130\n      - img \"Red Tartan Dress\"\n  - group \"3 / 5\":\n    - link \"McQueen silver earrings\":\n      - /url: https://alexandermcqueen.com/marketing?pid=854498J161F1046\n      - img \"McQueen silver earrings\"\n  - group \"4 / 5\":\n    - link \"McQueen knee high boots in black\":\n      - /url: https://alexandermcqueen.com/marketing?pid=852025WHAE31000\n      - img \"McQueen knee high boots in black\"\n  - group \"5 / 5\":\n    - link \"Tartan Manta Bag\":\n      - /url: https://alexandermcqueen.com/marketing?pid=8559971VDXB8490\n      - img \"Tartan Manta Bag\"\n- alert"
  },
  {
    "step": 3,
    "timestamp": "2026-01-13T16:30:01.733868",
    "path": [
      "Women",
      "Ready-to-Wear"
    ],
    "action": "clicked: Women > Ready-to-Wear",
    "url": "https://www.alexandermcqueen.com/en-us",
    "new_buttons": [],
    "new_links": {
      "New in": "/en-us/ca/women-new-in",
      "View All": "/en-us/ca/women/ready-to-wear/view-all",
      "Tailoring": "/en-us/ca/women/ready-to-wear/tailoring",
      "Coats and Outerwear": "/en-us/ca/women/ready-to-wear/coats-and-outerwear",
      "Jackets": "/en-us/ca/women/ready-to-wear/jackets",
      "Dresses": "/en-us/ca/women/ready-to-wear/dresses",
      "Knitwear": "/en-us/ca/women/ready-to-wear/knitwear",
      "Leather and Shearling": "/en-us/ca/women/ready-to-wear/leather",
      "Denim": "/en-us/ca/women/ready-to-wear/denim",
      "Tops and Shirts": "/en-us/ca/women/ready-to-wear/tops-and-shirts",
      "T-Shirts and Sweatshirts": "/en-us/ca/women/ready-to-wear/t-shirts-and-sweatshirts",
      "Skirts": "/en-us/ca/women/ready-to-wear/skirts",
      "Pants": "/en-us/ca/women/ready-to-wear/trousers",
      "Store Locator": "/en-us/stores",
      "McQueen double-breasted coat in grey": "https://alexandermcqueen.com/marketing?pid=852855QKABM1021",
      "Red Tartan Dress": "https://alexandermcqueen.com/marketing?pid=858338Q1BGE6130",
      "McQueen silver earrings": "https://alexandermcqueen.com/marketing?pid=854498J161F1046",
      "McQueen knee high boots in black": "https://alexandermcqueen.com/marketing?pid=852025WHAE31000",
      "Tartan Manta Bag": "https://alexandermcqueen.com/marketing?pid=8559971VDXB8490"
    },
    "aria": "- banner:\n  - list:\n    - listitem:\n      - dialog:\n        - img \"Alexander McQueen\"\n        - img \"McQueen PreSS26 Campaign\"\n        - paragraph: \"Shipping to:\"\n        - button \"United States\"\n        - button \"EN\"\n        - tablist \"Categories\":\n          - tab \"Women\" [selected]\n          - tab \"Men\"\n          - tab \"Gifts\"\n          - tab \"Inside McQueen\"\n        - tabpanel \"Women\":\n          - tablist \"Subcategories\":\n            - tab \"Collections\"\n            - button \"New in\":\n              - link \"New in\":\n                - /url: /en-us/ca/women-new-in\n            - tab \"Ready-to-Wear\" [selected]\n            - tab \"Handbags\"\n            - tab \"Shoes\"\n            - tab \"Accessories\"\n            - tab \"Jewellery\"\n          - tabpanel \"Ready-to-Wear\":\n            - list:\n              - listitem:\n                - link \"View All\":\n                  - /url: /en-us/ca/women/ready-to-wear/view-all\n              - listitem:\n                - link \"Tailoring\":\n                  - /url: /en-us/ca/women/ready-to-wear/tailoring\n              - listitem:\n                - link \"Coats and Outerwear\":\n                  - /url: /en-us/ca/women/ready-to-wear/coats-and-outerwear\n              - listitem:\n                - link \"Jackets\":\n                  - /url: /en-us/ca/women/ready-to-wear/jackets\n              - listitem:\n                - link \"Dresses\":\n                  - /url: /en-us/ca/women/ready-to-wear/dresses\n              - listitem:\n                - link \"Knitwear\":\n                  - /url: /en-us/ca/women/ready-to-wear/knitwear\n              - listitem:\n                - link \"Leather and Shearling\":\n                  - /url: /en-us/ca/women/ready-to-wear/leather\n              - listitem:\n                - link \"Denim\":\n                  - /url: /en-us/ca/women/ready-to-wear/denim\n              - listitem:\n                - link \"Tops and Shirts\":\n                  - /url: /en-us/ca/women/ready-to-wear/tops-and-shirts\n              - listitem:\n                - link \"T-Shirts and Sweatshirts\":\n                  - /url: /en-us/ca/women/ready-to-wear/t-shirts-and-sweatshirts\n              - listitem:\n                - link \"Skirts\":\n                  - /url: /en-us/ca/women/ready-to-wear/skirts\n              - listitem:\n                - link \"Pants\":\n                  - /url: /en-us/ca/women/ready-to-wear/trousers\n        - link \"Customer Service\":\n          - /url: /en-us/cp/client-service/client-service/contact-us\n        - link \"My Account\":\n          - /url: /en-us/myaccount\n        - link \"Store Locator\":\n          - /url: /en-us/stores\n        - button:\n          - img\n- main:\n  - group \"1 / 5\":\n    - link \"McQueen double-breasted coat in grey\":\n      - /url: https://alexandermcqueen.com/marketing?pid=852855QKABM1021\n      - img \"McQueen double-breasted coat in grey\"\n  - group \"2 / 5\":\n    - link \"Red Tartan Dress\":\n      - /url: https://alexandermcqueen.com/marketing?pid=858338Q1BGE6130\n      - img \"Red Tartan Dress\"\n  - group \"3 / 5\":\n    - link \"McQueen silver earrings\":\n      - /url: https://alexandermcqueen.com/marketing?pid=854498J161F1046\n      - img \"McQueen silver earrings\"\n  - group \"4 / 5\":\n    - link \"McQueen knee high boots in black\":\n      - /url: https://alexandermcqueen.com/marketing?pid=852025WHAE31000\n      - img \"McQueen knee high boots in black\"\n  - group \"5 / 5\":\n    - link \"Tartan Manta Bag\":\n      - /url: https://alexandermcqueen.com/marketing?pid=8559971VDXB8490\n      - img \"Tartan Manta Bag\"\n- alert"
  },
  {
    "step": 4,
    "timestamp": "2026-01-13T16:30:03.016233",
    "path": [
      "Women",
      "Handbags"
    ],
    "action": "clicked: Women > Handbags",
    "url": "https://www.alexandermcqueen.com/en-us",
    "new_buttons": [],
    "new_links": {
      "New in": "/en-us/ca/women-new-in",
      "View All": "/en-us/ca/women/handbags/view-all",
      "Clutches": "/en-us/ca/women/handbags/clutches",
      "Shoulder Bags": "/en-us/ca/women/handbags/shoulder-bags",
      "Crossbody Bags": "/en-us/ca/women/handbags/crossbody-bags",
      "Top Handles": "/en-us/ca/women/handbags/top-handles",
      "Mini Bags": "/en-us/ca/women/handbags/mini-bags",
      "Bag Charms": "/en-us/ca/women/accessories/bag-charms",
      "Manta": "/en-us/ca/women/handbags/manta-bag",
      "Farringdon": "/en-us/ca/women/handbags/farringdon-bag",
      "Jewelled Satchel": "/en-us/ca/women/handbags/the-jewelled-satchel",
      "Skull Flower": "/en-us/ca/women/handbags/the-skull-flower-bag",
      "Clutch Capsule Collection": "/en-us/ca/women/handbags/clutch-capsule",
      "Store Locator": "/en-us/stores",
      "McQueen double-breasted coat in grey": "https://alexandermcqueen.com/marketing?pid=852855QKABM1021",
      "Red Tartan Dress": "https://alexandermcqueen.com/marketing?pid=858338Q1BGE6130",
      "McQueen silver earrings": "https://alexandermcqueen.com/marketing?pid=854498J161F1046",
      "McQueen knee high boots in black": "https://alexandermcqueen.com/marketing?pid=852025WHAE31000",
      "Tartan Manta Bag": "https://alexandermcqueen.com/marketing?pid=8559971VDXB8490"
    },
    "aria": "- banner:\n  - list:\n    - listitem:\n      - dialog:\n        - img \"Alexander McQueen\"\n        - img \"McQueen PreSS26 Campaign\"\n        - paragraph: \"Shipping to:\"\n        - button \"United States\"\n        - button \"EN\"\n        - tablist \"Categories\":\n          - tab \"Women\" [selected]\n          - tab \"Men\"\n          - tab \"Gifts\"\n          - tab \"Inside McQueen\"\n        - tabpanel \"Women\":\n          - tablist \"Subcategories\":\n            - tab \"Collections\"\n            - button \"New in\":\n              - link \"New in\":\n                - /url: /en-us/ca/women-new-in\n            - tab \"Ready-to-Wear\"\n            - tab \"Handbags\" [selected]\n            - tab \"Shoes\"\n            - tab \"Accessories\"\n            - tab \"Jewellery\"\n          - tabpanel \"Handbags\":\n            - list:\n              - listitem:\n                - link \"View All\":\n                  - /url: /en-us/ca/women/handbags/view-all\n              - listitem:\n                - link \"Clutches\":\n                  - /url: /en-us/ca/women/handbags/clutches\n              - listitem:\n                - link \"Shoulder Bags\":\n                  - /url: /en-us/ca/women/handbags/shoulder-bags\n              - listitem:\n                - link \"Crossbody Bags\":\n                  - /url: /en-us/ca/women/handbags/crossbody-bags\n              - listitem:\n                - link \"Top Handles\":\n                  - /url: /en-us/ca/women/handbags/top-handles\n              - listitem:\n                - link \"Mini Bags\":\n                  - /url: /en-us/ca/women/handbags/mini-bags\n              - listitem:\n                - link \"Bag Charms\":\n                  - /url: /en-us/ca/women/accessories/bag-charms\n            - text: Shop By\n            - list:\n              - listitem:\n                - link \"Manta\":\n                  - /url: /en-us/ca/women/handbags/manta-bag\n              - listitem:\n                - link \"Farringdon\":\n                  - /url: /en-us/ca/women/handbags/farringdon-bag\n              - listitem:\n                - link \"Jewelled Satchel\":\n                  - /url: /en-us/ca/women/handbags/the-jewelled-satchel\n              - listitem:\n                - link \"Skull Flower\":\n                  - /url: /en-us/ca/women/handbags/the-skull-flower-bag\n              - listitem:\n                - link \"Clutch Capsule Collection\":\n                  - /url: /en-us/ca/women/handbags/clutch-capsule\n        - link \"Customer Service\":\n          - /url: /en-us/cp/client-service/client-service/contact-us\n        - link \"My Account\":\n          - /url: /en-us/myaccount\n        - link \"Store Locator\":\n          - /url: /en-us/stores\n        - button:\n          - img\n- main:\n  - group \"1 / 5\":\n    - link \"McQueen double-breasted coat in grey\":\n      - /url: https://alexandermcqueen.com/marketing?pid=852855QKABM1021\n      - img \"McQueen double-breasted coat in grey\"\n  - group \"2 / 5\":\n    - link \"Red Tartan Dress\":\n      - /url: https://alexandermcqueen.com/marketing?pid=858338Q1BGE6130\n      - img \"Red Tartan Dress\"\n  - group \"3 / 5\":\n    - link \"McQueen silver earrings\":\n      - /url: https://alexandermcqueen.com/marketing?pid=854498J161F1046\n      - img \"McQueen silver earrings\"\n  - group \"4 / 5\":\n    - link \"McQueen knee high boots in black\":\n      - /url: https://alexandermcqueen.com/marketing?pid=852025WHAE31000\n      - img \"McQueen knee high boots in black\"\n  - group \"5 / 5\":\n    - link \"Tartan Manta Bag\":\n      - /url: https://alexandermcqueen.com/marketing?pid=8559971VDXB8490\n      - img \"Tartan Manta Bag\"\n- alert"
  },
  {
    "step": 5,
    "timestamp": "2026-01-13T16:30:04.280321",
    "path": [
      "Women",
      "Shoes"
    ],
    "action": "clicked: Women > Shoes",
    "url": "https://www.alexandermcqueen.com/en-us",
    "new_buttons": [],
    "new_links": {
      "New in": "/en-us/ca/women-new-in",
      "View All": "/en-us/ca/women/shoes/view-all",
      "Boots": "/en-us/ca/women/shoes/boots",
      "Sneakers": "/en-us/ca/women/shoes/sneakers",
      "Pumps and Heels": "/en-us/ca/women/shoes/pumps",
      "Flat Shoes": "/en-us/ca/women/shoes/flat-shoes",
      "Sandals and Slides": "/en-us/ca/women/shoes/sandals-and-slides",
      "EC1 Sneakers": "/en-us/ca/women/shoes/ec1-sneaker",
      "Oversized Sneaker": "/en-us/ca/women/shoes/oversized-sneaker",
      "Tread Slick": "/en-us/ca/women/shoes/tread-slick",
      "Store Locator": "/en-us/stores",
      "McQueen double-breasted coat in grey": "https://alexandermcqueen.com/marketing?pid=852855QKABM1021",
      "Red Tartan Dress": "https://alexandermcqueen.com/marketing?pid=858338Q1BGE6130",
      "McQueen silver earrings": "https://alexandermcqueen.com/marketing?pid=854498J161F1046",
      "McQueen knee high boots in black": "https://alexandermcqueen.com/marketing?pid=852025WHAE31000",
      "Tartan Manta Bag": "https://alexandermcqueen.com/marketing?pid=8559971VDXB8490"
    },
    "aria": "- banner:\n  - list:\n    - listitem:\n      - dialog:\n        - img \"Alexander McQueen\"\n        - img \"McQueen PreSS26 Campaign\"\n        - paragraph: \"Shipping to:\"\n        - button \"United States\"\n        - button \"EN\"\n        - tablist \"Categories\":\n          - tab \"Women\" [selected]\n          - tab \"Men\"\n          - tab \"Gifts\"\n          - tab \"Inside McQueen\"\n        - tabpanel \"Women\":\n          - tablist \"Subcategories\":\n            - tab \"Collections\"\n            - button \"New in\":\n              - link \"New in\":\n                - /url: /en-us/ca/women-new-in\n            - tab \"Ready-to-Wear\"\n            - tab \"Handbags\"\n            - tab \"Shoes\" [selected]\n            - tab \"Accessories\"\n            - tab \"Jewellery\"\n          - tabpanel \"Shoes\":\n            - list:\n              - listitem:\n                - link \"View All\":\n                  - /url: /en-us/ca/women/shoes/view-all\n              - listitem:\n                - link \"Boots\":\n                  - /url: /en-us/ca/women/shoes/boots\n              - listitem:\n                - link \"Sneakers\":\n                  - /url: /en-us/ca/women/shoes/sneakers\n              - listitem:\n                - link \"Pumps and Heels\":\n                  - /url: /en-us/ca/women/shoes/pumps\n              - listitem:\n                - link \"Flat Shoes\":\n                  - /url: /en-us/ca/women/shoes/flat-shoes\n              - listitem:\n                - link \"Sandals and Slides\":\n                  - /url: /en-us/ca/women/shoes/sandals-and-slides\n            - text: Shop By\n            - list:\n              - listitem:\n                - link \"EC1 Sneakers\":\n                  - /url: /en-us/ca/women/shoes/ec1-sneaker\n              - listitem:\n                - link \"Oversized Sneaker\":\n                  - /url: /en-us/ca/women/shoes/oversized-sneaker\n              - listitem:\n                - link \"Tread Slick\":\n                  - /url: /en-us/ca/women/shoes/tread-slick\n        - link \"Customer Service\":\n          - /url: /en-us/cp/client-service/client-service/contact-us\n        - link \"My Account\":\n          - /url: /en-us/myaccount\n        - link \"Store Locator\":\n          - /url: /en-us/stores\n        - button:\n          - img\n- main:\n  - group \"1 / 5\":\n    - link \"McQueen double-breasted coat in grey\":\n      - /url: https://alexandermcqueen.com/marketing?pid=852855QKABM1021\n      - img \"McQueen double-breasted coat in grey\"\n  - group \"2 / 5\":\n    - link \"Red Tartan Dress\":\n      - /url: https://alexandermcqueen.com/marketing?pid=858338Q1BGE6130\n      - img \"Red Tartan Dress\"\n  - group \"3 / 5\":\n    - link \"McQueen silver earrings\":\n      - /url: https://alexandermcqueen.com/marketing?pid=854498J161F1046\n      - img \"McQueen silver earrings\"\n  - group \"4 / 5\":\n    - link \"McQueen knee high boots in black\":\n      - /url: https://alexandermcqueen.com/marketing?pid=852025WHAE31000\n      - img \"McQueen knee high boots in black\"\n  - group \"5 / 5\":\n    - link \"Tartan Manta Bag\":\n      - /url: https://alexandermcqueen.com/marketing?pid=8559971VDXB8490\n      - img \"Tartan Manta Bag\"\n- alert"
  },
  {
    "step": 6,
    "timestamp": "2026-01-13T16:30:05.565866",
    "path": [
      "Women",
      "Accessories"
    ],
    "action": "clicked: Women > Accessories",
    "url": "https://www.alexandermcqueen.com/en-us",
    "new_buttons": [],
    "new_links": {
      "New in": "/en-us/ca/women-new-in",
      "View All": "/en-us/ca/women/accessories/women-accessories",
      "Scarves": "/en-us/ca/women/accessories/scarves",
      "Bag Charms": "/en-us/ca/women/accessories/bag-charms",
      "Wallets and Cardholders": "/en-us/ca/women/accessories/wallets-and-cardholders",
      "Jewellery": "/en-us/ca/women/accessories/jewellery",
      "Belts": "/en-us/ca/women/accessories/belts",
      "Sunglasses": "/en-us/ca/women/accessories/sunglasses",
      "Other Accessories": "/en-us/ca/women/accessories/other-accessories",
      "Store Locator": "/en-us/stores",
      "McQueen double-breasted coat in grey": "https://alexandermcqueen.com/marketing?pid=852855QKABM1021",
      "Red Tartan Dress": "https://alexandermcqueen.com/marketing?pid=858338Q1BGE6130",
      "McQueen silver earrings": "https://alexandermcqueen.com/marketing?pid=854498J161F1046",
      "McQueen knee high boots in black": "https://alexandermcqueen.com/marketing?pid=852025WHAE31000",
      "Tartan Manta Bag": "https://alexandermcqueen.com/marketing?pid=8559971VDXB8490"
    },
    "aria": "- banner:\n  - list:\n    - listitem:\n      - dialog:\n        - img \"Alexander McQueen\"\n        - img \"McQueen PreSS26 Campaign\"\n        - paragraph: \"Shipping to:\"\n        - button \"United States\"\n        - button \"EN\"\n        - tablist \"Categories\":\n          - tab \"Women\" [selected]\n          - tab \"Men\"\n          - tab \"Gifts\"\n          - tab \"Inside McQueen\"\n        - tabpanel \"Women\":\n          - tablist \"Subcategories\":\n            - tab \"Collections\"\n            - button \"New in\":\n              - link \"New in\":\n                - /url: /en-us/ca/women-new-in\n            - tab \"Ready-to-Wear\"\n            - tab \"Handbags\"\n            - tab \"Shoes\"\n            - tab \"Accessories\" [selected]\n            - tab \"Jewellery\"\n          - tabpanel \"Accessories\":\n            - list:\n              - listitem:\n                - link \"View All\":\n                  - /url: /en-us/ca/women/accessories/women-accessories\n              - listitem:\n                - link \"Scarves\":\n                  - /url: /en-us/ca/women/accessories/scarves\n              - listitem:\n                - link \"Bag Charms\":\n                  - /url: /en-us/ca/women/accessories/bag-charms\n              - listitem:\n                - link \"Wallets and Cardholders\":\n                  - /url: /en-us/ca/women/accessories/wallets-and-cardholders\n              - listitem:\n                - link \"Jewellery\":\n                  - /url: /en-us/ca/women/accessories/jewellery\n              - listitem:\n                - link \"Belts\":\n                  - /url: /en-us/ca/women/accessories/belts\n              - listitem:\n                - link \"Sunglasses\":\n                  - /url: /en-us/ca/women/accessories/sunglasses\n              - listitem:\n                - link \"Other Accessories\":\n                  - /url: /en-us/ca/women/accessories/other-accessories\n        - link \"Customer Service\":\n          - /url: /en-us/cp/client-service/client-service/contact-us\n        - link \"My Account\":\n          - /url: /en-us/myaccount\n        - link \"Store Locator\":\n          - /url: /en-us/stores\n        - button:\n          - img\n- main:\n  - group \"1 / 5\":\n    - link \"McQueen double-breasted coat in grey\":\n      - /url: https://alexandermcqueen.com/marketing?pid=852855QKABM1021\n      - img \"McQueen double-breasted coat in grey\"\n  - group \"2 / 5\":\n    - link \"Red Tartan Dress\":\n      - /url: https://alexandermcqueen.com/marketing?pid=858338Q1BGE6130\n      - img \"Red Tartan Dress\"\n  - group \"3 / 5\":\n    - link \"McQueen silver earrings\":\n      - /url: https://alexandermcqueen.com/marketing?pid=854498J161F1046\n      - img \"McQueen silver earrings\"\n  - group \"4 / 5\":\n    - link \"McQueen knee high boots in black\":\n      - /url: https://alexandermcqueen.com/marketing?pid=852025WHAE31000\n      - img \"McQueen knee high boots in black\"\n  - group \"5 / 5\":\n    - link \"Tartan Manta Bag\":\n      - /url: https://alexandermcqueen.com/marketing?pid=8559971VDXB8490\n      - img \"Tartan Manta Bag\"\n- alert"
  },
  {
    "step": 7,
    "timestamp": "2026-01-13T16:30:06.833768",
    "path": [
      "Women",
      "Jewellery"
    ],
    "action": "clicked: Women > Jewellery",
    "url": "https://www.alexandermcqueen.com/en-us",
    "new_buttons": [],
    "new_links": {
      "New in": "/en-us/ca/women-new-in",
      "View All": "/en-us/ca/women/jewellery/view-all",
      "Necklaces and Pendants": "/en-us/ca/women/jewellery/necklaces-and-pendants",
      "Earrings": "/en-us/ca/women/jewellery/earrings",
      "Bracelets": "/en-us/ca/women/jewellery/bracelets",
      "Rings": "/en-us/ca/women/jewellery/rings",
      "Store Locator": "/en-us/stores",
      "McQueen double-breasted coat in grey": "https://alexandermcqueen.com/marketing?pid=852855QKABM1021",
      "Red Tartan Dress": "https://alexandermcqueen.com/marketing?pid=858338Q1BGE6130",
      "McQueen silver earrings": "https://alexandermcqueen.com/marketing?pid=854498J161F1046",
      "McQueen knee high boots in black": "https://alexandermcqueen.com/marketing?pid=852025WHAE31000",
      "Tartan Manta Bag": "https://alexandermcqueen.com/marketing?pid=8559971VDXB8490"
    },
    "aria": "- banner:\n  - list:\n    - listitem:\n      - dialog:\n        - img \"Alexander McQueen\"\n        - img \"McQueen PreSS26 Campaign\"\n        - paragraph: \"Shipping to:\"\n        - button \"United States\"\n        - button \"EN\"\n        - tablist \"Categories\":\n          - tab \"Women\" [selected]\n          - tab \"Men\"\n          - tab \"Gifts\"\n          - tab \"Inside McQueen\"\n        - tabpanel \"Women\":\n          - tablist \"Subcategories\":\n            - tab \"Collections\"\n            - button \"New in\":\n              - link \"New in\":\n                - /url: /en-us/ca/women-new-in\n            - tab \"Ready-to-Wear\"\n            - tab \"Handbags\"\n            - tab \"Shoes\"\n            - tab \"Accessories\"\n            - tab \"Jewellery\" [selected]\n          - tabpanel \"Jewellery\":\n            - list:\n              - listitem:\n                - link \"View All\":\n                  - /url: /en-us/ca/women/jewellery/view-all\n              - listitem:\n                - link \"Necklaces and Pendants\":\n                  - /url: /en-us/ca/women/jewellery/necklaces-and-pendants\n              - listitem:\n                - link \"Earrings\":\n                  - /url: /en-us/ca/women/jewellery/earrings\n              - listitem:\n                - link \"Bracelets\":\n                  - /url: /en-us/ca/women/jewellery/bracelets\n              - listitem:\n                - link \"Rings\":\n                  - /url: /en-us/ca/women/jewellery/rings\n        - link \"Customer Service\":\n          - /url: /en-us/cp/client-service/client-service/contact-us\n        - link \"My Account\":\n          - /url: /en-us/myaccount\n        - link \"Store Locator\":\n          - /url: /en-us/stores\n        - button:\n          - img\n- main:\n  - group \"1 / 5\":\n    - link \"McQueen double-breasted coat in grey\":\n      - /url: https://alexandermcqueen.com/marketing?pid=852855QKABM1021\n      - img \"McQueen double-breasted coat in grey\"\n  - group \"2 / 5\":\n    - link \"Red Tartan Dress\":\n      - /url: https://alexandermcqueen.com/marketing?pid=858338Q1BGE6130\n      - img \"Red Tartan Dress\"\n  - group \"3 / 5\":\n    - link \"McQueen silver earrings\":\n      - /url: https://alexandermcqueen.com/marketing?pid=854498J161F1046\n      - img \"McQueen silver earrings\"\n  - group \"4 / 5\":\n    - link \"McQueen knee high boots in black\":\n      - /url: https://alexandermcqueen.com/marketing?pid=852025WHAE31000\n      - img \"McQueen knee high boots in black\"\n  - group \"5 / 5\":\n    - link \"Tartan Manta Bag\":\n      - /url: https://alexandermcqueen.com/marketing?pid=8559971VDXB8490\n      - img \"Tartan Manta Bag\"\n- alert"
  },
  {
    "step": 8,
    "timestamp": "2026-01-13T16:30:07.561422",
    "path": [
      "Men"
    ],
    "action": "clicked: Men",
    "url": "https://www.alexandermcqueen.com/en-us",
    "new_buttons": [],
    "new_links": {
      "New in": "/en-us/ca/men-new-in",
      "Men\u2019s SS26 Pre Collection": "/en-us/ca/men/collections/m-ss26-pre-collection",
      "Men's AW25 Collection": "/en-us/ca/men/collections/m-aw25-collection",
      "Holiday Edit | Pre-SS26": "/en-us/ca/men/collections/holiday-edit",
      "Gifts for Him": "/en-us/ca/gifts/gifts-for-him",
      "Evening Edit": "/en-us/ca/men/collections/occasion-edit",
      "Winter Edit": "/en-us/ca/men/collections/m-seasonal-edit",
      "Store Locator": "/en-us/stores",
      "McQueen double-breasted coat in grey": "https://alexandermcqueen.com/marketing?pid=852855QKABM1021",
      "Red Tartan Dress": "https://alexandermcqueen.com/marketing?pid=858338Q1BGE6130",
      "McQueen silver earrings": "https://alexandermcqueen.com/marketing?pid=854498J161F1046",
      "McQueen knee high boots in black": "https://alexandermcqueen.com/marketing?pid=852025WHAE31000",
      "Tartan Manta Bag": "https://alexandermcqueen.com/marketing?pid=8559971VDXB8490"
    },
    "aria": "- banner:\n  - list:\n    - listitem:\n      - dialog:\n        - img \"Alexander McQueen\"\n        - img \"McQueen Pre SS26 collection for men\"\n        - paragraph: \"Shipping to:\"\n        - button \"United States\"\n        - button \"EN\"\n        - tablist \"Categories\":\n          - tab \"Women\"\n          - tab \"Men\" [selected]\n          - tab \"Gifts\"\n          - tab \"Inside McQueen\"\n        - tabpanel \"Men\":\n          - tablist \"Subcategories\":\n            - tab \"Collections\" [selected]\n            - button \"New in\":\n              - link \"New in\":\n                - /url: /en-us/ca/men-new-in\n            - tab \"Ready-to-Wear\"\n            - tab \"Bags\"\n            - tab \"Shoes\"\n            - tab \"Accessories\"\n            - tab \"Jewellery\"\n          - tabpanel \"Collections\":\n            - list:\n              - listitem:\n                - link \"Men\u2019s SS26 Pre Collection\":\n                  - /url: /en-us/ca/men/collections/m-ss26-pre-collection\n              - listitem:\n                - link \"Men's AW25 Collection\":\n                  - /url: /en-us/ca/men/collections/m-aw25-collection\n            - text: Shop By\n            - list:\n              - listitem:\n                - link \"Holiday Edit | Pre-SS26\":\n                  - /url: /en-us/ca/men/collections/holiday-edit\n              - listitem:\n                - link \"Gifts for Him\":\n                  - /url: /en-us/ca/gifts/gifts-for-him\n              - listitem:\n                - link \"Evening Edit\":\n                  - /url: /en-us/ca/men/collections/occasion-edit\n              - listitem:\n                - link \"Winter Edit\":\n                  - /url: /en-us/ca/men/collections/m-seasonal-edit\n        - link \"Customer Service\":\n          - /url: /en-us/cp/client-service/client-service/contact-us\n        - link \"My Account\":\n          - /url: /en-us/myaccount\n        - link \"Store Locator\":\n          - /url: /en-us/stores\n        - button:\n          - img\n- main:\n  - group \"1 / 5\":\n    - link \"McQueen double-breasted coat in grey\":\n      - /url: https://alexandermcqueen.com/marketing?pid=852855QKABM1021\n      - img \"McQueen double-breasted coat in grey\"\n  - group \"2 / 5\":\n    - link \"Red Tartan Dress\":\n      - /url: https://alexandermcqueen.com/marketing?pid=858338Q1BGE6130\n      - img \"Red Tartan Dress\"\n  - group \"3 / 5\":\n    - link \"McQueen silver earrings\":\n      - /url: https://alexandermcqueen.com/marketing?pid=854498J161F1046\n      - img \"McQueen silver earrings\"\n  - group \"4 / 5\":\n    - link \"McQueen knee high boots in black\":\n      - /url: https://alexandermcqueen.com/marketing?pid=852025WHAE31000\n      - img \"McQueen knee high boots in black\"\n  - group \"5 / 5\":\n    - link \"Tartan Manta Bag\":\n      - /url: https://alexandermcqueen.com/marketing?pid=8559971VDXB8490\n      - img \"Tartan Manta Bag\"\n- alert"
  },
  {
    "step": 9,
    "timestamp": "2026-01-13T16:30:14.318112",
    "path": [
      "Men",
      "Collections"
    ],
    "action": "clicked: Men > Collections",
    "url": "https://www.alexandermcqueen.com/en-us",
    "new_buttons": [],
    "new_links": {
      "New in": "/en-us/ca/men-new-in",
      "Men\u2019s SS26 Pre Collection": "/en-us/ca/men/collections/m-ss26-pre-collection",
      "Men's AW25 Collection": "/en-us/ca/men/collections/m-aw25-collection",
      "Holiday Edit | Pre-SS26": "/en-us/ca/men/collections/holiday-edit",
      "Gifts for Him": "/en-us/ca/gifts/gifts-for-him",
      "Evening Edit": "/en-us/ca/men/collections/occasion-edit",
      "Winter Edit": "/en-us/ca/men/collections/m-seasonal-edit",
      "Store Locator": "/en-us/stores",
      "McQueen double-breasted coat in grey": "https://alexandermcqueen.com/marketing?pid=852855QKABM1021",
      "Red Tartan Dress": "https://alexandermcqueen.com/marketing?pid=858338Q1BGE6130",
      "McQueen silver earrings": "https://alexandermcqueen.com/marketing?pid=854498J161F1046",
      "McQueen knee high boots in black": "https://alexandermcqueen.com/marketing?pid=852025WHAE31000",
      "Tartan Manta Bag": "https://alexandermcqueen.com/marketing?pid=8559971VDXB8490"
    },
    "aria": "- banner:\n  - list:\n    - listitem:\n      - dialog:\n        - img \"Alexander McQueen\"\n        - img \"McQueen Pre SS26 collection for men\"\n        - paragraph: \"Shipping to:\"\n        - button \"United States\"\n        - button \"EN\"\n        - tablist \"Categories\":\n          - tab \"Women\"\n          - tab \"Men\" [selected]\n          - tab \"Gifts\"\n          - tab \"Inside McQueen\"\n        - tabpanel \"Men\":\n          - tablist \"Subcategories\":\n            - tab \"Collections\" [selected]\n            - button \"New in\":\n              - link \"New in\":\n                - /url: /en-us/ca/men-new-in\n            - tab \"Ready-to-Wear\"\n            - tab \"Bags\"\n            - tab \"Shoes\"\n            - tab \"Accessories\"\n            - tab \"Jewellery\"\n          - tabpanel \"Collections\":\n            - list:\n              - listitem:\n                - link \"Men\u2019s SS26 Pre Collection\":\n                  - /url: /en-us/ca/men/collections/m-ss26-pre-collection\n              - listitem:\n                - link \"Men's AW25 Collection\":\n                  - /url: /en-us/ca/men/collections/m-aw25-collection\n            - text: Shop By\n            - list:\n              - listitem:\n                - link \"Holiday Edit | Pre-SS26\":\n                  - /url: /en-us/ca/men/collections/holiday-edit\n              - listitem:\n                - link \"Gifts for Him\":\n                  - /url: /en-us/ca/gifts/gifts-for-him\n              - listitem:\n                - link \"Evening Edit\":\n                  - /url: /en-us/ca/men/collections/occasion-edit\n              - listitem:\n                - link \"Winter Edit\":\n                  - /url: /en-us/ca/men/collections/m-seasonal-edit\n        - link \"Customer Service\":\n          - /url: /en-us/cp/client-service/client-service/contact-us\n        - link \"My Account\":\n          - /url: /en-us/myaccount\n        - link \"Store Locator\":\n          - /url: /en-us/stores\n        - button:\n          - img\n- main:\n  - group \"1 / 5\":\n    - link \"McQueen double-breasted coat in grey\":\n      - /url: https://alexandermcqueen.com/marketing?pid=852855QKABM1021\n      - img \"McQueen double-breasted coat in grey\"\n  - group \"2 / 5\":\n    - link \"Red Tartan Dress\":\n      - /url: https://alexandermcqueen.com/marketing?pid=858338Q1BGE6130\n      - img \"Red Tartan Dress\"\n  - group \"3 / 5\":\n    - link \"McQueen silver earrings\":\n      - /url: https://alexandermcqueen.com/marketing?pid=854498J161F1046\n      - img \"McQueen silver earrings\"\n  - group \"4 / 5\":\n    - link \"McQueen knee high boots in black\":\n      - /url: https://alexandermcqueen.com/marketing?pid=852025WHAE31000\n      - img \"McQueen knee high boots in black\"\n  - group \"5 / 5\":\n    - link \"Tartan Manta Bag\":\n      - /url: https://alexandermcqueen.com/marketing?pid=8559971VDXB8490\n      - img \"Tartan Manta Bag\"\n- alert"
  },
  {
    "step": 10,
    "timestamp": "2026-01-13T16:30:15.562623",
    "path": [
      "Men",
      "Ready-to-Wear"
    ],
    "action": "clicked: Men > Ready-to-Wear",
    "url": "https://www.alexandermcqueen.com/en-us",
    "new_buttons": [],
    "new_links": {
      "New in": "/en-us/ca/men-new-in",
      "View All": "/en-us/ca/men/ready-to-wear/view-all",
      "Tailoring": "/en-us/ca/men/ready-to-wear/tailoring",
      "Coats and Outerwear": "/en-us/ca/men/ready-to-wear/coats-and-outerwear",
      "Jackets": "/en-us/ca/men/ready-to-wear/jackets",
      "Knitwear": "/en-us/ca/men/ready-to-wear/knitwear",
      "T-Shirts and Sweatshirts": "/en-us/ca/men/ready-to-wear/t-shirts-and-sweatshirts",
      "Shirts": "/en-us/ca/men/ready-to-wear/shirts",
      "Trousers": "/en-us/ca/men/ready-to-wear/trousers",
      "Denim": "/en-us/ca/men/ready-to-wear/denim",
      "Leather and Shearling": "/en-us/ca/men/ready-to-wear/leather",
      "Store Locator": "/en-us/stores",
      "McQueen double-breasted coat in grey": "https://alexandermcqueen.com/marketing?pid=852855QKABM1021",
      "Red Tartan Dress": "https://alexandermcqueen.com/marketing?pid=858338Q1BGE6130",
      "McQueen silver earrings": "https://alexandermcqueen.com/marketing?pid=854498J161F1046",
      "McQueen knee high boots in black": "https://alexandermcqueen.com/marketing?pid=852025WHAE31000",
      "Tartan Manta Bag": "https://alexandermcqueen.com/marketing?pid=8559971VDXB8490"
    },
    "aria": "- banner:\n  - list:\n    - listitem:\n      - dialog:\n        - img \"Alexander McQueen\"\n        - img \"McQueen Pre SS26 collection for men\"\n        - paragraph: \"Shipping to:\"\n        - button \"United States\"\n        - button \"EN\"\n        - tablist \"Categories\":\n          - tab \"Women\"\n          - tab \"Men\" [selected]\n          - tab \"Gifts\"\n          - tab \"Inside McQueen\"\n        - tabpanel \"Men\":\n          - tablist \"Subcategories\":\n            - tab \"Collections\"\n            - button \"New in\":\n              - link \"New in\":\n                - /url: /en-us/ca/men-new-in\n            - tab \"Ready-to-Wear\" [selected]\n            - tab \"Bags\"\n            - tab \"Shoes\"\n            - tab \"Accessories\"\n            - tab \"Jewellery\"\n          - tabpanel \"Ready-to-Wear\":\n            - list:\n              - listitem:\n                - link \"View All\":\n                  - /url: /en-us/ca/men/ready-to-wear/view-all\n              - listitem:\n                - link \"Tailoring\":\n                  - /url: /en-us/ca/men/ready-to-wear/tailoring\n              - listitem:\n                - link \"Coats and Outerwear\":\n                  - /url: /en-us/ca/men/ready-to-wear/coats-and-outerwear\n              - listitem:\n                - link \"Jackets\":\n                  - /url: /en-us/ca/men/ready-to-wear/jackets\n              - listitem:\n                - link \"Knitwear\":\n                  - /url: /en-us/ca/men/ready-to-wear/knitwear\n              - listitem:\n                - link \"T-Shirts and Sweatshirts\":\n                  - /url: /en-us/ca/men/ready-to-wear/t-shirts-and-sweatshirts\n              - listitem:\n                - link \"Shirts\":\n                  - /url: /en-us/ca/men/ready-to-wear/shirts\n              - listitem:\n                - link \"Trousers\":\n                  - /url: /en-us/ca/men/ready-to-wear/trousers\n              - listitem:\n                - link \"Denim\":\n                  - /url: /en-us/ca/men/ready-to-wear/denim\n              - listitem:\n                - link \"Leather and Shearling\":\n                  - /url: /en-us/ca/men/ready-to-wear/leather\n        - link \"Customer Service\":\n          - /url: /en-us/cp/client-service/client-service/contact-us\n        - link \"My Account\":\n          - /url: /en-us/myaccount\n        - link \"Store Locator\":\n          - /url: /en-us/stores\n        - button:\n          - img\n- main:\n  - group \"1 / 5\":\n    - link \"McQueen double-breasted coat in grey\":\n      - /url: https://alexandermcqueen.com/marketing?pid=852855QKABM1021\n      - img \"McQueen double-breasted coat in grey\"\n  - group \"2 / 5\":\n    - link \"Red Tartan Dress\":\n      - /url: https://alexandermcqueen.com/marketing?pid=858338Q1BGE6130\n      - img \"Red Tartan Dress\"\n  - group \"3 / 5\":\n    - link \"McQueen silver earrings\":\n      - /url: https://alexandermcqueen.com/marketing?pid=854498J161F1046\n      - img \"McQueen silver earrings\"\n  - group \"4 / 5\":\n    - link \"McQueen knee high boots in black\":\n      - /url: https://alexandermcqueen.com/marketing?pid=852025WHAE31000\n      - img \"McQueen knee high boots in black\"\n  - group \"5 / 5\":\n    - link \"Tartan Manta Bag\":\n      - /url: https://alexandermcqueen.com/marketing?pid=8559971VDXB8490\n      - img \"Tartan Manta Bag\"\n- alert"
  },
  {
    "step": 11,
    "timestamp": "2026-01-13T16:30:16.807083",
    "path": [
      "Men",
      "Bags"
    ],
    "action": "clicked: Men > Bags",
    "url": "https://www.alexandermcqueen.com/en-us",
    "new_buttons": [],
    "new_links": {
      "New in": "/en-us/ca/men-new-in",
      "View All": "/en-us/ca/men/bags/view-all",
      "Totes": "/en-us/ca/men/bags/totes",
      "Messenger Bags": "/en-us/ca/men/bags/messenger-bags",
      "T-Bar Sling": "/en-us/ca/the-sling",
      "Store Locator": "/en-us/stores",
      "McQueen double-breasted coat in grey": "https://alexandermcqueen.com/marketing?pid=852855QKABM1021",
      "Red Tartan Dress": "https://alexandermcqueen.com/marketing?pid=858338Q1BGE6130",
      "McQueen silver earrings": "https://alexandermcqueen.com/marketing?pid=854498J161F1046",
      "McQueen knee high boots in black": "https://alexandermcqueen.com/marketing?pid=852025WHAE31000",
      "Tartan Manta Bag": "https://alexandermcqueen.com/marketing?pid=8559971VDXB8490"
    },
    "aria": "- banner:\n  - list:\n    - listitem:\n      - dialog:\n        - img \"Alexander McQueen\"\n        - img \"McQueen Pre SS26 collection for men\"\n        - paragraph: \"Shipping to:\"\n        - button \"United States\"\n        - button \"EN\"\n        - tablist \"Categories\":\n          - tab \"Women\"\n          - tab \"Men\" [selected]\n          - tab \"Gifts\"\n          - tab \"Inside McQueen\"\n        - tabpanel \"Men\":\n          - tablist \"Subcategories\":\n            - tab \"Collections\"\n            - button \"New in\":\n              - link \"New in\":\n                - /url: /en-us/ca/men-new-in\n            - tab \"Ready-to-Wear\"\n            - tab \"Bags\" [selected]\n            - tab \"Shoes\"\n            - tab \"Accessories\"\n            - tab \"Jewellery\"\n          - tabpanel \"Bags\":\n            - list:\n              - listitem:\n                - link \"View All\":\n                  - /url: /en-us/ca/men/bags/view-all\n              - listitem:\n                - link \"Totes\":\n                  - /url: /en-us/ca/men/bags/totes\n              - listitem:\n                - link \"Messenger Bags\":\n                  - /url: /en-us/ca/men/bags/messenger-bags\n            - text: Shop By\n            - list:\n              - listitem:\n                - link \"T-Bar Sling\":\n                  - /url: /en-us/ca/the-sling\n        - link \"Customer Service\":\n          - /url: /en-us/cp/client-service/client-service/contact-us\n        - link \"My Account\":\n          - /url: /en-us/myaccount\n        - link \"Store Locator\":\n          - /url: /en-us/stores\n        - button:\n          - img\n- main:\n  - group \"1 / 5\":\n    - link \"McQueen double-breasted coat in grey\":\n      - /url: https://alexandermcqueen.com/marketing?pid=852855QKABM1021\n      - img \"McQueen double-breasted coat in grey\"\n  - group \"2 / 5\":\n    - link \"Red Tartan Dress\":\n      - /url: https://alexandermcqueen.com/marketing?pid=858338Q1BGE6130\n      - img \"Red Tartan Dress\"\n  - group \"3 / 5\":\n    - link \"McQueen silver earrings\":\n      - /url: https://alexandermcqueen.com/marketing?pid=854498J161F1046\n      - img \"McQueen silver earrings\"\n  - group \"4 / 5\":\n    - link \"McQueen knee high boots in black\":\n      - /url: https://alexandermcqueen.com/marketing?pid=852025WHAE31000\n      - img \"McQueen knee high boots in black\"\n  - group \"5 / 5\":\n    - link \"Tartan Manta Bag\":\n      - /url: https://alexandermcqueen.com/marketing?pid=8559971VDXB8490\n      - img \"Tartan Manta Bag\"\n- alert"
  },
  {
    "step": 12,
    "timestamp": "2026-01-13T16:30:18.049369",
    "path": [
      "Men",
      "Shoes"
    ],
    "action": "clicked: Men > Shoes",
    "url": "https://www.alexandermcqueen.com/en-us",
    "new_buttons": [],
    "new_links": {
      "New in": "/en-us/ca/men-new-in",
      "View all": "/en-us/ca/men/shoes/view-all",
      "Boots": "/en-us/ca/men/shoes/boots",
      "Sneakers": "/en-us/ca/men/shoes/sneakers",
      "Loafers and Lace Ups": "/en-us/ca/men/shoes/loafers-and-lace-ups",
      "Sandals and Slides": "/en-us/ca/men/shoes/sandals-and-slides",
      "EC1 Sneakers": "/en-us/ca/men/shoes/ec1-sneakers",
      "Oversized Sneaker": "/en-us/ca/men/shoes/oversized-sneaker",
      "Tread Slick": "/en-us/ca/men/shoes/tread-slick",
      "Store Locator": "/en-us/stores",
      "McQueen double-breasted coat in grey": "https://alexandermcqueen.com/marketing?pid=852855QKABM1021",
      "Red Tartan Dress": "https://alexandermcqueen.com/marketing?pid=858338Q1BGE6130",
      "McQueen silver earrings": "https://alexandermcqueen.com/marketing?pid=854498J161F1046",
      "McQueen knee high boots in black": "https://alexandermcqueen.com/marketing?pid=852025WHAE31000",
      "Tartan Manta Bag": "https://alexandermcqueen.com/marketing?pid=8559971VDXB8490"
    },
    "aria": "- banner:\n  - list:\n    - listitem:\n      - dialog:\n        - img \"Alexander McQueen\"\n        - img \"McQueen Pre SS26 collection for men\"\n        - paragraph: \"Shipping to:\"\n        - button \"United States\"\n        - button \"EN\"\n        - tablist \"Categories\":\n          - tab \"Women\"\n          - tab \"Men\" [selected]\n          - tab \"Gifts\"\n          - tab \"Inside McQueen\"\n        - tabpanel \"Men\":\n          - tablist \"Subcategories\":\n            - tab \"Collections\"\n            - button \"New in\":\n              - link \"New in\":\n                - /url: /en-us/ca/men-new-in\n            - tab \"Ready-to-Wear\"\n            - tab \"Bags\"\n            - tab \"Shoes\" [selected]\n            - tab \"Accessories\"\n            - tab \"Jewellery\"\n          - tabpanel \"Shoes\":\n            - list:\n              - listitem:\n                - link \"View all\":\n                  - /url: /en-us/ca/men/shoes/view-all\n              - listitem:\n                - link \"Boots\":\n                  - /url: /en-us/ca/men/shoes/boots\n              - listitem:\n                - link \"Sneakers\":\n                  - /url: /en-us/ca/men/shoes/sneakers\n              - listitem:\n                - link \"Loafers and Lace Ups\":\n                  - /url: /en-us/ca/men/shoes/loafers-and-lace-ups\n              - listitem:\n                - link \"Sandals and Slides\":\n                  - /url: /en-us/ca/men/shoes/sandals-and-slides\n            - text: Shop By\n            - list:\n              - listitem:\n                - link \"EC1 Sneakers\":\n                  - /url: /en-us/ca/men/shoes/ec1-sneakers\n              - listitem:\n                - link \"Oversized Sneaker\":\n                  - /url: /en-us/ca/men/shoes/oversized-sneaker\n              - listitem:\n                - link \"Tread Slick\":\n                  - /url: /en-us/ca/men/shoes/tread-slick\n        - link \"Customer Service\":\n          - /url: /en-us/cp/client-service/client-service/contact-us\n        - link \"My Account\":\n          - /url: /en-us/myaccount\n        - link \"Store Locator\":\n          - /url: /en-us/stores\n        - button:\n          - img\n- main:\n  - group \"1 / 5\":\n    - link \"McQueen double-breasted coat in grey\":\n      - /url: https://alexandermcqueen.com/marketing?pid=852855QKABM1021\n      - img \"McQueen double-breasted coat in grey\"\n  - group \"2 / 5\":\n    - link \"Red Tartan Dress\":\n      - /url: https://alexandermcqueen.com/marketing?pid=858338Q1BGE6130\n      - img \"Red Tartan Dress\"\n  - group \"3 / 5\":\n    - link \"McQueen silver earrings\":\n      - /url: https://alexandermcqueen.com/marketing?pid=854498J161F1046\n      - img \"McQueen silver earrings\"\n  - group \"4 / 5\":\n    - link \"McQueen knee high boots in black\":\n      - /url: https://alexandermcqueen.com/marketing?pid=852025WHAE31000\n      - img \"McQueen knee high boots in black\"\n  - group \"5 / 5\":\n    - link \"Tartan Manta Bag\":\n      - /url: https://alexandermcqueen.com/marketing?pid=8559971VDXB8490\n      - img \"Tartan Manta Bag\"\n- alert"
  },
  {
    "step": 13,
    "timestamp": "2026-01-13T16:30:19.281514",
    "path": [
      "Men",
      "Accessories"
    ],
    "action": "clicked: Men > Accessories",
    "url": "https://www.alexandermcqueen.com/en-us",
    "new_buttons": [],
    "new_links": {
      "New in": "/en-us/ca/men-new-in",
      "View All": "/en-us/ca/men/accessories/men-accessories",
      "Scarves": "/en-us/ca/men/accessories/scarves",
      "Wallets and Cardholders": "/en-us/ca/men/accessories/wallets-and-cardholders",
      "Jewellery": "/en-us/ca/men/accessories/jewelry",
      "Ties": "/en-us/ca/men/accessories/ties",
      "Belts": "/en-us/ca/men/accessories/belts",
      "Sunglasses": "/en-us/ca/men/accessories/sunglasses",
      "Other Accessories": "/en-us/ca/men/accessories/other-accessories",
      "Store Locator": "/en-us/stores",
      "McQueen double-breasted coat in grey": "https://alexandermcqueen.com/marketing?pid=852855QKABM1021",
      "Red Tartan Dress": "https://alexandermcqueen.com/marketing?pid=858338Q1BGE6130",
      "McQueen silver earrings": "https://alexandermcqueen.com/marketing?pid=854498J161F1046",
      "McQueen knee high boots in black": "https://alexandermcqueen.com/marketing?pid=852025WHAE31000",
      "Tartan Manta Bag": "https://alexandermcqueen.com/marketing?pid=8559971VDXB8490"
    },
    "aria": "- banner:\n  - list:\n    - listitem:\n      - dialog:\n        - img \"Alexander McQueen\"\n        - img \"McQueen Pre SS26 collection for men\"\n        - paragraph: \"Shipping to:\"\n        - button \"United States\"\n        - button \"EN\"\n        - tablist \"Categories\":\n          - tab \"Women\"\n          - tab \"Men\" [selected]\n          - tab \"Gifts\"\n          - tab \"Inside McQueen\"\n        - tabpanel \"Men\":\n          - tablist \"Subcategories\":\n            - tab \"Collections\"\n            - button \"New in\":\n              - link \"New in\":\n                - /url: /en-us/ca/men-new-in\n            - tab \"Ready-to-Wear\"\n            - tab \"Bags\"\n            - tab \"Shoes\"\n            - tab \"Accessories\" [selected]\n            - tab \"Jewellery\"\n          - tabpanel \"Accessories\":\n            - list:\n              - listitem:\n                - link \"View All\":\n                  - /url: /en-us/ca/men/accessories/men-accessories\n              - listitem:\n                - link \"Scarves\":\n                  - /url: /en-us/ca/men/accessories/scarves\n              - listitem:\n                - link \"Wallets and Cardholders\":\n                  - /url: /en-us/ca/men/accessories/wallets-and-cardholders\n              - listitem:\n                - link \"Jewellery\":\n                  - /url: /en-us/ca/men/accessories/jewelry\n              - listitem:\n                - link \"Ties\":\n                  - /url: /en-us/ca/men/accessories/ties\n              - listitem:\n                - link \"Belts\":\n                  - /url: /en-us/ca/men/accessories/belts\n              - listitem:\n                - link \"Sunglasses\":\n                  - /url: /en-us/ca/men/accessories/sunglasses\n              - listitem:\n                - link \"Other Accessories\":\n                  - /url: /en-us/ca/men/accessories/other-accessories\n        - link \"Customer Service\":\n          - /url: /en-us/cp/client-service/client-service/contact-us\n        - link \"My Account\":\n          - /url: /en-us/myaccount\n        - link \"Store Locator\":\n          - /url: /en-us/stores\n        - button:\n          - img\n- main:\n  - group \"1 / 5\":\n    - link \"McQueen double-breasted coat in grey\":\n      - /url: https://alexandermcqueen.com/marketing?pid=852855QKABM1021\n      - img \"McQueen double-breasted coat in grey\"\n  - group \"2 / 5\":\n    - link \"Red Tartan Dress\":\n      - /url: https://alexandermcqueen.com/marketing?pid=858338Q1BGE6130\n      - img \"Red Tartan Dress\"\n  - group \"3 / 5\":\n    - link \"McQueen silver earrings\":\n      - /url: https://alexandermcqueen.com/marketing?pid=854498J161F1046\n      - img \"McQueen silver earrings\"\n  - group \"4 / 5\":\n    - link \"McQueen knee high boots in black\":\n      - /url: https://alexandermcqueen.com/marketing?pid=852025WHAE31000\n      - img \"McQueen knee high boots in black\"\n  - group \"5 / 5\":\n    - link \"Tartan Manta Bag\":\n      - /url: https://alexandermcqueen.com/marketing?pid=8559971VDXB8490\n      - img \"Tartan Manta Bag\"\n- alert"
  },
  {
    "step": 14,
    "timestamp": "2026-01-13T16:30:20.504914",
    "path": [
      "Men",
      "Jewellery"
    ],
    "action": "clicked: Men > Jewellery",
    "url": "https://www.alexandermcqueen.com/en-us",
    "new_buttons": [],
    "new_links": {
      "New in": "/en-us/ca/men-new-in",
      "View All": "/en-us/ca/men/jewelry/view-all",
      "Necklaces": "/en-us/ca/men/jewelry/necklaces",
      "Bracelets": "/en-us/ca/men/jewelry/bracelets",
      "Earrings": "/en-us/ca/men/jewelry/earrings",
      "Rings": "/en-us/ca/men/jewelry/rings",
      "Store Locator": "/en-us/stores",
      "McQueen double-breasted coat in grey": "https://alexandermcqueen.com/marketing?pid=852855QKABM1021",
      "Red Tartan Dress": "https://alexandermcqueen.com/marketing?pid=858338Q1BGE6130",
      "McQueen silver earrings": "https://alexandermcqueen.com/marketing?pid=854498J161F1046",
      "McQueen knee high boots in black": "https://alexandermcqueen.com/marketing?pid=852025WHAE31000",
      "Tartan Manta Bag": "https://alexandermcqueen.com/marketing?pid=8559971VDXB8490"
    },
    "aria": "- banner:\n  - list:\n    - listitem:\n      - dialog:\n        - img \"Alexander McQueen\"\n        - img \"McQueen Pre SS26 collection for men\"\n        - paragraph: \"Shipping to:\"\n        - button \"United States\"\n        - button \"EN\"\n        - tablist \"Categories\":\n          - tab \"Women\"\n          - tab \"Men\" [selected]\n          - tab \"Gifts\"\n          - tab \"Inside McQueen\"\n        - tabpanel \"Men\":\n          - tablist \"Subcategories\":\n            - tab \"Collections\"\n            - button \"New in\":\n              - link \"New in\":\n                - /url: /en-us/ca/men-new-in\n            - tab \"Ready-to-Wear\"\n            - tab \"Bags\"\n            - tab \"Shoes\"\n            - tab \"Accessories\"\n            - tab \"Jewellery\" [selected]\n          - tabpanel \"Jewellery\":\n            - list:\n              - listitem:\n                - link \"View All\":\n                  - /url: /en-us/ca/men/jewelry/view-all\n              - listitem:\n                - link \"Necklaces\":\n                  - /url: /en-us/ca/men/jewelry/necklaces\n              - listitem:\n                - link \"Bracelets\":\n                  - /url: /en-us/ca/men/jewelry/bracelets\n              - listitem:\n                - link \"Earrings\":\n                  - /url: /en-us/ca/men/jewelry/earrings\n              - listitem:\n                - link \"Rings\":\n                  - /url: /en-us/ca/men/jewelry/rings\n        - link \"Customer Service\":\n          - /url: /en-us/cp/client-service/client-service/contact-us\n        - link \"My Account\":\n          - /url: /en-us/myaccount\n        - link \"Store Locator\":\n          - /url: /en-us/stores\n        - button:\n          - img\n- main:\n  - group \"1 / 5\":\n    - link \"McQueen double-breasted coat in grey\":\n      - /url: https://alexandermcqueen.com/marketing?pid=852855QKABM1021\n      - img \"McQueen double-breasted coat in grey\"\n  - group \"2 / 5\":\n    - link \"Red Tartan Dress\":\n      - /url: https://alexandermcqueen.com/marketing?pid=858338Q1BGE6130\n      - img \"Red Tartan Dress\"\n  - group \"3 / 5\":\n    - link \"McQueen silver earrings\":\n      - /url: https://alexandermcqueen.com/marketing?pid=854498J161F1046\n      - img \"McQueen silver earrings\"\n  - group \"4 / 5\":\n    - link \"McQueen knee high boots in black\":\n      - /url: https://alexandermcqueen.com/marketing?pid=852025WHAE31000\n      - img \"McQueen knee high boots in black\"\n  - group \"5 / 5\":\n    - link \"Tartan Manta Bag\":\n      - /url: https://alexandermcqueen.com/marketing?pid=8559971VDXB8490\n      - img \"Tartan Manta Bag\"\n- alert"
  },
  {
    "step": 15,
    "timestamp": "2026-01-13T16:30:21.252913",
    "path": [
      "Gifts"
    ],
    "action": "clicked: Gifts",
    "url": "https://www.alexandermcqueen.com/en-us",
    "new_buttons": [],
    "new_links": {
      "Explore Gifts": "/en-us/cp/womens-gifts",
      "Handbags": "/en-us/ca/gifts/gifts-for-her/handbags",
      "Sneakers": "/en-us/ca/gifts/gifts-for-her/sneakers",
      "Scarves": "/en-us/ca/gifts/gifts-for-her/scarves",
      "Jewellery": "/en-us/ca/gifts/gifts-for-her/jewellery",
      "Wallets and Cardholders": "/en-us/ca/gifts/gifts-for-her/wallets-and-cardholders",
      "Store Locator": "/en-us/stores",
      "McQueen double-breasted coat in grey": "https://alexandermcqueen.com/marketing?pid=852855QKABM1021",
      "Red Tartan Dress": "https://alexandermcqueen.com/marketing?pid=858338Q1BGE6130",
      "McQueen silver earrings": "https://alexandermcqueen.com/marketing?pid=854498J161F1046",
      "McQueen knee high boots in black": "https://alexandermcqueen.com/marketing?pid=852025WHAE31000",
      "Tartan Manta Bag": "https://alexandermcqueen.com/marketing?pid=8559971VDXB8490"
    },
    "aria": "- banner:\n  - list:\n    - listitem:\n      - dialog:\n        - img \"Alexander McQueen\"\n        - img \"McQueen pumps with skull charm\"\n        - paragraph: \"Shipping to:\"\n        - button \"United States\"\n        - button \"EN\"\n        - tablist \"Categories\":\n          - tab \"Women\"\n          - tab \"Men\"\n          - tab \"Gifts\" [selected]\n          - tab \"Inside McQueen\"\n        - tabpanel \"Gifts\":\n          - tablist \"Subcategories\":\n            - tab \"Gifts for Her\" [selected]\n            - tab \"Gifts for Him\"\n          - tabpanel \"Gifts for Her\":\n            - list:\n              - listitem:\n                - link \"Explore Gifts\":\n                  - /url: /en-us/cp/womens-gifts\n              - listitem:\n                - link \"Handbags\":\n                  - /url: /en-us/ca/gifts/gifts-for-her/handbags\n              - listitem:\n                - link \"Sneakers\":\n                  - /url: /en-us/ca/gifts/gifts-for-her/sneakers\n              - listitem:\n                - link \"Scarves\":\n                  - /url: /en-us/ca/gifts/gifts-for-her/scarves\n              - listitem:\n                - link \"Jewellery\":\n                  - /url: /en-us/ca/gifts/gifts-for-her/jewellery\n              - listitem:\n                - link \"Wallets and Cardholders\":\n                  - /url: /en-us/ca/gifts/gifts-for-her/wallets-and-cardholders\n        - link \"Customer Service\":\n          - /url: /en-us/cp/client-service/client-service/contact-us\n        - link \"My Account\":\n          - /url: /en-us/myaccount\n        - link \"Store Locator\":\n          - /url: /en-us/stores\n        - button:\n          - img\n- main:\n  - group \"1 / 5\":\n    - link \"McQueen double-breasted coat in grey\":\n      - /url: https://alexandermcqueen.com/marketing?pid=852855QKABM1021\n      - img \"McQueen double-breasted coat in grey\"\n  - group \"2 / 5\":\n    - link \"Red Tartan Dress\":\n      - /url: https://alexandermcqueen.com/marketing?pid=858338Q1BGE6130\n      - img \"Red Tartan Dress\"\n  - group \"3 / 5\":\n    - link \"McQueen silver earrings\":\n      - /url: https://alexandermcqueen.com/marketing?pid=854498J161F1046\n      - img \"McQueen silver earrings\"\n  - group \"4 / 5\":\n    - link \"McQueen knee high boots in black\":\n      - /url: https://alexandermcqueen.com/marketing?pid=852025WHAE31000\n      - img \"McQueen knee high boots in black\"\n  - group \"5 / 5\":\n    - link \"Tartan Manta Bag\":\n      - /url: https://alexandermcqueen.com/marketing?pid=8559971VDXB8490\n      - img \"Tartan Manta Bag\"\n- alert"
  },
  {
    "step": 16,
    "timestamp": "2026-01-13T16:30:27.764562",
    "path": [
      "Gifts",
      "Gifts for Her"
    ],
    "action": "clicked: Gifts > Gifts for Her",
    "url": "https://www.alexandermcqueen.com/en-us",
    "new_buttons": [],
    "new_links": {
      "Explore Gifts": "/en-us/cp/womens-gifts",
      "Handbags": "/en-us/ca/gifts/gifts-for-her/handbags",
      "Sneakers": "/en-us/ca/gifts/gifts-for-her/sneakers",
      "Scarves": "/en-us/ca/gifts/gifts-for-her/scarves",
      "Jewellery": "/en-us/ca/gifts/gifts-for-her/jewellery",
      "Wallets and Cardholders": "/en-us/ca/gifts/gifts-for-her/wallets-and-cardholders",
      "Store Locator": "/en-us/stores",
      "McQueen double-breasted coat in grey": "https://alexandermcqueen.com/marketing?pid=852855QKABM1021",
      "Red Tartan Dress": "https://alexandermcqueen.com/marketing?pid=858338Q1BGE6130",
      "McQueen silver earrings": "https://alexandermcqueen.com/marketing?pid=854498J161F1046",
      "McQueen knee high boots in black": "https://alexandermcqueen.com/marketing?pid=852025WHAE31000",
      "Tartan Manta Bag": "https://alexandermcqueen.com/marketing?pid=8559971VDXB8490"
    },
    "aria": "- banner:\n  - list:\n    - listitem:\n      - dialog:\n        - img \"Alexander McQueen\"\n        - img \"McQueen pumps with skull charm\"\n        - paragraph: \"Shipping to:\"\n        - button \"United States\"\n        - button \"EN\"\n        - tablist \"Categories\":\n          - tab \"Women\"\n          - tab \"Men\"\n          - tab \"Gifts\" [selected]\n          - tab \"Inside McQueen\"\n        - tabpanel \"Gifts\":\n          - tablist \"Subcategories\":\n            - tab \"Gifts for Her\" [selected]\n            - tab \"Gifts for Him\"\n          - tabpanel \"Gifts for Her\":\n            - list:\n              - listitem:\n                - link \"Explore Gifts\":\n                  - /url: /en-us/cp/womens-gifts\n              - listitem:\n                - link \"Handbags\":\n                  - /url: /en-us/ca/gifts/gifts-for-her/handbags\n              - listitem:\n                - link \"Sneakers\":\n                  - /url: /en-us/ca/gifts/gifts-for-her/sneakers\n              - listitem:\n                - link \"Scarves\":\n                  - /url: /en-us/ca/gifts/gifts-for-her/scarves\n              - listitem:\n                - link \"Jewellery\":\n                  - /url: /en-us/ca/gifts/gifts-for-her/jewellery\n              - listitem:\n                - link \"Wallets and Cardholders\":\n                  - /url: /en-us/ca/gifts/gifts-for-her/wallets-and-cardholders\n        - link \"Customer Service\":\n          - /url: /en-us/cp/client-service/client-service/contact-us\n        - link \"My Account\":\n          - /url: /en-us/myaccount\n        - link \"Store Locator\":\n          - /url: /en-us/stores\n        - button:\n          - img\n- main:\n  - group \"1 / 5\":\n    - link \"McQueen double-breasted coat in grey\":\n      - /url: https://alexandermcqueen.com/marketing?pid=852855QKABM1021\n      - img \"McQueen double-breasted coat in grey\"\n  - group \"2 / 5\":\n    - link \"Red Tartan Dress\":\n      - /url: https://alexandermcqueen.com/marketing?pid=858338Q1BGE6130\n      - img \"Red Tartan Dress\"\n  - group \"3 / 5\":\n    - link \"McQueen silver earrings\":\n      - /url: https://alexandermcqueen.com/marketing?pid=854498J161F1046\n      - img \"McQueen silver earrings\"\n  - group \"4 / 5\":\n    - link \"McQueen knee high boots in black\":\n      - /url: https://alexandermcqueen.com/marketing?pid=852025WHAE31000\n      - img \"McQueen knee high boots in black\"\n  - group \"5 / 5\":\n    - link \"Tartan Manta Bag\":\n      - /url: https://alexandermcqueen.com/marketing?pid=8559971VDXB8490\n      - img \"Tartan Manta Bag\"\n- alert"
  },
  {
    "step": 17,
    "timestamp": "2026-01-13T16:30:29.001198",
    "path": [
      "Gifts",
      "Gifts for Him"
    ],
    "action": "clicked: Gifts > Gifts for Him",
    "url": "https://www.alexandermcqueen.com/en-us",
    "new_buttons": [],
    "new_links": {
      "Explore Gifts": "/en-us/cp/mens-gifts",
      "Bags": "/en-us/ca/gifts/gifts-for-him/bags",
      "Sneakers": "/en-us/ca/gifts/gifts-for-him/sneakers",
      "Jewellery": "/en-us/ca/gifts/gifts-for-him/jewellery",
      "Wallets and Cardholders": "/en-us/ca/gifts/gifts-for-him/wallets-and-cardholders",
      "Scarves": "/en-us/ca/gifts/gifts-for-him/scarves",
      "Store Locator": "/en-us/stores",
      "McQueen double-breasted coat in grey": "https://alexandermcqueen.com/marketing?pid=852855QKABM1021",
      "Red Tartan Dress": "https://alexandermcqueen.com/marketing?pid=858338Q1BGE6130",
      "McQueen silver earrings": "https://alexandermcqueen.com/marketing?pid=854498J161F1046",
      "McQueen knee high boots in black": "https://alexandermcqueen.com/marketing?pid=852025WHAE31000",
      "Tartan Manta Bag": "https://alexandermcqueen.com/marketing?pid=8559971VDXB8490"
    },
    "aria": "- banner:\n  - list:\n    - listitem:\n      - dialog:\n        - img \"Alexander McQueen\"\n        - img \"McQueen pumps with skull charm\"\n        - paragraph: \"Shipping to:\"\n        - button \"United States\"\n        - button \"EN\"\n        - tablist \"Categories\":\n          - tab \"Women\"\n          - tab \"Men\"\n          - tab \"Gifts\" [selected]\n          - tab \"Inside McQueen\"\n        - tabpanel \"Gifts\":\n          - tablist \"Subcategories\":\n            - tab \"Gifts for Her\"\n            - tab \"Gifts for Him\" [selected]\n          - tabpanel \"Gifts for Him\":\n            - list:\n              - listitem:\n                - link \"Explore Gifts\":\n                  - /url: /en-us/cp/mens-gifts\n              - listitem:\n                - link \"Bags\":\n                  - /url: /en-us/ca/gifts/gifts-for-him/bags\n              - listitem:\n                - link \"Sneakers\":\n                  - /url: /en-us/ca/gifts/gifts-for-him/sneakers\n              - listitem:\n                - link \"Jewellery\":\n                  - /url: /en-us/ca/gifts/gifts-for-him/jewellery\n              - listitem:\n                - link \"Wallets and Cardholders\":\n                  - /url: /en-us/ca/gifts/gifts-for-him/wallets-and-cardholders\n              - listitem:\n                - link \"Scarves\":\n                  - /url: /en-us/ca/gifts/gifts-for-him/scarves\n        - link \"Customer Service\":\n          - /url: /en-us/cp/client-service/client-service/contact-us\n        - link \"My Account\":\n          - /url: /en-us/myaccount\n        - link \"Store Locator\":\n          - /url: /en-us/stores\n        - button:\n          - img\n- main:\n  - group \"1 / 5\":\n    - link \"McQueen double-breasted coat in grey\":\n      - /url: https://alexandermcqueen.com/marketing?pid=852855QKABM1021\n      - img \"McQueen double-breasted coat in grey\"\n  - group \"2 / 5\":\n    - link \"Red Tartan Dress\":\n      - /url: https://alexandermcqueen.com/marketing?pid=858338Q1BGE6130\n      - img \"Red Tartan Dress\"\n  - group \"3 / 5\":\n    - link \"McQueen silver earrings\":\n      - /url: https://alexandermcqueen.com/marketing?pid=854498J161F1046\n      - img \"McQueen silver earrings\"\n  - group \"4 / 5\":\n    - link \"McQueen knee high boots in black\":\n      - /url: https://alexandermcqueen.com/marketing?pid=852025WHAE31000\n      - img \"McQueen knee high boots in black\"\n  - group \"5 / 5\":\n    - link \"Tartan Manta Bag\":\n      - /url: https://alexandermcqueen.com/marketing?pid=8559971VDXB8490\n      - img \"Tartan Manta Bag\"\n- alert"
  },
  {
    "step": 18,
    "timestamp": "2026-01-13T16:30:29.742718",
    "path": [
      "Inside McQueen"
    ],
    "action": "clicked: Inside McQueen",
    "url": "https://www.alexandermcqueen.com/en-us",
    "new_buttons": [],
    "new_links": {
      "About McQueen": "/en-us/about-the-house",
      "Stories": "/en-us/stories",
      "Collection Library": "/en-us/collections",
      "Store Locator": "/en-us/stores",
      "McQueen double-breasted coat in grey": "https://alexandermcqueen.com/marketing?pid=852855QKABM1021",
      "Red Tartan Dress": "https://alexandermcqueen.com/marketing?pid=858338Q1BGE6130",
      "McQueen silver earrings": "https://alexandermcqueen.com/marketing?pid=854498J161F1046",
      "McQueen knee high boots in black": "https://alexandermcqueen.com/marketing?pid=852025WHAE31000",
      "Tartan Manta Bag": "https://alexandermcqueen.com/marketing?pid=8559971VDXB8490"
    },
    "aria": "- banner:\n  - list:\n    - listitem:\n      - dialog:\n        - img \"Alexander McQueen\"\n        - img \"McQueen PreSS26 Campaign\"\n        - paragraph: \"Shipping to:\"\n        - button \"United States\"\n        - button \"EN\"\n        - tablist \"Categories\":\n          - tab \"Women\"\n          - tab \"Men\"\n          - tab \"Gifts\"\n          - tab \"Inside McQueen\" [selected]\n        - tabpanel \"Inside McQueen\":\n          - tablist \"Subcategories\":\n            - button \"About McQueen\":\n              - link \"About McQueen\":\n                - /url: /en-us/about-the-house\n            - button \"Stories\":\n              - link \"Stories\":\n                - /url: /en-us/stories\n            - button \"Collection Library\":\n              - link \"Collection Library\":\n                - /url: /en-us/collections\n          - tabpanel\n        - link \"Customer Service\":\n          - /url: /en-us/cp/client-service/client-service/contact-us\n        - link \"My Account\":\n          - /url: /en-us/myaccount\n        - link \"Store Locator\":\n          - /url: /en-us/stores\n        - button:\n          - img\n- main:\n  - group \"1 / 5\":\n    - link \"McQueen double-breasted coat in grey\":\n      - /url: https://alexandermcqueen.com/marketing?pid=852855QKABM1021\n      - img \"McQueen double-breasted coat in grey\"\n  - group \"2 / 5\":\n    - link \"Red Tartan Dress\":\n      - /url: https://alexandermcqueen.com/marketing?pid=858338Q1BGE6130\n      - img \"Red Tartan Dress\"\n  - group \"3 / 5\":\n    - link \"McQueen silver earrings\":\n      - /url: https://alexandermcqueen.com/marketing?pid=854498J161F1046\n      - img \"McQueen silver earrings\"\n  - group \"4 / 5\":\n    - link \"McQueen knee high boots in black\":\n      - /url: https://alexandermcqueen.com/marketing?pid=852025WHAE31000\n      - img \"McQueen knee high boots in black\"\n  - group \"5 / 5\":\n    - link \"Tartan Manta Bag\":\n      - /url: https://alexandermcqueen.com/marketing?pid=8559971VDXB8490\n      - img \"Tartan Manta Bag\"\n- alert"
  },
  {
    "step": 19,
    "timestamp": "2026-01-13T16:30:36.479660",
    "path": [
      "Inside McQueen",
      "About McQueen"
    ],
    "action": "clicked: Inside McQueen > About McQueen",
    "url": "https://www.alexandermcqueen.com/en-us",
    "new_buttons": [],
    "new_links": {
      "About McQueen": "/en-us/about-the-house",
      "Stories": "/en-us/stories",
      "Collection Library": "/en-us/collections",
      "Store Locator": "/en-us/stores",
      "McQueen double-breasted coat in grey": "https://alexandermcqueen.com/marketing?pid=852855QKABM1021",
      "Red Tartan Dress": "https://alexandermcqueen.com/marketing?pid=858338Q1BGE6130",
      "McQueen silver earrings": "https://alexandermcqueen.com/marketing?pid=854498J161F1046",
      "McQueen knee high boots in black": "https://alexandermcqueen.com/marketing?pid=852025WHAE31000",
      "Tartan Manta Bag": "https://alexandermcqueen.com/marketing?pid=8559971VDXB8490"
    },
    "aria": "- banner:\n  - list:\n    - listitem:\n      - dialog:\n        - img \"Alexander McQueen\"\n        - img \"McQueen PreSS26 Campaign\"\n        - paragraph: \"Shipping to:\"\n        - button \"United States\"\n        - button \"EN\"\n        - tablist \"Categories\":\n          - tab \"Women\"\n          - tab \"Men\"\n          - tab \"Gifts\"\n          - tab \"Inside McQueen\" [selected]\n        - tabpanel \"Inside McQueen\":\n          - tablist \"Subcategories\":\n            - button \"About McQueen\":\n              - link \"About McQueen\":\n                - /url: /en-us/about-the-house\n            - button \"Stories\":\n              - link \"Stories\":\n                - /url: /en-us/stories\n            - button \"Collection Library\":\n              - link \"Collection Library\":\n                - /url: /en-us/collections\n          - tabpanel\n        - link \"Customer Service\":\n          - /url: /en-us/cp/client-service/client-service/contact-us\n        - link \"My Account\":\n          - /url: /en-us/myaccount\n        - link \"Store Locator\":\n          - /url: /en-us/stores\n        - button:\n          - img\n- main:\n  - group \"1 / 5\":\n    - link \"McQueen double-breasted coat in grey\":\n      - /url: https://alexandermcqueen.com/marketing?pid=852855QKABM1021\n      - img \"McQueen double-breasted coat in grey\"\n  - group \"2 / 5\":\n    - link \"Red Tartan Dress\":\n      - /url: https://alexandermcqueen.com/marketing?pid=858338Q1BGE6130\n      - img \"Red Tartan Dress\"\n  - group \"3 / 5\":\n    - link \"McQueen silver earrings\":\n      - /url: https://alexandermcqueen.com/marketing?pid=854498J161F1046\n      - img \"McQueen silver earrings\"\n  - group \"4 / 5\":\n    - link \"McQueen knee high boots in black\":\n      - /url: https://alexandermcqueen.com/marketing?pid=852025WHAE31000\n      - img \"McQueen knee high boots in black\"\n  - group \"5 / 5\":\n    - link \"Tartan Manta Bag\":\n      - /url: https://alexandermcqueen.com/marketing?pid=8559971VDXB8490\n      - img \"Tartan Manta Bag\"\n- alert"
  }
]