[
  {
    "step": 0,
    "timestamp": "2026-01-09T16:14:09.997927",
    "path": [],
    "action": "initial_load",
    "url": "https://www.stussy.com/",
    "new_buttons": [],
    "new_links": {},
    "aria": "- region \"cookieconsent\":\n  - text: St\u00fcssy uses cookies (internal and third-party) to remember your preferences and tailor your visit at stussy.com. Click ACCEPT ALL to get the most personalized experience or choose preferences for which purposes you allow the use of cookies. For more information,\n  - link \"visit the Privacy Policy.\":\n    - /url: https://www.stussy.com/pages/legal?open=Legal-privacy\n  - button \"settings cookies\": PREFERENCES\n  - button \"allow cookies\": ACCEPT ALL\n- link \"Skip to content\":\n  - /url: \"#MainContent\"\n- banner:\n  - heading \"St\u00fcssy homepage\" [level=1]:\n    - link \"St\u00fcssy homepage\":\n      - /url: /\n      - img \"St\u00fcssy\"\n  - navigation \"Site Menu\":\n    - link \"Shop\":\n      - /url: /collections/new-arrivals\n    - button \"Caret\":\n      - img \"Caret\"\n    - link \"Archive\":\n      - /url: /blogs/news\n    - link \"Support\":\n      - /url: /pages/customer-support\n    - button \"Caret\":\n      - img \"Caret\"\n  - button \"SEARCH\"\n  - button \"Select Country & Currency\": US / $\n  - button \"Open Cart\": Bag\n- list\n- main:\n  - link:\n    - /url: /collections/new-arrivals\n    - img\n- contentinfo:\n  - button \"Newsletter\"\n  - text: \u00a9 2026 ST\u00dcSSY"
  },
  {
    "step": 1,
    "timestamp": "2026-01-09T16:14:19.884865",
    "path": [
      "Shop"
    ],
    "action": "clicked: Shop",
    "url": "https://www.stussy.com/collections/new-arrivals",
    "new_buttons": [],
    "new_links": {
      "Shop - New Arrivals": "/collections/new-arrivals",
      "Shop - Tees": "/collections/tees",
      "Shop - Outerwear": "/collections/outerwear",
      "Shop - Sweats": "/collections/sweats",
      "Shop - Tops & Shirts": "/collections/tops-shirts",
      "Shop - Knits": "/collections/knits",
      "Shop - Pants": "/collections/pants",
      "Shop - Shorts": "/collections/shorts",
      "Shop - Denim": "/collections/denim",
      "Shop - Headwear": "/collections/headwear",
      "Shop - Sunglasses": "/collections/sunglasses",
      "Shop - Accessories": "/collections/accessories",
      "Woodland Camo BASIC ST\u00dcSSY THERMAL": "/collections/new-arrivals/products/1140356-basic-stussy-thermal-woodland-camo",
      "BASIC ST\u00dcSSY THERMAL": "/collections/new-arrivals/products/1140356-basic-stussy-thermal-pale-yellow",
      "BASIC ST\u00dcSSY THERMAL, size XS": "/collections/new-arrivals/products/1140356-basic-stussy-thermal-pale-yellow?variant=42159272165472",
      "BASIC ST\u00dcSSY THERMAL, size S": "/collections/new-arrivals/products/1140356-basic-stussy-thermal-pale-yellow?variant=42159272198240",
      "BASIC ST\u00dcSSY THERMAL, size M": "/collections/new-arrivals/products/1140356-basic-stussy-thermal-pale-yellow?variant=42159272231008",
      "BASIC ST\u00dcSSY THERMAL, size L": "/collections/new-arrivals/products/1140356-basic-stussy-thermal-pale-yellow?variant=42159272263776",
      "BASIC ST\u00dcSSY THERMAL, size XL": "/collections/new-arrivals/products/1140356-basic-stussy-thermal-pale-yellow?variant=42159272296544",
      "BASIC ST\u00dcSSY THERMAL, size XXL": "/collections/new-arrivals/products/1140356-basic-stussy-thermal-pale-yellow?variant=42159272329312",
      "Leopard BASIC ST\u00dcSSY THERMAL": "/collections/new-arrivals/products/1140356-basic-stussy-thermal-leopard",
      "Dust Blue BASIC ST\u00dcSSY THERMAL": "/collections/new-arrivals/products/1140356-basic-stussy-thermal-dust-blue",
      "Pale Yellow BASIC ST\u00dcSSY THERMAL": "/collections/new-arrivals/products/1140356-basic-stussy-thermal-pale-yellow",
      "Blue Stripe OXFORD SHIRT": "/collections/new-arrivals/products/1110364-oxford-shirt-blue-stripe",
      "OXFORD SHIRT": "/collections/new-arrivals/products/1110364-oxford-shirt-blue-stripe",
      "OXFORD SHIRT, size S": "/collections/new-arrivals/products/1110364-oxford-shirt-blue-stripe?variant=41533672161376",
      "OXFORD SHIRT, size M": "/collections/new-arrivals/products/1110364-oxford-shirt-blue-stripe?variant=41533672194144",
      "OXFORD SHIRT, size L": "/collections/new-arrivals/products/1110364-oxford-shirt-blue-stripe?variant=41533672226912",
      "OXFORD SHIRT, size XL": "/collections/new-arrivals/products/1110364-oxford-shirt-blue-stripe?variant=41533672259680",
      "OXFORD SHIRT, size XXL": "/collections/new-arrivals/products/1110364-oxford-shirt-blue-stripe?variant=41533672292448",
      "White STANDARD SHIRT": "/collections/new-arrivals/products/1110357-standard-shirt-white",
      "STANDARD SHIRT": "/collections/new-arrivals/products/1110357-standard-shirt-white",
      "STANDARD SHIRT, size S": "/collections/new-arrivals/products/1110357-standard-shirt-white?variant=41119447318624",
      "STANDARD SHIRT, size M": "/collections/new-arrivals/products/1110357-standard-shirt-white?variant=41119447351392",
      "STANDARD SHIRT, size L": "/collections/new-arrivals/products/1110357-standard-shirt-white?variant=41119447384160",
      "STANDARD SHIRT, size XL": "/collections/new-arrivals/products/1110357-standard-shirt-white?variant=41119447416928",
      "STANDARD SHIRT, size XXL": "/collections/new-arrivals/products/1110357-standard-shirt-white?variant=41119447449696",
      "Ash Heather PATCH ZIP KNIT HOODIE": "/collections/new-arrivals/products/118593-patch-zip-knit-hoodie-ash-heather",
      "PATCH ZIP KNIT HOODIE": "/collections/new-arrivals/products/118593-patch-zip-knit-hoodie-ash-heather",
      "PATCH ZIP KNIT HOODIE, size S": "/collections/new-arrivals/products/118593-patch-zip-knit-hoodie-ash-heather?variant=41755057094752",
      "PATCH ZIP KNIT HOODIE, size M": "/collections/new-arrivals/products/118593-patch-zip-knit-hoodie-ash-heather?variant=41755057127520",
      "PATCH ZIP KNIT HOODIE, size L": "/collections/new-arrivals/products/118593-patch-zip-knit-hoodie-ash-heather?variant=41755057160288",
      "PATCH ZIP KNIT HOODIE, size XL": "/collections/new-arrivals/products/118593-patch-zip-knit-hoodie-ash-heather?variant=41755057193056",
      "PATCH ZIP KNIT HOODIE, size XXL": "/collections/new-arrivals/products/118593-patch-zip-knit-hoodie-ash-heather?variant=41755057225824",
      "Indigo RAW DENIM WORK SHORT": "/collections/new-arrivals/products/112337-raw-denim-work-short-indigo",
      "RAW DENIM WORK SHORT": "/collections/new-arrivals/products/112337-raw-denim-work-short-indigo",
      "RAW DENIM WORK SHORT, size 28": "/collections/new-arrivals/products/112337-raw-denim-work-short-indigo?variant=41436710961248",
      "RAW DENIM WORK SHORT, size 30": "/collections/new-arrivals/products/112337-raw-denim-work-short-indigo?variant=41436710994016",
      "RAW DENIM WORK SHORT, size 32": "/collections/new-arrivals/products/112337-raw-denim-work-short-indigo?variant=41436711026784",
      "RAW DENIM WORK SHORT, size 34": "/collections/new-arrivals/products/112337-raw-denim-work-short-indigo?variant=41436711059552",
      "RAW DENIM WORK SHORT, size 36": "/collections/new-arrivals/products/112337-raw-denim-work-short-indigo?variant=41436711092320",
      "RAW DENIM WORK SHORT, size 38": "/collections/new-arrivals/products/112337-raw-denim-work-short-indigo?variant=41436711125088",
      "Ocean BASIC ST\u00dcSSY SKULLCAP": "/collections/new-arrivals/products/1321263-basic-stussy-skullcap-ocean",
      "BASIC ST\u00dcSSY SKULLCAP": "/collections/new-arrivals/products/1321263-basic-stussy-skullcap-rose-pink",
      "Sport Red BASIC ST\u00dcSSY SKULLCAP": "/collections/new-arrivals/products/1321263-basic-stussy-skullcap-sport-red",
      "Rose Pink BASIC ST\u00dcSSY SKULLCAP": "/collections/new-arrivals/products/1321263-basic-stussy-skullcap-rose-pink",
      "Matte Silver/Sunflare Mirror SIMON SUNGLASSES": "/collections/new-arrivals/products/338410-simon-sunglasses-matte-silver-sunflare-mirror-lens",
      "SIMON SUNGLASSES": "/collections/new-arrivals/products/338410-simon-sunglasses-matte-silver-sunflare-mirror-lens",
      "Black DOWN PUFFER WRINKLED NYLON": "/collections/new-arrivals/products/115729-down-puffer-wrinkled-nylon-black",
      "DOWN PUFFER WRINKLED NYLON": "/collections/new-arrivals/products/115729-down-puffer-wrinkled-nylon-black",
      "DOWN PUFFER WRINKLED NYLON, size XS": "/collections/new-arrivals/products/115729-down-puffer-wrinkled-nylon-black?variant=39656152236128",
      "DOWN PUFFER WRINKLED NYLON, size S": "/collections/new-arrivals/products/115729-down-puffer-wrinkled-nylon-black?variant=39656152301664",
      "DOWN PUFFER WRINKLED NYLON, size M": "/collections/new-arrivals/products/115729-down-puffer-wrinkled-nylon-black?variant=39656152203360",
      "DOWN PUFFER WRINKLED NYLON, size L": "/collections/new-arrivals/products/115729-down-puffer-wrinkled-nylon-black?variant=39656152268896",
      "DOWN PUFFER WRINKLED NYLON, size XL": "/collections/new-arrivals/products/115729-down-puffer-wrinkled-nylon-black?variant=39656152170592",
      "DOWN PUFFER WRINKLED NYLON, size XXL": "/collections/new-arrivals/products/115729-down-puffer-wrinkled-nylon-black?variant=39656152137824",
      "Digi Camo MICRO RIPSTOP DOWN JACKET": "/collections/new-arrivals/products/115877-micro-ripstop-down-jacket-digi-camo",
      "MICRO RIPSTOP DOWN JACKET": "/collections/new-arrivals/products/115877-micro-ripstop-down-jacket-digi-camo",
      "MICRO RIPSTOP DOWN JACKET, size S": "/collections/new-arrivals/products/115877-micro-ripstop-down-jacket-digi-camo?variant=41754983432288",
      "MICRO RIPSTOP DOWN JACKET, size M": "/collections/new-arrivals/products/115877-micro-ripstop-down-jacket-digi-camo?variant=41754983465056",
      "MICRO RIPSTOP DOWN JACKET, size L": "/collections/new-arrivals/products/115877-micro-ripstop-down-jacket-digi-camo?variant=41754983497824",
      "MICRO RIPSTOP DOWN JACKET, size XL": "/collections/new-arrivals/products/115877-micro-ripstop-down-jacket-digi-camo?variant=41754983530592",
      "MICRO RIPSTOP DOWN JACKET, size XXL": "/collections/new-arrivals/products/115877-micro-ripstop-down-jacket-digi-camo?variant=41754983563360",
      "Olive MANTRA RAGLAN THERMAL": "/collections/new-arrivals/products/1140395-mantra-raglan-thermal-olive",
      "MANTRA RAGLAN THERMAL": "/collections/new-arrivals/products/1140395-mantra-raglan-thermal-pink",
      "MANTRA RAGLAN THERMAL, size S": "/collections/new-arrivals/products/1140395-mantra-raglan-thermal-pink?variant=42159162196064",
      "MANTRA RAGLAN THERMAL, size M": "/collections/new-arrivals/products/1140395-mantra-raglan-thermal-pink?variant=42159162228832",
      "MANTRA RAGLAN THERMAL, size L": "/collections/new-arrivals/products/1140395-mantra-raglan-thermal-pink?variant=42159162261600",
      "MANTRA RAGLAN THERMAL, size XL": "/collections/new-arrivals/products/1140395-mantra-raglan-thermal-pink?variant=42159162294368",
      "MANTRA RAGLAN THERMAL, size XXL": "/collections/new-arrivals/products/1140395-mantra-raglan-thermal-pink?variant=42159162327136",
      "White MANTRA RAGLAN THERMAL": "/collections/new-arrivals/products/1140395-mantra-raglan-thermal-white",
      "Washed Black MANTRA RAGLAN THERMAL": "/collections/new-arrivals/products/1140395-mantra-raglan-thermal-washed-black",
      "Pink MANTRA RAGLAN THERMAL": "/collections/new-arrivals/products/1140395-mantra-raglan-thermal-pink",
      "Khaki RELAXED HOODIE": "/collections/new-arrivals/products/118572-relaxed-hoodie-khaki",
      "RELAXED HOODIE": "/collections/new-arrivals/products/118572-relaxed-hoodie-khaki",
      "RELAXED HOODIE, size S": "/collections/new-arrivals/products/118572-relaxed-hoodie-khaki?variant=41119541035104",
      "RELAXED HOODIE, size M": "/collections/new-arrivals/products/118572-relaxed-hoodie-khaki?variant=41119541067872",
      "RELAXED HOODIE, size L": "/collections/new-arrivals/products/118572-relaxed-hoodie-khaki?variant=41119541100640",
      "RELAXED HOODIE, size XL": "/collections/new-arrivals/products/118572-relaxed-hoodie-khaki?variant=41119541133408",
      "RELAXED HOODIE, size XXL": "/collections/new-arrivals/products/118572-relaxed-hoodie-khaki?variant=41119541166176",
      "Sand Camo BASIC MESH SHORT": "/collections/new-arrivals/products/112335-basic-mesh-short-sand-camo",
      "BASIC MESH SHORT": "/collections/new-arrivals/products/112335-basic-mesh-short-sand-camo",
      "BASIC MESH SHORT, size S": "/collections/new-arrivals/products/112335-basic-mesh-short-sand-camo?variant=41340350562400",
      "BASIC MESH SHORT, size M": "/collections/new-arrivals/products/112335-basic-mesh-short-sand-camo?variant=41340350595168",
      "BASIC MESH SHORT, size L": "/collections/new-arrivals/products/112335-basic-mesh-short-sand-camo?variant=41340350627936",
      "BASIC MESH SHORT, size XL": "/collections/new-arrivals/products/112335-basic-mesh-short-sand-camo?variant=41340350660704",
      "BASIC MESH SHORT, size XXL": "/collections/new-arrivals/products/112335-basic-mesh-short-sand-camo?variant=41340350693472",
      "Black SHERPA PANELED HOODED JACKET": "/collections/new-arrivals/products/118530-sherpa-paneled-hooded-jacket-black",
      "SHERPA PANELED HOODED JACKET": "/collections/new-arrivals/products/118530-sherpa-paneled-hooded-jacket-black",
      "SHERPA PANELED HOODED JACKET, size XS": "/collections/new-arrivals/products/118530-sherpa-paneled-hooded-jacket-black?variant=39643762688096",
      "SHERPA PANELED HOODED JACKET, size S": "/collections/new-arrivals/products/118530-sherpa-paneled-hooded-jacket-black?variant=39643762720864",
      "SHERPA PANELED HOODED JACKET, size M": "/collections/new-arrivals/products/118530-sherpa-paneled-hooded-jacket-black?variant=39643762753632",
      "SHERPA PANELED HOODED JACKET, size L": "/collections/new-arrivals/products/118530-sherpa-paneled-hooded-jacket-black?variant=39643762786400",
      "SHERPA PANELED HOODED JACKET, size XL": "/collections/new-arrivals/products/118530-sherpa-paneled-hooded-jacket-black?variant=39643762819168",
      "SHERPA PANELED HOODED JACKET, size XXL": "/collections/new-arrivals/products/118530-sherpa-paneled-hooded-jacket-black?variant=39643762851936",
      "Black SHERPA REVERSIBLE JACKET": "/collections/new-arrivals/products/118529-sherpa-reversible-jacket-black",
      "SHERPA REVERSIBLE JACKET": "/collections/new-arrivals/products/118529-sherpa-reversible-jacket-black",
      "SHERPA REVERSIBLE JACKET, size XS": "/collections/new-arrivals/products/118529-sherpa-reversible-jacket-black?variant=39643760590944",
      "SHERPA REVERSIBLE JACKET, size S": "/collections/new-arrivals/products/118529-sherpa-reversible-jacket-black?variant=39643760623712",
      "SHERPA REVERSIBLE JACKET, size M": "/collections/new-arrivals/products/118529-sherpa-reversible-jacket-black?variant=39643760656480",
      "SHERPA REVERSIBLE JACKET, size L": "/collections/new-arrivals/products/118529-sherpa-reversible-jacket-black?variant=39643760689248",
      "SHERPA REVERSIBLE JACKET, size XL": "/collections/new-arrivals/products/118529-sherpa-reversible-jacket-black?variant=39643760722016",
      "SHERPA REVERSIBLE JACKET, size XXL": "/collections/new-arrivals/products/118529-sherpa-reversible-jacket-black?variant=39643760754784",
      "Blue NALGENE WATER BOTTLE": "/collections/new-arrivals/products/138833-nalgene-water-bottle-blue",
      "NALGENE WATER BOTTLE": "/collections/new-arrivals/products/138833-nalgene-water-bottle-oran",
      "Seafoam NALGENE WATER BOTTLE": "/collections/new-arrivals/products/138833-nalgene-water-bottle-seaf",
      "Mocha NALGENE WATER BOTTLE": "/collections/new-arrivals/products/138833-nalgene-water-bottle-moch",
      "Orange NALGENE WATER BOTTLE": "/collections/new-arrivals/products/138833-nalgene-water-bottle-oran",
      "Black FLIGHT BOMBER": "/collections/new-arrivals/products/115837-flight-bomber-black",
      "FLIGHT BOMBER": "/collections/new-arrivals/products/115837-flight-bomber-golden-olive",
      "FLIGHT BOMBER, size S": "/collections/new-arrivals/products/115837-flight-bomber-golden-olive?variant=41119477039200",
      "FLIGHT BOMBER, size M": "/collections/new-arrivals/products/115837-flight-bomber-golden-olive?variant=41119477071968",
      "FLIGHT BOMBER, size L": "/collections/new-arrivals/products/115837-flight-bomber-golden-olive?variant=41119477104736",
      "FLIGHT BOMBER, size XL": "/collections/new-arrivals/products/115837-flight-bomber-golden-olive?variant=41119477137504",
      "FLIGHT BOMBER, size XXL": "/collections/new-arrivals/products/115837-flight-bomber-golden-olive?variant=41119477170272",
      "Golden Olive FLIGHT BOMBER": "/collections/new-arrivals/products/115837-flight-bomber-golden-olive",
      "Light Wash TRUCKER JACKET DENIM": "/collections/new-arrivals/products/115781-trucker-jacket-denim-light-wash",
      "TRUCKER JACKET DENIM": "/collections/new-arrivals/products/115781-trucker-jacket-denim-light-wash",
      "TRUCKER JACKET DENIM, size S": "/collections/new-arrivals/products/115781-trucker-jacket-denim-light-wash?variant=40337376346208",
      "TRUCKER JACKET DENIM, size M": "/collections/new-arrivals/products/115781-trucker-jacket-denim-light-wash?variant=40337376378976",
      "TRUCKER JACKET DENIM, size L": "/collections/new-arrivals/products/115781-trucker-jacket-denim-light-wash?variant=40337376411744",
      "TRUCKER JACKET DENIM, size XL": "/collections/new-arrivals/products/115781-trucker-jacket-denim-light-wash?variant=40337376444512",
      "TRUCKER JACKET DENIM, size XXL": "/collections/new-arrivals/products/115781-trucker-jacket-denim-light-wash?variant=40337376477280",
      "White LAZY LS TEE": "/collections/new-arrivals/products/1140333-lazy-ls-tee-white",
      "LAZY LS TEE": "/collections/new-arrivals/products/1140333-lazy-ls-tee-white",
      "LAZY LS TEE, size XS": "/collections/new-arrivals/products/1140333-lazy-ls-tee-white?variant=41533687136352",
      "LAZY LS TEE, size S": "/collections/new-arrivals/products/1140333-lazy-ls-tee-white?variant=41533687169120",
      "LAZY LS TEE, size M": "/collections/new-arrivals/products/1140333-lazy-ls-tee-white?variant=41533687201888",
      "LAZY LS TEE, size L": "/collections/new-arrivals/products/1140333-lazy-ls-tee-white?variant=41533687234656",
      "LAZY LS TEE, size XL": "/collections/new-arrivals/products/1140333-lazy-ls-tee-white?variant=41533687267424",
      "LAZY LS TEE, size XXL": "/collections/new-arrivals/products/1140333-lazy-ls-tee-white?variant=41533687300192",
      "White CDG & ST\u00dcSSY LAGUNA BEACH EAU DE TOILETTE": "/collections/new-arrivals/products/cdgstu50-cdg-stussy-laguna-beach-eau-de-toilette-white",
      "CDG & ST\u00dcSSY LAGUNA BEACH EAU DE TOILETTE": "/collections/new-arrivals/products/cdgstu50-cdg-stussy-laguna-beach-eau-de-toilette-white",
      "Black BEACH SHELL WAVE DYE": "/collections/new-arrivals/products/115745-beach-shell-wave-dye-black",
      "BEACH SHELL WAVE DYE": "/collections/new-arrivals/products/115745-beach-shell-wave-dye-black",
      "BEACH SHELL WAVE DYE, size XS": "/collections/new-arrivals/products/115745-beach-shell-wave-dye-black?variant=39967445418080",
      "BEACH SHELL WAVE DYE, size S": "/collections/new-arrivals/products/115745-beach-shell-wave-dye-black?variant=39683083534432",
      "BEACH SHELL WAVE DYE, size M": "/collections/new-arrivals/products/115745-beach-shell-wave-dye-black?variant=39683083501664",
      "BEACH SHELL WAVE DYE, size L": "/collections/new-arrivals/products/115745-beach-shell-wave-dye-black?variant=39683083403360",
      "BEACH SHELL WAVE DYE, size XL": "/collections/new-arrivals/products/115745-beach-shell-wave-dye-black?variant=39683083468896",
      "BEACH SHELL WAVE DYE, size XXL": "/collections/new-arrivals/products/115745-beach-shell-wave-dye-black?variant=39683083337824",
      "Vintage Black LAZY TEE": "/collections/new-arrivals/products/1140283-lazy-tee-vintage-black",
      "LAZY TEE": "/collections/new-arrivals/products/1140283-lazy-tee-white",
      "LAZY TEE, size XS": "/collections/new-arrivals/products/1140283-lazy-tee-white?variant=41533685727328",
      "LAZY TEE, size S": "/collections/new-arrivals/products/1140283-lazy-tee-white?variant=41533685760096",
      "LAZY TEE, size M": "/collections/new-arrivals/products/1140283-lazy-tee-white?variant=41533685792864",
      "LAZY TEE, size L": "/collections/new-arrivals/products/1140283-lazy-tee-white?variant=41533685825632",
      "LAZY TEE, size XL": "/collections/new-arrivals/products/1140283-lazy-tee-white?variant=41533685858400",
      "LAZY TEE, size XXL": "/collections/new-arrivals/products/1140283-lazy-tee-white?variant=41533685891168",
      "Grey LAZY TEE": "/collections/new-arrivals/products/1140283-lazy-tee-grey",
      "White LAZY TEE": "/collections/new-arrivals/products/1140283-lazy-tee-white",
      "Brown WASHED CANVAS WORK SHORT": "/collections/new-arrivals/products/112327-washed-canvas-work-short-brown",
      "WASHED CANVAS WORK SHORT": "/collections/new-arrivals/products/112327-washed-canvas-work-short-brown",
      "WASHED CANVAS WORK SHORT, size 26": "/collections/new-arrivals/products/112327-washed-canvas-work-short-brown?variant=41119448563808",
      "WASHED CANVAS WORK SHORT, size 28": "/collections/new-arrivals/products/112327-washed-canvas-work-short-brown?variant=41119448596576",
      "WASHED CANVAS WORK SHORT, size 30": "/collections/new-arrivals/products/112327-washed-canvas-work-short-brown?variant=41119448629344",
      "WASHED CANVAS WORK SHORT, size 32": "/collections/new-arrivals/products/112327-washed-canvas-work-short-brown?variant=41119448662112",
      "WASHED CANVAS WORK SHORT, size 34": "/collections/new-arrivals/products/112327-washed-canvas-work-short-brown?variant=41119448694880",
      "WASHED CANVAS WORK SHORT, size 36": "/collections/new-arrivals/products/112327-washed-canvas-work-short-brown?variant=41119448727648",
      "WASHED CANVAS WORK SHORT, size 38": "/collections/new-arrivals/products/112327-washed-canvas-work-short-brown?variant=41119448760416",
      "Ocean Blue REVERSIBLE TECH SKULLCAP": "/collections/new-arrivals/products/1321179-reversible-tech-skullcap-ocean-blue",
      "REVERSIBLE TECH SKULLCAP": "/collections/new-arrivals/products/1321179-reversible-tech-skullcap-ocean-blue",
      "Lime MIDWEIGHT HOODED PUFFER": "/collections/new-arrivals/products/115783-midweight-hooded-puffer-lime",
      "MIDWEIGHT HOODED PUFFER": "/collections/new-arrivals/products/115783-midweight-hooded-puffer-lime",
      "MIDWEIGHT HOODED PUFFER, size XS": "/collections/new-arrivals/products/115783-midweight-hooded-puffer-lime?variant=40350179459168",
      "MIDWEIGHT HOODED PUFFER, size S": "/collections/new-arrivals/products/115783-midweight-hooded-puffer-lime?variant=40350179491936",
      "MIDWEIGHT HOODED PUFFER, size M": "/collections/new-arrivals/products/115783-midweight-hooded-puffer-lime?variant=40350179524704",
      "MIDWEIGHT HOODED PUFFER, size L": "/collections/new-arrivals/products/115783-midweight-hooded-puffer-lime?variant=40350179557472",
      "MIDWEIGHT HOODED PUFFER, size XL": "/collections/new-arrivals/products/115783-midweight-hooded-puffer-lime?variant=40350179623008",
      "MIDWEIGHT HOODED PUFFER, size XXL": "/collections/new-arrivals/products/115783-midweight-hooded-puffer-lime?variant=40350179655776",
      "Black BONDED SHERPA HOODIE": "/collections/new-arrivals/products/118585-bonded-sherpa-hoodie-black",
      "BONDED SHERPA HOODIE": "/collections/new-arrivals/products/118585-bonded-sherpa-hoodie-green",
      "BONDED SHERPA HOODIE, size S": "/collections/new-arrivals/products/118585-bonded-sherpa-hoodie-green?variant=41533867622496",
      "BONDED SHERPA HOODIE, size M": "/collections/new-arrivals/products/118585-bonded-sherpa-hoodie-green?variant=41533867655264",
      "BONDED SHERPA HOODIE, size L": "/collections/new-arrivals/products/118585-bonded-sherpa-hoodie-green?variant=41533867688032",
      "BONDED SHERPA HOODIE, size XL": "/collections/new-arrivals/products/118585-bonded-sherpa-hoodie-green?variant=41533867720800",
      "BONDED SHERPA HOODIE, size XXL": "/collections/new-arrivals/products/118585-bonded-sherpa-hoodie-green?variant=41533867753568",
      "Green BONDED SHERPA HOODIE": "/collections/new-arrivals/products/118585-bonded-sherpa-hoodie-green",
      "Ecru WOOL LS THERMAL": "/collections/new-arrivals/products/1140374-wool-ls-thermal-ecru",
      "WOOL LS THERMAL": "/collections/new-arrivals/products/1140374-wool-ls-thermal-ecru",
      "WOOL LS THERMAL, size S": "/collections/new-arrivals/products/1140374-wool-ls-thermal-ecru?variant=41533715546208",
      "WOOL LS THERMAL, size M": "/collections/new-arrivals/products/1140374-wool-ls-thermal-ecru?variant=41533715578976",
      "WOOL LS THERMAL, size L": "/collections/new-arrivals/products/1140374-wool-ls-thermal-ecru?variant=41533715611744",
      "WOOL LS THERMAL, size XL": "/collections/new-arrivals/products/1140374-wool-ls-thermal-ecru?variant=41533715644512",
      "WOOL LS THERMAL, size XXL": "/collections/new-arrivals/products/1140374-wool-ls-thermal-ecru?variant=41533715677280",
      "Rinsed Indigo BIG OL' SHORT DENIM": "/collections/new-arrivals/products/112296t-big-ol-short-denim-rinsed-indigo",
      "BIG OL' SHORT DENIM": "/collections/new-arrivals/products/112296t-big-ol-short-denim-rinsed-indigo",
      "BIG OL' SHORT DENIM, size 26": "/collections/new-arrivals/products/112296t-big-ol-short-denim-rinsed-indigo?variant=41119447711840",
      "BIG OL' SHORT DENIM, size 28": "/collections/new-arrivals/products/112296t-big-ol-short-denim-rinsed-indigo?variant=41119447744608",
      "BIG OL' SHORT DENIM, size 30": "/collections/new-arrivals/products/112296t-big-ol-short-denim-rinsed-indigo?variant=41119447777376",
      "BIG OL' SHORT DENIM, size 32": "/collections/new-arrivals/products/112296t-big-ol-short-denim-rinsed-indigo?variant=41119447810144",
      "BIG OL' SHORT DENIM, size 34": "/collections/new-arrivals/products/112296t-big-ol-short-denim-rinsed-indigo?variant=41119447842912",
      "BIG OL' SHORT DENIM, size 36": "/collections/new-arrivals/products/112296t-big-ol-short-denim-rinsed-indigo?variant=41119447875680",
      "BIG OL' SHORT DENIM, size 38": "/collections/new-arrivals/products/112296t-big-ol-short-denim-rinsed-indigo?variant=41119447908448",
      "Red BEACH PLAID SHIRT": "/collections/new-arrivals/products/1110358-beach-plaid-shirt-red",
      "BEACH PLAID SHIRT": "/collections/new-arrivals/products/1110358-beach-plaid-shirt-off-white",
      "BEACH PLAID SHIRT, size S": "/collections/new-arrivals/products/1110358-beach-plaid-shirt-off-white?variant=41436698607712",
      "BEACH PLAID SHIRT, size M": "/collections/new-arrivals/products/1110358-beach-plaid-shirt-off-white?variant=41436698640480",
      "BEACH PLAID SHIRT, size L": "/collections/new-arrivals/products/1110358-beach-plaid-shirt-off-white?variant=41436698673248",
      "BEACH PLAID SHIRT, size XL": "/collections/new-arrivals/products/1110358-beach-plaid-shirt-off-white?variant=41436698706016",
      "BEACH PLAID SHIRT, size XXL": "/collections/new-arrivals/products/1110358-beach-plaid-shirt-off-white?variant=41436698738784",
      "Off White BEACH PLAID SHIRT": "/collections/new-arrivals/products/1110358-beach-plaid-shirt-off-white",
      "Faded Blue TWO TONE HOODIE": "/collections/new-arrivals/products/118584-two-tone-hoodie-faded-blue",
      "TWO TONE HOODIE": "/collections/new-arrivals/products/118584-two-tone-hoodie-grey-heather",
      "TWO TONE HOODIE, size S": "/collections/new-arrivals/products/118584-two-tone-hoodie-grey-heather?variant=41533863886944",
      "TWO TONE HOODIE, size M": "/collections/new-arrivals/products/118584-two-tone-hoodie-grey-heather?variant=41533863919712",
      "TWO TONE HOODIE, size L": "/collections/new-arrivals/products/118584-two-tone-hoodie-grey-heather?variant=41533863952480",
      "TWO TONE HOODIE, size XL": "/collections/new-arrivals/products/118584-two-tone-hoodie-grey-heather?variant=41533863985248",
      "TWO TONE HOODIE, size XXL": "/collections/new-arrivals/products/118584-two-tone-hoodie-grey-heather?variant=41533864018016",
      "Grey Heather TWO TONE HOODIE": "/collections/new-arrivals/products/118584-two-tone-hoodie-grey-heather",
      "Real Tree Edge NEW ERA 9TWENTY BASIC TRUCKER": "/collections/new-arrivals/products/1311126-new-era-9twenty-basic-trucker-real-tree-edge",
      "NEW ERA 9TWENTY BASIC TRUCKER": "/collections/new-arrivals/products/1311126-new-era-9twenty-basic-trucker-real-tree-edge",
      "Khaki NEW ERA 9TWENTY TONAL BASIC TRUCKER": "/collections/new-arrivals/products/1311164-new-era-9twenty-tonal-basic-trucker-khaki",
      "NEW ERA 9TWENTY TONAL BASIC TRUCKER": "/collections/new-arrivals/products/1311164-new-era-9twenty-tonal-basic-trucker-khaki"
    },
    "aria": "- region \"cookieconsent\":\n  - text: St\u00fcssy uses cookies (internal and third-party) to remember your preferences and tailor your visit at stussy.com. Click ACCEPT ALL to get the most personalized experience or choose preferences for which purposes you allow the use of cookies. For more information,\n  - link \"visit the Privacy Policy.\":\n    - /url: https://www.stussy.com/pages/legal?open=Legal-privacy\n  - button \"settings cookies\": PREFERENCES\n  - button \"allow cookies\": ACCEPT ALL\n- link \"Skip to content\":\n  - /url: \"#MainContent\"\n- banner:\n  - link \"St\u00fcssy homepage\":\n    - /url: /\n    - img \"St\u00fcssy\"\n  - navigation \"Site Menu\":\n    - link \"Shop\":\n      - /url: /collections/new-arrivals\n    - button \"Caret\" [expanded]:\n      - img \"Caret\"\n    - region \"Caret\":\n      - list:\n        - listitem:\n          - link \"Shop - New Arrivals\":\n            - /url: /collections/new-arrivals\n            - text: New Arrivals\n        - listitem:\n          - link \"Shop - Tees\":\n            - /url: /collections/tees\n            - text: Tees\n        - listitem:\n          - link \"Shop - Outerwear\":\n            - /url: /collections/outerwear\n            - text: Outerwear\n        - listitem:\n          - link \"Shop - Sweats\":\n            - /url: /collections/sweats\n            - text: Sweats\n        - listitem:\n          - link \"Shop - Tops & Shirts\":\n            - /url: /collections/tops-shirts\n            - text: Tops & Shirts\n        - listitem:\n          - link \"Shop - Knits\":\n            - /url: /collections/knits\n            - text: Knits\n        - listitem:\n          - link \"Shop - Pants\":\n            - /url: /collections/pants\n            - text: Pants\n        - listitem:\n          - link \"Shop - Shorts\":\n            - /url: /collections/shorts\n            - text: Shorts\n        - listitem:\n          - link \"Shop - Denim\":\n            - /url: /collections/denim\n            - text: Denim\n        - listitem:\n          - link \"Shop - Headwear\":\n            - /url: /collections/headwear\n            - text: Headwear\n        - listitem:\n          - link \"Shop - Sunglasses\":\n            - /url: /collections/sunglasses\n            - text: Sunglasses\n        - listitem:\n          - link \"Shop - Accessories\":\n            - /url: /collections/accessories\n            - text: Accessories\n    - link \"Archive\":\n      - /url: /blogs/news\n    - link \"Support\":\n      - /url: /pages/customer-support\n    - button \"Caret\":\n      - img \"Caret\"\n  - button \"SEARCH\"\n  - button \"Select Country & Currency\": US / $\n  - button \"Open Cart\": Bag\n- list\n- main:\n  - heading \"New Arrivals | California Sportswear | St\u00fcssy\" [level=1]\n  - region \"New Arrivals\":\n    - list:\n      - listitem:\n        - link \"Woodland Camo BASIC ST\u00dcSSY THERMAL\":\n          - /url: /collections/new-arrivals/products/1140356-basic-stussy-thermal-woodland-camo\n          - img \"Raglan Thermal Basic Stock Mens Long Sleeve In Woodland Camo\"\n          - img\n        - link \"BASIC ST\u00dcSSY THERMAL\":\n          - /url: /collections/new-arrivals/products/1140356-basic-stussy-thermal-woodland-camo\n        - paragraph\n        - text: 6 colors $80\n        - list:\n          - listitem:\n            - link \"BASIC ST\u00dcSSY THERMAL, size XS\":\n              - /url: /collections/new-arrivals/products/1140356-basic-stussy-thermal-woodland-camo?variant=41533694214240\n              - text: XS\n          - listitem:\n            - link \"BASIC ST\u00dcSSY THERMAL, size S\":\n              - /url: /collections/new-arrivals/products/1140356-basic-stussy-thermal-woodland-camo?variant=41533694247008\n              - text: S\n          - listitem:\n            - link \"BASIC ST\u00dcSSY THERMAL, size M\":\n              - /url: /collections/new-arrivals/products/1140356-basic-stussy-thermal-woodland-camo?variant=41533694279776\n              - text: M\n          - listitem:\n            - link \"BASIC ST\u00dcSSY THERMAL, size L\":\n              - /url: /collections/new-arrivals/products/1140356-basic-stussy-thermal-woodland-camo?variant=41533694312544\n              - text: L\n          - listitem:\n            - link \"BASIC ST\u00dcSSY THERMAL, size XL\":\n              - /url: /collections/new-arrivals/products/1140356-basic-stussy-thermal-woodland-camo?variant=41533694345312\n              - text: XL\n          - listitem:\n            - link \"BASIC ST\u00dcSSY THERMAL, size XXL\":\n              - /url: /collections/new-arrivals/products/1140356-basic-stussy-thermal-woodland-camo?variant=41533694378080\n              - text: XXL\n      - listitem:\n        - link \"Leopard BASIC ST\u00dcSSY THERMAL\":\n          - /url: /collections/new-arrivals/products/1140356-basic-stussy-thermal-leopard\n          - img \"Raglan Thermal Basic Stock Mens Long Sleeve In Leopard\"\n          - img\n        - link \"BASIC ST\u00dcSSY THERMAL\":\n          - /url: /collections/new-arrivals/products/1140356-basic-stussy-thermal-leopard\n        - paragraph\n        - text: 6 colors $80\n        - list:\n          - listitem:\n            - link \"BASIC ST\u00dcSSY THERMAL, size XS\":\n              - /url: /collections/new-arrivals/products/1140356-basic-stussy-thermal-leopard?variant=41533692149856\n              - text: XS\n          - listitem:\n            - link \"BASIC ST\u00dcSSY THERMAL, size S\":\n              - /url: /collections/new-arrivals/products/1140356-basic-stussy-thermal-leopard?variant=41533692182624\n              - text: S\n          - listitem:\n            - link \"BASIC ST\u00dcSSY THERMAL, size M\":\n              - /url: /collections/new-arrivals/products/1140356-basic-stussy-thermal-leopard?variant=41533692215392\n              - text: M\n          - listitem:\n            - link \"BASIC ST\u00dcSSY THERMAL, size L\":\n              - /url: /collections/new-arrivals/products/1140356-basic-stussy-thermal-leopard?variant=41533692248160\n              - text: L\n          - listitem:\n            - link \"BASIC ST\u00dcSSY THERMAL, size XL\":\n              - /url: /collections/new-arrivals/products/1140356-basic-stussy-thermal-leopard?variant=41533692280928\n              - text: XL\n          - listitem:\n            - link \"BASIC ST\u00dcSSY THERMAL, size XXL\":\n              - /url: /collections/new-arrivals/products/1140356-basic-stussy-thermal-leopard?variant=41533692313696\n              - text: XXL\n      - listitem:\n        - link \"Dust Blue BASIC ST\u00dcSSY THERMAL\":\n          - /url: /collections/new-arrivals/products/1140356-basic-stussy-thermal-dust-blue\n          - img \"Raglan Thermal Basic Stock Mens Long Sleeve In Dust Blue\"\n          - img\n        - link \"BASIC ST\u00dcSSY THERMAL\":\n          - /url: /collections/new-arrivals/products/1140356-basic-stussy-thermal-dust-blue\n        - paragraph\n        - text: $80\n        - list:\n          - listitem:\n            - link \"BASIC ST\u00dcSSY THERMAL, size XS\":\n              - /url: /collections/new-arrivals/products/1140356-basic-stussy-thermal-dust-blue?variant=42159271608416\n              - text: XS\n          - listitem:\n            - link \"BASIC ST\u00dcSSY THERMAL, size S\":\n              - /url: /collections/new-arrivals/products/1140356-basic-stussy-thermal-dust-blue?variant=42159271641184\n              - text: S\n          - listitem:\n            - link \"BASIC ST\u00dcSSY THERMAL, size M\":\n              - /url: /collections/new-arrivals/products/1140356-basic-stussy-thermal-dust-blue?variant=42159271673952\n              - text: M\n          - listitem:\n            - link \"BASIC ST\u00dcSSY THERMAL, size L\":\n              - /url: /collections/new-arrivals/products/1140356-basic-stussy-thermal-dust-blue?variant=42159271706720\n              - text: L\n          - listitem:\n            - link \"BASIC ST\u00dcSSY THERMAL, size XL\":\n              - /url: /collections/new-arrivals/products/1140356-basic-stussy-thermal-dust-blue?variant=42159271739488\n              - text: XL\n          - listitem:\n            - link \"BASIC ST\u00dcSSY THERMAL, size XXL\":\n              - /url: /collections/new-arrivals/products/1140356-basic-stussy-thermal-dust-blue?variant=42159271772256\n              - text: XXL\n      - listitem:\n        - link \"Pale Yellow BASIC ST\u00dcSSY THERMAL\":\n          - /url: /collections/new-arrivals/products/1140356-basic-stussy-thermal-pale-yellow\n          - img \"Raglan Thermal Basic Stock Mens Long Sleeve In Pale Yellow\"\n          - img\n        - link \"BASIC ST\u00dcSSY THERMAL\":\n          - /url: /collections/new-arrivals/products/1140356-basic-stussy-thermal-pale-yellow\n        - paragraph\n        - text: $80\n        - list:\n          - listitem:\n            - link \"BASIC ST\u00dcSSY THERMAL, size XS\":\n              - /url: /collections/new-arrivals/products/1140356-basic-stussy-thermal-pale-yellow?variant=42159272165472\n              - text: XS\n          - listitem:\n            - link \"BASIC ST\u00dcSSY THERMAL, size S\":\n              - /url: /collections/new-arrivals/products/1140356-basic-stussy-thermal-pale-yellow?variant=42159272198240\n              - text: S\n          - listitem:\n            - link \"BASIC ST\u00dcSSY THERMAL, size M\":\n              - /url: /collections/new-arrivals/products/1140356-basic-stussy-thermal-pale-yellow?variant=42159272231008\n              - text: M\n          - listitem:\n            - link \"BASIC ST\u00dcSSY THERMAL, size L\":\n              - /url: /collections/new-arrivals/products/1140356-basic-stussy-thermal-pale-yellow?variant=42159272263776\n              - text: L\n          - listitem:\n            - link \"BASIC ST\u00dcSSY THERMAL, size XL\":\n              - /url: /collections/new-arrivals/products/1140356-basic-stussy-thermal-pale-yellow?variant=42159272296544\n              - text: XL\n          - listitem:\n            - link \"BASIC ST\u00dcSSY THERMAL, size XXL\":\n              - /url: /collections/new-arrivals/products/1140356-basic-stussy-thermal-pale-yellow?variant=42159272329312\n              - text: XXL\n      - listitem:\n        - link \"Blue Stripe OXFORD SHIRT\":\n          - /url: /collections/new-arrivals/products/1110364-oxford-shirt-blue-stripe\n          - img \"Oxford Ls Shirt Mens Long Sleeve In Blue Stripe\"\n          - img\n        - link \"OXFORD SHIRT\":\n          - /url: /collections/new-arrivals/products/1110364-oxford-shirt-blue-stripe\n        - paragraph\n        - text: $160\n        - list:\n          - listitem:\n            - link \"OXFORD SHIRT, size S\":\n              - /url: /collections/new-arrivals/products/1110364-oxford-shirt-blue-stripe?variant=41533672161376\n              - text: S\n          - listitem:\n            - link \"OXFORD SHIRT, size M\":\n              - /url: /collections/new-arrivals/products/1110364-oxford-shirt-blue-stripe?variant=41533672194144\n              - text: M\n          - listitem:\n            - link \"OXFORD SHIRT, size L\":\n              - /url: /collections/new-arrivals/products/1110364-oxford-shirt-blue-stripe?variant=41533672226912\n              - text: L\n          - listitem:\n            - link \"OXFORD SHIRT, size XL\":\n              - /url: /collections/new-arrivals/products/1110364-oxford-shirt-blue-stripe?variant=41533672259680\n              - text: XL\n          - listitem:\n            - link \"OXFORD SHIRT, size XXL\":\n              - /url: /collections/new-arrivals/products/1110364-oxford-shirt-blue-stripe?variant=41533672292448\n              - text: XXL\n      - listitem:\n        - link \"White STANDARD SHIRT\":\n          - /url: /collections/new-arrivals/products/1110357-standard-shirt-white\n          - img \"Standard Ls Shirt Mens Long Sleeve In White\"\n          - img\n        - link \"STANDARD SHIRT\":\n          - /url: /collections/new-arrivals/products/1110357-standard-shirt-white\n        - paragraph\n        - text: $160\n        - list:\n          - listitem:\n            - link \"STANDARD SHIRT, size S\":\n              - /url: /collections/new-arrivals/products/1110357-standard-shirt-white?variant=41119447318624\n              - text: S\n          - listitem:\n            - link \"STANDARD SHIRT, size M\":\n              - /url: /collections/new-arrivals/products/1110357-standard-shirt-white?variant=41119447351392\n              - text: M\n          - listitem:\n            - link \"STANDARD SHIRT, size L\":\n              - /url: /collections/new-arrivals/products/1110357-standard-shirt-white?variant=41119447384160\n              - text: L\n          - listitem:\n            - link \"STANDARD SHIRT, size XL\":\n              - /url: /collections/new-arrivals/products/1110357-standard-shirt-white?variant=41119447416928\n              - text: XL\n          - listitem:\n            - link \"STANDARD SHIRT, size XXL\":\n              - /url: /collections/new-arrivals/products/1110357-standard-shirt-white?variant=41119447449696\n              - text: XXL\n      - listitem:\n        - link \"Ash Heather PATCH ZIP KNIT HOODIE\":\n          - /url: /collections/new-arrivals/products/118593-patch-zip-knit-hoodie-ash-heather\n          - img \"Brass Zip Knit Hood Mens Long Sleeve In Ash Heather\"\n          - img\n        - link \"PATCH ZIP KNIT HOODIE\":\n          - /url: /collections/new-arrivals/products/118593-patch-zip-knit-hoodie-ash-heather\n        - paragraph\n        - text: $165\n        - list:\n          - listitem:\n            - link \"PATCH ZIP KNIT HOODIE, size S\":\n              - /url: /collections/new-arrivals/products/118593-patch-zip-knit-hoodie-ash-heather?variant=41755057094752\n              - text: S\n          - listitem:\n            - link \"PATCH ZIP KNIT HOODIE, size M\":\n              - /url: /collections/new-arrivals/products/118593-patch-zip-knit-hoodie-ash-heather?variant=41755057127520\n              - text: M\n          - listitem:\n            - link \"PATCH ZIP KNIT HOODIE, size L\":\n              - /url: /collections/new-arrivals/products/118593-patch-zip-knit-hoodie-ash-heather?variant=41755057160288\n              - text: L\n          - listitem:\n            - link \"PATCH ZIP KNIT HOODIE, size XL\":\n              - /url: /collections/new-arrivals/products/118593-patch-zip-knit-hoodie-ash-heather?variant=41755057193056\n              - text: XL\n          - listitem:\n            - link \"PATCH ZIP KNIT HOODIE, size XXL\":\n              - /url: /collections/new-arrivals/products/118593-patch-zip-knit-hoodie-ash-heather?variant=41755057225824\n              - text: XXL\n      - listitem:\n        - link \"Indigo RAW DENIM WORK SHORT\":\n          - /url: /collections/new-arrivals/products/112337-raw-denim-work-short-indigo\n          - img \"Work Short Denim Mens Regular In Raw\"\n          - img\n        - link \"RAW DENIM WORK SHORT\":\n          - /url: /collections/new-arrivals/products/112337-raw-denim-work-short-indigo\n        - paragraph\n        - text: $125\n        - list:\n          - listitem:\n            - link \"RAW DENIM WORK SHORT, size 28\":\n              - /url: /collections/new-arrivals/products/112337-raw-denim-work-short-indigo?variant=41436710961248\n              - text: \"28\"\n          - listitem:\n            - link \"RAW DENIM WORK SHORT, size 30\":\n              - /url: /collections/new-arrivals/products/112337-raw-denim-work-short-indigo?variant=41436710994016\n              - text: \"30\"\n          - listitem:\n            - link \"RAW DENIM WORK SHORT, size 32\":\n              - /url: /collections/new-arrivals/products/112337-raw-denim-work-short-indigo?variant=41436711026784\n              - text: \"32\"\n          - listitem:\n            - link \"RAW DENIM WORK SHORT, size 34\":\n              - /url: /collections/new-arrivals/products/112337-raw-denim-work-short-indigo?variant=41436711059552\n              - text: \"34\"\n          - listitem:\n            - link \"RAW DENIM WORK SHORT, size 36\":\n              - /url: /collections/new-arrivals/products/112337-raw-denim-work-short-indigo?variant=41436711092320\n              - text: \"36\"\n          - listitem:\n            - link \"RAW DENIM WORK SHORT, size 38\":\n              - /url: /collections/new-arrivals/products/112337-raw-denim-work-short-indigo?variant=41436711125088\n              - text: \"38\"\n      - listitem:\n        - link \"Ocean BASIC ST\u00dcSSY SKULLCAP\":\n          - /url: /collections/new-arrivals/products/1321263-basic-stussy-skullcap-ocean\n          - img \"Basic Skullcap Beanie Accessories In Ocean\"\n          - img\n        - link \"BASIC ST\u00dcSSY SKULLCAP\":\n          - /url: /collections/new-arrivals/products/1321263-basic-stussy-skullcap-ocean\n        - paragraph\n        - text: 5 colors $45\n      - listitem:\n        - link \"Sport Red BASIC ST\u00dcSSY SKULLCAP\":\n          - /url: /collections/new-arrivals/products/1321263-basic-stussy-skullcap-sport-red\n          - img \"Basic Skullcap Beanie Accessories In Sport Red\"\n          - img\n        - link \"BASIC ST\u00dcSSY SKULLCAP\":\n          - /url: /collections/new-arrivals/products/1321263-basic-stussy-skullcap-sport-red\n        - paragraph\n        - text: 5 colors $45\n      - listitem:\n        - link \"Rose Pink BASIC ST\u00dcSSY SKULLCAP\":\n          - /url: /collections/new-arrivals/products/1321263-basic-stussy-skullcap-rose-pink\n          - img \"Basic Skullcap Beanie Accessories In Rose Pink\"\n          - img\n        - link \"BASIC ST\u00dcSSY SKULLCAP\":\n          - /url: /collections/new-arrivals/products/1321263-basic-stussy-skullcap-rose-pink\n        - paragraph\n        - text: $45\n      - listitem:\n        - link \"Matte Silver/Sunflare Mirror SIMON SUNGLASSES\":\n          - /url: /collections/new-arrivals/products/338410-simon-sunglasses-matte-silver-sunflare-mirror-lens\n          - img \"Simon Sunglasses Accessories In Matte Silver/sunflare Mirror\"\n          - img\n        - link \"SIMON SUNGLASSES\":\n          - /url: /collections/new-arrivals/products/338410-simon-sunglasses-matte-silver-sunflare-mirror-lens\n        - paragraph\n        - text: $160\n      - listitem:\n        - link \"Black DOWN PUFFER WRINKLED NYLON\":\n          - /url: /collections/new-arrivals/products/115729-down-puffer-wrinkled-nylon-black\n          - img \"Wrinkled Nylon Down Puffer Mens Long Sleeve In Black\"\n          - img\n        - link \"DOWN PUFFER WRINKLED NYLON\":\n          - /url: /collections/new-arrivals/products/115729-down-puffer-wrinkled-nylon-black\n        - paragraph\n        - text: $300\n        - list:\n          - listitem:\n            - link \"DOWN PUFFER WRINKLED NYLON, size XS\":\n              - /url: /collections/new-arrivals/products/115729-down-puffer-wrinkled-nylon-black?variant=39656152236128\n              - text: XS\n          - listitem:\n            - link \"DOWN PUFFER WRINKLED NYLON, size S\":\n              - /url: /collections/new-arrivals/products/115729-down-puffer-wrinkled-nylon-black?variant=39656152301664\n              - text: S\n          - listitem:\n            - link \"DOWN PUFFER WRINKLED NYLON, size M\":\n              - /url: /collections/new-arrivals/products/115729-down-puffer-wrinkled-nylon-black?variant=39656152203360\n              - text: M\n          - listitem:\n            - link \"DOWN PUFFER WRINKLED NYLON, size L\":\n              - /url: /collections/new-arrivals/products/115729-down-puffer-wrinkled-nylon-black?variant=39656152268896\n              - text: L\n          - listitem:\n            - link \"DOWN PUFFER WRINKLED NYLON, size XL\":\n              - /url: /collections/new-arrivals/products/115729-down-puffer-wrinkled-nylon-black?variant=39656152170592\n              - text: XL\n          - listitem:\n            - link \"DOWN PUFFER WRINKLED NYLON, size XXL\":\n              - /url: /collections/new-arrivals/products/115729-down-puffer-wrinkled-nylon-black?variant=39656152137824\n              - text: XXL\n      - listitem:\n        - link \"Digi Camo MICRO RIPSTOP DOWN JACKET\":\n          - /url: /collections/new-arrivals/products/115877-micro-ripstop-down-jacket-digi-camo\n          - img \"Micro Ripstop Down Mock Mens Long Sleeve In Digi Camo\"\n          - img\n        - link \"MICRO RIPSTOP DOWN JACKET\":\n          - /url: /collections/new-arrivals/products/115877-micro-ripstop-down-jacket-digi-camo\n        - paragraph\n        - text: $325\n        - list:\n          - listitem:\n            - link \"MICRO RIPSTOP DOWN JACKET, size S\":\n              - /url: /collections/new-arrivals/products/115877-micro-ripstop-down-jacket-digi-camo?variant=41754983432288\n              - text: S\n          - listitem:\n            - link \"MICRO RIPSTOP DOWN JACKET, size M\":\n              - /url: /collections/new-arrivals/products/115877-micro-ripstop-down-jacket-digi-camo?variant=41754983465056\n              - text: M\n          - listitem:\n            - link \"MICRO RIPSTOP DOWN JACKET, size L\":\n              - /url: /collections/new-arrivals/products/115877-micro-ripstop-down-jacket-digi-camo?variant=41754983497824\n              - text: L\n          - listitem:\n            - link \"MICRO RIPSTOP DOWN JACKET, size XL\":\n              - /url: /collections/new-arrivals/products/115877-micro-ripstop-down-jacket-digi-camo?variant=41754983530592\n              - text: XL\n          - listitem:\n            - link \"MICRO RIPSTOP DOWN JACKET, size XXL\":\n              - /url: /collections/new-arrivals/products/115877-micro-ripstop-down-jacket-digi-camo?variant=41754983563360\n              - text: XXL\n      - listitem:\n        - link \"Olive MANTRA RAGLAN THERMAL\":\n          - /url: /collections/new-arrivals/products/1140395-mantra-raglan-thermal-olive\n          - img \"Raglan Thermal Mens Long Sleeve In Olive\"\n          - img\n        - link \"MANTRA RAGLAN THERMAL\":\n          - /url: /collections/new-arrivals/products/1140395-mantra-raglan-thermal-olive\n        - paragraph\n        - text: $80\n        - list:\n          - listitem:\n            - link \"MANTRA RAGLAN THERMAL, size S\":\n              - /url: /collections/new-arrivals/products/1140395-mantra-raglan-thermal-olive?variant=42159160361056\n              - text: S\n          - listitem:\n            - link \"MANTRA RAGLAN THERMAL, size M\":\n              - /url: /collections/new-arrivals/products/1140395-mantra-raglan-thermal-olive?variant=42159160393824\n              - text: M\n          - listitem:\n            - link \"MANTRA RAGLAN THERMAL, size L\":\n              - /url: /collections/new-arrivals/products/1140395-mantra-raglan-thermal-olive?variant=42159160426592\n              - text: L\n          - listitem:\n            - link \"MANTRA RAGLAN THERMAL, size XL\":\n              - /url: /collections/new-arrivals/products/1140395-mantra-raglan-thermal-olive?variant=42159160459360\n              - text: XL\n          - listitem:\n            - link \"MANTRA RAGLAN THERMAL, size XXL\":\n              - /url: /collections/new-arrivals/products/1140395-mantra-raglan-thermal-olive?variant=42159160492128\n              - text: XXL\n      - listitem:\n        - link \"White MANTRA RAGLAN THERMAL\":\n          - /url: /collections/new-arrivals/products/1140395-mantra-raglan-thermal-white\n          - img \"Raglan Thermal Mens Long Sleeve In White\"\n          - img\n        - link \"MANTRA RAGLAN THERMAL\":\n          - /url: /collections/new-arrivals/products/1140395-mantra-raglan-thermal-white\n        - paragraph\n        - text: $80\n        - list:\n          - listitem:\n            - link \"MANTRA RAGLAN THERMAL, size S\":\n              - /url: /collections/new-arrivals/products/1140395-mantra-raglan-thermal-white?variant=42159166390368\n              - text: S\n          - listitem:\n            - link \"MANTRA RAGLAN THERMAL, size M\":\n              - /url: /collections/new-arrivals/products/1140395-mantra-raglan-thermal-white?variant=42159166423136\n              - text: M\n          - listitem:\n            - link \"MANTRA RAGLAN THERMAL, size L\":\n              - /url: /collections/new-arrivals/products/1140395-mantra-raglan-thermal-white?variant=42159166455904\n              - text: L\n          - listitem:\n            - link \"MANTRA RAGLAN THERMAL, size XL\":\n              - /url: /collections/new-arrivals/products/1140395-mantra-raglan-thermal-white?variant=42159166488672\n              - text: XL\n          - listitem:\n            - link \"MANTRA RAGLAN THERMAL, size XXL\":\n              - /url: /collections/new-arrivals/products/1140395-mantra-raglan-thermal-white?variant=42159166521440\n              - text: XXL\n      - listitem:\n        - link \"Washed Black MANTRA RAGLAN THERMAL\":\n          - /url: /collections/new-arrivals/products/1140395-mantra-raglan-thermal-washed-black\n          - img \"Raglan Thermal Mens Long Sleeve In Washed Black\"\n          - img\n        - link \"MANTRA RAGLAN THERMAL\":\n          - /url: /collections/new-arrivals/products/1140395-mantra-raglan-thermal-washed-black\n        - paragraph\n        - text: $80\n        - list:\n          - listitem:\n            - link \"MANTRA RAGLAN THERMAL, size S\":\n              - /url: /collections/new-arrivals/products/1140395-mantra-raglan-thermal-washed-black?variant=42159165177952\n              - text: S\n          - listitem:\n            - link \"MANTRA RAGLAN THERMAL, size M\":\n              - /url: /collections/new-arrivals/products/1140395-mantra-raglan-thermal-washed-black?variant=42159165210720\n              - text: M\n          - listitem:\n            - link \"MANTRA RAGLAN THERMAL, size L\":\n              - /url: /collections/new-arrivals/products/1140395-mantra-raglan-thermal-washed-black?variant=42159165243488\n              - text: L\n          - listitem:\n            - link \"MANTRA RAGLAN THERMAL, size XL\":\n              - /url: /collections/new-arrivals/products/1140395-mantra-raglan-thermal-washed-black?variant=42159165276256\n              - text: XL\n          - listitem:\n            - link \"MANTRA RAGLAN THERMAL, size XXL\":\n              - /url: /collections/new-arrivals/products/1140395-mantra-raglan-thermal-washed-black?variant=42159165309024\n              - text: XXL\n      - listitem:\n        - link \"Pink MANTRA RAGLAN THERMAL\":\n          - /url: /collections/new-arrivals/products/1140395-mantra-raglan-thermal-pink\n          - img \"Raglan Thermal Mens Long Sleeve In Pink\"\n          - img\n        - link \"MANTRA RAGLAN THERMAL\":\n          - /url: /collections/new-arrivals/products/1140395-mantra-raglan-thermal-pink\n        - paragraph\n        - text: $80\n        - list:\n          - listitem:\n            - link \"MANTRA RAGLAN THERMAL, size S\":\n              - /url: /collections/new-arrivals/products/1140395-mantra-raglan-thermal-pink?variant=42159162196064\n              - text: S\n          - listitem:\n            - link \"MANTRA RAGLAN THERMAL, size M\":\n              - /url: /collections/new-arrivals/products/1140395-mantra-raglan-thermal-pink?variant=42159162228832\n              - text: M\n          - listitem:\n            - link \"MANTRA RAGLAN THERMAL, size L\":\n              - /url: /collections/new-arrivals/products/1140395-mantra-raglan-thermal-pink?variant=42159162261600\n              - text: L\n          - listitem:\n            - link \"MANTRA RAGLAN THERMAL, size XL\":\n              - /url: /collections/new-arrivals/products/1140395-mantra-raglan-thermal-pink?variant=42159162294368\n              - text: XL\n          - listitem:\n            - link \"MANTRA RAGLAN THERMAL, size XXL\":\n              - /url: /collections/new-arrivals/products/1140395-mantra-raglan-thermal-pink?variant=42159162327136\n              - text: XXL\n      - listitem:\n        - link \"Khaki RELAXED HOODIE\":\n          - /url: /collections/new-arrivals/products/118572-relaxed-hoodie-khaki\n          - img \"Fleece Raglan Hood Mens Long Sleeve In Khaki\"\n          - img\n        - link \"RELAXED HOODIE\":\n          - /url: /collections/new-arrivals/products/118572-relaxed-hoodie-khaki\n        - paragraph\n        - text: 6 colors $130\n        - list:\n          - listitem:\n            - link \"RELAXED HOODIE, size S\":\n              - /url: /collections/new-arrivals/products/118572-relaxed-hoodie-khaki?variant=41119541035104\n              - text: S\n          - listitem:\n            - link \"RELAXED HOODIE, size M\":\n              - /url: /collections/new-arrivals/products/118572-relaxed-hoodie-khaki?variant=41119541067872\n              - text: M\n          - listitem:\n            - link \"RELAXED HOODIE, size L\":\n              - /url: /collections/new-arrivals/products/118572-relaxed-hoodie-khaki?variant=41119541100640\n              - text: L\n          - listitem:\n            - link \"RELAXED HOODIE, size XL\":\n              - /url: /collections/new-arrivals/products/118572-relaxed-hoodie-khaki?variant=41119541133408\n              - text: XL\n          - listitem:\n            - link \"RELAXED HOODIE, size XXL\":\n              - /url: /collections/new-arrivals/products/118572-relaxed-hoodie-khaki?variant=41119541166176\n              - text: XXL\n      - listitem:\n        - link \"Sand Camo BASIC MESH SHORT\":\n          - /url: /collections/new-arrivals/products/112335-basic-mesh-short-sand-camo\n          - img \"Mesh Short Basic Mens Regular In Sand Camo\"\n          - img\n        - link \"BASIC MESH SHORT\":\n          - /url: /collections/new-arrivals/products/112335-basic-mesh-short-sand-camo\n        - paragraph\n        - text: 6 colors $85\n        - list:\n          - listitem:\n            - link \"BASIC MESH SHORT, size S\":\n              - /url: /collections/new-arrivals/products/112335-basic-mesh-short-sand-camo?variant=41340350562400\n              - text: S\n          - listitem:\n            - link \"BASIC MESH SHORT, size M\":\n              - /url: /collections/new-arrivals/products/112335-basic-mesh-short-sand-camo?variant=41340350595168\n              - text: M\n          - listitem:\n            - link \"BASIC MESH SHORT, size L\":\n              - /url: /collections/new-arrivals/products/112335-basic-mesh-short-sand-camo?variant=41340350627936\n              - text: L\n          - listitem:\n            - link \"BASIC MESH SHORT, size XL\":\n              - /url: /collections/new-arrivals/products/112335-basic-mesh-short-sand-camo?variant=41340350660704\n              - text: XL\n          - listitem:\n            - link \"BASIC MESH SHORT, size XXL\":\n              - /url: /collections/new-arrivals/products/112335-basic-mesh-short-sand-camo?variant=41340350693472\n              - text: XXL\n      - listitem:\n        - link \"Black SHERPA PANELED HOODED JACKET\":\n          - /url: /collections/new-arrivals/products/118530-sherpa-paneled-hooded-jacket-black\n          - img\n          - img\n        - link \"SHERPA PANELED HOODED JACKET\":\n          - /url: /collections/new-arrivals/products/118530-sherpa-paneled-hooded-jacket-black\n        - paragraph\n        - text: $200\n        - list:\n          - listitem:\n            - link \"SHERPA PANELED HOODED JACKET, size XS\":\n              - /url: /collections/new-arrivals/products/118530-sherpa-paneled-hooded-jacket-black?variant=39643762688096\n              - text: XS\n          - listitem:\n            - link \"SHERPA PANELED HOODED JACKET, size S\":\n              - /url: /collections/new-arrivals/products/118530-sherpa-paneled-hooded-jacket-black?variant=39643762720864\n              - text: S\n          - listitem:\n            - link \"SHERPA PANELED HOODED JACKET, size M\":\n              - /url: /collections/new-arrivals/products/118530-sherpa-paneled-hooded-jacket-black?variant=39643762753632\n              - text: M\n          - listitem:\n            - link \"SHERPA PANELED HOODED JACKET, size L\":\n              - /url: /collections/new-arrivals/products/118530-sherpa-paneled-hooded-jacket-black?variant=39643762786400\n              - text: L\n          - listitem:\n            - link \"SHERPA PANELED HOODED JACKET, size XL\":\n              - /url: /collections/new-arrivals/products/118530-sherpa-paneled-hooded-jacket-black?variant=39643762819168\n              - text: XL\n          - listitem:\n            - link \"SHERPA PANELED HOODED JACKET, size XXL\":\n              - /url: /collections/new-arrivals/products/118530-sherpa-paneled-hooded-jacket-black?variant=39643762851936\n              - text: XXL\n      - listitem:\n        - link \"Black SHERPA REVERSIBLE JACKET\":\n          - /url: /collections/new-arrivals/products/118529-sherpa-reversible-jacket-black\n          - img\n          - img\n        - link \"SHERPA REVERSIBLE JACKET\":\n          - /url: /collections/new-arrivals/products/118529-sherpa-reversible-jacket-black\n        - paragraph\n        - text: $200\n        - list:\n          - listitem:\n            - link \"SHERPA REVERSIBLE JACKET, size XS\":\n              - /url: /collections/new-arrivals/products/118529-sherpa-reversible-jacket-black?variant=39643760590944\n              - text: XS\n          - listitem:\n            - link \"SHERPA REVERSIBLE JACKET, size S\":\n              - /url: /collections/new-arrivals/products/118529-sherpa-reversible-jacket-black?variant=39643760623712\n              - text: S\n          - listitem:\n            - link \"SHERPA REVERSIBLE JACKET, size M\":\n              - /url: /collections/new-arrivals/products/118529-sherpa-reversible-jacket-black?variant=39643760656480\n              - text: M\n          - listitem:\n            - link \"SHERPA REVERSIBLE JACKET, size L\":\n              - /url: /collections/new-arrivals/products/118529-sherpa-reversible-jacket-black?variant=39643760689248\n              - text: L\n          - listitem:\n            - link \"SHERPA REVERSIBLE JACKET, size XL\":\n              - /url: /collections/new-arrivals/products/118529-sherpa-reversible-jacket-black?variant=39643760722016\n              - text: XL\n          - listitem:\n            - link \"SHERPA REVERSIBLE JACKET, size XXL\":\n              - /url: /collections/new-arrivals/products/118529-sherpa-reversible-jacket-black?variant=39643760754784\n              - text: XXL\n      - listitem:\n        - link \"Blue NALGENE WATER BOTTLE\":\n          - /url: /collections/new-arrivals/products/138833-nalgene-water-bottle-blue\n          - img \"Nalgene Water Bottle Accessories In Blue\"\n          - img\n        - link \"NALGENE WATER BOTTLE\":\n          - /url: /collections/new-arrivals/products/138833-nalgene-water-bottle-blue\n        - paragraph\n        - text: $28\n      - listitem:\n        - link \"Seafoam NALGENE WATER BOTTLE\":\n          - /url: /collections/new-arrivals/products/138833-nalgene-water-bottle-seaf\n          - img \"Nalgene Water Bottle Accessories In Seafoam\"\n          - img\n        - link \"NALGENE WATER BOTTLE\":\n          - /url: /collections/new-arrivals/products/138833-nalgene-water-bottle-seaf\n        - paragraph\n        - text: $28\n      - listitem:\n        - link \"Mocha NALGENE WATER BOTTLE\":\n          - /url: /collections/new-arrivals/products/138833-nalgene-water-bottle-moch\n          - img \"Nalgene Water Bottle Accessories In Mocha\"\n          - img\n        - link \"NALGENE WATER BOTTLE\":\n          - /url: /collections/new-arrivals/products/138833-nalgene-water-bottle-moch\n        - paragraph\n        - text: $28\n      - listitem:\n        - link \"Orange NALGENE WATER BOTTLE\":\n          - /url: /collections/new-arrivals/products/138833-nalgene-water-bottle-oran\n          - img \"Nalgene Water Bottle Accessories In Orange\"\n          - img\n        - link \"NALGENE WATER BOTTLE\":\n          - /url: /collections/new-arrivals/products/138833-nalgene-water-bottle-oran\n        - paragraph\n        - text: $28\n      - listitem:\n        - link \"Black FLIGHT BOMBER\":\n          - /url: /collections/new-arrivals/products/115837-flight-bomber-black\n          - img \"Flight Bomber Mens Long Sleeve In Black\"\n          - img\n        - link \"FLIGHT BOMBER\":\n          - /url: /collections/new-arrivals/products/115837-flight-bomber-black\n        - paragraph\n        - text: $265\n        - list:\n          - listitem:\n            - link \"FLIGHT BOMBER, size S\":\n              - /url: /collections/new-arrivals/products/115837-flight-bomber-black?variant=41119475335264\n              - text: S\n          - listitem:\n            - link \"FLIGHT BOMBER, size M\":\n              - /url: /collections/new-arrivals/products/115837-flight-bomber-black?variant=41119475368032\n              - text: M\n          - listitem:\n            - link \"FLIGHT BOMBER, size L\":\n              - /url: /collections/new-arrivals/products/115837-flight-bomber-black?variant=41119475400800\n              - text: L\n          - listitem:\n            - link \"FLIGHT BOMBER, size XL\":\n              - /url: /collections/new-arrivals/products/115837-flight-bomber-black?variant=41119475433568\n              - text: XL\n          - listitem:\n            - link \"FLIGHT BOMBER, size XXL\":\n              - /url: /collections/new-arrivals/products/115837-flight-bomber-black?variant=41119475466336\n              - text: XXL\n      - listitem:\n        - link \"Golden Olive FLIGHT BOMBER\":\n          - /url: /collections/new-arrivals/products/115837-flight-bomber-golden-olive\n          - img \"Flight Bomber Mens Long Sleeve In Golden Olive\"\n          - img\n        - link \"FLIGHT BOMBER\":\n          - /url: /collections/new-arrivals/products/115837-flight-bomber-golden-olive\n        - paragraph\n        - text: $265\n        - list:\n          - listitem:\n            - link \"FLIGHT BOMBER, size S\":\n              - /url: /collections/new-arrivals/products/115837-flight-bomber-golden-olive?variant=41119477039200\n              - text: S\n          - listitem:\n            - link \"FLIGHT BOMBER, size M\":\n              - /url: /collections/new-arrivals/products/115837-flight-bomber-golden-olive?variant=41119477071968\n              - text: M\n          - listitem:\n            - link \"FLIGHT BOMBER, size L\":\n              - /url: /collections/new-arrivals/products/115837-flight-bomber-golden-olive?variant=41119477104736\n              - text: L\n          - listitem:\n            - link \"FLIGHT BOMBER, size XL\":\n              - /url: /collections/new-arrivals/products/115837-flight-bomber-golden-olive?variant=41119477137504\n              - text: XL\n          - listitem:\n            - link \"FLIGHT BOMBER, size XXL\":\n              - /url: /collections/new-arrivals/products/115837-flight-bomber-golden-olive?variant=41119477170272\n              - text: XXL\n      - listitem:\n        - link \"Light Wash TRUCKER JACKET DENIM\":\n          - /url: /collections/new-arrivals/products/115781-trucker-jacket-denim-light-wash\n          - img \"Trucker Denim Mens Long Sleeve In Light Wash\"\n          - img\n        - link \"TRUCKER JACKET DENIM\":\n          - /url: /collections/new-arrivals/products/115781-trucker-jacket-denim-light-wash\n        - paragraph\n        - text: $185\n        - list:\n          - listitem:\n            - link \"TRUCKER JACKET DENIM, size S\":\n              - /url: /collections/new-arrivals/products/115781-trucker-jacket-denim-light-wash?variant=40337376346208\n              - text: S\n          - listitem:\n            - link \"TRUCKER JACKET DENIM, size M\":\n              - /url: /collections/new-arrivals/products/115781-trucker-jacket-denim-light-wash?variant=40337376378976\n              - text: M\n          - listitem:\n            - link \"TRUCKER JACKET DENIM, size L\":\n              - /url: /collections/new-arrivals/products/115781-trucker-jacket-denim-light-wash?variant=40337376411744\n              - text: L\n          - listitem:\n            - link \"TRUCKER JACKET DENIM, size XL\":\n              - /url: /collections/new-arrivals/products/115781-trucker-jacket-denim-light-wash?variant=40337376444512\n              - text: XL\n          - listitem:\n            - link \"TRUCKER JACKET DENIM, size XXL\":\n              - /url: /collections/new-arrivals/products/115781-trucker-jacket-denim-light-wash?variant=40337376477280\n              - text: XXL\n      - listitem:\n        - link \"White LAZY LS TEE\":\n          - /url: /collections/new-arrivals/products/1140333-lazy-ls-tee-white\n          - img \"Lazy Ls Tee Mens Long Sleeve In White\"\n          - img\n        - link \"LAZY LS TEE\":\n          - /url: /collections/new-arrivals/products/1140333-lazy-ls-tee-white\n        - paragraph\n        - text: 3 colors $60\n        - list:\n          - listitem:\n            - link \"LAZY LS TEE, size XS\":\n              - /url: /collections/new-arrivals/products/1140333-lazy-ls-tee-white?variant=41533687136352\n              - text: XS\n          - listitem:\n            - link \"LAZY LS TEE, size S\":\n              - /url: /collections/new-arrivals/products/1140333-lazy-ls-tee-white?variant=41533687169120\n              - text: S\n          - listitem:\n            - link \"LAZY LS TEE, size M\":\n              - /url: /collections/new-arrivals/products/1140333-lazy-ls-tee-white?variant=41533687201888\n              - text: M\n          - listitem:\n            - link \"LAZY LS TEE, size L\":\n              - /url: /collections/new-arrivals/products/1140333-lazy-ls-tee-white?variant=41533687234656\n              - text: L\n          - listitem:\n            - link \"LAZY LS TEE, size XL\":\n              - /url: /collections/new-arrivals/products/1140333-lazy-ls-tee-white?variant=41533687267424\n              - text: XL\n          - listitem:\n            - link \"LAZY LS TEE, size XXL\":\n              - /url: /collections/new-arrivals/products/1140333-lazy-ls-tee-white?variant=41533687300192\n              - text: XXL\n      - listitem:\n        - link \"White CDG & ST\u00dcSSY LAGUNA BEACH EAU DE TOILETTE\":\n          - /url: /collections/new-arrivals/products/cdgstu50-cdg-stussy-laguna-beach-eau-de-toilette-white\n          - img \"Stussy Laguna Beach Scent Accessories In White\"\n          - img\n        - link \"CDG & ST\u00dcSSY LAGUNA BEACH EAU DE TOILETTE\":\n          - /url: /collections/new-arrivals/products/cdgstu50-cdg-stussy-laguna-beach-eau-de-toilette-white\n        - paragraph\n        - text: $100\n      - listitem:\n        - link \"Black BEACH SHELL WAVE DYE\":\n          - /url: /collections/new-arrivals/products/115745-beach-shell-wave-dye-black\n          - img \"Beach Shell Wave Dye Mens Long Sleeve In Black\"\n          - img\n        - link \"BEACH SHELL WAVE DYE\":\n          - /url: /collections/new-arrivals/products/115745-beach-shell-wave-dye-black\n        - paragraph\n        - text: $185\n        - list:\n          - listitem:\n            - link \"BEACH SHELL WAVE DYE, size XS\":\n              - /url: /collections/new-arrivals/products/115745-beach-shell-wave-dye-black?variant=39967445418080\n              - text: XS\n          - listitem:\n            - link \"BEACH SHELL WAVE DYE, size S\":\n              - /url: /collections/new-arrivals/products/115745-beach-shell-wave-dye-black?variant=39683083534432\n              - text: S\n          - listitem:\n            - link \"BEACH SHELL WAVE DYE, size M\":\n              - /url: /collections/new-arrivals/products/115745-beach-shell-wave-dye-black?variant=39683083501664\n              - text: M\n          - listitem:\n            - link \"BEACH SHELL WAVE DYE, size L\":\n              - /url: /collections/new-arrivals/products/115745-beach-shell-wave-dye-black?variant=39683083403360\n              - text: L\n          - listitem:\n            - link \"BEACH SHELL WAVE DYE, size XL\":\n              - /url: /collections/new-arrivals/products/115745-beach-shell-wave-dye-black?variant=39683083468896\n              - text: XL\n          - listitem:\n            - link \"BEACH SHELL WAVE DYE, size XXL\":\n              - /url: /collections/new-arrivals/products/115745-beach-shell-wave-dye-black?variant=39683083337824\n              - text: XXL\n      - listitem:\n        - link \"Vintage Black LAZY TEE\":\n          - /url: /collections/new-arrivals/products/1140283-lazy-tee-vintage-black\n          - img \"Lazy Ss Tee Mens Short Sleeve In Vintage Black\"\n          - img\n        - link \"LAZY TEE\":\n          - /url: /collections/new-arrivals/products/1140283-lazy-tee-vintage-black\n        - paragraph\n        - text: $50\n        - list:\n          - listitem:\n            - link \"LAZY TEE, size XS\":\n              - /url: /collections/new-arrivals/products/1140283-lazy-tee-vintage-black?variant=41533684187232\n              - text: XS\n          - listitem:\n            - link \"LAZY TEE, size S\":\n              - /url: /collections/new-arrivals/products/1140283-lazy-tee-vintage-black?variant=41533684220000\n              - text: S\n          - listitem:\n            - link \"LAZY TEE, size M\":\n              - /url: /collections/new-arrivals/products/1140283-lazy-tee-vintage-black?variant=41533684252768\n              - text: M\n          - listitem:\n            - link \"LAZY TEE, size L\":\n              - /url: /collections/new-arrivals/products/1140283-lazy-tee-vintage-black?variant=41533684285536\n              - text: L\n          - listitem:\n            - link \"LAZY TEE, size XL\":\n              - /url: /collections/new-arrivals/products/1140283-lazy-tee-vintage-black?variant=41533684318304\n              - text: XL\n          - listitem:\n            - link \"LAZY TEE, size XXL\":\n              - /url: /collections/new-arrivals/products/1140283-lazy-tee-vintage-black?variant=41533684351072\n              - text: XXL\n      - listitem:\n        - link \"Grey LAZY TEE\":\n          - /url: /collections/new-arrivals/products/1140283-lazy-tee-grey\n          - img \"Lazy Ss Tee Mens Short Sleeve In Grey\"\n          - img\n        - link \"LAZY TEE\":\n          - /url: /collections/new-arrivals/products/1140283-lazy-tee-grey\n        - paragraph\n        - text: $50\n        - list:\n          - listitem:\n            - link \"LAZY TEE, size XS\":\n              - /url: /collections/new-arrivals/products/1140283-lazy-tee-grey?variant=39928924012640\n              - text: XS\n          - listitem:\n            - link \"LAZY TEE, size S\":\n              - /url: /collections/new-arrivals/products/1140283-lazy-tee-grey?variant=39928924045408\n              - text: S\n          - listitem:\n            - link \"LAZY TEE, size M\":\n              - /url: /collections/new-arrivals/products/1140283-lazy-tee-grey?variant=39928924078176\n              - text: M\n          - listitem:\n            - link \"LAZY TEE, size L\":\n              - /url: /collections/new-arrivals/products/1140283-lazy-tee-grey?variant=39928924110944\n              - text: L\n          - listitem:\n            - link \"LAZY TEE, size XL\":\n              - /url: /collections/new-arrivals/products/1140283-lazy-tee-grey?variant=39928924143712\n              - text: XL\n          - listitem:\n            - link \"LAZY TEE, size XXL\":\n              - /url: /collections/new-arrivals/products/1140283-lazy-tee-grey?variant=39928924176480\n              - text: XXL\n      - listitem:\n        - link \"White LAZY TEE\":\n          - /url: /collections/new-arrivals/products/1140283-lazy-tee-white\n          - img \"Lazy Ss Tee Mens Short Sleeve In White\"\n          - img\n        - link \"LAZY TEE\":\n          - /url: /collections/new-arrivals/products/1140283-lazy-tee-white\n        - paragraph\n        - text: $50\n        - list:\n          - listitem:\n            - link \"LAZY TEE, size XS\":\n              - /url: /collections/new-arrivals/products/1140283-lazy-tee-white?variant=41533685727328\n              - text: XS\n          - listitem:\n            - link \"LAZY TEE, size S\":\n              - /url: /collections/new-arrivals/products/1140283-lazy-tee-white?variant=41533685760096\n              - text: S\n          - listitem:\n            - link \"LAZY TEE, size M\":\n              - /url: /collections/new-arrivals/products/1140283-lazy-tee-white?variant=41533685792864\n              - text: M\n          - listitem:\n            - link \"LAZY TEE, size L\":\n              - /url: /collections/new-arrivals/products/1140283-lazy-tee-white?variant=41533685825632\n              - text: L\n          - listitem:\n            - link \"LAZY TEE, size XL\":\n              - /url: /collections/new-arrivals/products/1140283-lazy-tee-white?variant=41533685858400\n              - text: XL\n          - listitem:\n            - link \"LAZY TEE, size XXL\":\n              - /url: /collections/new-arrivals/products/1140283-lazy-tee-white?variant=41533685891168\n              - text: XXL\n      - listitem:\n        - link \"Brown WASHED CANVAS WORK SHORT\":\n          - /url: /collections/new-arrivals/products/112327-washed-canvas-work-short-brown\n          - img \"Work Short Washed Canvas Mens Regular In Brown\"\n          - img\n        - link \"WASHED CANVAS WORK SHORT\":\n          - /url: /collections/new-arrivals/products/112327-washed-canvas-work-short-brown\n        - paragraph\n        - text: 2 colors $125\n        - list:\n          - listitem:\n            - link \"WASHED CANVAS WORK SHORT, size 26\":\n              - /url: /collections/new-arrivals/products/112327-washed-canvas-work-short-brown?variant=41119448563808\n              - text: \"26\"\n          - listitem:\n            - link \"WASHED CANVAS WORK SHORT, size 28\":\n              - /url: /collections/new-arrivals/products/112327-washed-canvas-work-short-brown?variant=41119448596576\n              - text: \"28\"\n          - listitem:\n            - link \"WASHED CANVAS WORK SHORT, size 30\":\n              - /url: /collections/new-arrivals/products/112327-washed-canvas-work-short-brown?variant=41119448629344\n              - text: \"30\"\n          - listitem:\n            - link \"WASHED CANVAS WORK SHORT, size 32\":\n              - /url: /collections/new-arrivals/products/112327-washed-canvas-work-short-brown?variant=41119448662112\n              - text: \"32\"\n          - listitem:\n            - link \"WASHED CANVAS WORK SHORT, size 34\":\n              - /url: /collections/new-arrivals/products/112327-washed-canvas-work-short-brown?variant=41119448694880\n              - text: \"34\"\n          - listitem:\n            - link \"WASHED CANVAS WORK SHORT, size 36\":\n              - /url: /collections/new-arrivals/products/112327-washed-canvas-work-short-brown?variant=41119448727648\n              - text: \"36\"\n          - listitem:\n            - link \"WASHED CANVAS WORK SHORT, size 38\":\n              - /url: /collections/new-arrivals/products/112327-washed-canvas-work-short-brown?variant=41119448760416\n              - text: \"38\"\n      - listitem:\n        - link \"Ocean Blue REVERSIBLE TECH SKULLCAP\":\n          - /url: /collections/new-arrivals/products/1321179-reversible-tech-skullcap-ocean-blue\n          - img \"Reversible Tech Skullcap Accessories In Ocean Blue\"\n          - img\n        - link \"REVERSIBLE TECH SKULLCAP\":\n          - /url: /collections/new-arrivals/products/1321179-reversible-tech-skullcap-ocean-blue\n        - paragraph\n        - text: 5 colors $50\n      - listitem:\n        - link \"Lime MIDWEIGHT HOODED PUFFER\":\n          - /url: /collections/new-arrivals/products/115783-midweight-hooded-puffer-lime\n          - img \"Midweight Hooded Puffer Mens Long Sleeve In Lime\"\n          - img\n        - link \"MIDWEIGHT HOODED PUFFER\":\n          - /url: /collections/new-arrivals/products/115783-midweight-hooded-puffer-lime\n        - paragraph\n        - text: $245\n        - list:\n          - listitem:\n            - link \"MIDWEIGHT HOODED PUFFER, size XS\":\n              - /url: /collections/new-arrivals/products/115783-midweight-hooded-puffer-lime?variant=40350179459168\n              - text: XS\n          - listitem:\n            - link \"MIDWEIGHT HOODED PUFFER, size S\":\n              - /url: /collections/new-arrivals/products/115783-midweight-hooded-puffer-lime?variant=40350179491936\n              - text: S\n          - listitem:\n            - link \"MIDWEIGHT HOODED PUFFER, size M\":\n              - /url: /collections/new-arrivals/products/115783-midweight-hooded-puffer-lime?variant=40350179524704\n              - text: M\n          - listitem:\n            - link \"MIDWEIGHT HOODED PUFFER, size L\":\n              - /url: /collections/new-arrivals/products/115783-midweight-hooded-puffer-lime?variant=40350179557472\n              - text: L\n          - listitem:\n            - link \"MIDWEIGHT HOODED PUFFER, size XL\":\n              - /url: /collections/new-arrivals/products/115783-midweight-hooded-puffer-lime?variant=40350179623008\n              - text: XL\n          - listitem:\n            - link \"MIDWEIGHT HOODED PUFFER, size XXL\":\n              - /url: /collections/new-arrivals/products/115783-midweight-hooded-puffer-lime?variant=40350179655776\n              - text: XXL\n      - listitem:\n        - link \"Black BONDED SHERPA HOODIE\":\n          - /url: /collections/new-arrivals/products/118585-bonded-sherpa-hoodie-black\n          - img \"Bonded Sherpa Lined Hood Mens Long Sleeve In Black\"\n          - img\n        - link \"BONDED SHERPA HOODIE\":\n          - /url: /collections/new-arrivals/products/118585-bonded-sherpa-hoodie-black\n        - paragraph\n        - text: $170\n        - list:\n          - listitem:\n            - link \"BONDED SHERPA HOODIE, size S\":\n              - /url: /collections/new-arrivals/products/118585-bonded-sherpa-hoodie-black?variant=41533865590880\n              - text: S\n          - listitem:\n            - link \"BONDED SHERPA HOODIE, size M\":\n              - /url: /collections/new-arrivals/products/118585-bonded-sherpa-hoodie-black?variant=41533865623648\n              - text: M\n          - listitem:\n            - link \"BONDED SHERPA HOODIE, size L\":\n              - /url: /collections/new-arrivals/products/118585-bonded-sherpa-hoodie-black?variant=41533865656416\n              - text: L\n          - listitem:\n            - link \"BONDED SHERPA HOODIE, size XL\":\n              - /url: /collections/new-arrivals/products/118585-bonded-sherpa-hoodie-black?variant=41533865689184\n              - text: XL\n          - listitem:\n            - link \"BONDED SHERPA HOODIE, size XXL\":\n              - /url: /collections/new-arrivals/products/118585-bonded-sherpa-hoodie-black?variant=41533865721952\n              - text: XXL\n      - listitem:\n        - link \"Green BONDED SHERPA HOODIE\":\n          - /url: /collections/new-arrivals/products/118585-bonded-sherpa-hoodie-green\n          - img \"Bonded Sherpa Lined Hood Mens Long Sleeve In Green\"\n          - img\n        - link \"BONDED SHERPA HOODIE\":\n          - /url: /collections/new-arrivals/products/118585-bonded-sherpa-hoodie-green\n        - paragraph\n        - text: $170\n        - list:\n          - listitem:\n            - link \"BONDED SHERPA HOODIE, size S\":\n              - /url: /collections/new-arrivals/products/118585-bonded-sherpa-hoodie-green?variant=41533867622496\n              - text: S\n          - listitem:\n            - link \"BONDED SHERPA HOODIE, size M\":\n              - /url: /collections/new-arrivals/products/118585-bonded-sherpa-hoodie-green?variant=41533867655264\n              - text: M\n          - listitem:\n            - link \"BONDED SHERPA HOODIE, size L\":\n              - /url: /collections/new-arrivals/products/118585-bonded-sherpa-hoodie-green?variant=41533867688032\n              - text: L\n          - listitem:\n            - link \"BONDED SHERPA HOODIE, size XL\":\n              - /url: /collections/new-arrivals/products/118585-bonded-sherpa-hoodie-green?variant=41533867720800\n              - text: XL\n          - listitem:\n            - link \"BONDED SHERPA HOODIE, size XXL\":\n              - /url: /collections/new-arrivals/products/118585-bonded-sherpa-hoodie-green?variant=41533867753568\n              - text: XXL\n      - listitem:\n        - link \"Ecru WOOL LS THERMAL\":\n          - /url: /collections/new-arrivals/products/1140374-wool-ls-thermal-ecru\n          - img \"Wool Ls Thermal Mens Long Sleeve In Ecru\"\n          - img\n        - link \"WOOL LS THERMAL\":\n          - /url: /collections/new-arrivals/products/1140374-wool-ls-thermal-ecru\n        - paragraph\n        - text: $100\n        - list:\n          - listitem:\n            - link \"WOOL LS THERMAL, size S\":\n              - /url: /collections/new-arrivals/products/1140374-wool-ls-thermal-ecru?variant=41533715546208\n              - text: S\n          - listitem:\n            - link \"WOOL LS THERMAL, size M\":\n              - /url: /collections/new-arrivals/products/1140374-wool-ls-thermal-ecru?variant=41533715578976\n              - text: M\n          - listitem:\n            - link \"WOOL LS THERMAL, size L\":\n              - /url: /collections/new-arrivals/products/1140374-wool-ls-thermal-ecru?variant=41533715611744\n              - text: L\n          - listitem:\n            - link \"WOOL LS THERMAL, size XL\":\n              - /url: /collections/new-arrivals/products/1140374-wool-ls-thermal-ecru?variant=41533715644512\n              - text: XL\n          - listitem:\n            - link \"WOOL LS THERMAL, size XXL\":\n              - /url: /collections/new-arrivals/products/1140374-wool-ls-thermal-ecru?variant=41533715677280\n              - text: XXL\n      - listitem:\n        - link \"Rinsed Indigo BIG OL' SHORT DENIM\":\n          - /url: /collections/new-arrivals/products/112296t-big-ol-short-denim-rinsed-indigo\n          - img\n          - img\n        - link \"BIG OL' SHORT DENIM\":\n          - /url: /collections/new-arrivals/products/112296t-big-ol-short-denim-rinsed-indigo\n        - paragraph\n        - text: $125\n        - list:\n          - listitem:\n            - link \"BIG OL' SHORT DENIM, size 26\":\n              - /url: /collections/new-arrivals/products/112296t-big-ol-short-denim-rinsed-indigo?variant=41119447711840\n              - text: \"26\"\n          - listitem:\n            - link \"BIG OL' SHORT DENIM, size 28\":\n              - /url: /collections/new-arrivals/products/112296t-big-ol-short-denim-rinsed-indigo?variant=41119447744608\n              - text: \"28\"\n          - listitem:\n            - link \"BIG OL' SHORT DENIM, size 30\":\n              - /url: /collections/new-arrivals/products/112296t-big-ol-short-denim-rinsed-indigo?variant=41119447777376\n              - text: \"30\"\n          - listitem:\n            - link \"BIG OL' SHORT DENIM, size 32\":\n              - /url: /collections/new-arrivals/products/112296t-big-ol-short-denim-rinsed-indigo?variant=41119447810144\n              - text: \"32\"\n          - listitem:\n            - link \"BIG OL' SHORT DENIM, size 34\":\n              - /url: /collections/new-arrivals/products/112296t-big-ol-short-denim-rinsed-indigo?variant=41119447842912\n              - text: \"34\"\n          - listitem:\n            - link \"BIG OL' SHORT DENIM, size 36\":\n              - /url: /collections/new-arrivals/products/112296t-big-ol-short-denim-rinsed-indigo?variant=41119447875680\n              - text: \"36\"\n          - listitem:\n            - link \"BIG OL' SHORT DENIM, size 38\":\n              - /url: /collections/new-arrivals/products/112296t-big-ol-short-denim-rinsed-indigo?variant=41119447908448\n              - text: \"38\"\n      - listitem:\n        - link \"Red BEACH PLAID SHIRT\":\n          - /url: /collections/new-arrivals/products/1110358-beach-plaid-shirt-red\n          - img \"Beach Plaid Shirt Mens Long Sleeve In Red\"\n          - img\n        - link \"BEACH PLAID SHIRT\":\n          - /url: /collections/new-arrivals/products/1110358-beach-plaid-shirt-red\n        - paragraph\n        - text: $160\n        - list:\n          - listitem:\n            - link \"BEACH PLAID SHIRT, size S\":\n              - /url: /collections/new-arrivals/products/1110358-beach-plaid-shirt-red?variant=41436701130848\n              - text: S\n          - listitem:\n            - link \"BEACH PLAID SHIRT, size M\":\n              - /url: /collections/new-arrivals/products/1110358-beach-plaid-shirt-red?variant=41436701163616\n              - text: M\n          - listitem:\n            - link \"BEACH PLAID SHIRT, size L\":\n              - /url: /collections/new-arrivals/products/1110358-beach-plaid-shirt-red?variant=41436701196384\n              - text: L\n          - listitem:\n            - link \"BEACH PLAID SHIRT, size XL\":\n              - /url: /collections/new-arrivals/products/1110358-beach-plaid-shirt-red?variant=41436701229152\n              - text: XL\n          - listitem:\n            - link \"BEACH PLAID SHIRT, size XXL\":\n              - /url: /collections/new-arrivals/products/1110358-beach-plaid-shirt-red?variant=41436701261920\n              - text: XXL\n      - listitem:\n        - link \"Off White BEACH PLAID SHIRT\":\n          - /url: /collections/new-arrivals/products/1110358-beach-plaid-shirt-off-white\n          - img \"Beach Plaid Shirt Mens Long Sleeve In Off White\"\n          - img\n        - link \"BEACH PLAID SHIRT\":\n          - /url: /collections/new-arrivals/products/1110358-beach-plaid-shirt-off-white\n        - paragraph\n        - text: $160\n        - list:\n          - listitem:\n            - link \"BEACH PLAID SHIRT, size S\":\n              - /url: /collections/new-arrivals/products/1110358-beach-plaid-shirt-off-white?variant=41436698607712\n              - text: S\n          - listitem:\n            - link \"BEACH PLAID SHIRT, size M\":\n              - /url: /collections/new-arrivals/products/1110358-beach-plaid-shirt-off-white?variant=41436698640480\n              - text: M\n          - listitem:\n            - link \"BEACH PLAID SHIRT, size L\":\n              - /url: /collections/new-arrivals/products/1110358-beach-plaid-shirt-off-white?variant=41436698673248\n              - text: L\n          - listitem:\n            - link \"BEACH PLAID SHIRT, size XL\":\n              - /url: /collections/new-arrivals/products/1110358-beach-plaid-shirt-off-white?variant=41436698706016\n              - text: XL\n          - listitem:\n            - link \"BEACH PLAID SHIRT, size XXL\":\n              - /url: /collections/new-arrivals/products/1110358-beach-plaid-shirt-off-white?variant=41436698738784\n              - text: XXL\n      - listitem:\n        - link \"Faded Blue TWO TONE HOODIE\":\n          - /url: /collections/new-arrivals/products/118584-two-tone-hoodie-faded-blue\n          - img \"Two Tone Hood Mens Long Sleeve In Faded Blue\"\n          - img\n        - link \"TWO TONE HOODIE\":\n          - /url: /collections/new-arrivals/products/118584-two-tone-hoodie-faded-blue\n        - paragraph\n        - text: $140\n        - list:\n          - listitem:\n            - link \"TWO TONE HOODIE, size S\":\n              - /url: /collections/new-arrivals/products/118584-two-tone-hoodie-faded-blue?variant=41533863133280\n              - text: S\n          - listitem:\n            - link \"TWO TONE HOODIE, size M\":\n              - /url: /collections/new-arrivals/products/118584-two-tone-hoodie-faded-blue?variant=41533863166048\n              - text: M\n          - listitem:\n            - link \"TWO TONE HOODIE, size L\":\n              - /url: /collections/new-arrivals/products/118584-two-tone-hoodie-faded-blue?variant=41533863198816\n              - text: L\n          - listitem:\n            - link \"TWO TONE HOODIE, size XL\":\n              - /url: /collections/new-arrivals/products/118584-two-tone-hoodie-faded-blue?variant=41533863231584\n              - text: XL\n          - listitem:\n            - link \"TWO TONE HOODIE, size XXL\":\n              - /url: /collections/new-arrivals/products/118584-two-tone-hoodie-faded-blue?variant=41533863264352\n              - text: XXL\n      - listitem:\n        - link \"Grey Heather TWO TONE HOODIE\":\n          - /url: /collections/new-arrivals/products/118584-two-tone-hoodie-grey-heather\n          - img \"Two Tone Hood Mens Long Sleeve In Grey Heather\"\n          - img\n        - link \"TWO TONE HOODIE\":\n          - /url: /collections/new-arrivals/products/118584-two-tone-hoodie-grey-heather\n        - paragraph\n        - text: $140\n        - list:\n          - listitem:\n            - link \"TWO TONE HOODIE, size S\":\n              - /url: /collections/new-arrivals/products/118584-two-tone-hoodie-grey-heather?variant=41533863886944\n              - text: S\n          - listitem:\n            - link \"TWO TONE HOODIE, size M\":\n              - /url: /collections/new-arrivals/products/118584-two-tone-hoodie-grey-heather?variant=41533863919712\n              - text: M\n          - listitem:\n            - link \"TWO TONE HOODIE, size L\":\n              - /url: /collections/new-arrivals/products/118584-two-tone-hoodie-grey-heather?variant=41533863952480\n              - text: L\n          - listitem:\n            - link \"TWO TONE HOODIE, size XL\":\n              - /url: /collections/new-arrivals/products/118584-two-tone-hoodie-grey-heather?variant=41533863985248\n              - text: XL\n          - listitem:\n            - link \"TWO TONE HOODIE, size XXL\":\n              - /url: /collections/new-arrivals/products/118584-two-tone-hoodie-grey-heather?variant=41533864018016\n              - text: XXL\n      - listitem:\n        - link \"Real Tree Edge NEW ERA 9TWENTY BASIC TRUCKER\":\n          - /url: /collections/new-arrivals/products/1311126-new-era-9twenty-basic-trucker-real-tree-edge\n          - img \"Basic Trucker 9twenty Cap Accessories In Real Tree Edge\"\n          - img\n        - link \"NEW ERA 9TWENTY BASIC TRUCKER\":\n          - /url: /collections/new-arrivals/products/1311126-new-era-9twenty-basic-trucker-real-tree-edge\n        - paragraph\n        - text: $45\n      - listitem:\n        - link \"Khaki NEW ERA 9TWENTY TONAL BASIC TRUCKER\":\n          - /url: /collections/new-arrivals/products/1311164-new-era-9twenty-tonal-basic-trucker-khaki\n          - img\n          - img\n        - link \"NEW ERA 9TWENTY TONAL BASIC TRUCKER\":\n          - /url: /collections/new-arrivals/products/1311164-new-era-9twenty-tonal-basic-trucker-khaki\n        - paragraph\n        - text: $50\n    - text: LOADING\n- contentinfo:\n  - button \"Newsletter\"\n  - text: \u00a9 2026 ST\u00dcSSY"
  }
]